shortcode,username,date_utc,is_video,is_sponsored,hashtags,mentions,caption,video_view_count,video_length,likes,comments,likes+comments,location_name,location_latlong
CIFw_kAMbk6,priceline,2020-11-27 10:06,yes,False,,,"b""Don't miss our biggest sale of the year! Sign in to access new deals every two hours, all day long. Click the link in bio to save now and travel any time.\xe2\x81\xa0""",135,3.533,7,1,8,,
CIDyIIRlbEA,priceline,2020-11-26 15:39,yes,False,,,"b""Know what goes well with turkey? Deals. Today's your last chance to unlock early access to VIP Black Friday prices. Link in bio to save now and travel any time.\xe2\x81\xa0""",283,4.966,25,1,26,,
CIBLomess-r,priceline,2020-11-25 15:17,no,False,,,b'Stay in the magic! Save up to 35% on rooms at select Disney Resort Hotels. Link in bio\xe2\x81\xa0\n\xe2\x81\xa0\n*Terms apply',0,0,18,4,22,,
CH1ICg_hdXn,priceline,2020-11-20 23:01,yes,False,,,b'Unlock early access to Black Friday & Cyber Monday deals as a Priceline VIP member. Sign up is free! Link in bio.',375,7.033,23,4,27,,
CHQ3MufA3PL,priceline,2020-11-06 20:55,no,False,,,"b'Instant VIP Gold access! Automatically unlock VIP Gold benefits when you become a card member and get up to 50% off 30,000 hotels, early access to sales and so much more! \xe2\x81\xa0\n\xe2\x81\xa0\nClick the link in bio to learn more and apply.'",0,0,19,15,34,,
CHAkN9SHXqX,priceline,2020-10-31 13:06,yes,False,,9am,b'Happy Halloween! Save an extra 10% off Express Deal hotels* with code WITCHES10. Our treat! Click the link bio to save now and travel anytime.\xe2\x81\xa0\n\xe2\x81\xa0\n\xe2\x81\xa0\n*Code is valid until 11/2 @9am EST. $200 minimum spend',371,10.8,15,13,28,,
CG7asatHg0L,priceline,2020-10-29 13:02,yes,False,,,b'Need a vaca? Use code MUMMIES10 to save an extra 10% off Express Deal hotels*. Click the link in bio to find a scary good deal.\n\n*Code is valid until 10/31 at 9am EST. $200 minimum spend',426,10.8,23,10,33,,
CG3Hj3JJgLX,priceline,2020-10-27 20:58,yes,False,,,b'We have some scary good deals this spooky season. Save an extra 10% off Express Deal hotels* with code DRACULA10. Click the link in bio to save now on your next getaway.\n\n*Code is valid until 10/29 at 9am EST. $200 minimum spend',371,10.8,24,7,31,,
CGINT6JFcAW,priceline,2020-10-09 15:44,yes,False,,,"b""Our new VIP rewards program makes it ridiculously easy to save even more with Priceline! Sign up for FREE and unlock huge savings, early access to sales, travel perks, and more. Click the link in bio to become a Priceline VIP. \n\nAlready have a Priceline account? You're already a VIP! Sign in to check out your perks.""",441,9.666,24,41,65,,
CGCjVxrnldn,priceline,2020-10-07 11:01,no,False,,,b'Jump on these deals! Save an extra $25 on Express Deal Hotels with code FLASHSALE*. Click the link in bio to save now and travel anytime.\n\n *$125 minimum spend - Offer expires 11:59pm 10/7',0,0,15,14,29,,
CFcbrw-lvBk,priceline,2020-09-22 15:43,no,False,,,b'Save some green on your next road trip with our Fall Equinox Sale! Score up to 30% off on top rental car brands.  Click the link in bio to save.',0,0,43,29,72,,
CFUbj7Mgm5z,priceline,2020-09-19 13:08,no,False,,,b'Dubai is Open! Travel with confidence on Emirates and explore Dubai with flights as low as $799* round trip. Click the link in bio.\n\n*Terms apply',0,0,21,24,45,,
CFUbj7Mgm5z,priceline,2020-09-19 13:08,no,False,,,b'Dubai is Open! Travel with confidence on Emirates and explore Dubai with flights as low as $799* round trip. Click the link in bio.\n\n*Terms apply',0,0,21,24,45,,
CFP-JimJHME,priceline,2020-09-17 19:34,no,False,,,b'Winter is coming. Explore great deals on American Airlines to US ski destinations starting at $289* round trip. Click the link in bio to save now and ski later.\n\n*Select markets. Restrictions apply.',0,0,16,12,28,,
CFKYo_jlltM,priceline,2020-09-15 15:30,no,False,,flyfrontier,b'Catch these savings before they take off. @flyfrontier has flights starting from $39*. Save now on your next trip via the link in bio.\n\n*Terms apply',0,0,23,14,37,,
CFIZ8gEAoS1,priceline,2020-09-14 21:03,no,False,,united,b'Book confidently. Say goodbye to change fees on domestic flights* on @United. Link in bio\n\n*Terms apply',0,0,33,7,40,,
CEyulFpACag,priceline,2020-09-06 11:00,no,False,,,"b'The sun is setting on our End of Summer Sale. One day left to save an extra 10% on hotel, flight and rental car Express Deals* with code EOSSAVE10. Save now. Travel anytime.\nClick the link in bio for savings\n\n*See terms'",0,0,28,17,45,,
CEtXRB2gcng,priceline,2020-09-04 09:00,no,False,,,"b'Catch some extra savings this Labor Day weekend. Save an extra 10% on hotel, flight and rental car Express Deals* with code EOSSAVE10. Click the link in bio for savings\n\n*See terms'",0,0,28,15,43,,
CEqJRDqFzMj,priceline,2020-09-03 03:00,no,False,,,"b'We\xe2\x80\x99ve got you covered this Labor Day weekend with savings from coast to coast. Use code EOSSAVE10 to save an extra 10% on hotel, flight and rental car Express Deals*. \nClick the link in bio for savings\n\n*See terms'",0,0,28,11,39,,
CEkfSQ9FACk,priceline,2020-08-31 22:17,no,False,,,"b'Whether you choose to travel by air, land or kayak, we want to help you save big on your next trip. Use code EOSHTL10 to save an extra 10% off hotel Express Deals*. Click the link in bio for savings\n\n*See terms'",0,0,43,13,56,,
CEW1ambAyh_,priceline,2020-08-26 15:01,yes,False,,,"b""Discover what's nearby for less. Save up to 35% on top rental car brands and save an extra $25 on Express Deal hotel stays with code EOSHTL25*. Click the link in bio for savings\n\n*See terms""",224,18.033,20,11,31,,
CESZ1EzHvdj,priceline,2020-08-24 21:43,no,False,,,"b'New Deal Alert! This week, save an extra $25 on Express Deal hotel stays with code EOSHTL25*. Click the link in bio for savings.\n\n*See terms'",0,0,27,10,37,,
CEKZXXSFJX3,priceline,2020-08-21 19:05,no,False,,,b'Longing for a getaway? Save an extra $20 off* with code EOSHTL20 on a two-night Express Deal hotel getaway. Click the link in bio for deals.\n\n*See terms',0,0,18,9,27,,
CEEzw0AFr0r,priceline,2020-08-19 15:00,yes,False,,,"b""We're floating some extra savings your way with our End of Summer Sale. Save an extra $20 off* with code EOSHTL20 on a two-night Express Deal hotel getaway. Click the link in bio for deals.\n\n*See terms""",278,14.833,20,12,32,,
CD4n0k6lQNa,priceline,2020-08-14 21:25,no,False,,,"b""You don't need to go far to save BIG. Save on close-to-home getaways with our hotel & rental car bundles!\nClick link in bio.""",0,0,31,19,50,,
CB_BYL2jzjU,priceline,2020-06-28 16:01,no,False,,,b'One day left to save an extra $20 off* with SUMMER2020 on a two-night Express Deal hotel getaway. Click the link in bio to save now and travel anytime. *See terms',0,0,34,92,126,,
CB6FbJVFcg0,priceline,2020-06-26 18:00,no,False,,,b'Book yourself a break with our Summer Sale. Take an extra $20 off* with SUMMER2020 on a two-night Express Deal hotel getaway. Click the link in bio to save now and travel anytime. *See terms',0,0,30,34,64,,
CByXCfun3QM,priceline,2020-06-23 18:00,no,False,,,b'Miss the open road? Enjoy an escape with rental car deals. Save up to 35% on daily and weekend car rentals with our Summer Sale. Link in bio',0,0,25,23,48,,
CBqpGHallSP,priceline,2020-06-20 18:04,no,False,,,b'We\xe2\x80\x99re extending our Summer Sale! Click the link in bio to save now and travel anytime.',0,0,29,21,50,,
CBjIykTH3jE,priceline,2020-06-17 20:07,no,False,,,b'Considering a getaway? Save an extra $20 off* with code SUMMER2020 on a two-night Express Deal hotel getaway. Click the link in bio for deals. *See terms',0,0,30,18,48,,
CBYgqiAhxrI,priceline,2020-06-13 17:04,no,False,,,b'Save now and travel anytime with our Summer Sale deals. Take an extra $20 off* with SUMMER2020 on a two-night Express Deal hotel getaway. Click the link in bio for deals. *See terms',0,0,27,17,44,,
CBTqh4_AZvu,priceline,2020-06-11 19:54,no,False,,,"b'Need a break? Enjoy an easy getaway with rental car deals. Save up to 35% on daily, weekend and weekly car rentals with our Summer Sale. Link in bio.'",0,0,29,12,41,,
B-ZvqMOjCju,priceline,2020-03-31 15:00,no,False,,,"b'The COVID-19 pandemic has disrupted travel for millions. In response, Priceline and many major airlines have introduced new online cancellation tools, to help you skip the phone. Airlines, hotels and rental car companies have also made change/cancel rules much more flexible. These tools should make it easier for you to cancel if necessary. Visit our help page to see your options. Thank you. Link in bio.'",0,0,34,147,181,,
B9qC8BMgVRz,priceline,2020-03-13 02:25,no,False,,,"b""We understand that many customers need assistance with travel plans right now. We're working to address the most immediate cases first, and do not have customer support on Instagram. If your travel plans aren't immediate, please wait to contact us. If you are traveling in the next 72 hours, you can reach our customer care agents via private message on Facebook and Twitter. Thank you.\n\nClick the link on our bio for more information and updates.""",0,0,123,261,384,,
B9W53PPn5j9,priceline,2020-03-05 16:00,no,False,,,"b'Whether its a dream trip to Mexico or a quick weekend getaway - bundle, save and pay later. Start bundling with link in bio'",0,0,26,67,93,,
B9PQnVRHS7X,priceline,2020-03-02 16:45,no,False,,,b'We\xe2\x80\x99re kicking off our Spring Breakout Sale with a hotel deal! Save $20 on a 2-night Express Deal hotel stay* with code SPRING20. \nClick the link in our bio to book now. *See terms',0,0,16,22,38,,
B81bhyilpy9,priceline,2020-02-21 16:00,no,False,,,"b'Leap Year Preview Sale! Leap into huge cruise deals like free pre-paid gratuities and up to $2,000 to spend at sea! Click the link in our bio to book your next voyage.'",0,0,34,30,64,,
B8gncMtoZl1,priceline,2020-02-13 14:00,no,False,"everytripisabigdeal,hotel,travel,deals,valentine,weekend",,"b""Whether you're single or taken, why not use it as a reason to get away this weekend? Use code GETAWAY10 for an additional 10% off already discounted Express Deal hotels for the next 48 hours. Click the link in bio\n\n#everytripisabigdeal #hotel #travel #deals #valentine #weekend""",0,0,38,24,62,,
B8Pigxqlqyy,priceline,2020-02-06 22:50,no,False,"everytripisabigdeal,hotel,travel,deals,miami,florida",,"b""Need to thaw out? Turn up the heat in Miami with steady temps in the mid 70's. Hotel prices have dropped 30% since the big game, so now is the perfect time to book your long weekend. \nClick the link in bio to book your trip.\n\n#everytripisabigdeal #hotel #travel #deals #miami #florida""",0,0,24,21,45,,
B769WkqH6Zs,priceline,2020-01-29 23:00,no,False,"everytripisabigdeal,travel,deals,hotels,sf,califonia",,b'If San Francisco is still on your bucket list February is a great time to visit. Avoid tourist season with lower rates on hotels and fewer selfie sticks. \nClick the link in bio to book your trip.\n\n#Everytripisabigdeal #travel #deals #hotels #sf #califonia',0,0,41,26,67,,
B7bvLCvFsY4,priceline,2020-01-17 20:00,no,False,"pricelinecruises,cruisenorwegian,cruise,travel,deals,weekendsale,everytripisabigdeal",,"b'Weekend Sale! Priceline Cruises and Norwegian is offering 30% off fares & up to $2,000 to spend at sea. Set sail today!\n\nClick the link in our bio to book your next voyage.  #PricelineCruises #CruiseNorwegian #cruise #travel #deals #weekendsale #everytripisabigdeal'",0,0,24,30,54,,
B7Y5NDsFjO_,priceline,2020-01-16 17:30,yes,False,"travel,deals,hotels,snow,winter,everytripisabigdeal",,b'Prefer deep powder to warm sandy shores? Take advantage of all that fresh snow falling out west with deep hotel discounts. Link in bio.\n\n#travel #deals #hotels #snow #winter #everytripisabigdeal',228,12.033,22,11,33,,
B7BWB2sjpej,priceline,2020-01-07 14:00,no,False,"pricelinecruises,royalcaribbean,cruise,travel,deals,everytripisabigdeal",,"b'Cruise Savings! Treat yourself to a cruise with free kids\xe2\x80\x99 fares and up to $2,100 to spend on board!\n\nClick the link in our bio to book your next voyage.  #PricelineCruises #RoyalCaribbean #cruise #travel #deals #everytripisabigdeal'",0,0,12,31,43,,
B6v2y4sju2x,priceline,2019-12-31 19:00,no,False,"seasonofsavings,holidays,travel,deals,everytripisabigdeal",,b'Double tap if you\xe2\x80\x99re looking forward to the new year and new adventures in 2020!\n\nClick the link in our bio to book your next adventure.  #SeasonofSavings #holidays #travel #deals #everytripisabigdeal',0,0,33,27,60,,
B6tEQ9Pg9Xk,priceline,2019-12-30 17:00,no,False,"seasonofsavings,travel,deals,holiday",,b'Win 2 Round Trip Flights to Asia!\nEnter for a Chance to Win 2 Round Trip Flights to Asia. *See Terms \nClick the link in our bio to enter now #SeasonofSavings #travel #deals #holiday',0,0,23,8,31,,
B6iqOZrgd2T,priceline,2019-12-26 16:00,no,False,"seasonofsavings,holidays,travel,deals,everytripisabigdeal",,b'To home or Half Dome\xe2\x80\xa6save up to 15% off on select rental car brands. No coupon needed.\n\nClick the link in our bio to book now.  #SeasonofSavings #holidays #travel #deals #everytripisabigdeal',0,0,9,12,21,,
B6bQ_hEnvxG,priceline,2019-12-23 19:05,no,False,"seasonofsavings,seasonofsavings,holidays,cruises,travel,deals,everytripisabigdeal",,b'It\xe2\x80\x99s week 4 of our #SeasonofSavings campaign and that means a brand-new sweepstakes! This week we\xe2\x80\x99re giving away a $500 Visa Gift Card to one lucky winner! Enter now through Dec 30th. \nClick the link in our bio to enter now.  #SeasonofSavings #holidays #cruises #travel #deals #everytripisabigdeal',0,0,16,8,24,,
B6VyRqYjWEe,priceline,2019-12-21 16:00,no,False,"seasonofsavings,holidays,cruises,travel,deals,everytripisabigdeal",,"b'FINAL CALL! Book now and set sail with the gift of pre-paid gratuities & up to $2,000 to spend at sea!\n\nClick the link in our bio to book now.  #SeasonofSavings #holidays #cruises #travel #deals #everytripisabigdeal'",0,0,21,7,28,,
B6Qa8Fqhyk2,priceline,2019-12-19 14:00,yes,False,"seasonofsavings,holidays,travel,deals,trip,everytripisabigdeal",,b'Escape to some place cozy this holiday. Save $20 on a 2-night Express Deal hotel stay* with code SOFAFREE20\n\nClick the link in our bio to book now.  #SeasonofSavings #holidays #travel #deals #trip #everytripisabigdeal *See terms',309,6.033,13,5,18,,
B6JrWXiFdDW,priceline,2019-12-16 23:09,no,False,"seasonofsavings,holidays,cruises,travel,deals,everytripisabigdeal",norwegiancruiseline,"b'\xe2\x80\x98Tis the Season of Savings! Book now and set sail with the gift of pre-paid gratuities & up to $2,000 to spend at sea with @norwegiancruiseline !\n\nClick the link in our bio to book now.  #SeasonofSavings #holidays #cruises #travel #deals #everytripisabigdeal'",0,0,23,10,33,,
B5-oyy1AKNt,priceline,2019-12-12 16:15,no,False,"seasonofsavings,holidays,travel,deals,trip,everytripisabigdeal",,"b'This holiday, enjoy your family. Avoid the air mattress. Save $20 on a 2-night Express Deal hotel stay* with code SOFAFREE20\n\nClick the link in our bio to book now.  #SeasonofSavings #holidays #travel #deals #trip #everytripisabigdeal *See terms'",0,0,17,14,31,,
B53NUd3DTLq,priceline,2019-12-09 19:00,no,False,"holidays,travel,deals,trip,everytripisabigdeal",,"b'You don\xe2\x80\x99t have to crash on the sofa for the holidays this year. This week only, save $20 on a 2-night Express Deal hotel stay* with code SOFAFREE20\n\nClick the link in our bio to book now.  #holidays #travel #deals #trip #everytripisabigdeal *See terms'",0,0,22,6,28,,
B5xvIv6AD7Z,priceline,2019-12-07 16:00,yes,False,"seasonsofsavings,holidays,travel,deals,trip,everytripisabigdeal",,"b'Tired of winter already? Book a flight today to escape to someplace warmer and instantly earn a 10% hotel coupon for thousands of hotels. \nHurry, only two days left for this deal! Click the link in our bio to book now.  #SeasonsofSavings #holidays #travel #deals #trip #everytripisabigdeal'",286,11.066,24,4,28,,
B5ssa7BnfcX,priceline,2019-12-05 17:00,no,False,"seasonsofsavings,holidays,travel,deals,trip,everytripisabigdeal",,b'Our #SeasonsofSavings campaign is HERE with 5 weeks of savings! Our sale takes off with a flight deal. Book a flight today and instantly earn a 10% hotel coupon for thousands of hotels.\n\nClick the link in our bio to book now  #holidays #travel #deals #trip #everytripisabigdeal',0,0,10,6,16,,
B5n3au0nbim,priceline,2019-12-03 20:00,yes,False,"givingtuesday,givingback,nonprofit,travel,everytripisabigdeal",,"b'Looking for a new way to give back? With Priceline Gives, we\xe2\x80\x99ll donate 1% of your eligible trip to your favorite nonprofit. It\xe2\x80\x99s that simple. \nLearn more and get started at priceline.com/gives\n\n#GivingTuesday #givingback #nonprofit #travel #Everytripisabigdeal'",251,7.766,12,3,15,,
B5myu92gFc2,priceline,2019-12-03 10:00,no,False,"seasonofsavings,mgm,deals,travel",,"b""How would you like to win a dream vacation for two to Las Vegas?  This week our Season of Savings sweepstakes gives you the chance to win a three-night stay at Park MGM with a $100 Food & Beverage credit, tickets to Cirque du Soleil's new show R.U.N at Luxor and round-trip airfare on Allegiant. #seasonofsavings #mgm #deals #travel""",0,0,26,5,31,,
B5kOgB-j6qp,priceline,2019-12-02 10:05,no,False,"cybermonday,deals,savings,travel,trips",,b'Need a break after the holidays? Check out our Cyber Monday Sale NOW! With new deals launching every 2 hours! Click the link in our bio for deals\n\n#cybermonday #deals #savings #travel #trips',0,0,34,12,46,,
B5kN7iggDxE,priceline,2019-12-02 10:00,no,False,"cybermonday,lasvegas,deals,travel",,"b'CYBER MONDAY SALE!  Save an extra 15% off Hotel Express Deals in Las Vegas, already up to 60% off.  Use promo code CYBERLV15. Ends 12/02/19. Terms apply. #cybermonday #lasvegas #deals #travel'",0,0,13,3,16,,
B5fTNwXjuqD,priceline,2019-11-30 12:10,no,False,"blackfriday,deals,savings,travel,trips,pricelineblackfridaysale",,b'Missed Black Friday? Well you\xe2\x80\x99re in luck! We\xe2\x80\x99ve extended our Black Friday Sale throughout the weekend! Click the link in the bio for deals\n\n#blackfriday #deals #savings #travel #trips #pricelineblackfridaysale',0,0,12,7,19,,
B5dPoaND4_-,priceline,2019-11-29 17:00,no,False,"blackfriday,deals,travel",,"b'BLACK FRIDAY SALE!  China Southern Airlines is offering 10% off when you purchase your direct flight ticket to Guangzhou, China.  With rich history, culture and traditions, Guangzhou is one of the top travel destinations in China. Ends 12/03/19. Terms apply. #blackfriday #deals #travel'",0,0,19,4,23,,
B5cgH4kAptA,priceline,2019-11-29 10:05,yes,False,"blackfriday,deals,savings,travel,trips,pricelineblackfridaysale",,b'Our Biggest Black Friday sale is LIVE!!! With new deals every two hours all day long! Click the link in our bio for deals.\n\n#blackfriday #deals #savings #travel #trips #pricelineblackfridaysale',313,5.2,8,4,12,,
B5cfi_Cg5Oc,priceline,2019-11-29 10:00,no,False,,thriftycarrental,b'BLACK FRIDAY SALE! Our friends @thriftycarrental are offering Up to 25% off base rates*. Start planning your Christmas & New Years trips today! *Discount applies to pay later base rate. Taxes and Fees excluded. Ends 12/02/19. Terms apply.',0,0,10,5,15,,
B5aZtHsDmQF,priceline,2019-11-28 14:30,no,False,"thanksgiving,travel,trips,blackfriday,deals,savings,extragravy",,b'Wishing you a Happy Thanksgiving and safe travels. Grab a side of savings  with your turkey. Our Biggest Black Friday Sale goes LIVE at 5AM EST!!! #thanksgiving #travel #trips #blackfriday #deals #savings #extragravy',0,0,28,5,33,,
B5Wzn3dj8aK,priceline,2019-11-27 05:00,no,False,"holidaysavings,orlando",,"b'Happiest Holiday Savings! Explore All 4 Theme Parks with a 4-Park Magic Ticket at Walt Disney World:registered: Resort. 4 Days from $89 Per Day (from $356 total) Plus Tax. Plus, additional savings on Disney Hotels on Priceline - Today Only!\n#HolidaySavings #Orlando'",0,0,26,4,30,,
B5VhQ21HhHf,priceline,2019-11-26 17:00,no,False,"blackfriday,deals,savings,travel,trips,pricelineblackfridayevent",,"b'Black Friday is only 3-days away! Sign up for our Insider Deals, for your chance to save up to 99% off hotels, rental cars, and flights!* Click the link in our bio to see terms and sign up. \n#blackfriday #deals #savings #travel #trips #pricelineblackfridayevent'",0,0,17,2,19,,
B5NeQYJjvQ7,priceline,2019-11-23 14:00,no,False,"blackfriday,deals,savings,travel,trips",,"b'Our Biggest Black Friday Sale Ever is coming!! Sign up for our insider deals, for your chance to save up to 99% off hotels, rental cars, and flights!* Click the link in our bio to see terms and sign up.\n\n#blackfriday #deals #savings #travel #trips'",0,0,53,17,70,,
B1odzXeHLgR,priceline,2019-08-26 15:30,no,False,"thrifty,carrental,summer,greatrates",,b'SALE TODAY!  Our friends at Thrifty Car Rental are offering 15% off the base rates* of their SUVs.  Plan your end of Summer getaway today!\n\n#Thrifty #carrental #summer #greatrates',0,0,35,72,107,,
B1EXWt9FCgI,priceline,2019-08-12 15:01,no,False,"southamerica,latamairlines,summer,sweeps",,b'South America anyone? Explore a place unlike any other where every path takes you on a different adventure. Enter for a chance to win* flight tickets with LATAM Airlines. Plus $800 in hotel credit from Priceline! *Terms apply\n\n#SouthAmerica #LATAMAirlines #summer #sweeps',0,0,26,20,46,,
B00zntjgupO,priceline,2019-08-06 14:00,no,False,"everytripisabigdeal,summer,vacation,travel,trips",,b'Seize your Summer. Save $20 now with code WEEKEND20 on a 2-night stay at thousands of eligible hotels.\n\n#everytripisabigdeal #summer #vacation #travel #trips',0,0,24,18,42,,
B0yjawvFdJi,priceline,2019-08-05 17:00,no,False,"louisvillelove,bourboncity",,"b""Escape to Bourbon City: Experience a city that's fun for all and all for fun! Save up to 60% on Hotel Express Deals in Louisville. #louisvillelove #bourboncity""",0,0,22,13,35,,
B0i_zcOlMdG,priceline,2019-07-30 16:00,no,False,"everytripisabigdeal,summer,vacation,travel,trips",,b'Seize your Summer. Book a hotel today to save up to $30 off a future Express Deal hotel.\n\n#everytripisabigdeal #summer #vacation #travel #trips',0,0,28,15,43,,
B0gNPwsA9jF,priceline,2019-07-29 14:00,no,False,"seizeyoursummersale,palacestation,lasvegas,stationcasinos",,"b""Summer Dreamin' at Palace Station Las Vegas \nBook your Vegas summer getaway now and get a $20 Daily Dining Credit\n#SeizeYourSummerSale #PalaceStation #LasVegas #StationCasinos""",0,0,22,11,33,,
B0Qwe0KAX5A,priceline,2019-07-23 14:00,no,False,"everytripisabigdeal,summer,vacation,travel,trips",,"b""Seize your Summer. Book a flight today and you'll instantly receive a 10% coupon for thousands of hotels.\n\n#everytripisabigdeal #summer #vacation #travel #trips""",0,0,26,18,44,,
B0OLr5cHH2T,priceline,2019-07-22 14:00,no,False,"seizeyoursummersale,lacolección,cancun",,b'Feel our Cancun\nBook now and Save up to 50% with Cancun\xe2\x80\x99s favorite resorts\n#SeizeYourSummerSale #LaColecci\xc3\xb3n #Cancun',0,0,26,12,38,,
Bz-u-aKARQT,priceline,2019-07-16 14:00,no,False,"everytripisabigdeal,summer,vacation,travel,trips",,"b'Stay longer, save more! Use coupon code WEEKEND to save $20 on thousands of eligible hotels when you spend at least $100 and stay at least two nights. Tap the link in our bio to book your next getaway.\n\n#everytripisabigdeal #summer #vacation #travel #trips'",0,0,26,17,43,,
Bzqbq7bAuu0,priceline,2019-07-08 16:47,no,False,"everytripisabigdeal,summer,vacation,travel,trips,deals",,"b""Wouldn't you love to take more trips this summer? We're here to help with our Seize Your Summer sale! Now through July 14, use coupon code SUMMER20 to save $20 off a minimum $100 Express Deal hotel purchase exclusively in our app. So tap the link in our bio to download and save now. *Express Deal - exact hotel revealed only after booking. All sales final. $100 minimum excludes taxes and fees. Travel anytime.\n\n#everytripisabigdeal #summer #vacation #travel #trips #deals""",0,0,30,22,52,,
BzYerw4gdwV,priceline,2019-07-01 17:27,no,False,"everytripisabigdeal,deals,travel,trips,savings",,b'Your boarding call to see the world! Incredible Incredible July 4th fares with Qatar Airways. Tap the link in our bio to find your deal!\n\n#everytripisabigdeal #deals #travel #trips #savings',0,0,28,38,66,,
By5xaBqlkgy,priceline,2019-06-19 19:14,no,False,"everytripisabigdeal,insiders,deals,travel,trips,seizeyoursummer,savings",,"b""It's time to Seize Your Summer and take more trips that matter - for less! On June 27, we will be sending exclusive savings to ALL our email insiders. Join the list now through June 25 at 5 p.m. ET so you don't miss any of the moments that matter this summer. Tap the link in our bio to sign up.\n\n#everytripisabigdeal #insiders #deals #travel #trips #seizeyoursummer #savings""",0,0,48,25,73,,
BysVe6knr_U,priceline,2019-06-14 14:00,no,False,"everytripisabigdeal,sale,savings,roadtrips,summer,vacation,deals",,b'Budget-friendly deals are here! Save up to 30% now on Budget rental cars during our Summer Kickoff Sale through June 16 and plan more summer road trips. Click the link in our bio to be on your way.\n\n#everytripisabigdeal #sale #savings #roadtrips #summer #vacation  #deals',0,0,27,18,45,,
ByqBb4ujM17,priceline,2019-06-13 16:26,no,False,"everytripisabigdeal,sale,savings,roadtrips,vacation,summer",,b'Final days to save even MORE on those summer road trips with our Summer Kickoff Sale! Save up to 30% now on rental cars with Avis through June 16. Tap the link in our bio to drive away with your savings. \n#everytripisabigdeal #sale #savings #roadtrips #vacation #summer',0,0,25,15,40,,
