shortcode,username,date_utc,is_video,is_sponsored,hashtags,mentions,caption,video_view_count,video_length,likes,comments,likes+comments,location_name,location_latlong
CIDgs0_g1mS,riteaid,2020-11-26 13:00,yes,False,thanksgiving,,"b'Though this season may find us far apart, we\xe2\x80\x99re thankful you\xe2\x80\x99ve touched our hearts! Happy #Thanksgiving to all of our treasured customers, associates and your families.:turkey::maple_leaf:'",99,8.033,22,1,23,,
CIDdeE3h3LN,riteaid,2020-11-26 12:32,yes,False,bonuscash,,"b'The hottest deals of the season are here! Earn $15 #BonusCash when you spend $50 thru 11/28! Get the in-store coupon at the link in our bio, or shop online and earn automatically with your wellness+ rewards!'",98,14.0,18,1,19,,
CIBrK97DSur,riteaid,2020-11-25 19:53,no,False,"unicorns,holiday,bonuscash",thesandiegomom,"b'Do you believe in #unicorns? Find something magical for everyone on your #holiday list, from toys to d\xc3\xa9cor & more, & save! Hurry, earn $15 #BonusCash when you spend $50 thru 11/28 in-store, or earn automatically online with your wellness+ rewards! Click the link in our bio to get the in-store coupon & shop.:unicorn_face: :camera:@thesandiegomom'",0,0,120,3,123,,
CH-kRkXjQSD,riteaid,2020-11-24 15:02,yes,False,bonuscash,valerieoresko,"b'Dreaming of a cozy holiday at home? We\xe2\x80\x99ve got you covered. Earn $15 #BonusCash thru 11/28 when you spend $50 in-store, or spend $50 online and earn automatically! :wrapped_gift::Christmas_tree:Get your coupon at the link in our bio. :camera: @valerieoresko'",459,29.366,48,4,52,,
CH8FiabDY6B,riteaid,2020-11-23 15:48,no,False,bonuscash,"pawmoire,morganleewomack,sweetscarlettsadventures","b'It\xe2\x80\x99s sweater weather, & your furbabies deserve to be stylish, too. Check out our adorable selection of holiday pet sweaters, beds, treats & toys. Click the link in our bio to get a $15 #BonusCash coupon in-store when you spend $50 thru 11/28! :dog_face::money_with_wings::camera:: @Pawmoire, @morganleewomack @sweetscarlettsadventures'",0,0,220,8,228,,
CH6HQrmjHTs,riteaid,2020-11-22 21:24,no,False,cakebeauty,cakebeauty,"b'Your skincare routine is about to be the BEST part of your day :smiling_face_with_heart-eyes: Indulge in @cakebeauty, naturally luxe and rich textured skincare, to bring out your inner glow girl. :sparkles: Cleanse, hydrate and prep with :shortcake:. Tap to shop or click on the link in our bio. #cakebeauty'",0,0,45,3,48,,
CH5mX3QjZ6V,riteaid,2020-11-22 16:38,yes,False,,,"b'Stock up now to be prepared and take on cold symptoms from onset to recovery. Buy One, Get One 50% Off these products in-store, or click the link in our bio to shop online.'",306,13.976,26,1,27,,
CH22LZQjwbv,riteaid,2020-11-21 15:01,yes,False,"nationalhealthyskinmonth,healthyskinmonth,yourhealthiestskin",,"b'Keep your skin soft & smooth all winter long with nourishing moisturizers for face and body. Stock up & save in-store, or tap here or click the link in our bio to shop online. #NationalHealthySkinMonth #HealthySkinMonth #YourHealthiestSkin'",365,16.01,37,2,39,,
CH0ScI6A6aq,riteaid,2020-11-20 15:07,yes,False,holiday,nedspecktor,b'Make #holiday magic happen with a quick stop at your local Rite Aid. We\xe2\x80\x99ve got everything you need from toys to gift wrap & more !:Christmas_tree::wrapped_gift: Click the link in our bio to get a coupon for $10 off $40 in-store thru 11/21! :camera: @nedspecktor',403,28.233,54,3,57,,
CHxpZ0Tjc4R,riteaid,2020-11-19 14:30,yes,False,,,"b'Welcome to the new Rite Aid, where alternative remedies and traditional medicine meet to help you achieve Whole Health. Click on the link in our bio to learn more.'",338,14.943,42,1,43,,
CHvhWo3jEL-,riteaid,2020-11-18 18:51,yes,False,"soapbox,crueltyfree,vegan,giveback,givingback",soapbox,"b""NEW! @soapbox makes goodness easy to find, with moisture-rich hand, hair and body products. Everything you want, nothing you don't: 100% vegan, cruelty-free hand, hair and body products with moisturizing, benefit-rich ingredients. Healthy hands, body and hair start here. And, Soapbox donates a soap to communities in need with every purchase. Tap to shop or click on the link in our bio. #Soapbox #crueltyfree #vegan #giveback #givingback""",339,14.993,36,3,39,,
CHsY-A1Ak-w,riteaid,2020-11-17 13:30,yes,False,,,b'The sweet and soothing scent of lavender may help promote sleep for great days ahead. Click the link in our bio to shop.',238,14.033,31,1,32,,
CHqZ8dZpS9H,riteaid,2020-11-16 19:00,yes,False,,,"b'Welcome to the new Rite Aid, where the alternative remedies and traditional medicine meet to help you achieve Whole Health. Click on the link in our bio to learn what\xe2\x80\x99s new.'",373,13.033,47,3,50,,
CHnaXzKDt6a,riteaid,2020-11-15 15:06,no,False,brow,archesandhalos,"b'Introducing our newest #brow brand, @ArchesandHalos! With brow-building pomade, water-resistant tinted brow mousse, a brow razor, brow shaping, shading and defining pencils and more, you can get luxurious-looking brows for less! Plus, when you buy $40 in-store thru 11/21, you save $10! Get Coupon here: https://ritea.id/10off40. Or, tap here or click the link in our bio to shop online.'",0,0,58,2,60,,
CHlJfboLY5f,riteaid,2020-11-14 18:00,yes,False,,,"b'Welcome to the New Rite Aid, a perfect fusion of alternative remedies and traditional medicine. Click the link in our bio to learn more about how we\xe2\x80\x99re helping you achieve Whole Health.'",735,4.033,85,3,88,,
CHk18SPjX0P,riteaid,2020-11-14 15:09,no,False,"lashes,ardelllashes,lashextensions,repost",ardellbeauty,"b'Is there anything better than opening a new multipack of @ardellbeauty lashes and DUO Adhesive?! :fallen_leaf::sparkles: Pick your favorite packs today. SAVE in-store with BOGO 50% OFF thru 11/21. Or, tap to shop or click the link in our bio. #lashes #ardelllashes #lashextensions #repost'",0,0,49,0,49,,
CHiIDO2DbXQ,riteaid,2020-11-13 13:51,yes,False,,"purezerobeauty,refreshscalpcare","b'There are a few secrets to great winter hair! Take care of your scalp, avoid over washing and don\xe2\x80\x99t leave home with wet hair. @purezerobeauty and @refreshscalpcare can help. Tap to shop or click on the link in our bio.'",368,16.01,42,1,43,,
CHgReOfjBFw,riteaid,2020-11-12 20:33,no,False,"physciansformula,butterbronzer,bronzer",physiciansformula,"b'Running low on your glowing must-haves? @physiciansformula has you covered: This week, get all Physicians Formula favorites BOGO 50% off in-store thru 11/14! Or, tap to shop online or click the link in our bio. #physciansformula #butterbronzer #bronzer'",0,0,74,0,74,,
CHgAfgGjfcl,riteaid,2020-11-12 18:05,yes,False,,,"b'Welcome to the New Rite Aid, a perfect fusion of alternative remedies and traditional medicine. Click the link in our bio to learn more about how we can help you achieve Whole Health.'",459,14.993,42,2,44,,
CHc4xbWnh89,riteaid,2020-11-11 13:00,yes,False,"veteransday,foldsofhonor,standwithus,honortheirserviceeducatetheirl",foldsofhonor,"b'On #VeteransDay, The Rite Aid Foundation joins @FoldsOfHonor to thank and honor service members across the country. #FoldsOfHonor #StandWithUs #HonorTheirServiceEducateTheirLegacy Click the link in our bio to learn more about our Foundation.'",374,12.0,38,2,40,,
CHa1MBYjean,riteaid,2020-11-10 17:50,yes,False,,,"b'Welcome to the New Rite Aid, a perfect fusion of alternative remedies and traditional medicine. Click the link in our bio to learn more about how we can help you achieve Whole Health.'",519,11.13,59,3,62,,
CHZIKacjTfo,riteaid,2020-11-10 01:57,no,False,,"facehalo,valerieoresko","b'Make your night, again and again. These new @facehalo makeup removers replace up to 500 single-use wipes! They\xe2\x80\x99re sustainable, non-toxic and safe for sensitive skin. Tap here or click on the link in our bio to shop. :camera:@valerieoresko'",0,0,64,3,67,,
CHX3VKdjaE5,riteaid,2020-11-09 14:12,yes,False,,,"b'Welcome to the New Rite Aid, a perfect fusion of alternative remedies and traditional medicine. Click the link in our bio to learn more about how we can help you achieve Whole Health.'",574,15.033,60,4,64,,
CHVTbqsD25f,riteaid,2020-11-08 14:19,yes,False,,,"b'Welcome to the New Rite Aid, a perfect fusion of alternative remedies and traditional medicine. Click the link to learn more about how we can help you achieve Whole Health.'",603,30.033,73,2,75,,
CHSllnuhuB9,riteaid,2020-11-07 13:00,yes,False,,,"b'Let\xe2\x80\x99s talk about stress. A little bit of stress is motivating, but too much stress can be bad for the body. This Stress Awareness Week, consider alternative ways to decompress. Tap to shop or click the link in our bio.'",353,13.0,27,1,28,,
CHQcPR-Forq,riteaid,2020-11-06 16:59,yes,False,,,b'What\xe2\x80\x99s the difference between COVID-19 & cold symptoms? Check out our helpful symptom guide in the link in our bio to learn more.',384,17.033,38,0,38,,
CHNzcIzlSJB,riteaid,2020-11-05 16:24,yes,False,,,b'Do you know the difference between COVID-19 & allergy symptoms? Check out our helpful symptom guide in the link in our bio to learn more.',324,17.033,38,2,40,,
CHLm9JpjMkf,riteaid,2020-11-04 19:58,yes,False,"repost,gotmyshotfor,gotmyshotfor,sponsored,flushot","steeple_squigs,riteaid,riteaid","b""#repost @steeple_squigs\n\xe3\x83\xbb\xe3\x83\xbb\xe3\x83\xbb\nBig day! Flu shot day! I got this pretty blue band-aid to prove it and I'll be showing it off the rest of the day. Went into @riteaid after practice, no appointment needed, and within 10 minutes I was outa there. I want to go home for the holidays this year, so I #gotmyshotfor my family so that I can help keep them safe over the holidays. Now it's your turn! Go get that flu shot and snap a picture with your pretty blue band-aid and post on your stories tagging me and @riteaid and tell us who you are protecting from the flu using #gotmyshotfor. I'll repost you in my stories to keep the good momentum going! Stay safe and healthy everyone! #sponsored #flushot Click the link in our bio to learn more.""",465,46.833,29,2,31,,
CHLIyBOly_E,riteaid,2020-11-04 15:33,yes,False,"covid19,flu",,b'What are the symptoms of COVID-19 vs. the flu? Our helpful visual guide can tell you more. Check out our helpful symptom guide in the link in our bio to learn more. #Covid19 #flu',357,17.033,37,1,38,,
CHGVH0ijk2P,riteaid,2020-11-02 18:45,no,False,"crueltyfree,nailpolish",ellamila,"b'If you want a plant-based, vegan, #crueltyfree nail (and makeup) brand, @ellamila has got you covered. Fashion-forward with non-toxic ingredients, Ella+Mila has 17 chemical-free #nailpolish, removers and nail care products. NEW to RiteAid.com! Tap to shop or click the link in our bio.'",0,0,55,4,59,,
CHDd1IBj7sp,riteaid,2020-11-01 16:03,no,False,"veganbeauty,physiciansformula,veganmakeup,crueltyfree",physiciansformula,"b'Explore ethical and affordable vegan makeup, skincare, and beauty products that are safe for sensitive skin types from @physiciansformula. This week only, when you shop in-store, save with Buy One, Get One for 75% off! Plus, use our $10 off $40 coupon here or the link in our bio. ritea.id/10off40\n#veganbeauty #physiciansformula #veganmakeup #crueltyfree'",0,0,87,6,93,,
CHAulW3jYw2,riteaid,2020-10-31 14:32,no,False,"halloweenmakeup,bonuscash","mayamua__,kokiecosmetics","b'Get this last-minute #halloweenmakeup glam look from @Mayamua__ with @kokiecosmetics Skin Perfect HD Foundation (here in 30W) and Powder Contour Palette. Today only, you earn $6 wellness+ #BonusCash when you spend $12! Tap or click the link in bio to browse and pick up in-store today.'",0,0,79,3,82,,
CG972pdjFT_,riteaid,2020-10-30 12:32,yes,False,"repost,gotmyshotfor,sponsored,flushot,fluseason","the.flying.phoenix,riteaid","b'#repost @the.flying.phoenix\n\xe3\x83\xbb\xe3\x83\xbb\xe3\x83\xbb\nWho did I get my Flu shot for? #GotMyShotFor my family and friends! :red_heart_selector: My relationships and bonds with those closest to me are the most important things in my life. To know that a simple action like getting the flu shot can not only keep me healthy but all of those around me safe as well, was the easiest decision in the world to make! Click the link in our bio for more info and to find a store. @riteaid #Sponsored #flushot #fluseason'",1292,54.233,47,2,49,,
CG94Uz7D4cS,riteaid,2020-10-30 11:59,yes,False,immune,,b'These #immune support helpers are easy for kids to take. Shop options from elderberry syrup to pops and Vitamin C gummies online. Click the ink in bio.',301,14.0,29,1,30,,
CG7hUVLBLzT,riteaid,2020-10-29 14:00,yes,False,halloween,"hersheys,reeses",b'The most spooktacular day of the year is upon us! Hurry - click the link in our bio to clip these Load2Card coupons and get up to $4 off on @Hersheys & @Reeses #Halloween candy!',402,12.633,36,2,38,,
CG5J_J8F9X7,riteaid,2020-10-28 15:57,no,False,"timetovote,vote,vote2020",,"b'Our voices, our votes, our future! We\xe2\x80\x99re proud to announce we\xe2\x80\x99ve joined the Time to Vote movement & are providing our hourly store associates paid time off to vote on Nov. 3. Learn more at the link in our bio. #TimetoVote #vote #vote2020'",0,0,76,2,78,,
CG429cED9Za,riteaid,2020-10-28 13:11,no,False,"chocolate,nationalchocolateday,halloween","reeses,kitkat,snickers,ghirardelli,missfoodaddict","b""Whether you're a @Reeses, @KitKat, @Snickers or @Ghirardelli fan, find your fave #chocolate on #NationalChocolateDay! :chocolate_bar: Grab some last-minute #Halloween candy in-store to celebrate these treats today. :camera:@missfoodaddict""",0,0,70,3,73,,
CG2lcuRl1P9,riteaid,2020-10-27 16:00,yes,False,halloween,"hersheys,reeses",b'The most spooktacular day of the year is upon us! Hurry - click the link in our bio to clip these Load2Card coupons and get up to $4 off on @Hersheys & @Reeses #Halloween candy!',533,7.0,41,1,42,,
CGz2cNEDuEf,riteaid,2020-10-26 14:37,yes,False,halloween,"gisele.ayora,maybelline,wetnwildbeauty,revlon,ardellbeauty,lorealparis,covergirl,kissproducts","b'If you need a last-minute #Halloween costume, try this glam ""Wednesday"" makeup look from @gisele.ayora. Browse these products at the link in our bio and pick up in-store this week! Watch her beauty haul on our story.:ghost::nail_polish::lipstick:\nProducts she used: \n@maybelline master contour blush and highlight palette \n@wetnwildbeauty Color Icon eyeshadow\n@revlon brow pencil and Colorstay skinny liquid felt tip eyeliner \n@ardellbeauty wispy lashes\n@lorealparis infallible foundation \n@covergirl TruNaked smoky palette \n@kissproducts Halloween nails'",1586,52.4,54,1,55,,
CGuwSqJj21N,riteaid,2020-10-24 15:07,yes,False,halloween,valerieoresko,"b'Yes, there are nice witches. @ValerieOresko shows us how to create a bat-wing eyeliner look and spider web nails this #Halloween!:bat::spider_selector::nail_polish:Check out her how-to blog at ritea.id/glam. Tap or click the link in our bio to shop, and head in-store to get this look, plus costume, in time.'",1165,7.3,50,2,52,,
CGsrcRgj26j,riteaid,2020-10-23 19:40,no,False,"skincare,rosehip","essano_beauty,essano.usa,shantellrobertson","b'@essano_beauty\xe2\x80\x99s plant-based #skincare line is made with ingredients from New Zealand, :seedling:and it can now be found in the U.S. at Rite Aid!  Find this #rosehip oil natural skincare online and in select stores. Tap the link in our bio to shop. @essano.usa :camera:@shantellrobertson'",0,0,72,2,74,,
CGpnZYWjNLR,riteaid,2020-10-22 15:13,yes,False,"repost,gotmyshotfor,gotmyshotfor,ad","lessthandomesticgoddess,riteaid",b'#repost @lessthandomesticgoddess\n\xe3\x83\xbb\xe3\x83\xbb\xe3\x83\xbb\nI #GotMyShotFor my family!\n.\nI joined the @riteaid #GotMyShotFor movement and got my flu shot for my mom who is at high risk. Getting the flu shot is an easy way to protect our loved ones!\n.\nJoin me and get yours at your local Rite Aid. Be sure to let me know who you got your flu shot for! There has never been a more important time to protect ourselves and those who mean so much to us. #ad Learn more and find a store at ritea.id/flu or the link in our bio.',1380,55.533,44,1,45,,
CGoZU_ejsX7,riteaid,2020-10-22 03:49,yes,False,,nourishedfam,b'Listen to this story from  @nourishedfam \xe2\x80\x93 it\xe2\x80\x99ll touch your heart. :red_heart_selector::hamster_face: Remember to get your kids a flu shot to protect your family. Learn more at ritea.id/flu',834,145.901,40,5,45,,
CGnAO5HjEgB,riteaid,2020-10-21 14:47,yes,False,"flushot,gotmyshotfor",,"b'Getting a flu shot doesn\xe2\x80\x99t just give you protection, it also protects your loved ones. Share your flu shot pic or video, and tell us who you\xe2\x80\x99re getting your #flushot for using the hashtag #gotmyshotfor. Learn more and find a store at ritea.id/flu or click the link in our bio.'",1448,6.033,49,2,51,,
CGkqVQHD2JG,riteaid,2020-10-20 16:57,yes,False,"halloween,costumes",mrandmrshalloween,"b'No matter how you celebrate #Halloween this year, you can still have fun and be safe. Get these ideas and more from @mrandmrshalloween at ritea.id/halloween, and pick up candy, ingredients, #costumes, & gifts in-store today! :ghost::jack-o-lantern::candy:Click the link in our bio to find a store.'",926,7.683,56,2,58,,
CGh1GZEjcgF,riteaid,2020-10-19 14:37,yes,False,halloween,valerieoresko,"b""If you're going for a simple makeup look for #Halloween, try this bat-wing eyeliner and these spider web nails! Add a witch's hat and you're good to go.:bat::spider_selector:@ValerieOresko shows how it's done at ritea.id/glam. Tap to shop or click the link in our bio.""",2220,4.233,84,2,86,,
CGgW3w1j8qd,riteaid,2020-10-19 00:49,no,False,"glowing,kokie,highlighter,concealer",kokiecosmetics,b'Introducing @kokiecosmetics #Glowing & Bright Face $15 Bundle! In-store this week ONLY.:blue_heart:Tap or click the link in our bio to explore #Kokie products. \n\nIncludes...\n- 1 Soft Glow #Highlighter \n- 1 Setting Spray\n- 1 Be Bright #Concealer',0,0,46,3,49,,
CGfNn7tDZpR,riteaid,2020-10-18 14:09,no,False,"pirate,costumes,halloween,trickortreat",missfoodaddict,"b""@missfoodaddict's Maltese may be a #pirate from a haunted ship, but she looks pretty cute! :dog_face::skull_and_crossbones_selector::jack-o-lantern:Find #costumes, candy and decor you need for #Halloween - for people and fur babies alike! Head to ritea.id/store or the link in our bio to find your store. #trickortreat""",0,0,119,5,124,,
CGcigHlDYP6,riteaid,2020-10-17 13:14,no,False,"repost,halloween","tiffanycartagena_,tiffany.cartegena_,elfcosmetics,maybelline,covergirl,lauramercier,rimmellondonus,revlon,kissproducts,covergirl,almay,benefitcosmetics,anastasiabeverlyhills,wetnwildbeauty,maybelline,beautycounter,elfcosmetics","b""#repost\n@tiffanycartagena_\n:sparkles:GOLDEN:sparkles: Goddess Makeup // #Halloween is just around the corner, and @tiffany.cartegena_ created this pretty look to try!:ghost::two_hearts:\nDifferent weekly sale offers save you up to 50% off with your wellness+ number. :face_screaming_in_fear::lipstick::fallen_leaf: Tap to shop or click the link in our bio for all products. Or, stop in-store to pick up soon!\n\n:sparkles:PRODUCTS:sparkles:\n\n@elfcosmetics Hydrating Face Primer\n@maybelline SuperStay Foundation (Classic Ivory)\n@covergirl Clean Fresh Concealer\n@lauramercier Translucent Setting Powder\n@rimmellondonus Rimmel London - Magnif'eyes Eyeshadow Palette\n@revlon Photoready Eye Art (Desert Dazzle)\n@kissproducts Luxtentions (Classic)\n@covergirl Lash Blast Volume Mascara\n@almay Brow Styler\n@benefitcosmetics Hoola Bronzer\n@anastasiabeverlyhills Blush Trio\n@wetnwildbeauty Golden Flower Crown\n@maybelline Color Sensational Shaping Lip Liner (Beige Babe)\n@beautycounter Beyond Gloss Rosewood\n@elfcosmetics Illuminating Mist & Set""",0,0,50,1,51,,
CGaHVg1jp2x,riteaid,2020-10-16 14:38,no,False,"repost,gotmyshotfor,ad,flushot,immunesupport,immunebooster","annmariebailey_,riteaid","b'#repost @annmariebailey_\n\xe3\x83\xbb\xe3\x83\xbb\xe3\x83\xbb\nWho do you get your flu shot for? I #GotMyShotFor this little man right here! Being a mom means not only do I have to protect myself, but I also want to protect those around me. Thankfully @riteaid makes it super convenient, too! Protect yourself, your loved ones, and community by getting your flu shot this year. Learn more and find a store at ritea.id/flu or the link in our bio. #ad #flushot #immunesupport #immunebooster'",0,0,92,1,93,,
CGX2xkxj2Aj,riteaid,2020-10-15 17:35,no,False,"oreos,halloween","oreo,christy_l_kitchen","b'Make these easy, spooky @oreo bat treats with kids! :bat: These are super cute, and all you need is a knife to cut the cookie in half for the wings! :backhand_index_pointing_right: Swipe to watch how @christy_l_kitchen does it, and follow below. Get #Oreos & all things #Halloween in-store. Tap to shop or click the link in our bio.\nDirections:\n\xe2\x80\xa2\tTake 2 Oreo cookies. \n\xe2\x80\xa2\tSeparate one cookie. Using a knife, cut the side without the cream filling in half for the wings and place them on top of the cream filling.\n\xe2\x80\xa2\tSeparate the second cookie, place the top part onto the first cookie and gently press. \n\xe2\x80\xa2\tUsing the cream filling, apply a tiny amount on the back of a small round candy for the eye. Stick it on the cookie.'",0,0,80,8,88,,
CGXeLrAlbAz,riteaid,2020-10-15 14:00,no,False,"mani,pumpkin,halloween","tiffanycartagena_,essie,lacolorscosmetics","b'This multi-color #mani looks #pumpkin-perfect on @tiffanycartagena_! :jack-o-lantern::ghost: Try your own using @Essie Summit of Style sparkle polish, Essie Sechage Rapide expressie polish, and @lacolorscosmetics Striking white (not pictured). Get these #Halloween colors in-store, or tap or click the link in our bio to shop online.'",0,0,117,5,122,,
CGVZn4RDsJG,riteaid,2020-10-14 18:44,yes,False,,,"b'What\xe2\x80\x99s cooler than ice cream? How about $10 OFF a Thrifty ice cream scoop! Gift a Thrifty fan with the real deal. Offer ends 10/17. Online only. Tap here, go to ritea.id/thriftyscoop or the link in our bio to shop.'",691,9.338,52,3,55,,
CGVTTxsjKev,riteaid,2020-10-14 17:46,no,False,"halloween,trickortreat","thesandiegomom,pezcandyusa","b""It's Halloween happiness for @thesandiegomom's girls! They had some #Halloween fun thanks to all the goodies and crafts they picked out! :jack-o-lantern::ghost:They filled treat cups with glow sticks, @Pezcandyusa, Halloween squishies and yummy candy.:candy:Find your store at ritea.id/store or the link in our bio. #trickortreat""",0,0,84,0,84,,
CGS_ZLmjx9y,riteaid,2020-10-13 20:14,no,False,"halloween,marshmallows","christy_l_kitchen,kelloggsricekrispies","b'Make these easy #Halloween ghost and monster treats:ghost:with kids from @christy_l_kitchen! Pick up cookie cutters, marshmallows, white chocolate and @KelloggsRiceKrispies cereal at Rite Aid! Check out our Stories to see how she does it and click the link in our bio for store locations. Directions below:\n\n1. Melt #marshmallows and 2 tbsp butter in a pot to a a glue-like consistency\n2. Slowly add a half a bag of Rice Krispies and mix it in altogether\n3. Use a cookie cutter to help mold the mixture into the shape; immediately take it out of the mold and let it cool and set completely\n4. Melt white and green chocolate separately and apply it on the Rice Krispie treat; let it harden. (You can also make your frosting using corn starch and sugar and then add natural food coloring or extracted vegetable juice to it.)\n5.  Use white icing for the monster eyes and a bakery decorative gel to make the pupils and monster features\n6. Add in mini sticks to create a marshmallow krispie pop'",0,0,121,5,126,,
CGQfKkPD_oT,riteaid,2020-10-12 20:54,no,False,fall,"ourlifefromatoz,mommyneedsadotcom",b'We love how these fall colors make a home so cozy!:maple_leaf: What\xe2\x80\x99s your favorite part about #Fall? :jack-o-lantern: Slide to see some outdoor decor ideas and get 50% off in-store! Find your store at ritea.id/store or the link in our bio.\n:camera: @ourlifefromatoz @mommyneedsadotcom',0,0,124,6,130,,
CGP6QpHjlhX,riteaid,2020-10-12 15:34,yes,False,"repost,ad","steeple_squigs,riteaid","b""#repost @steeple_squigs\n\xe3\x83\xbb\xe3\x83\xbb\xe3\x83\xbb\nThe challenges of 2020 have taught me that above all else, our health is the most important thing. Some things are out of our control, but getting a flu shot from @riteaid is a simple and easy thing that we can all do to help protect ourselves and our loved ones from getting sick with the flu this season. I'm getting a flu shot to help protect myself, but also my neighbors, friends, teammates, and family members. #ad Go to ritea.id/flu or click the link in our bio to learn more and find your store.""",1148,35.866,60,6,66,,
CGNGx6bD_1n,riteaid,2020-10-11 13:23,no,False,"halloween,costume",,"b'Create a spooky #Halloween room for safe trick-or-treating at home, or even a virtual zoom #costume contest! Get 50% off spooky de\xcc\x81cor and SAVE on candy :candy:when you shop in-store.:jack-o-lantern::ghost:Head to ritea.id/store or click the link in our bio to find your store.'",0,0,178,3,181,,
CGKmnf_laQ7,riteaid,2020-10-10 14:03,yes,False,americanpharmacistsmonth,,"b'In times like this, our pharmacists go above and beyond each day to help keep us well. Nominate your Pharmacist as a Rite Aid Pharmacy Hero by 10/31 and you could both win $1000. Learn more and nominate at the link in our bio. #AmericanPharmacistsMonth'",753,14.0,63,2,65,,
