shortcode,username,date_utc,is_video,is_sponsored,hashtags,mentions,caption,video_view_count,video_length,likes,comments,likes+comments,location_name,location_latlongB3cRJN7gp6F,centurylink,2019-10-10 14:51,no,False,ctlcares,,b'115 employees from our London location have been promoting and fundraising for cancer research \xe2\x80\x93 they also recently participated in a 14 mile trek to raise awareness for the disease that affects us all. #CTLcares',0,0,77,0,77,,
B3Uxw8IAwjg,centurylink,2019-10-07 17:02,no,False,repost,seahawks,"b'#Repost @seahawks\n\nNew lights, new look :eyes::star-struck:'",0,0,115,0,115,Lumen Field,47.595025832 -122.3318422263
B3H64_LgaG_,centurylink,2019-10-02 17:12,no,False,"cxday2019,cx,ex,ctlcx",,"b'#CXDay2019 at CenturyLink brought employees, leadership & industry experts from across the globe together to talk #CX and #EX transformation, and celebrate our successes. We\xe2\x80\x99re excited about the progress we\xe2\x80\x99ve made and look forward to continuing to OWN THE EXPERIENCE. #CTLcx'",0,0,55,0,55,,
B2xWSHHg4pz,centurylink,2019-09-23 22:49,no,False,"worldgratitudeday,ctllife",,b'We\xe2\x80\x99re celebrating #WorldGratitudeDay with sweets and treats for the wonderful people who make up the CenturyLink team! \nWhat are you grateful for?\n\n#CTLlife',0,0,59,0,59,,
B2hfCK-AJ-7,centurylink,2019-09-17 18:57,no,False,itprofessionalsday,,b'Our IT professionals are transforming the lives of our customers through innovative technology solutions. Join us in wishing them a happy #ITProfessionalsDay!',0,0,51,0,51,,
B2foaYrgGoQ,centurylink,2019-09-17 01:49,yes,False,"nationalworkingparentsday,ctllife",,"b'We know as a working parent, every moment counts with your little ones. Our benefits help employees achieve work/life balance by valuing who and what is most important to them. #NationalWorkingParentsDay #CTLlife'",357,103.827,48,1,49,,
B2XEE6UgKKc,centurylink,2019-09-13 17:49,no,False,"lgbtq,womenintech,stem,ctlinclusion",,b'We\xe2\x80\x99re always proud to celebrate the uniqueness and individuality of our employees along with the support that they bring to the #LGBTQ+ community. \nJoin us in celebrating the #WomenInTech who are pushing to make history in #STEM-related careers. #CTLinclusion',0,0,78,0,78,,
B2R3QaCgigb,centurylink,2019-09-11 17:21,no,False,"bluefriday,gohawks,ctllife","seahawks,seahawksdancers,bluethunderdrumline,centurylink_field","b'What a great way to kick off the @seahawks season! :american_football: #BlueFriday was so much fun. A huge thank you to @seahawksdancers, @bluethunderdrumline & @centurylink_field! #GoHawks #CTLlife'",0,0,119,0,119,Lumen Field,47.595025832 -122.3318422263
