shortcode,username,date_utc,is_video,is_sponsored,hashtags,mentions,caption,video_view_count,video_length,likes,comments,likes+comments,location_name,location_latlongCCtwesdF0PO,clinique,2020-07-16 19:37:56.000000,yes,False,b'',"b'najaustin,ethelsclub,somewhere__good,justdavia'","b'@najaustin, founder and CEO of @ethelsclub and @somewhere__good joins @justdavia in conversation about mental health and how to make time for wellness throughout your day.'",29587,1373.735,1098,16,,,
CCtYcRsDrkX,clinique,2020-07-16 16:07:39.000000,no,False,"b'cliniquetakeover,cliniquepartner'","b'najaustin,ethelsclub,clinique,clinique,ethelsclub,justdavia,clinique'","b""#CliniqueTakeover\xc2\xa0@najaustin :sparkles: Let's talk about wellness and mental health! Hey everyone - I'm Naj, the founder of\xc2\xa0@ethelsclub, a social and wellness club designed for people of color to thrive, online & IRL\xc2\xa0and today I am taking over @Clinique. One of my life goals is owning my wellness journey and creating ways to embed healthy moments throughout my daily life. Join along @clinique stories to get a mini tour of\xc2\xa0@ethelsclub Brooklyn clubhouse and learn more about the oasis we\xe2\x80\x99ve created for our members. Make sure to also tune in and join a convo with me and @justdavia today at 3 pm on\xc2\xa0@clinique\xc2\xa0Instagram\xc2\xa0live to learn tips and tricks to unpack your wellness journey - together.\xc2\xa0#cliniquepartner""",0,0,1535,8,,,
CCqzGYdDA7P,clinique,2020-07-15 16:02:53.000000,no,False,"b'mycliniqueritual,stayingin'",b'cliniquemexico',"b'A Clinique summer glow is three steps away. Ale, from our @cliniquemexico team, shares her glowifying go-tos on IG Stories. Tap once to shop. #MyCliniqueRitual #stayingin'",0,0,14598,113,,,
CCokbOrjB7d,clinique,2020-07-14 19:16:10.000000,no,False,"b'evenbetter,clinique,beauty,makeup,parabenfree,fragrancefree,happyskin'",b'fatima.b.ibrahim',"b'""It\xe2\x80\x99s formulated for 24 hours of hydration and was dermatologist developed to actually improve skin with wear! I\xe2\x80\x99m wearing WN 110,"" says @fatima.b.ibrahim of fan favorite #EvenBetter Makeup. \n\n#Clinique #beauty #makeup #parabenfree #fragrancefree #happyskin'",0,0,3191,51,,,
CCl_58cliLR,clinique,2020-07-13 19:18:46.000000,yes,False,b'',b'tarasowlaty',"b'@tarasowlaty, creator, chef, nutritionist, and journalist, shares her favorite ways to add comfort to your every day.\n \nProducts featured:\n \nDeep Comfort Body Butter\nDeep Comfort Hand + Cuticle Cream\nMoisture Surge 72-Hour'",54472,890.735,1553,17,,,
CCls4TKDwBe,clinique,2020-07-13 16:32:19.000000,no,False,b'cliniquetakeover',"b'tarasowlaty,clinique'","b'#CliniqueTakeover @tarasowlaty I ""I think we all deserve a little extra love and comfort...I\xe2\x80\x99ve definitely been feeling dry and depleted lately, so @clinique\xe2\x80\x99s hydrating products are truly giving me life.""\n\nJoin us for Tara\'s Instagram Live at 3:00 PM EST as she shares her tips for adding comfort to your life. :two_hearts:'",0,0,4776,13,,,
CCeSM-PFBlt,clinique,2020-07-10 19:24:44.000000,yes,False,b'',b'cliniquemexico',"b'Mariana, del equipo de @cliniquemexico, nos comparte sus mejores tips para borrar ojeras.\n\nProducts featured:\nMoisture Surge 72-Hour\nAll About Eyes Serum De-Puffing Eye Massage\nAll About Eyes\nClinique concealer brush\nBeyond Perfecting Super Concealer in the Apricot shade\nBeyond Perfecting Super Concealer in shade Apricto and Medium\nBeyond Perfecting Powder Base + Corrector in shade Neutral\nBeyond Perfecting Foundation + Concealer in 6.5 buttermilk\nHigh Impact Elevating Mascara\nClinique Pop:trade_mark_selector: Lip Colour + Primer in Cherry Pop'",68639,1147.933,1657,44,,,
CCd9EuKDXY2,clinique,2020-07-10 16:19:54.000000,no,False,"b'stayingin,mycliniqueritual'",b'',b'Skin myth: SPF is only for the outdoors. Tap to shop our favorite ways to add SPF to our daily routine. #StayingIn #mycliniqueritual',0,0,9281,59,,,
CCbg21nje3d,clinique,2020-07-09 17:34:52.000000,no,False,"b'cliniquetakeover,cliniquepartner,backtobasics'","b'sweatwithbec,clinique'","b'#CliniqueTakeover @sweatwithbec I ""BRINGING IT BACK TO BASICS w/ @clinique\xe2\x80\x99s infamous 3 STEP ROUTINE to keep my pores squeaky clean & keep those sweat induced breakouts at bay :sparkles: TONIGHT we\xe2\x80\x99re bringing you a FREE workout on zoom at 6pm, sign up via link in my bio :peach::fire:#cliniquepartner #backtobasics""'",0,0,4935,38,,,
CCYyafNj5CG,clinique,2020-07-08 16:19:31.000000,yes,False,"b'soundon,evenbetter,clinique,beauty,makeup,skincare,parabenfree,fragrancefree,happyskin'",b'',"b""#SoundOn to hear Iesha's foundation story and why she loves #EvenBetter Makeup to help with her dark spots. Then tap once to find your perfect match.\n\nIesha\xe2\x80\x99s wearing Even Better Makeup in shade WN 100.\n\n#Clinique #beauty #makeup #skincare #parabenfree #fragrancefree #happyskin""",44445,21.333,3507,71,,,
CCTmwXhHu9W,clinique,2020-07-06 15:58:28.000000,yes,False,b'',b'emilia_clarke',"b'Clinique Global Brand Ambassador, @emilia_clarke, walks you through her skin care and makeup routine featuring some of her favorite Clinique products.\n\nProducts featured:\n\nTake The Day Off Cleansing Balm\nClarifying Lotion 1\nMoisture Surge 72-Hour\nBuff Brush\nMoisture Surge Sheertint Hydrator\nBeyond Perfecting Concealer\nPowder Pop Bronzer\nCheek Pop\nHigh Impact Mascara\nJust Browsing Brush-on Styling Mousse\nPretty Easy Liquid Eyelining Pen\nMoisture Surge Pop Triple Lip Balm'",67632,1707.817,4695,120,,,
CCL4p33j64T,clinique,2020-07-03 15:56:01.000000,yes,False,"b'evenbetter,clinique,beauty,makeup,skincare,parabenfree,fragrancefree,happyskin'",b'',b'Dry skin? Don\xe2\x80\x99t settle for anything less than #EvenBetter Refresh Hydrating & Repairing Makeup. It\xe2\x80\x99s infused with skin-plumping hydration and contains salicylic acid and peptides to help keep skin smooth.\n\n#Clinique #beauty #makeup #skincare #parabenfree #fragrancefree #happyskin',30287,20.4,2179,44,,,
CCJUMl5DIPh,clinique,2020-07-02 15:57:54.000000,no,False,b'',b'',"b'Have a question? We\xe2\x80\x99ve got you covered. Chat live with an award-winning Clinique expert about products, tips, and promos, from wherever you are. Visit clinique.com to get started! :sparkles:'",0,0,1598,23,,,
CCGynVXDAVS,clinique,2020-07-01 16:25:59.000000,no,False,"b'stayingin,mycliniqueritual'",b'',b'Make the most of your beauty sleep :sleeping_face: Tap to shop some of our favorite products to prep for bedtime.  #StayingIn #mycliniqueritual',0,0,37599,194,,,
CCESMviDy4k,clinique,2020-06-30 17:04:40.000000,yes,False,"b'regram,cliniquepartner'","b'emilia_clarke,clinique'","b'#Regram @emilia_clarke I ""Had the most glorious time doing my @clinique tutorial.... here\xe2\x80\x99s a little snipbit of what you missed...#cliniquepartner"" Visit Clinique.com/livestream to watch the full video :two_hearts:'",38452,20.033,3122,49,,,
CCB2qoKlt-R,clinique,2020-06-29 18:25:25.000000,yes,False,b'',b'roxienafousi',"b'@roxienafousi, an emotional health advisor, shares her favorite self-care routines and the products she uses to put herself in a positive mental space for the day. \nProducts featured:\nCity Block Sheer SPF 25\nMoisture Surge Eye 96-Hour Hydro-Filler Concentrate\nChubby Stick Moisturizing Lip Color Balm in shade Mega Melon'",89015,1196.333,2045,36,,,
CCBm7XhDP9C,clinique,2020-06-29 16:07:39.000000,no,False,"b'cliniquetakeover,cliniquetakeover,cliniquepartner,selflove,selfcare'","b'roxienafousi,clinique'","b'#CliniqueTakeover @roxienafousi I ""Giving yourself undivided attention and time to reset and refresh is such a wonderful way to start and end each day, contributing to your overall wellbeing. Every morning I play positive affirmations whilst taking time to be mindful during my skincare routine.\n\n@CLINIQUE has been a staple in my beauty cabinet since as long as I can remember and so I am absolutely thrilled to be doing a #cliniquetakeover tonight on their IG Live at 2 PM EST where I\xe2\x80\x99ll be talking you through ways to practice and cultivate more Self Love into your life.\n\nMy favourite Clinique products at the moment are: City Block Sheer SPF 25 (it\xe2\x80\x99s non oily which is so hard to find in SPF!!), the Moisture Surge Eye 96-Hour Hydro-Filler Concentrate (this mama needs that!) and the Chubby Stick Moisturizing Lip Color Balm :red_heart_selector: A D #cliniquepartner #selflove #selfcare""'",0,0,9968,44,,,
CB6G30yDF7J,clinique,2020-06-26 18:12:52.000000,no,False,"b'clinique,beauty,skincare,parabenfree,fragrancefree,happyskin'",b'',b'Summer essential :up_arrow_selector::sun_selector::two_hearts: #Clinique #beauty #skincare #parabenfree #fragrancefree #happyskin',0,0,7290,56,,,
CB3TouWjrm_,clinique,2020-06-25 16:06:41.000000,no,False,"b'clinique,beauty,skincare,makeup,parabenfree,fragrancefree,happyskin'",b'',b'Shelfie goals :smiling_face_with_heart-eyes: Can you spot any of your favorites?\n\n#Clinique #beauty #skincare #makeup #parabenfree #fragrancefree #happyskin',0,0,16845,141,,,
CB0cDp6DVLS,clinique,2020-06-24 13:22:32.000000,no,False,b'regram',b'emilia_clarke',b'#regram Clinique Ambassador @emilia_clarke goes LIVE on clinique.com today at 1PM EST to share her getting ready routine. Leave a :woman_raising_hand_selector: below if you\xe2\x80\x99ll be tuning in!',0,0,38826,389,,,
CByrmYfD5sh,clinique,2020-06-23 21:04:34.000000,yes,False,b'',"b'sharifasays,envsnfest,ayanftgreene'","b'@sharifasays, founder of @envsnfest, hosts @ayanftgreene from the NYC Census Bureau in conversation on why the census is so important to black and brown communities.'",15028,312.366,1132,11,,,
CByXwsBDXG8,clinique,2020-06-23 18:06:31.000000,no,False,"b'cliniquetakeover,cliniquetakeover'","b'sharifasays,sharifasays,ayanftgreene,clinique,ayanftgreene'","b""#CliniqueTakeover @sharifasays I Hey guys! @sharifasays here I will be doing a #CliniqueTakeover with @ayanftgreene today at 3PM on @clinique LIVE. Where do we go from here? How can we use our voices to push forth change? The fight isn't over, it has just begun. Change doesn't happen overnight but if we are resilient and steadfast, change will come. Join me and @ayanftgreene from the NYC census bureau to chat history and why the census is so important to black and brown communities.""",0,0,1943,27,,,
CBwTRogDQGv,clinique,2020-06-22 22:48:50.000000,no,False,b'amplifymelanatedvoices',"b'sharifasays,envsnfest,sharifasays,ayanftgreene'","b""We're committed to using our platform to #amplifymelanatedvoices and tomorrow, @sharifasays, founder of @ENVSNfest, will be taking over our channel!\n\nWe've had the opportunity to collaborate with Sharifa on past campaigns and as a sponsor of the annual ENVSN Festival. We're thrilled to give our channel to her as she highlights some of her amazing work.\n\nTune in tomorrow for @sharifasays' takeover, including an Instagram Live with @ayanftgreene at 3:00 PM EST!""",0,0,2535,42,,,
CBtb6zRjdf2,clinique,2020-06-21 20:06:39.000000,no,False,"b'fathersday,mycliniqueritual'",b'',"b'Follow Eugene and JJ\xe2\x80\x99s skincare routine, for a sweet way to celebrate #FathersDay with great skin. #mycliniqueritual'",0,0,11735,68,,,
CBlTOw7DFIc,clinique,2020-06-18 16:16:48.000000,no,False,"b'stayingin,mycliniqueritual'",b'divinely_d',b'#StayingIn doesn\xe2\x80\x99t mean you can\xe2\x80\x99t get a little glam. :face_blowing_a_kiss: Tap to shop @divinely_d\xe2\x80\x99s look. #mycliniqueritual',0,0,4916,72,,,
CBdl7RqDZFs,clinique,2020-06-15 16:26:15.000000,no,False,b'',b'',"b'In an effort to continue listening and learning, we want to hear from you. We\xe2\x80\x99re looking to partner with leaders in the Black community who are doing great work, and we want to use our platform to amplify their voice. Tag your favorite creators and community leaders in the comments.'",0,0,1879,253,,,
CBS8oTtjhz6,clinique,2020-06-11 13:12:59.000000,no,False,b'raceforward',"b'urbanjusticecenter,naacp'","b'To our Clinique Community,\nWe stand in solidarity with our Black employees, Black consumers and Black communities & firmly believe Black lives matter.\nWe don\xe2\x80\x99t have all the answers, but we\xe2\x80\x99re committed on this journey together to listen, learn and act.\xc2\xa0\nWe will continue to reflect on how we can do better and work towards ending systemic racism.\xc2\xa0\nWe will commit to advocate for change and compassion.\nWe will be transparent about the work we are doing today, while we continue our ongoing journey of education, reflection & improvement.\n-\xc2\xa0\nThese are the four areas of action.\n-\nCommunity support:\n*We reached out to our community for recommendations of organizations pushing for systemic changes, including racial and social justice, and have committed donations to\xc2\xa0@urbanjusticecenter, #raceforward (raceforward.org), & @naacp.\n-\nChanges from within:\n*Provide mandatory unconscious bias training - expand training to all full-time US Clinique employees.\n*ELC to match employee donations - *available to eligible U.S. & U.K.-based employees, up to the employee\xe2\x80\x99s individual company match cap through June 2020.\n-\xc2\xa0\nTalent investment: *Talent acquisition - reach U.S. population parity for our Black employees for all levels in the next five years.\n*Provide equitable access to professional development and advancement for our Black employees in the U.S.\n*Hold ourselves accountable for creating a workforce that is more representative and responsive to people of all backgrounds.\n*Organize a brand-wide Day of Solidarity that focuses on learning, action and service.\n-\xc2\xa0\nRepresentation: *Ensure end-to-end creative process accurately and consistently represents the Black experience, engages Black professionals and continue to evolve our products to better meet the needs of our Black consumers.\n*We will increase our pool of Black talent among our behind-the-camera creative teams and require input from Black professionals or consumers in the development of concepts.\n*Increased representation of Black talent in campaigns.\n-\xc2\xa0\nThis is an on-going conversation and we will continue to learn and grow together.\nYour Clinique Family'",0,0,3822,270,,,
CA6u3F4DRG0,clinique,2020-06-02 03:30:54.000000,no,False,b'theshowmustbepaused',b'',b'We stand committed in support of Black communities by going dark tomorrow as a demonstration of solidarity. #theshowmustbepaused',0,0,10321,270,,,
CA3OkGgDK1N,clinique,2020-05-31 18:50:58.000000,no,False,b'',b'',"b'Your Clinique family stands with the black community. We condemn and do not tolerate racism, violence and hatred.\nWe know that just stating our support isn\xe2\x80\x99t enough\xe2\x80\x94we need to take action and will be announcing our additional support this week.'",0,0,14857,426,,,
CA0dBbyj25D,clinique,2020-05-30 16:59:35.000000,no,False,"b'cliniqueid,clinique,beauty,skincare,parabenfree,fragrancefree,happyskin'",b'seewantwear',b'Have you added #CliniqueiD to your routine yet? :camera_with_flash:: @seewantwear #Clinique #beauty #skincare #parabenfree #fragrancefree #happyskin',0,0,13357,206,,,
CAyEpYYj6WE,clinique,2020-05-29 18:48:06.000000,no,False,"b'stayingin,mycliniqueritual'",b'',"b'Clear things up in three easy steps. Heather, a Clinique Field Executive and Trainer, shares how she turned her skin around her first year of college. Head to stories for more. #StayingIn #mycliniqueritual'",0,0,20174,230,,,
CAvMyZNjIKl,clinique,2020-05-28 16:01:54.000000,yes,False,"b'moisturesurge,clinique,beauty,makeup,parabenfree,fragrancefree,happyskin'",b'',"b'NEW #MoistureSurge Pop Triple Balm hydrates, tints, and adds :sparkles: Shade featured: Acai  #Clinique #beauty #makeup #parabenfree #fragrancefree #happyskin'",64216,5.5,4632,78,,,
CAsqz7Jju_R,clinique,2020-05-27 16:26:09.000000,no,False,"b'evenbetter,clinique,beauty,makeup,parabenfree,fragrancefree,happyskin'",b'juliacabanblog',b':check_mark:Hydrating\n:check_mark:Full-coverage\n:check_mark:24-hour wear\n\nShop #EvenBetter Refresh on clinique.com now! #Clinique #beauty #makeup #parabenfree #fragrancefree #happyskin :camera_with_flash:: @juliacabanblog',0,0,6700,53,,,
CAqEZKvj4ry,clinique,2020-05-26 16:11:58.000000,no,False,"b'evenbetter,stayingin,mycliniqueritual'",b'',"b'Allie, from our Global Social Media team, shares her three dark spot go-tos to get her routine glowing :sparkles: Tap to shop! \nShade featured: #EvenBetter makeup in shade WN 04 Bone\n\n#StayingIn #mycliniqueritual'",0,0,36469,211,,,
CAndBkxjBgh,clinique,2020-05-25 15:49:28.000000,no,False,"b'seeaheartsendaheart,seeaheartsendaheart'","b'clinique,cliniqueboots.bath'","b'#SeeAHeartSendAHeart by drawing a heart with your favorite lipstick + post it to Instagram to show support for those on the front lines. Tag @clinique with #SeeAHeartSendAHeart as a thank you, from the bottom of our hearts. :red_heart_selector::camera_with_flash:: @cliniqueboots.bath'",0,0,6780,55,,,
CAk6ogpD1za,clinique,2020-05-24 16:10:28.000000,no,False,"b'clinique,beauty,makeup,parabenfree,fragrancefree,happyskin'",b'',b'Leave us a :woman_raising_hand_selector: if your vanity looks a lot like this :smiling_face_with_heart-eyes::down_arrow_selector: #Clinique #beauty #makeup #parabenfree #fragrancefree #happyskin',0,0,30973,230,,,
CAibAamDhOe,clinique,2020-05-23 16:55:38.000000,no,False,"b'freshpressed,clinique,beauty,skincare,parabenfree,fragrancefree,happyskin'",b'carolinareal',"b'\xe2\x80\x9cI mix a few pumps into my moisturizer of Vitamin C in the morning and Vitamin A at night. This will help even out and retexturize your skin,\xe2\x80\x9d says @carolinareal of #FreshPressed Clinical. :sparkles: \n#Clinique #beauty #skincare #parabenfree #fragrancefree #happyskin'",0,0,9602,112,,,
CAgQhKAjNHb,clinique,2020-05-22 21:00:00.000000,yes,False,b'',b'',"b'Heather, a Clinique Field Executive and Trainer, shares her 5 must-have products for acne prone skin.\n\nProducts featured:\nAcne Solutions Cleansing Foam\nAcne Solutions Oil-Control Cleansing Mask\nAcne Solutions Clarifying Lotion\nAcne Solutions Clinical Clearing Gel\nClinique iD for Pores & Uneven Texture with the Dramatically Different Oil-Free Gel base'",30176,1704.93,1653,37,,,
CAf6V7QD72x,clinique,2020-05-22 17:31:44.000000,no,False,"b'stayingin,mycliniqueritual'",b'',b'Want to see how (and why) Rachel keeps her shelfie so stocked? :smiling_face_with_heart-eyes: Check out our stories! #StayingIn #MyCliniqueRitual',0,0,20043,284,,,
CAdfHhMjU7l,clinique,2020-05-21 19:13:15.000000,yes,False,b'',b'',"b'Learn how to create a Beauty in Bloom look with Audrey from Clinique Global Education, using our NEW Instagram exclusive set. The set comes with three full sizes, three minis, and a colorful floral tote. $29.50, only available until 5/23 at 11:59 PST.\n\nThe 7-piece Beauty in Bloom set features:\n\nLimited Edition Eye + Cheek Palette\nHigh Impact Waterproof Mascara in shade Black\nTake The Day Off for Lids, Lashes & Lips\nClinique Pop in shade Bare Pop\xc2\xa0\n7-Day Scrub\nMoisture Surge Face Spray Thirsty Skin Relief\nFloral Tote'",42589,1399.328,1876,47,,,
CAdLjNKjbse,clinique,2020-05-21 16:04:22.000000,no,False,"b'clinique,makeup,skincare'",b'',b'Get all your summer must-haves in one petal-pretty set. Shop :cherry_blossom:Beauty in Bloom:cherry_blossom: exclusively on Instagram Checkout for the next 3 DAYS before it becomes available anywhere else. Tap the product icon to get started (US only). #Clinique #makeup #skincare',0,0,32212,186,,,
CAapHUYjb8K,clinique,2020-05-20 16:24:59.000000,no,False,"b'clinique,beauty,skincare,makeup,parabenfree,fragrancefree,happyskin'",b'',"b':cherry_blossom: Dropping TOMORROW at 12:00 PM EST, exclusively on Instagram.:cherry_blossom: Tap the product tag in this image to set your reminder and don\xe2\x80\x99t miss our Beauty in Bloom set. (US only) #Clinique #beauty #skincare #makeup #parabenfree #fragrancefree #happyskin'",0,0,8002,50,,,
CAYK4yIjX-_,clinique,2020-05-19 17:22:23.000000,no,False,"b'seeaheartsendaheart,seeaheartsendaheart'","b'clinique,clinique.newcastle,cliniquefenwickcanterbury,elainedfarley,heatherbowtie,amymiller827'","b'Swipe :left_arrow_selector: for some of our favorite #SeeAHeartSendAHeart regrams, then join us by drawing a heart with your favorite lipstick + post it to Instagram to show support for those on the front lines. Be sure to tag @clinique and #SeeAHeartSendAHeart. Thank you, from the bottom of our hearts. :red_heart_selector: :camera_with_flash:: @clinique.newcastle, @cliniquefenwickcanterbury, @elainedfarley, @heatherbowtie, @amymiller827'",0,0,6887,58,,,
CAVedorDtK-,clinique,2020-05-18 16:15:43.000000,no,False,"b'clinique,beauty,skincare,parabenfree,fragrancefree,happyskin'",b'',b'NEW! Now you can shop your Clinique favorites directly on Instagram :sparkles: Just tap once to add to your cart or head to our Stories for a step-by-step how-to. \n#Clinique #beauty #skincare #parabenfree #fragrancefree #happyskin',0,0,17832,105,,,
CATG0pXjs4c,clinique,2020-05-17 18:11:11.000000,yes,False,"b'moisturesurge,clinique,beauty,skincare,parabenfree,fragrancefree,happyskin'",b'ultabeauty',b'Grow your glow :sparkles: with #MoistureSurge 72-Hour. Now in a limited-edition :cherry_blossom: design. Shop online at @ultabeauty. \n#Clinique #beauty #skincare #parabenfree\n#fragrancefree #happyskin',37395,8.805,3877,64,,,
CAS1ZtcDVqW,clinique,2020-05-17 15:38:26.000000,no,False,"b'clinique,live'",b'',b'Tune in LIVE this week :up_arrow_selector: What are you most excited to watch :down_arrow_selector:? #Clinique #live',0,0,1798,31,,,
CAQS-3Tj0LJ,clinique,2020-05-16 15:59:11.000000,no,False,"b'regram,seeaheartsendaheart,seeaheartsendaheart'","b'emilia_clarke,clinique,clinique'","b'#Regram @emilia_clarke: \xe2\x80\x9c:red_heart_selector: #seeaheartsendaheart:red_heart_selector:This is to all the incredible magical front line health workers the world over who have been keeping us safe during this pandemic and everyday of our lives... @clinique have been doing some incredible work to say thank you and help support them! They have been donating thousands of products to local hospitals and providing financial support to global organisations. What a beautiful company I am a proud to be in their family :smiling_face_with_heart-eyes: Go on, let\xe2\x80\x99s see your heart!!\xe2\x80\x9d Show support for those on the front lines by drawing a heart with your favorite lipstick on a mirror or window and post to Instagram, tagging @clinique and #SeeAHeartSendAHeart. Thank you, from the bottom of our hearts.:red_heart_selector:'",0,0,6868,35,,,
CANzCEnDI-T,clinique,2020-05-15 16:41:31.000000,no,False,"b'stayingin,mycliniqueritual'",b'',"b""Keep it spring-y even when you\xe2\x80\x99re inside. :cherry_blossom: Tap once to shop Sarah's favorite products for spring & swipe :left_arrow_selector: to see her final look. #StayingIn #myCliniqueRitual""",0,0,25454,125,,,
CAK-LjtDAdX,clinique,2020-05-14 14:22:01.000000,yes,False,b'seeaheartsendaheart',b'clinique',"b'Draw a heart with your favorite lipstick and share it to show support for those on the front lines. Tag @clinique with #SeeAHeartSendAHeart as a thank you, from the bottom of our hearts. :red_heart_selector:'",26374,21.533,2073,58,,,
CAInVX1DhBZ,clinique,2020-05-13 16:23:06.000000,no,False,b'',b'',b'Let us know your answer below :thinking_face::down_arrow_selector:',0,0,1877,75,,,
CAGDLGMjpUB,clinique,2020-05-12 16:28:39.000000,no,False,"b'stayingin,mycliniqueritual'",b'',b'#StayingIn doesn\xe2\x80\x99t mean goodbye to dating. :winking_face: Audrey gets virtual date gorgeous with a bold lip and lashes for days. Tap once to shop her look. #MyCliniqueRitual',0,0,11317,91,,,
CADdOt0jQDm,clinique,2020-05-11 16:18:36.000000,no,False,"b'clinique,takethedayoff,skincare,parabenfree,fragrancefree,happyskin'",b'tatis.blog',"b"":red_heart_selector: if you're looking forward to this moment. :up_arrow_selector: :camera_with_flash:: @tatis.blog #Clinique #TakeTheDayOff #skincare #parabenfree #fragrancefree #happyskin""",0,0,10946,108,,,
CAAqE8gjoaO,clinique,2020-05-10 14:13:09.000000,no,False,b'mothersday',b'',"b'To all moms & mother figures, no matter how near or far, we wish you a Happy #MothersDay :two_hearts:'",0,0,5434,40,,,
B_-SVeQDWwQ,clinique,2020-05-09 16:07:12.000000,no,False,"b'moisturesurge,cliniquehappy,clinique,beauty,makeup,skincare,parabenfree,fragrancefree,happyskin'",b'',"b""What's the first thing you'd try? :cherry_blossom:#MoistureSurge #CliniqueHappy #Clinique #beauty #makeup #skincare #parabenfree #fragrancefree #happyskin""",0,0,50386,466,,,
B_7tXR0jGcc,clinique,2020-05-08 16:05:40.000000,no,False,"b'stayingin,mycliniqueritual'",b'clinique_oz',"b'Got a meeting in a minute? Check out our stories where Anna, from our @clinique_oz team, shows you how to look Zoom-pretty and polished. #StayingIn #MyCliniqueRitual'",0,0,18959,100,,,
B_5tMu8DpaA,clinique,2020-05-07 21:25:44.000000,no,False,"b'beautyunited,frontlinerespondersfund,elcfamily'",b'thebeautyunited',"b'Clinique is proud to be part of BeautyUnited, the largest industry-wide effort to support frontline healthcare workers around the world during this pandemic. We are proud to contribute the maximum donation of 2,000 skin care products as a small token of our appreciation for their ongoing extraordinary efforts.  To learn more, tap the link in our bio. #beautyunited @thebeautyunited #frontlinerespondersfund #elcfamily'",0,0,2833,30,,,
B_5IWmvDs7n,clinique,2020-05-07 16:03:47.000000,no,False,b'',b'',b':writing_hand_selector::down_arrow_selector::growing_heart:',0,0,2075,64,,,
