shortcode,username,date_utc,is_video,is_sponsored,hashtags,mentions,caption,video_view_count,video_length,likes,comments,likes+comments,location_name,location_latlongB_FNmWIgfea,dentsuintl,2020-04-17 12:09:07.000000,no,False,"b'media,creative,crm,strongteam,globalrockstars,lifeasa,instatakeover,wfh'",b'',"b'Just off from our comms & marketing leadership team call\xe2\x80\xa6 introducing this brilliant team from around the world\xe2\x80\xa6 including our CMOs and CCOs from China to Denmark, Singapore to London, New York to Texas.\n\nWorking with such a global team from across DAN\xe2\x80\x99s #media, #creative and #CRM business areas, brings brilliant diversity in perspective and ideas to our marketing and comms agenda around the world.\n\nThis strong team (I am not biased!) have been determined, focused and diligent in making sure our people and clients are supported during the past couple of months\xe2\x80\xa6 whilst also doing their very busy day jobs. You can see them in action at some of these links:\n\nhttps://spoti.fi/2VA79tM\nhttps://spoti.fi/2RJ6aX9\n\n#strongteam #globalrockstars\n.\n.\n.\n#LifeAsA #Instatakeover #wfh'",0,0,112,5,,,
B_Ez_cIAIMx,dentsuintl,2020-04-17 08:25:21.000000,no,False,"b'harmony,opposites,bepresent,inthemoment,fridayfocus,lifeasa,instatakeover,wfh'",b'katyappleton',"b'Scroll to see what happens next\xe2\x80\xa6! The yang to my yin and the crazy to my calm! #harmony in #opposites\n\nWorking from home makes it even more important to have time to exercise, and be on my yoga mat\xe2\x80\xa6 it helps to focus the mind and end the week positively.\n\nSome inspiration comes from my yoga teacher @katyappleton and Ekhart Tolle: \xe2\x80\x98Realise deeply that the present moment is all you will ever have.\xe2\x80\x99\n#bepresent #inthemoment #fridayfocus\n.\n.\n.\n#LifeAsA #Instatakeover #wfh'",0,0,157,4,,,
B_C9yl1gxNp,dentsuintl,2020-04-16 15:12:29.000000,no,False,"b'familytimes,lockdown,yahtzee,poker,fullhouse,fairgame,lifeasa,instatakeover,wfh'",b'',"b'More time at home means more time to experiment in the kitchen! This is one of my mum\xe2\x80\x99s recipes and is a winner every time! Also takes me back to #familytimes when we would all be together around the dining table, talking noisily over each other. Recipe available on request!\n\nThese days our evenings are much quieter, just the two of us in #lockdown filling our nights with games like #yahtzee and #poker. Though my hubby seems to always win at the last minute\xe2\x80\xa6 #fullhouse #fairgame\n.\n.\n.\n#LifeAsA #Instatakeover #wfh'",0,0,87,0,,,
B_CMUw2IyET,dentsuintl,2020-04-16 08:00:19.000000,no,False,"b'wideawake,baking,gingerbread,joyful,happy,lifeasa,wfh,instatakeover'",b'',b'It was an early start in our house this morning\xe2\x80\xa6 with a very #wideawake toddler!! What better way to start the day than by #baking #gingerbread. As you can see it was a quick creative process from production to consumption!\n\nA very #joyful and #happy boy\xe2\x80\xa6 and all before the working day begins!\n.\n.\n.\n#LifeAsA #wfh #instatakeover',0,0,116,1,,,
B_AHSyMKV1P,dentsuintl,2020-04-15 12:37:54.000000,no,False,"b'media,creative,diversity,performance,delivery,clientcentricity,lifeasa,instatakeover,wfh,data,worldclass'",b'merkle',"b'Acquisitions bring new people and great leaders into the business. And at DAN acquisitions are in our DNA.\n\nToday we announced that DAN has accelerated the full purchase of @Merkle, and that we have fast-tracked their full integration into DAN. Merkle joined the DAN family back in 2016 and the acquisition has been game-changing enabling us to offer our clients what they want and need world-class CRM services and integrated solutions across the marketing mix with #Media and #Creative.\n\nIt is a real honour to work with leading industry figures like David Williams, Founder & CEO, Merkle. David is inspiring, smart and brilliant. He built Merkle and is helping to shape DAN\xe2\x80\x99s culture and strategy with a focus on #diversity, #performance, #delivery and #clientcentricity.\n\n#LifeAsA #Instatakeover #wfh #data #worldclass'",0,0,203,2,,,
B-_nhNHo0E3,dentsuintl,2020-04-15 08:00:15.000000,no,False,"b'family,community,strongertogether,lifeasa,instatakeover,wfh'",b'',"b'In these unprecedented and challenging times, every day throws up new challenges and opportunities. The current situation with coronavirus is serious and requires us to consider carefully how we are supporting and protecting our 42,000 people around the world. We are a diverse and talented network. That is what makes us so distinct. One thing that I observed from my first day at DAN (over four years ago now) is that however big we grow, through acquisition or hiring, there is always a sense of #family and #community, a passion to help each other and lead the way in doing good. That is very unique and special in this industry.\n\nOver the past months and weeks we have come together in new and creative ways, sharing different ideas to look after our teams and their families in these difficult times. Our European and American colleagues have learned from our Chinese colleagues with a priority on our people, our clients and our local communities. \nIn times of hardship we naturally come together as a global network at DAN. It is both humbling and inspiring.  #strongertogether\n.\n.\n.\n#LifeAsA #Instatakeover #wfh'",0,0,208,1,,,
B-9kmCyg1ra,dentsuintl,2020-04-14 12:56:07.000000,no,False,"b'potato,lightrelief,backtowork,mediafutures,onbrand,kindness'","b'sabrodriguez,caratglobal'","b'A fusion of humour and virtual working\xe2\x80\xa6 a recipe for success! Today\xe2\x80\x99s Editorial Team meeting saw our head of digital marketing join our video call as none other than, the very versatile garden veggie, a #potato! This caused a huge amount of much needed laughter at the start of the call. #lightrelief #backtowork\n\nYou can view the more professional side of @sabrodriguez in action interviewing one of our brilliant #MediaFutures experts, Dan Calladine of @CaratGlobal, in today\xe2\x80\x99s #OnBrand Spotify Podcast discussing the rise of community and humanity: https://spoti.fi/2Xx24F0\n\nAnd check out Dan\xe2\x80\x99s blog at DAN.com on doing the right thing\xe2\x80\xa6 and particularly the rise of #kindness during these troubled times for brands that means \xe2\x80\x98being kind, open and helping create the changes that their customers want.\xe2\x80\x99 https://bit.ly/2yf5Xno'",0,0,79,0,,,
B-9EXhSA6AC,dentsuintl,2020-04-14 08:14:31.000000,no,False,"b'toddlerconferencecall,friendsinlockdown,eastereggs,tractors,lifeasa,wfh,instatakeover'",b'',"b'I kick off the day connecting with our colleagues in Tokyo, who are ending their day.  Meanwhile, a million miles away, yet sitting next to me, Max is kicking off his day with a #toddlerconferencecall pretending to talk to his #friendsinlockdown around the neighbourhood about #eastereggs and #tractors. \nIt is very grounding and inspiring working with my little boy close by\xe2\x80\xa6 but I do also need space and quiet to get the job done - cue the next post\xe2\x80\xa6 #LifeAsA #wfh #instatakeover'",0,0,168,1,,,
B-6oAOsAoA_,dentsuintl,2020-04-13 09:28:11.000000,no,False,"b'instatakeover,boys,bump,joy,lifeasa,wfh'",b'',"b'Hi everyone, my name is Dani Jordan, I am responsible for DAN\xe2\x80\x99s global Communications & Marketing agenda and I am based from London. It is my job to ensure that we are showcasing the best of our network to clients, media and beyond, protecting and enhancing our reputation and engaging our people and talent around the world.  However, I\xe2\x80\x99m kicking off this week\xe2\x80\x99s #instatakeover with my family on Easter Monday, as a mum and wife\xe2\x80\xa6 with my #boys and #bump! Life can be very demanding as a full time, pregnant, working mum and it is really important to savour the time that you have with family. This lockdown has its challenges, but also its rewards. And moments like these are sheer #joy. #LifeAsA #wfh'",0,0,219,6,,,
B-6d7jKIVyQ,dentsuintl,2020-04-13 08:00:14.000000,no,False,"b'instatakeover,lifeasa,wfh'",b'iprospectirl',"b'A big thank you to Marija Cepulyte of @iprospectirl for her brilliant #Instatakeover last week! This week, Dani Jordan from the Dentsu Aegis Network Global Comms team is going to be showing us what #LifeAsA Chief Communications & Marketing Officer is all about. Over to you, Dani! #wfh'",0,0,75,0,,,
B-4i2XBAuj5,dentsuintl,2020-04-12 14:04:40.000000,no,False,"b'wfh,easter,colouringeggs,eggcolouring,traditions,lifeasa,instatakeover'",b'',"b'Various countries around the world have their own weird and wonderful Easter celebrations, specialities and traditions. My dad sometimes says, there are as many traditions around the world as there are houses \xe2\x80\x93 and I think he might be right! \nTo me, Easter has always been about eggs \xe2\x80\x93 colouring them, playing with them, and, of course, eating them \xe2\x80\x93 and I do mean real eggs, not the chocolate ones! I like using natural colouring materials such as onion shells and herbs since they are always available, but my absolutely favourite way to colour eggs is using wax \xe2\x80\x93 you can see some of my previous edible \xe2\x80\x9cmasterpieces\xe2\x80\x9c in the carousel. \nQuarantine or no quarantine, there is no reason not to carry on with traditions at home \xe2\x80\x93 what\xe2\x80\x99s yours?\n\nHappy Easter!\n\n#wfh #easter #colouringeggs #eggcolouring #traditions #LifeAsA #Instatakeover'",0,0,106,0,,,
B-1UVz0oGsx,dentsuintl,2020-04-11 08:00:15.000000,no,False,"b'goals,mbajourney,quarantinegoals,lifeasa,wfh'",b'',"b""The impression that I sometimes get from social media is that other people somehow cook from scratch every day (always using new recipes), they\xe2\x80\x99re exercising daily, and they\xe2\x80\x99re also repainting their entire apartment while teaching their dog TikTok dances\xe2\x80\xa6 This adds to a performance pressure to be your most efficient self, but it can paint a deceptive picture. \nIf you do have goals for yourself this Spring, I think it's important to be realistic and start with one goal at a time: you probably cannot learn how to play ukulele, read 658 books and start an intensive exercise routine all at the same time, particularly if you were not practicing regularly before. \nMy personal goal is to see the beauty in the little things and... catch up on my MBA readings, since I have a lot of them! What are yours? :smiling_face_with_smiling_eyes: \n#goals #mbajourney #quarantinegoals #LifeAsA #wfh""",0,0,91,0,,,
B-zBe6TgzPS,dentsuintl,2020-04-10 10:37:58.000000,yes,False,"b'i,wfh,calm,breathe,lifeasa,instatakeover'",b'calm',"b'I filmed my 11 tips for working from home videos during the first week of the quarantine \xe2\x80\x93 but some things are easier said than done, and I have not been following them myself, when I really should have.\n\nThere is a word in Lithuanian \xe2\x80\x93 namis\xc4\x97da \xe2\x80\x93 that has no equivalent in English. Namis\xc4\x97da is a person who is very content to stay at home and prefer doing that to leaving their house \xe2\x80\x93 I am that kind of a person. While I am extremely extroverted and love socialising, if I can stay indoors, I will; for example, I prefer watching a movie at home to going to the cinema and having a house party to going out. So when the quarantine started, it all felt like bliss to me, I was genuinely enjoying having more time at home and being able to wake up without an alarm clock.\n\nSoon the novelty wore out and I found myself suffering from one of the worst migraines of my life, all out of stress that I was refusing to acknowledge. The quarantine made my stress worse, since I was feeling terribly alone with my problems.\n#I took a weekend to recover and downloaded a meditation app (@Calm \xe2\x80\x93 they have a free trial for Dentsu employees), and took my mental health to my own hands. I have decided to give meditation a go, discovered that Matthew McConaughey\xe2\x80\x99s voice is the best sleep remedy I\xe2\x80\x99ve ever tried. I am forcing myself to take breaks and talk to people more, and I am slowly getting back to \xe2\x80\x9cnormal\xe2\x80\x9d, whatever that is.\n\nSo don\xe2\x80\x99t forget to breathe, and look after yourselves \xe2\x80\x93 because if not you, who else will?\n\n#wfh #calm #breathe #LifeAsA #Instatakeover'",774,28.5,23,0,,,
B-w5pswp4St,dentsuintl,2020-04-09 14:50:05.000000,no,False,"b'wfh,wfhtips,lifeasa,instatakeover'",b'',"b""My 11 tips for working from home:\n\n1. Establish physical workspace boundaries at home between your work area and other activities\n2. Set background noise to what works for you - e.g. music, white noise, grey noise, silence\xe2\x80\xa6\n3. Create space between people in your house - invest into a pair of good noise cancelling headphones if you can\n4. Have a routine! Even if it's just getting out of bed at the same time or making a cup of coffee\n5. Stay organised - plan your work as well as breaks\n6. Communicate more than before with your colleagues and use video camera in your catch ups to make it more personal\n7. Have regular check-ins on workload, offer support or ask for help when you need it\n8. Don't forget to move! Take extra time to incorporate exercise into your routine - go for a run, do yoga in your living room, or join one of the many available free online dance classes\n9. Do go outside (if you still can) for some extra vitamin D - try working from your balcony or garden if you have one\n10. Eat well and stay hydrated - take the time to look up a new recipe or what to do with the ingredients you already have in the house\n11. Use your spare time to do what you have always wanted to do, but have been telling yourself that you don't have the time for it* *and if you find yourself still not doing it - guess you can cross that item out of your wishlist for good!\n\nHave I missed anything - what tips have you got to share with me?\n\n#wfh #wfhtips #LifeAsA #Instatakeover""",0,0,73,8,,,
B-rxxZzI8VA,dentsuintl,2020-04-07 15:05:02.000000,no,False,"b'darjeeling,lifeasa,wfh'","b'marijatravels,iprospectirl'","b""Having been isolating in my tiny apartment for the last few weeks, I keep on looking back to this photo that really sparks joy, bringing me back to this time last year, when I was carelessly backpacking through Nepal and India (taken from a toy train in #Darjeeling). My name is Marija \xc4\x8cepulyt\xc4\x97 (the j is silent, and don\xe2\x80\x99t sweat about the surname \xe2\x80\x93 @marijatravels) and this week, I will be taking over the Global DAN Instagram account's #LifeAsA series.\n\nI work as a Digital Performance Account Director for iProspect Dublin (@iprospectirl), heading up one of the Client Leadership teams in Ireland. I am currently coming up close to my 7th workaversary; having started my career in the UK at iProspect Manchester back in 2013, I am quite a long timer here, and one my senior colleagues has said \xe2\x80\x93 \xe2\x80\x9cMarija probably bleeds green\xe2\x80\x9d. So, stick with me for some snippets from my life, as well as some handy tips for working \xe2\x80\x93 and not working \xe2\x80\x93 from home. #wfh""",0,0,215,11,,,
B-rLFOjoC1k,dentsuintl,2020-04-07 09:26:56.000000,no,False,"b'instatakeover,lifeasa,wfh'",b'iprospectirl',"b'Massive thanks to Laura Boatman for her #Instatakeover last week! This week, Marija Cepulyte is going to be showing us #LifeAsA Digital Performance Account Director at @iprospectIrl. Over to you, Marija! #wfh'",0,0,80,0,,,
B-l3kpbIMqg,dentsuintl,2020-04-05 08:00:15.000000,no,False,"b'lifeasa,instatakeover,wfh'",b'',"b'One of the benefits of self-isolation for me is finally having the time to pursue my hobbies, which previously got pushed down the pile of priorities in our fast-paced world.  I have really appreciated having the time to slow down, rest and appreciate the small things in life.  Over the last couple of weeks I have found the time to read, paint and practice yoga which has been much needed! #LifeAsA #Instatakeover #wfh'",0,0,103,2,,,
B-jSxN5oNjU,dentsuintl,2020-04-04 08:00:10.000000,no,False,"b'lifeasa,instatakeover,wfh'",b'',b'I have found that keeping fit and exercising during this challenging time is vital for both my physical and mental health. I am very lucky that one of my work colleagues runs a virtual bootcamp three times a week where Vizeum can come together and do a HIT workout from our homes! #LifeAsA #Instatakeover #wfh',0,0,77,0,,,
B-hClQioNOG,dentsuintl,2020-04-03 11:00:15.000000,no,False,"b'lifeas,instatakeover,wfh'",b'',"b'One of my tips for staying healthy during this time is to ensure I make the time to get outside every day. On my lunchbreaks I go for a wander around my neighbourhood in Bondi to get some fresh sea air, which is one of the highlights of my day and really helps to beat the cabin fever! I definitely have a new-found appreciation for living in this beautiful part of the world.  #LifeAs #Instatakeover\n #wfh'",0,0,88,1,,,
B-gt-6BIFgr,dentsuintl,2020-04-03 08:00:15.000000,no,False,"b'instatakeover,lifeasa,wfh'",b'vizeumaustralia',"b'This is my home desk where I am able to connect with my colleagues, clients and media partners in the virtual world. At @VizeumAustralia we are determined to ensure that working from home doesn\xe2\x80\x99t prevent us from maintaining our valuable relationships and therefore video calls are a must! We have been successful in finding new ways to bring our real-world meetings online, including team catch ups, connecting with media partners and even social activities! #Instatakeover #LifeAsA #wfh'",0,0,113,1,,,
B-ekqJDoKcM,dentsuintl,2020-04-02 12:00:18.000000,no,False,"b'instatakeover,wfh'","b'lauraboaty,vizeumaustralia'",b'Hi everyone! My name is Laura Boatman (@lauraboaty) and I am the Group Digital & Technology Director here at @VizeumAustralia. It is my job to ensure that we are providing our clients with best in market digital planning & buying solutions. I will be kicking off this week\xe2\x80\x99s #Instatakeover from Sydney!\n #wfh',0,0,163,0,,,
B-eabuDoLz8,dentsuintl,2020-04-02 10:30:56.000000,no,False,"b'instatakeover,lifeasa,wfh'",b'vizeumaustralia',"b'A huge thanks to Katy Burns for her #Instatakeover last week! This week, Laura Boatman is going to be showing us #LifeAsA Group Digital & Technology Director at @VizeumAustralia. Over to you, Laura! #wfh'",0,0,36,0,,,
B-OzSFjIft9,dentsuintl,2020-03-27 09:00:14.000000,no,False,"b'lifeasa,wfh,instatakeover'",b'',"b'tay connected to your colleagues. We\xe2\x80\x99re lucky at DAN to be set up with secure, cloud based collaboration tools. Every morning our team video chats over coffee, and I try to \xe2\x80\x98chat message\xe2\x80\x99 people with small requests rather than send emails to replicate hallway/desk conversations and maintain relationships. On Friday our team hung out with a few drinks over Microsoft Teams. As a former bartender, I taught them how to make a pisco sour! #LifeAsA #wfh #Instatakeover'",0,0,106,0,,,
B-MOepRoAxi,dentsuintl,2020-03-26 09:00:09.000000,no,False,"b'lifeasa,wfh,instatakeover'",b'',"b'We can\xe2\x80\x99t control our situation, but we can control how we react to it. Find ways to focus on the positives of your household working from home. As a newlywed, I feel very lucky to have a daily lunch date with my husband. I\xe2\x80\x99m also thinking about how I can use time saved from not commuting to look after my mental health, e.g. self-care/meditation, learning a new skill or working on a personal project. #LifeAsA #wfh #Instatakeover'",0,0,82,0,,,
B-JpsOuIku2,dentsuintl,2020-03-25 09:00:13.000000,no,False,"b'lifeasa,wfh,instatakeover'",b'',"b'It\xe2\x80\x99s easy to get wrapped up in deep work so set yourself a \xe2\x80\x98clocking off\xe2\x80\x99 time to make sure you step away from your workspace at the end of the day. If you need to care for children / vulnerable loved ones, agree a flexible working schedule with your manager. It\xe2\x80\x99s important to set boundaries between work and relaxation or other personal commitments to avoid burn-out. In my house, Wednesdays are now \xe2\x80\x98Movie Night\xe2\x80\x99! #LifeAsA #wfh #Instatakeover'",0,0,83,0,,,
B-HF4x-gImr,dentsuintl,2020-03-24 09:08:48.000000,no,False,"b'lifeasa,wfh,instatakeover'",b'',"b'It\xe2\x80\x99s important to set up a healthy work space. I\xe2\x80\x99m lucky to have a home office but I like to use different spaces to stoke my creativity (e.g. if I have writer\xe2\x80\x99s block). Wherever I\xe2\x80\x99m working, I make sure I have natural light, fresh air, water and noise cancelling headphones for deep work. #LifeAsA #wfh #Instatakeover'",0,0,102,0,,,
B-FCcRYIcyX,dentsuintl,2020-03-23 14:00:18.000000,no,False,"b'lifeasa,wfh,instatakeover'",b'',"b'It\xe2\x80\x99s tempting to slide out of bed and straight into work but setting a routine is important for my productivity, as is keeping physically active. I usually have a long commute so I\xe2\x80\x99m replacing my walk to the station with a walk at my local green space or an at-home workout. #LifeAsA #wfh #Instatakeover'",0,0,52,1,,,
B-EyBfrorxi,dentsuintl,2020-03-23 11:36:49.000000,no,False,"b'lifeasa,wfh,instatakeover'",b'',"b'Hi, I\xe2\x80\x99m Katy Burns, Global Comms Manager for DAN. In a previous role, I worked remotely for 4 years, so I wanted to share my work-from-home tips. #LifeAsA #wfh #Instatakeover'",0,0,104,0,,,
B98xt3xoojG,dentsuintl,2020-03-20 09:00:13.000000,no,False,"b'lifeasa,instatakeover'",b'',"b""Weekly Planning WIP. At the start of each working week the team gets together to discuss what's on our plate. We like to take this time to understand any new learnings from recent projects and help balance the workload amongst ourselves. Key events from the weekend past also tend to feature! #LifeAsA #Instatakeover""",0,0,62,0,,,
B96M7NcItiT,dentsuintl,2020-03-19 09:00:15.000000,no,False,"b'lifeasa,instatakeover'",b'',"b'Team member Steph and I researching up and coming cultural trends. Always aiming to stay on top any news and societal shifts that will have an impact on Australians, our clients and our creative work, #LifeAsA #Instatakeover'",0,0,55,0,,,
B91DVZAoW4I,dentsuintl,2020-03-17 09:00:16.000000,no,False,"b'lifeasa,instatakeover'","b'dentsuaegis,haystaccontent'",b'Excited smiles before heading into pitch. Collaborating with our @dentsuaegis and office colleagues @haystaccontent for a strategic social opportunity on a leading global brand. Fingers and toes crossed! #LifeAsA #Instatakeover',0,0,86,0,,,
B9yzIfjomWe,dentsuintl,2020-03-16 12:00:11.000000,no,False,"b'lifeasa,instatakeover'","b'bwmdentsu,toyota_aus,kmartaus,realestateaus,nandosaus'","b'Hi, my name is Zara Cooper and I am a Strategic Planner at @bwmdentsu Melbourne. My day to day consists of matching client goals to human insights, to help choose a path towards meaningful creative work. My team and I work across brands from many categories including @toyota_aus, @kmartaus, @realestateaus and @nandosaus #LifeAsA #Instatakeover'",0,0,43,0,,,
B9yeiWFIRD7,dentsuintl,2020-03-16 09:00:13.000000,no,False,"b'instatakeover,lifeasa'","b'zooper_dooper_,bwmdentsu'","b'A big thank you to Katie Higgins for her great #Instatakeover last week! This week Zara Cooper (@zooper_dooper_) is going to be showing us what #LifeAsA Strategic Planner at @BWMDentsu is all about. Over to you, Zara!'",0,0,40,0,,,
B9rZYTKoVyS,dentsuintl,2020-03-13 15:01:16.000000,yes,False,"b'iwd2020,eachforequal'",b'',"b""For International Women's Day, we asked Anna Moulton, Global HR Director, Dentsu Aegis Network, about her advice for future leaders and what it takes to make the workplace more diverse. Watch the full session here: http://bit.ly/2xze9Pg #IWD2020 #EachForEqual""",633,22.833,29,0,,,
B9rEyMUI5v_,dentsuintl,2020-03-13 12:01:20.000000,yes,False,"b'iwd2020,eachforequal'",b'',"b""For International Women's Day, we heard from Leon Markham, VP of Competitive Intelligence, Salesforce, about the business case for diversity. Watch the full session here: http://bit.ly/2TITjp7 #IWD2020 #EachForEqual""",390,27.266,13,0,,,
B9qzMkYoyFy,dentsuintl,2020-03-13 09:27:37.000000,yes,False,"b'iwd2020,eachforequal'",b'',"b'We spoke to Will Akerman, Founder and Managing Director, MyKindaFuture about why diversity in the workplace matters. Watch the full session here: http://bit.ly/2vlU0LO #IWD2020 #EachForEqual'",360,36.7,14,0,,,
B9pDZ7YIJhr,dentsuintl,2020-03-12 17:10:47.000000,yes,False,"b'iwd2020,eachforequal'",b'hearst',"b""For International Women's Day, we spoke to Claire Blunt, Chief Financial, Operations and Data Officer, @Hearst Europe, about the importance of sisterhood. Watch the full session here: http://bit.ly/2Q9wLvG #IWD2020 #EachForEqual""",418,29.8,21,0,,,
B9l2Kv5gBje,dentsuintl,2020-03-11 11:16:31.000000,no,False,"b'iwd2020,eachforequal'",b'',"b""To celebrate International Women's Day, we spoke to leaders across our business about what it takes to drive diversity and inclusion in the workplace and beyond. Check out the link in our bio for more info! #IWD2020 #EachForEqual""",0,0,62,0,,,
B9jX7qNgSSK,dentsuintl,2020-03-10 12:13:50.000000,no,False,"b'iwd2020,eachforequal'",b'',"b""To celebrate International Women's Day, we spoke to changemakers and thought leaders from across our business and our partners about how they\xe2\x80\x99re shifting the dial when it comes to building diverse and sustainable talent pools. Check out the link in our bio for more info! #IWD2020 #EachForEqual""",0,0,58,0,,,
B9hYZthIOtN,dentsuintl,2020-03-09 17:39:30.000000,no,False,"b'iwd2020,eachforequal'",b'',"b""We heard from Scott Sallee, Social Impact Manager, Dentsu Aegis Network, about how we're supporting new joiners at the start of their careers. Check out the link in our bio for more info! #IWD2020 #EachForEqual""",0,0,50,0,,,
