shortcode,username,date_utc,is_video,is_sponsored,hashtags,mentions,caption,video_view_count,video_length,likes,comments,likes+comments,location_name,location_latlongCDyEM0ZDuAe,dentsuintl,2020-08-12 08:18:26.000000,no,False,"b'lifeasa,instatakeover,wfh'",b'',b'This has been my home office since lockdown began. Tips for staying productive: Buy some great coffee (and bring your office chair home...) #LifeAsA #Instatakeover #wfh',0,0,168,1,,,
CDwSfxig0Es,dentsuintl,2020-08-11 15:44:49.000000,no,False,"b'wfh,instatakeover,lifeasa'",b'',"b""Hi everyone, I'm Joakim, the Client Director of Team MKTG Norway. Looking forward to seeing you this week! #wfh #Instatakeover #LifeAsA""",0,0,125,1,,b'dentsu norway',59.9148105083 10.7413959386
CDwF8e6I0UQ,dentsuintl,2020-08-11 13:55:12.000000,no,False,"b'instatakeover,lifeasa,wfh'",b'mktg_nor',"b""A very big thank you to Delfi Kartikawati for her brilliant #Instatakeover last week! This week, Joakim Rugdal of @mktg_nor, is going to be showing us what #LifeAsA Client Director is all about when you're working from home. Over to you, Joakim! #wfh""",0,0,56,0,,,
CDlKI7PDq64,dentsuintl,2020-08-07 08:00:12.000000,no,False,"b'wfh,instatakeover,dentsuaegisapac,lifeasa'",b'',b'I hope you\xe2\x80\x99ve enjoyed staying home with me this week. It has been a pleasure showing you how I make #WFH a fun experience. Stay safe everyone! \n#instatakeover #dentsuaegisapac #lifeasa',0,0,63,0,,,
CDilVwLDBH-,dentsuintl,2020-08-06 08:00:09.000000,no,False,"b'instatakeover,dentsuaegisapac,lifeasa'",b'',"b""Despite many plans being postponed and changed because of COVID-19, I managed to take the time to reflect and redefine my goals. Furthermore, I'm blessed to have more time to interact with my parents while practising physical distancing from home. Look how cute they are while cooking together! #instatakeover #dentsuaegisapac #lifeasa""",0,0,84,0,,,
CDgAkyQINrc,dentsuintl,2020-08-05 08:01:19.000000,yes,False,"b'instatakeover,wfh,lifeasa'",b'',"b'I have also initiated an internal WFH contest, created a collaborative playlist, relatable word bingo, and a crossword game for iProspect Indonesia to have fun and stay positive during this pandemic. #instatakeover #wfh #lifeasa'",560,24.4,25,0,,,
CDdbxeLomJm,dentsuintl,2020-08-04 08:01:16.000000,yes,False,"b'instatakeover,wfh,lifeasa'",b'',b'I break up the monotony of daily working from home by connecting with my friends and colleagues during breaks or after work. We often play games over video call to exercise our bodies and minds. #instatakeover #wfh #lifeasa',772,10.966,43,1,,,
CDb-FywJB0F,dentsuintl,2020-08-03 18:21:42.000000,no,False,"b'instatakeover,wfh,lifeasa'",b'iprospectvaluklik',"b""Hi there, I'm Delfi Kartikawati, Marketing Comms Associate Manager at iProspect Indonesia (@iprospectvaluklik). I believe that working from home may not always be easy, but we can use some effort to make it a good one. For me, I set up a table in my Mom's little garden to stay out in the sun. Having my morning coffee in the first half keeps me focused all day. #instatakeover #wfh #lifeasa""",0,0,170,0,,b'Indonesia',-0.8349 113.4668
CDa2-BXIJuI,dentsuintl,2020-08-03 08:00:17.000000,no,False,"b'lifeasa,instatakeover,lifeasa,wfh'",b'delfi.tse',"b""Our #LifeAsA series takes us behind the scenes and into the lives of the people who make up Dentsu Aegis Network. Each week, we hand over our Instagram account to a different guest editor to find out more about their role, their culture and their hobbies and passions outside the workplace.\n\nFor this week's #Instatakeover, we're heading to Indonesia where Delfi Kartikawati (@Delfi.tse) will be showing what #LifeAsA Marketing Comms Associate Manager is all about and how she's made her #WFH experience a memorable and positive one. Over to you, Delfi!""",0,0,82,1,,,
CC6ITKbJRu6,dentsuintl,2020-07-21 14:56:46.000000,no,False,b'',b'',,0,0,41,2,,,
CConLR3InV0,dentsuintl,2020-07-14 19:40:14.000000,no,False,b'',b'',,0,0,41,0,,,
CCdYfSnosLt,dentsuintl,2020-07-10 11:00:16.000000,no,False,b'',b'',,0,0,38,0,,,
CCbCMxYIZyw,dentsuintl,2020-07-09 13:07:01.000000,no,False,b'',b'',,0,0,49,0,,,
CCETuZIICYe,dentsuintl,2020-06-30 17:17:37.000000,no,False,b'',b'',,0,0,66,0,,,
CB6MdX3Iwwx,dentsuintl,2020-06-26 19:01:43.000000,no,False,b'',b'',,0,0,60,0,,,
CB3aQRKIfhG,dentsuintl,2020-06-25 17:04:32.000000,no,False,b'',b'',,0,0,58,0,,,
CBnoZDiIeIy,dentsuintl,2020-06-19 14:00:13.000000,no,False,b'',b'',,0,0,29,2,,,
CBnGDzjDfCB,dentsuintl,2020-06-19 09:00:13.000000,no,False,b'',b'',,0,0,41,7,,,
CBlDli9Id_d,dentsuintl,2020-06-18 14:00:09.000000,no,False,b'',b'',,0,0,43,0,,,
CBkponUgBR4,dentsuintl,2020-06-18 10:13:20.000000,no,False,b'',b'',,0,0,54,0,,,
CBNhc6QA7Z4,dentsuintl,2020-06-09 10:39:18.000000,no,False,b'',b'',"b'When people are seen, heard and supported, we take powerful steps forward. This week, we\xe2\x80\x99re turning our social channels over to our colleagues, specifically our Black colleagues in this moment of transformative global progress. These conversations may be uncomfortable, but we know powerful growth comes from discomfort. We are using our platform for awareness and advocacy, and we are listening and committed to actionable change.'",0,0,110,0,,,
CBDkwxMouV_,dentsuintl,2020-06-05 13:55:51.000000,no,False,b'',b'',,0,0,289,3,,,
CBApcRBjhLL,dentsuintl,2020-06-04 10:39:02.000000,no,False,b'',b'',"b'Toshi Yamamoto, Acting Executive Chairman & CEO, Dentsu Aegis Network and President & CEO, Dentsu Group Inc., pledges commitment to anti-racism:'",0,0,264,0,,,
CA7u0YSoFDQ,dentsuintl,2020-06-02 12:49:49.000000,no,False,b'blackouttuesday',b'',b'#BlackoutTuesday',0,0,338,0,,,
CA42mv-jGN2,dentsuintl,2020-06-01 10:00:07.000000,no,False,"b'lifeasa,wfh,instatakeover'",b'',"b'Hi everyone! My name is Anna Lungley. I care passionately about the impact we have on our planet and the people and communities in which we live and work, and I am extremely lucky to be able to combine this with my job as Global Head of Social Impact for Dentsu Aegis Network.\n\nI\xe2\x80\x99m looking forward to sharing a glimpse into my world. It\xe2\x80\x99s a busy one! At work I have an amazing team who determined to make a difference in the world. And at home, I have four kids and a puppy! My husband and I both work in sustainability and we\xe2\x80\x99ve been impressed by how informed the next generation are on issues like climate change. It\xe2\x80\x99s really inspiring.\n #LifeAsA #wfh #Instatakeover'",0,0,103,0,,,
CA4r_bBDhS2,dentsuintl,2020-06-01 08:27:22.000000,no,False,"b'instatakeover,lifeasa,socialimpact,wfh'",b'',"b'A very big thank you to Scott Sallee for his #Instatakeover! This week, Anna Lungley is going to be showing us what #LifeAsA Global Head of #SocialImpact here at Dentsu Aegis Network is all about during lockdown. Over to you, Anna! #wfh'",0,0,81,0,,,
CAe6wl8gApC,dentsuintl,2020-05-22 08:16:52.000000,yes,False,"b'lifeasa,wfh,instatakeover'",b'',b'Birthday in lockdown? My wife threw me a surprise tropical party with friends dialing in on Houseparty. Time in lockdown helps us focus on what is truly essential to our happiness. Connection. Kindness. Generosity. Purpose. #LifeAsA #wfh #instatakeover',1269,6.0,71,0,,,
CAdAt1hAIi_,dentsuintl,2020-05-21 14:29:58.000000,yes,False,b'',b'',,963,1674.332,24,1,,,
CAcli26Ag0u,dentsuintl,2020-05-21 10:32:16.000000,no,False,"b'lifeasa,wfh,instatakeover'",b'',"b""Since it's Throwback Thursday: our DAN Apprentices and I recently had the honour of representing our industry at the Houses of Parliament. Championing our future leaders is one of the best parts of my job. #LifeAsA #wfh #Instatakeover""",0,0,70,0,,,
CAatpcDANJR,dentsuintl,2020-05-20 17:04:36.000000,no,False,"b'lifeasa,wfh,instatakeover'","b'kaylemshepherd,common.vc'","b""We've been hard at work creating opportunities with The CODE, our flagship Social Impact programme representing Creativity, Opportunity, Diversity, and Empowerment. In April, Kaylem, a student from The CODE and I participated in an online Coronavirus Hackathon to solve the challenges we face in a post-Covid-19 world, including Environment, Health & Wellbeing, Education, Employment, and Human Behaviour. On June 1st we launch the Rise Up! digital marketing challenge. Great work @kaylemshepherd @common.vc! #LifeAsA #wfh #Instatakeover""",0,0,61,2,,,
CAaDAKuoHeX,dentsuintl,2020-05-20 10:52:01.000000,no,False,"b'lifeasa,instatakeover,wfh'",b'',"b""Time in nature is essential for my wellbeing. During lockdown I went 5 days without leaving the flat and wouldn't stop to take a proper lunch. My body and mind rang all the alarm bells - headaches & back pain to remind me to look after myself. Book it into your schedule and put it in your Outlook! #LifeAsA #Instatakeover #wfh""",0,0,88,0,,,
CAXPtLJATc_,dentsuintl,2020-05-19 08:45:22.000000,yes,False,"b'danceanddonate,lifeasa,wfh,instatakeoverwithice'",b'',b'My wife and I participating in the  #DanceAndDonate challenge. Inequality is exacerbated during global crises such as pandemics or other effects of climate change; witnessing the Dentsu community responding with generosity and solidarity to support charities in these times is uplifting. #LifeAsA #wfh #instatakeoverwithice',2622,5.266,128,2,,,
CAVKkNjAfEM,dentsuintl,2020-05-18 13:21:51.000000,no,False,"b'lifeasa,instatakeover,wfh'",b'',"b""Hi DAN-fam, I'm Scott. I've been with the company for about 3.5 years and lead Social Impact in the UK, looking after our diversity & inclusion, environmental, and social strategies. I co-chair the Wellbeing Committee and sit on the Steerco of &PROUD. :rainbow: I founded Mindfulness Mondays, a time for our community to come together, reset, and recharge. All are welcome! :purple_heart: It's Mental Health Awareness Week in the UK, so that's the theme of our #LifeAsA #Instatakeover! #wfh""",0,0,130,3,,,
CAVFi2Go2Tq,dentsuintl,2020-05-18 12:38:01.000000,no,False,"b'instatakeover,lifeasa,wfh'",b'',"b'A very big thank you to Mela Anwar for her brilliant #Instatakeover last week and especially for her energetic live workout sessions! This week Scott Sallee is going to be showing us what #LifeAsA Social Impact Manager is like during lockdown. Over to you, Scott! #wfh'",0,0,48,1,,,
CAM3X9eK0ff,dentsuintl,2020-05-15 08:00:17.000000,no,False,"b'wfh,happytribe,dentsuaegisapac,instatakeover,lifeasa'",b'',"b""Another great thing about #WFH is that I don't need to put on any make up! Besides saving money from having to buy make up, my skin also feels smoother nowadays. Ultimately, I love WFH because I can work in an environment that I am comfortable and familiar with. Thank you for being home with me this week!  I\xe2\x80\x99m staying in and staying safe this period. I hope you are too. .\n.\n.\n#happytribe #dentsuaegisapac #instatakeover #lifeasa""",0,0,141,1,,,
CAKekNrg09R,dentsuintl,2020-05-14 09:44:58.000000,no,False,"b'wfh,happytribe,dentsuaegisapac,instatakeover,lifeasa'",b'',"b""The only problem with #WFH my house is small. As space is limited, it's really easy to get bored. However, there are still many perks to WFH, one of which is that it gives me time to cook my lunch. I try to cook a healthy one as much as possible.\n.\n.\n.\n#happytribe #dentsuaegisapac #instatakeover #lifeasa""",0,0,127,1,,,
CAH1vvIAuA2,dentsuintl,2020-05-13 09:09:48.000000,no,False,"b'wfh,happytribe,happytribe,dentsuaegisapac,instatakeover,lifeasa'",b'',"b""Since we started #WFH, I realised the immediate need to have face time so that the #HappyTribe does not face any cabin fever. That's why it is crucial to have a daily morning huddle. We do so twice a day, 8.45 AM SGT and 8.45 AM IST for our Singapore and India teams respectively. On Monday, Wednesday and Friday, I've been leading the team's exercise. It\xe2\x80\x99s nothing fancy since I'm not a professional. I tailor my classes with stretching, low impact dance and body combat. .\n.\n.\n#happytribe #dentsuaegisapac #instatakeover #lifeasa""",0,0,102,2,,,
CAFOSwMg3HZ,dentsuintl,2020-05-12 08:46:34.000000,no,False,"b'happytribe,dentsuaegisapac,instatakeover,lifeasa,wfh'","b'hmarketer,merkle'","b""Hi! I'm Mela Anwar. I'm Head of Talent & Culture at Happy Marketer (@hmarketer), a @Merkle Company, in DAN Singapore. One of my top five Gallup strengths is discipline, and so I'm used to routines. It took me less than a week to adjust to working from home, and so far, I love it! My day starts as early as 5am. I start the day by drinking my coffee and exercising. I move my furniture around and turn my small living room into a mini-workout studio.\n.\n.\n.\n#happytribe #dentsuaegisapac #instatakeover #lifeasa #wfh""",0,0,111,1,,,
CADSx7CKiXK,dentsuintl,2020-05-11 14:47:21.000000,no,False,"b'instatakeover,lifeasa,wfh'",b'',"b""A very big thank you to Kristina Church for her brilliant, family-filled #Instatakeover last week. Next up is Mela Anwar, who'll be showing us her #LifeAsA Head of Talent & Culture during lockdown. Over you, Mela! #wfh""",0,0,78,0,,,
B_4RAdIqh1Q,dentsuintl,2020-05-07 08:00:14.000000,no,False,"b'lifeasa,wfh,instatakeover'",b'',"b'To keep my mind sane, I early on decided I need to get some fresh air before starting my workday. Every workday I get up around 6.30 and go for a brisk walk of about 50 minutes whereas the first 20 are up hill to get my blood flowing. I listen to podcasts and try to clear my head so I\xe2\x80\x99m ready for my workday. Highly recommended :flexed_biceps:#LifeAsA #wfh #Instatakeover'",0,0,65,0,,,
B_13og8qG57,dentsuintl,2020-05-06 09:40:01.000000,no,False,"b'lifeasa,wfh,instatakeover'",b'',"b'As our whole country closed, so was my husband\xe2\x80\x99s work. I feel lucky that I\xe2\x80\x99ve been able to work full time while Hugo\xe2\x80\x99s been home. And my favorite part; being able to spend so much time together as a family despite all the noise and the occasional \xe2\x80\x9cmommy, I have to poop!\xe2\x80\x9d whilst in a Teams meeting with clients :face_with_tears_of_joy: This is them making lunch while I\xe2\x80\x99m at my previous desk in our apartment. #LifeAsA #wfh #Instatakeover'",0,0,66,1,,,
B_zHa3EKXa0,dentsuintl,2020-05-05 08:00:15.000000,no,False,"b'lifeasa,wfh,instatakeover'",b'',"b""It took a while, but I finally managed to get a proper home office! The desk is designed and built by me to fit perfectly into the space we had available. Color chosen by my son :winking_face: Now I finally have a door I can close when I need privacy and it's so much better than sitting in the dining room where everything happens. #LifeAsA #wfh #Instatakeover""",0,0,205,1,,,
B_xPQbSAAOf,dentsuintl,2020-05-04 14:30:58.000000,yes,False,"b'lifeasa,wfh,instatakeover'",b'',"b'Hi, my name is Kristina, this is my husband and our son Hugo doing what we do best, summers! Since our summer plans of traveling outside the country are most likely cancelled, we\xe2\x80\x99re hoping for a warm summer with lots of sun :sun_selector: Oh, and I work as a Digital Lead here in Norway, been with Carat for 2 years and in the industry for over 10. #LifeAsA #wfh #Instatakeover'",1387,4.0,83,3,,,
B_wo61nKC3P,dentsuintl,2020-05-04 08:55:15.000000,no,False,"b'instatakeover,lifeasa,wfh'",b'kristinaslife',"b'A massive thank you to Katarina Krohg for her super creative #Instatakeover last week! This week we have Kristina Church (@kristinaslife) showing us what #LifeAsA Digital Lead at Carat Norway looks like during life under lockdown. Take it away, Kristina! #wfh'",0,0,65,0,,,
B_o0SKpqGqB,dentsuintl,2020-05-01 08:01:22.000000,yes,False,"b'lifeasa,dentsuaegis,dentsudenmark,freshair,elements,nature,walkingmeditation,homeoffice,copenhagen,wfh,instatakeover'",b'',"b'Working from home and Social Distancing sentence means spending a lot of time inside at home.\n\nThis is where the nature \xe2\x80\x93 the outside \xe2\x80\x93 is our best friend.\n\nGoing for walks or bike rides with as much contact with the elements as possible and some deep breathing can recharge you in the most satisfying way.\n\nBecause I meditate, I do \xe2\x80\x9cwalking meditation\xe2\x80\x9d. Which simply means I concentrate on my deep breaths while I walk. This makes me feel the ground under me, the water sparkling and waving by me, the air refreshing me and the sun warming me to an indulgent extent. It makes me the happiest human.\n\nStay Safe. Take Care of your energy. We got this!\n\n#LifeAsA #DentsuAegis #Dentsudenmark #freshair #elements #nature #walkingmeditation #homeoffice #Copenhagen\n #wfh #Instatakeover'",456,44.4,26,0,,b'Copenhagen',55.6761111111 12.5688888889
B_mT0VugeXN,dentsuintl,2020-04-30 08:38:23.000000,no,False,"b'lifeasa,dentsuaegis,dentsudenmark,vidcalls,audio,voice,liptrills,homeoffice,copenhagen,wfh,instatakeover'",b'',"b'Hello? Can you hear me?\n\nWhether it\xe2\x80\x99s a voice or tech challenge, we can get around it pretty easily.\n\nBefore big presentations I always warm up my voice with breath and lip trill exercises. In this way you get some good energy pumping in your body, plus your voice flows more effortlessly and with more power.\n\nDuring local meetings, if audio is bad in video conference \xe2\x80\x93 switch off the sound and mic of the video conference, so you can keep seeing each other and/or the presentation.\n\nThen make a regular phone call to get good sound.\n\nAfter a day with meetings it\xe2\x80\x99s important to unwind \xe2\x80\x93 I like to draw a little \xe2\x80\x93 I really thrive in living it up at home. People worry because I\xe2\x80\x99m alone, but I am 60/40 extrovert/introvert, and I have a million interests, so I am doing very well ;) #LifeAsA #DentsuAegis #Dentsudenmark #vidcalls #audio #voice #Liptrills #homeoffice #Copenhagen\n #wfh #instatakeover'",0,0,77,0,,b'Copenhagen',55.6761111111 12.5688888889
B_jwyhmgZS4,dentsuintl,2020-04-29 08:53:49.000000,no,False,"b'lifeasa,lifeasa,dentsuaegis,dentsudenmark,techneck,goodposture,copenhagen,homeoffice,wfh,instatakeover'",b'dentsuaegis',"b'Technology is our friends, but it is also the contributor of pain to our necks and backs.\n\nHaving a \xe2\x80\x9ctech neck\xe2\x80\x9d, bad posture or neck/back pains, come from us slouching down to look at our phones all the time or sitting on our office chairs and staring at our computers.\n\nYou can do some 3 simple and great exercises that make a huge difference and relieves these pains, and I show these simple exercises in @DentsuAegis stories today or under #LifeAsA IG Story highlights.\n\nYou are strengthening your neck and back to not hunch over in the first place instead of just trying to relieve the pain temporarily. \nIf you can\xe2\x80\x99t find the exercises \xe2\x80\x93 just send an IG message to me. \n#LifeAsA #DentsuAegis #Dentsudenmark #techneck #goodposture #Copenhagen #homeoffice #wfh #instatakeover'",0,0,56,0,,b'Copenhagen',55.6761111111 12.5688888889
B_hJLJnA_lm,dentsuintl,2020-04-28 08:29:11.000000,no,False,"b'lifeasa,motivation,meditation,pianobreaks,wfh,instatakeover'","b'insighttimer,markmanson'","b""Manage Energy. Stay Productive.\n\nI start each morning with a  meditation using @insighttimer\n\nListening to your mind and body is always important. Just as you have an indicator for your phone and computer's battery, tuning into your own energy status is crucial to being productive.\n\nFeeling the rush of motivation is amazing, but it will not always come to you as a source of inspirational feeling.\n\nSometimes, you have to just get crackin\xe2\x80\x99 to ignite the feeling of motivation This knowledge has been paramount to my productivity. I sense whether I\xe2\x80\x99m waiting for motivation \xe2\x80\x93 in this case I just start working. If it\xe2\x80\x99s difficult, especially at home, I put on work clothes, do my hair and maybe put on some low key but rhythmic music to get the pace going. Sometimes chewing gum helps my fluttering energy grounded. \nIf your brain really just needs to recharge, respect it \xe2\x80\x93 even if it\xe2\x80\x99s just 20min. Allowing yourself to recharge the energy your mind and body are yearning for, will make you so much more effective and efficient. I might draw, play the piano, sing, dance a little, stream, take a nap\xe2\x80\xa6 I also do this if I need a break to let my creative thoughts process.\n\n@markmanson #LifeAsA #Motivation #Meditation #Pianobreaks #wfh #instatakeover""",0,0,73,6,,b'Copenhagen',55.6761111111 12.5688888889
B_fInKegTbj,dentsuintl,2020-04-27 13:45:47.000000,no,False,"b'japanbaptized,copenhagen,lifeasa,dentsuaegis,dentsudenmark,scandinasian,copenhagen,peopledrivebusiness,wfh,instatakeover'",b'katarinakrohg',"b'Scandinasian check!\n\nNice to meet you! I\xe2\x80\x99m @KatarinaKrohg, a marketing strategist from Copenhagen.\nMy roots are Norwegian, Japanese, and South Korean, while I\xe2\x80\x99ve been in Denmark my whole life.\n\nI was born in Kyushu #JapanBaptized in Kobe, Japan\nI found my home in #Copenhagen\n\nMy amazing Dentsu colleagues were a huge part of making me feel more at home in Denmark than I ever had \xe2\x80\x93 I mean, I\xe2\x80\x99ve been in Denmark since I was 6 months old!I still can\xe2\x80\x99t believe how many incredibly lovely, funny and smart people we have gathered under one roof.\n\n#LifeAsA #DentsuAegis #Dentsudenmark #Scandinasian #Copenhagen #PeopleDriveBusiness #wfh #instatakeover'",0,0,73,0,,b'Copenhagen',55.6761111111 12.5688888889
B_euB9aK_Sn,dentsuintl,2020-04-27 09:53:36.000000,no,False,"b'instatakeover,lifeasa,wfh'",b'dentsuaegis_dk',"b'A big thank you to Kristina Juhlin for her great #Instatakeover last week! This week, Katarina Krohg is going to be showing us what #LifeAsA Marketing Strategist looks like at @dentsuaegis_dk whilst working from home during quarantine. Over to you, Katarina! #wfh'",0,0,63,1,,,
B_XG9XfAdlV,dentsuintl,2020-04-24 10:57:25.000000,no,False,"b'lifeasa,wfh,instakeover,teams,dentsuatwork,friday,tieday'",b'',"b'In times of isolation, it\xe2\x80\x99s important to touch ground with the teams on a daily basis. I have meetings with the Dentsu Aegis, Amplifi and Dentsu Data Lab (DDL) management every day. It\xe2\x80\x99s important to use the camera for personal interactions and share laughs. Together we going to fight this through. Have a lovely weekend, and stay safe! #LifeAsA #wfh #instakeover #teams #dentsuatwork #Friday #tieday'",0,0,110,0,,,
B_UVF6xA1Y3,dentsuintl,2020-04-23 09:03:12.000000,no,False,"b'lifeasa,wfh,instakeover,lunchrun,sweden,kalleskaviar'",b'',"b'Using the lunch break for a run is always a good idea working from home. For lunch, an egg-sandwich with spread-caviar called Kalles Kaviar, a Swedish delight I think only Swedes enjoy. How do toy like to spend your lunch working from home? #LifeAsA #wfh #instakeover #lunchrun #Sweden #kalleskaviar'",0,0,96,1,,,
B_RpFT_Ii1e,dentsuintl,2020-04-22 08:00:14.000000,no,False,"b'lifeasa,wfh,instakeover,fika,sweden'",b'',"b'When working from home, it\xe2\x80\x99s still important to have short breaks. I prefer mine with Oolong tea in 95\xc2\xb0C water and Royal Copenhagen porcelain, and of course some cookies. In Sweden we call it a \xe2\x80\x9cfika\xe2\x80\x9d. How do you like your fika? #LifeAsA #wfh #instakeover #fika #Sweden'",0,0,89,2,,,
B_PEStuqyCi,dentsuintl,2020-04-21 08:00:16.000000,no,False,"b'lifeasa,wfh,instakeover,dentsuatwork'",b'',"b'Working from home needs the right equipment. Under my laptop is a thick book that lifts up the computer to an ergonomic level, my headset secures confidentiality when sharing home office with my husband and my laptop camera is always on for personal interaction in meetings. #LifeAsA #wfh #instakeover #dentsuatwork'",0,0,137,0,,,
B_NJoEXqBee,dentsuintl,2020-04-20 14:08:23.000000,no,False,"b'lifeasa,wfh,instakeover,dentsuatwork'",b'',"b'Hello everyone, I\xe2\x80\x99m Kristina Juhlin reporting from my home-office in Stockholm, Sweden. I work as a MD for Amplifi, Posterscope and DDL Sweden. Join me this week and I\xe2\x80\x99ll show you how I\xe2\x80\x99m working from home. #LifeAsA #wfh #instakeover #dentsuatwork'",0,0,89,3,,,
B_MzphNIWJp,dentsuintl,2020-04-20 10:56:20.000000,no,False,"b'instatakeover,lifeasa,wfh'",b'',"b'Huge thanks to Dani Jordan for her awesome #Instatakeover last week! This week, Kristina Juhlin of Amnet Sweden is going to be showing us what #LifeAsA Managing Director is like whilst #wfh. Over to you, Kristina!'",0,0,80,0,,,
B_FkmSPiqav,dentsuintl,2020-04-17 15:30:15.000000,no,False,"b'virtualteamdrinks,londonlockdown,rockstars,pregnantlife,notrealbubbles,stayhome,staysafe,stayinspired,lifeasa,instatakeover,wfh'",b'',"b'It has been great sharing my week with you\xe2\x80\xa6 thank you for tuning in and for supporting Dentsu Aegis Network! \nThere is no greater tonic than ending the week with our #virtualteamdrinks. This is now a team tradition which we have done every week since we were in #londonlockdown. It is a great way for us to connect at the end of the week, download and share weekend plans (as you can imagine not exactly the most riveting at the moment!) You can see some of the team #rockstars on the screen. \nWhile the rest of the team enjoy sipping nice wine, beer or G&Ts, I have been sampling non-alcoholic alcohol substitutes\xe2\x80\xa6 and while it isn\xe2\x80\x99t quite the same, it is amazing how many products there are out there! Today I am having sparkling tea it is actually surprisingly good! #pregnantlife #notrealbubbles \nWishing everyone a very happy, healthy and safe weekend wherever you are in the world. #stayhome #staysafe #stayinspired\n.\n.\n.\n\n#LifeAsA #Instatakeover #wfh'",0,0,136,1,,,
