shortcode,username,date_utc,is_video,is_sponsored,hashtags,mentions,caption,video_view_count,video_length,likes,comments,likes+comments,location_name,location_latlongCEVGhFKljq_,extraspace,2020-08-25 22:52:04.000000,no,False,b'',b'',"b'Would you or your family enjoy a reading nook in the home? :books:\n\nMake sure you have plenty of storage space in or around your book nook! With built-in bookshelves or storage bench drawers, you\xe2\x80\x99ll have a convenient place in your reading corner to set up cute home decor and knick-knacks, as well as store your personal library close to where you\xe2\x80\x99ll be reading.\n\nYou can see more photos and read our Reading Nook Design Ideas blog post by tapping the link in our bio. :green_heart: Let us know what you think!\n\n(:camera:: IG/jennifer.johns.129)'",0,0,132,3,,,
CEP-_GBFtdH,extraspace,2020-08-23 23:10:03.000000,no,False,b'',b'southwestbysoutheast',"b""If your home had a different decor style, what style would you choose? :couch_and_lamp_selector:\n\nIf you'd like to change to a modern minimalist style, look for furniture with bold geometric shapes and clean lines. Opt for a rectangular coffee table with exposed legs. Or incorporate unique shapes and lines with table centerpieces, plant pots, and photo frames.\n\nCredit :camera:: @southwestbysoutheast""",0,0,100,1,,,
CEK1gn9lM71,extraspace,2020-08-21 23:11:03.000000,no,False,b'',b'nickyhousesnaps',"b'Hidden storage underneath the cushions! :green_heart: Which room do you wish you had more space in?\n\nTake advantage of the space under your couch, loveseat, or sofa by adding secret storage drawers! Whether you design a bench-style couch with built-in storage or simply add pullout drawers under an existing couch, this is a great way to store kids toys, board games, DVDs, and more!\n\nCredit :camera:: @nickyhousesnaps'",0,0,118,1,,,
CEFthbvFPvV,extraspace,2020-08-19 23:25:03.000000,no,False,b'',b'chelseagthomas',"b""Here's some more kitchen organization! :spoon: Would you prefer a spice drawer or a spice cabinet?\n\nCountertop and wall-mounted spice racks can take up valuable kitchen storage space. Try switching to a spice drawer instead! Just lay the containers flat in a divided drawer for attractive and accessible spice storage.\n\nCredit :camera:: @chelseagthomas""",0,0,110,8,,,
CEAfW9aldj2,extraspace,2020-08-17 22:45:06.000000,no,False,b'',b'thedowntownaly',"b""Amazing pantry organization! :smiling_face_with_heart-eyes: Is this what your dream pantry looks like?\n\nWith some drywall and shelving, you can turn a kitchen corner into a floor-to-ceiling pantry. If you've felt like you need more space for organization, this could be a great home renovation opportunity.\n\nCredit :camera:: @thedowntownaly""",0,0,345,19,,"b'Plano, Texas'",33.0504 -96.7459
CD7VxE5FTDu,extraspace,2020-08-15 22:45:05.000000,no,False,b'',b'revivalhomedesigns',"b'Planning any home renovations currently? :house: One great idea is to add paneling to your walls!\n\nCreate a rustic look in your kitchen or bathroom by installing shiplap or wooden planks on walls. Or give bedroom, hallway, and living room walls a makeover with wainscoting, board and batten, or beadboard.\n\nCredit :camera:: @revivalhomedesigns'",0,0,185,14,,,
CD2OsXVl1lu,extraspace,2020-08-13 23:07:03.000000,no,False,b'',b'myrestyleproject',"b'What do you do with the space under the stairs? :exploding_head: Each of these panels are actually organized drawers that pull out!\n\nIs there another way you would prefer to use the space under your stairs? Depending on the location of the staircase, some use it as a play-space, wine storage, or a pet room! :thinking_face: What would you prefer?\n\nCredit :camera:: @myrestyleproject'",0,0,117,5,,,
CDxF6Aul_HB,extraspace,2020-08-11 23:14:04.000000,no,False,b'',b'nevillejohnsongroup',"b""What helps you stay focused while working? :laptop_computer:\n\nHaving a tidy and organized space for working is important. If you're looking to create a home office with minimal space, try something like this! Keep your chair, computer, keyboard, and other office supplies out of sight with hideaway cabinets and drawers.\n\nCredit :camera:: @nevillejohnsongroup""",0,0,197,5,,,
CDraq2OFHYs,extraspace,2020-08-09 18:20:04.000000,no,False,b'',b'minttinyhomes',"b'What do you like most about this tiny home? :house:\n\nTake advantage of vertical space with a lofted bedroom! By building up, you\xe2\x80\x99ll find increased floor space for other living spaces like your kitchen and living room. This can be a good idea for any small home or perhaps a shared kids bedroom.\n\nCredit :camera:: @minttinyhomes'",0,0,600,39,,,
CDmvaJnlAY2,extraspace,2020-08-07 22:45:06.000000,no,False,b'',b'leclairdecor',"b""What's the most difficult part of interior design for you? :thinking_face:\n\nYou don\xe2\x80\x99t need to worry about decorating your home all at once. Focus on quality of items over quantity when designing with modern furniture and decor. Start small and use each room\xe2\x80\x99s basic features to guide your decorating decisions.\n\nIf you have a gorgeous glass-top coffee table, for example, consider using other reflective elements\xe2\x80\x94like mirrors and glazed ceramic vases\xe2\x80\x94around the room to create the theme throughout.\n\nCredit :camera:: @leclairdecor""",0,0,163,7,,,
CDhocwjlyut,extraspace,2020-08-05 23:08:04.000000,no,False,b'',b'hunted_interior',"b'Would you prefer a spacious laundry room or a space-saving laundry closet? :thinking_face:\n\nYou can turn a reach-in closet into a laundry room by removing shelving, putting down a floor protector, and installing the water and drain lines. If the closet is really small, opt for a stackable washer-dryer!\n\nCredit :camera:: @hunted_interior'",0,0,591,21,,,
CDcfFqclhFC,extraspace,2020-08-03 23:10:04.000000,no,False,b'',b'gweenhomedecor',"b'What room are you most proud of for your interior design? :smiling_face_with_sunglasses:\n\nThe barn door on this bathroom adds so much charm! For small space living, this bathroom also makes smart choices to maximize space, such as using a pedestal sink. Which room in your home are you most proud of?\n\nCredit :camera:: @gweenhomedecor'",0,0,340,7,,,
CDXQO3plZFM,extraspace,2020-08-01 22:24:03.000000,no,False,b'',b'ourhomedays',"b""Do you prefer modern or repurposed vintage items? :thinking_face:\n\nOne way to add hidden storage to your living room is to use a trunk for a coffee table. Not only does a storage trunk make for a great decorative piece in your living room, but you can also store pillows, blankets, books, and other items inside of it, keeping them out of the way! Is this something you'd like in your home?\n\nCredit :camera:: @ourhomedays""",0,0,245,9,,,
CDXQO3plZFM,extraspace,2020-08-01 22:24:03.000000,no,False,b'',b'ourhomedays',"b""Do you prefer modern or repurposed vintage items? :thinking_face:\n\nOne way to add hidden storage to your living room is to use a trunk for a coffee table. Not only does a storage trunk make for a great decorative piece in your living room, but you can also store pillows, blankets, books, and other items inside of it, keeping them out of the way! Is this something you'd like in your home?\n\nCredit :camera:: @ourhomedays""",0,0,245,9,,,
CDSE7qulurF,extraspace,2020-07-30 22:09:07.000000,no,False,b'',b'decormarkethome',"b'Do you have a favorite piece of functional furniture that helps you organize clutter? :smiling_face_with_halo: What is it?\n\nYou could replace a basic coffee table with one that has built-in storage! Hidden coffee table drawers will make it easier to keep remotes, magazines, board games, coasters, and other living room items out of the way.\n\nCredit :camera:: @decormarkethome'",0,0,86,1,,,
CDNAfJ8Fkpz,extraspace,2020-07-28 22:54:04.000000,no,False,b'',b'bestidblog',b'Do you know the differences between minimalist and modern interior design? :thinking_face:\n\nSee our blog post by tapping the link in our bio! We love to share home tips that can help you get organized and make the most of your space. Which interior design style do you prefer?\n\nCredit :camera:: @bestidblog',0,0,230,5,,,
CDH5L0VF1qz,extraspace,2020-07-26 23:14:03.000000,no,False,b'',b'chadmellon',"b'What do you like most about this modern bathroom? :green_heart:\n\nAdd mirrors throughout your house to add light and create the illusion of extra space. Another good way to improve your home\xe2\x80\x99s lighting is by leaving windows unblocked. Hang simple blinds or shades for privacy and to help regulate temperature, but skip heavier window furnishings like curtains or drapes.\n\nCredit :camera:: @chadmellon'",0,0,240,15,,,
CDCuVo0lwDJ,extraspace,2020-07-24 23:03:04.000000,no,False,b'',b'smalltownstyleme',"b'Doing the laundry might be just a bit more enjoyable in a room like this. :winking_face: Do you agree?\n\nWith extra cabinets and shelving, the room could serve multiple purposes. Store your pet supplies, cleaning items, coats, and more. What do you think?\n\nCredit :camera:: @smalltownstyleme'",0,0,234,8,,,
CC9izVZlnrn,extraspace,2020-07-22 22:46:03.000000,no,True,b'',b'ourvanquest',"b""We're so excited to reveal all the hard work on this skoolie from @OurVanQuest tomorrow on our stories! :bus: Make sure to come check out their beautiful bus conversion and small space organization tips! Are you as excited as we are? :smiling_face_with_heart-eyes:\n\nAlso, huge congrats on their newborn, Capri!""",0,0,252,15,,,
CC4bRW1lQDk,extraspace,2020-07-20 23:04:03.000000,no,False,b'',b'decluttrme',"b'What feeling best describes a perfectly organized closet? :smiling_face_with_sunglasses:\n\nHow would you describe it? Home organization can help reduce stress and anxiety, while making your general day-to-day easier. Decide what things are worth keeping, then find the space to keep them organized!\n\nCredit :camera:: @decluttrme'",0,0,163,9,,,
CCzO7y0Fl4o,extraspace,2020-07-18 22:40:03.000000,no,False,b'',b'lenart_meble',"b""What's your favorite home organization tip for small space living? :thinking_face:\n\nWe've shared some hidden storage blog posts in the link in our bio to help out! A murphy bed like this one is a great idea for maximizing a small space. What tip do you have to share?\n\nCredit :camera:: @lenart_meble""",0,0,175,5,,,
CCuFHeFl7Ii,extraspace,2020-07-16 22:38:03.000000,no,False,b'',b'themartinnest',"b""Takeover on our stories today from @themartinnest! :smiling_face_with_heart-eyes: Jessica is showing examples of hidden storage to maximize the space in your home. Her home style is gorgeous and we're excited to share her talent with you!\n\nWhat was your favorite part of the takeover? :green_heart:""",0,0,172,3,,,
CCo-9eHlz0D,extraspace,2020-07-14 23:08:04.000000,no,False,b'',b'brunoandlibby',"b'Is a mudroom included in your dream home? :smiling_face_with_heart-eyes: Why or why not?\n\nA place to take off your muddy shoes can be nice for helping to keep the rest of your home clean. Plus, a mudroom can serve as a spot to keep jackets, umbrellas, sports equipment, or outdoor gear. More storage area for more home organization! What do you think?\n\n(:camera:: @brunoandlibby)'",0,0,295,15,,,
CCE5izXlFNr,extraspace,2020-06-30 22:48:04.000000,no,False,b'',b'sandradeco__sweet_home',"b""Do you enjoy painting? Why or why not? :paintbrush_selector::artist_palette:\n\nPainting your cabinets can be an affordable DIY project with a big impact. Be prepared though for some long hours of labor. Some people love painting, others don't! How about you?\n\nCredit :camera:: @sandradeco__sweet_home""",0,0,358,17,,,
CB_0TM3Fd_D,extraspace,2020-06-28 23:26:03.000000,no,False,b'',b'lindyegalloway',"b'On a scale of 1-10, how much do you need this? :grinning_face_with_sweat:\n\nCreative bathroom storage can help keep your counters free of clutter! This useful drawer is just one of the many ideas from our recent blog post on hidden bathroom storage ideas. Let us know what other creative solutions you find for staying organized!\n\nCredit :camera:: @lindyegalloway'",0,0,366,29,,,
CB6pOWflpz_,extraspace,2020-06-26 23:13:04.000000,no,False,b'',b'diariesofmyhome',"b""What's something you love about your home? :green_heart:\n\nWe really love how bright this home is! You can create more light in your home through large windows, but also by painting a room in lighter colors so as to reflect the light. So what do you love about your home?\n\nCredit :camera:: @diariesofmyhome""",0,0,182,17,,,
CB1fD_rl1d7,extraspace,2020-06-24 23:08:04.000000,no,False,b'',b'houseofhanesinteriors',"b""Takeover on our stories tomorrow w/ @houseofhanesinteriors! Who's excited? :smiling_face_with_heart-eyes:\n\nAshley will be showing the hidden storage in her gorgeous living room. :green_heart: Follow along to see how you can use hidden storage to maximize space and keep things organized in your home!""",0,0,191,14,,,
CBwV0JNFrwO,extraspace,2020-06-22 23:11:03.000000,no,False,b'',b'choosing.less',"b'Gorgeous RV renovation with reclaimed shiplap! :bus: What do you like most about this space?\n\nFor any small space, you can use floating shelving to give a more open, airy feel to your home. Hanging plants also leaves more room on your shelves for showing off any books, photos, or trinkets. What do you think?\n\nCredit :camera:: @choosing.less'",0,0,349,14,,,
CBrF0dPlneU,extraspace,2020-06-20 22:15:06.000000,no,False,b'',b'courtneyungaro_spaceanddesign',b'What do you wish you had more space for? :thinking_face:\n\nCheck the link in our bio for some great hidden storage ideas! Using a storage ottoman in the living room is just one way you can maximize the space in your home and keep clutter out of the way.\n\nCredit :camera:: @courtneyungaro_spaceanddesign',0,0,181,5,,,
CBmCwIbl5uA,extraspace,2020-06-18 23:12:05.000000,no,False,b'',b'designbykatalin',"b""Would you rather have a sunroom or home theater? :thinking_face:\n\nSunrooms are a great home renovation idea if you want a controlled environment where you can enjoy the outdoors while still being inside. On the other hand, doesn't a good movie and some popcorn sound awfully nice? Which would you prefer?\n\nCredit :camera:: @designbykatalin""",0,0,500,56,,,
CBMQ2tQFmDy,extraspace,2020-06-08 22:55:03.000000,no,False,b'',b'highandtightdesign',"b"":green_heart: What's your favorite color for a bedroom?\n\nCreate a feature wall using a different material or bold paint color! Feature walls add a bit of personality to any room. What color would you choose for a feature wall in your bedroom?\n\nCredit :camera:: @highandtightdesign""",0,0,292,26,,,
CBHKsoJFmm2,extraspace,2020-06-06 23:25:02.000000,no,False,b'',b'nest_twenty_eight',"b'Do you prefer a mostly white-painted home or a home with lots of color? :artist_palette:\n\nA quick and easy home improvement project is to paint your walls. Opt for light colors like gray, beige, and white in small rooms to help the space reflect light and feel more open. If you want a more dramatic look in your home, paint with darker colors like navy blue and deep purple. Don\xe2\x80\x99t want to paint the whole room? Accent walls are an easy way to add a pop of color to your space without a ton of work!\n\nCredit :camera:: @nest_twenty_eight'",0,0,282,32,,,
CBB8TROl1d5,extraspace,2020-06-04 22:43:03.000000,no,False,b'',b'the_ramblr_rv',b'Beautiful butcher block countertops in this RV! :bus: What style countertops are your favorite?\n\nAdd a butcher block countertop style by repurposing old wood from other RV makeover projects. Go with concrete countertops by putting thin layers of cement over existing counters. Or install granite or marble countertops to elevate your camper van design with a more contemporary look! :green_heart: Is there a countertop style you particularly love?\n\nCredit :camera:: @the_ramblr_rv',0,0,184,9,,,
CA82JS4lWYV,extraspace,2020-06-02 23:13:03.000000,no,False,b'',b'love_lives_here',"b""What's your opinion on glass-paned cabinets? :thinking_face:\n\nYou can choose from quite a few options like clear or frosted glass; plexiglass is also a great solution if you\xe2\x80\x99re on a budget. These cabinets are easy to clean and an amazing way to show off your favorite dishes! What do you think?\n\nCredit :camera:: @love_lives_here""",0,0,178,28,,,
CA3t7cHFMEY,extraspace,2020-05-31 23:25:03.000000,no,False,b'',b'jeffmindell',"b""Would you prefer to have your bathroom or living room renovated? :thinking_face:\n\nToday's inspiration is for your bathroom! Give your bathroom a fresh look by updating old faucets, knobs, handles, and shower heads with hardware in warm shades like bronze, gold, and copper.\n\nCredit :camera:: @jeffmindell""",0,0,191,5,,,
CAyiDY6F3GX,extraspace,2020-05-29 23:05:05.000000,no,False,b'',b'henhurst',"b'What tip do you have for creating additional space in your kitchen? :fork_and_knife:\n\nOpen shelving is a simple way to free up space, especially in a small kitchen where cabinets can feel bulky. Not only does open shelving make it possible for you to keep dishes, spices, and other kitchen items organized, but it\xe2\x80\x99s also fairly easy to install yourself if you\xe2\x80\x99re on a budget! Do you like open shelving?\n\nCredit :camera:: @henhurst'",0,0,316,18,,,
CAtdfySFAgw,extraspace,2020-05-27 23:49:04.000000,no,False,b'',b'melaniejadedesign',"b'Cute creativity for under-the-stairs storage! :smiling_face_with_heart-eyes: What could you use some extra space for?\n\nWe love sharing tips on how to maximize the space in your home. Adding some shelving and bins under your stairs can give you room to display your book collection, your trinkets from past travels, or photos of your family! What do you wish you had more space for?\n\nCredit :camera:: @melaniejadedesign'",0,0,531,13,,,
CAoJJ9PlMds,extraspace,2020-05-25 22:15:08.000000,no,False,b'',b'featherglass',"b""The more light the better! Don't you agree? :sun_with_face:\n\nIf natural light is hard to come by in a room, perhaps try a chandelier! Place white, whimsical light fixtures in a bedroom or dining room for a chic look, or opt for something more industrial with a black matte finish to create a modern farmhouse design in your kitchen.\n\nCredit :camera:: @featherglass""",0,0,245,5,,,
CAjHPWEl2VC,extraspace,2020-05-23 23:22:11.000000,no,False,b'',b'',b'Would you rather live in one place for the rest of your life :house_with_garden: or be constantly traveling in an RV home? :bus: Why?\n\nCheck out the link in our bio for some beautiful RV renovation ideas. These gorgeous photos are pretty convincing for living a life on the road! What do you think? (:camera:: IG/danielvanhorn)',0,0,325,26,,,
CAd9EDNFwzf,extraspace,2020-05-21 23:17:03.000000,no,False,b'',b'my_graceful_mess',"b'Wallpaper? Yes or no? :thinking_face:\n\nWallpaper can add some fun character to any room! Wallpaper can last longer than paint, but also becomes a pain to remove if you change your mind about it. Try bold patterns to make a statement in any room.\n\nCredit :camera:: @my_graceful_mess'",0,0,136,21,,,
CAY0KP-l5qu,extraspace,2020-05-19 23:23:03.000000,no,False,b'',b'westwingde',"b'Can you ever have too many throw pillows? :grinning_face_with_sweat::green_heart: For pops of color and diversity in texture, throw pillows can add a lot to a room! Keep a basket or bin nearby to put the pillows in when you would like more sitting space.\n\nCredit :camera:: @westwingde'",0,0,178,5,,,
CATEk8_lFO8,extraspace,2020-05-17 17:51:04.000000,no,False,b'',b'homehydrangea',"b""What's been the best part of your weekend? :smiling_face_with_sunglasses:\n\nWe hope you've been able to enjoy some time outdoors! Check the link in our bio for home renovation and landscaping ideas. The photos are absolutely gorgeous! :smiling_face_with_heart-eyes:\n\nCredit :camera:: @homehydrangea""",0,0,343,7,,,
CAOcSfvFEVy,extraspace,2020-05-15 22:42:04.000000,no,False,b'',b'theheartandhaven',"b""Banquette seating. Yes or no? :thinking_face:\n\nOn one hand, this is a fantastic space-saving way to add seating. Plus, it looks so cute! On the other hand, it can be awkward sliding in and out. Especially if you're stuck in the middle of other people. What do you think? Is banquette seating something you would like in your home?\n\nCredit :camera:: @theheartandhaven""",0,0,448,18,,,
CAJWXLnlBjI,extraspace,2020-05-13 23:14:04.000000,no,False,b'',b'kling_designs',"b'What do you like most about this minimalist bathroom? :green_heart:\n\nGive the illusion of a bigger and brighter bathroom with glass shower doors. This is a fantastic idea for those creating a small minimalist bathroom, as glass doors will allow more light to fill the space. For a more budget-friendly option that doesn\xe2\x80\x99t require extra labor, simply put up a clear or frosted shower curtain.\n\nCredit :camera:: @kling_designs'",0,0,465,27,,,
CAEH2aHF7bk,extraspace,2020-05-11 22:31:03.000000,no,False,b'',b'stello_style',"b'How do you feel with an organized kitchen vs. an un-organized kitchen? :dizzy_face:\n\nAn organized home can help reduce stress! Organize the kitchen by cleaning out the fridge, pantry, and cabinets. Donate items that you no longer need to local food pantries and shelters. Use wicker baskets and clear containers for storing food, spices, and other pantry items. Also, make sure items like coffee and snacks are kept in easy-to-reach places!\n\nCredit :camera:: @stello_style'",0,0,498,15,,,
B__AjZCl5dt,extraspace,2020-05-09 22:51:05.000000,no,False,b'',b'styleathomemag',"b""Tomorrow is Mother's Day! :hugging_face: How will you be celebrating?\n\nMake your mother (or wife) feel appreciated this holiday by serving them! You could organize the kitchen, add flowers to your landscaping, or prepare a home-cooked meal. Is there something you're planning on doing or that you would appreciate?\n\nCredit :camera:: @styleathomemag""",0,0,268,5,,,
B_55P97leRo,extraspace,2020-05-07 23:11:04.000000,no,False,b'',b'somutschlove',"b'Do you prefer earth tones or bold colors? :artist_palette:\n\nWhen it comes to choosing paint colors for a farmhouse-style home, neutral and earth tones work best because they make rooms appear brighter, larger, and more inviting. Go with shades of beige, tan, brown, and white. If you need accent colors, opt for light blues, yellows, and greens.\n\nCredit :camera:: @somutschlove'",0,0,310,12,,,
B_0vM4SlNiP,extraspace,2020-05-05 23:07:04.000000,no,False,b'',b'sarah.lloyd.landscape.design',"b'For someone new to landscaping, what would be the first tip you share with them? :blossom:\n\nCheck the link in our bio for some great DIY projects! From landscaping to home improvement, these ideas can be great inspiration for your home.\n\nCredit :camera:: @sarah.lloyd.landscape.design'",0,0,218,11,,,
B_vmhrnFO7w,extraspace,2020-05-03 23:15:04.000000,no,False,b'',b'succulent_treasure_chest',"b""What would you say the best kind of gift is for Mother's Day? :bouquet:\n\nVertical gardens make for a wonderful DIY project. Save space by planting flowers and other greenery on a fence. If you're hoping someone will work on this with you for Mother's Day, you better let them know soon. :winking_face:\n\nCredit :camera:: @succulent_treasure_chest""",0,0,382,7,,,
B_qXrClFfPj,extraspace,2020-05-01 22:29:04.000000,no,False,b'',b'brodyplants',"b'Would you prefer a backyard full of soft grass or artistic gravel? :sun_with_face:\n\nYou can have both! Use different textures to create visual depth, which can help make a small yard seem bigger, but it also allows you to play with a wide range of landscape styles throughout your yard. Mix and match grass, gravel, mulch, and other greenery to break up the space and create a unique outdoor space!\n\nCredit :camera:: @brodyplants'",0,0,247,8,,,
B_lTO4IF4U2,extraspace,2020-04-29 23:14:03.000000,no,False,b'',b'kyrosdesigns',"b""What tips do you have for making a small space appear bigger? :thinking_face:\n\nIn a bathroom, you can use a floating vanity to create negative space. Negative space is a useful illusion for making any small room appear more open. Minimalist design uses this technique often. How else do you make small spaces appear bigger? Let's hear your suggestions!\n\nCredit :camera:: @kyrosdesigns""",0,0,434,10,,,
B_gHWoglvuu,extraspace,2020-04-27 22:54:04.000000,no,False,b'',b'ourwintonhome',"b'Can you really ever have enough baskets? :winking_face::green_heart: Complete any farmhouse look with wicker statement pieces. Whether it\xe2\x80\x99s wicker baskets in your bathroom to store linens, wicker chairs around a breakfast nook, or a wicker nightstand, these items complement the neutral color palette while also adding dimension to a stark white room.\n\nCredit :camera:: @ourwintonhome'",0,0,562,18,,,
B_bAKsplc4o,extraspace,2020-04-25 23:15:06.000000,no,False,b'',b'sincerelyesther',"b""Working from home: RV style! :bus:\n\nOn the road or not, working from home has its challenges! For those of you now working from home, what's been the hardest part? :thinking_face: Any advice for others?\n\nCredit :camera:: @sincerelyesther""",0,0,344,8,,,
B_VyWDpFc57,extraspace,2020-04-23 22:38:05.000000,no,True,b'',b'simplysoutherncottage',b'What are your favorite flowers to see in the spring? :tulip:\n\nMake sure to check out our stories today to see more of this beautiful landscaping from @simplysoutherncottage! Sara shows her process for switching from her winter pansies to her summer annuals. We love her useful tips and gorgeous yard!',0,0,300,41,,,
