shortcode,username,date_utc,is_video,is_sponsored,hashtags,mentions,caption,video_view_count,video_length,likes,comments,likes+comments,location_name,location_latlongB_QsTT7FdrM,extraspace,2020-04-21 23:09:04.000000,no,False,b'',b'somutschlove',"b'Bring the outdoors in! :herb:\n\nFrom garland on a kitchen table to vases of greenery and branches in every room, using plants to decorate your home can instantly transform your space into a cozy place to relax. Plus, it\xe2\x80\x99s the perfect opportunity to add some color without taking away from that airy farmhouse look!\n\nCredit :camera:: @somutschlove'",0,0,235,8,,,
B_LkFWeF1ks,extraspace,2020-04-19 23:21:03.000000,no,False,b'',b'andrea_doonan_hort_design',"b'What spring/summer projects are you most looking forward to? :thinking_face:\n\nPlanting flowers along the side of your house, edging existing plants, or creating a pathway are all great ideas for landscaping your side yard!\n\nCredit :camera:: @andrea_doonan_hort_design'",0,0,279,10,,,
B_GY5Joj9TM,extraspace,2020-04-17 23:07:07.000000,no,False,b'',b'homewithkelsey',"b'Gorgeous minimalist bedroom! Not too much or too little. :winking_face:\n\nEmpty walls can look odd and impersonal, but you also don\xe2\x80\x99t want to overdress your bedroom walls\xe2\x80\x94especially in a room that\xe2\x80\x99s meant for resting and recuperating. Choose one wall in your room and add simple wall decor like a large mirror or two large portraits to fill some white space and unite your design.\n\nCredit :camera:: @homewithkelsey'",0,0,443,11,,,
B_BP4CmF9t1,extraspace,2020-04-15 23:12:05.000000,no,False,b'',b'brookside_design',"b""What's your favorite part about the spring season? :rose:\n\nWe hope you have a chance to get outdoors for a bit (while maintaining social distancing)! The outdoors have a lot to offer, even in your own backyard. Looking for helpful landscaping tips? Check the link in our bio!\n\nCredit :camera:: @brookside_design""",0,0,162,7,,,
B-8Ir_VlRtA,extraspace,2020-04-13 23:33:03.000000,no,False,b'',b'kristinabills',"b'Lighting can make a big difference for minimalist design. :light_bulb:\n\nA minimalist home should have simple lighting that provides maximum brightness\xe2\x80\x94and the bathroom is no exception! Consider a pendant light over the sink, wall scones, or recessed lighting above the shower. Try to choose something that matches the rest of the hardware so you have a cohesive bathroom design.\n\nCredit :camera:: @kristinabills'",0,0,212,2,,,
B-0XGXrl7u6,extraspace,2020-04-10 23:05:04.000000,no,False,b'',b'lifebyleanna',"b""What do you think of this cute space? :smiling_face_with_heart-eyes:\n\nHave you watched today's takeover on our stories yet from @lifebyleanna? Leanna shares her adorable baby room and some tips for organizing a kids room!""",0,0,384,35,,,
B-x0IBopVuP,extraspace,2020-04-09 23:20:57.000000,no,False,b'',b'ourfergusonfarmhouse',"b""You voted, and the winner of our Home Decor Styles Bracket Challenge is... MODERN FARMHOUSE! :smiling_face_with_heart-eyes: Thank you to everyone who participated in voting over the past few weeks. Here's what the final results of each vote looked like:\n\nRound 1: Modern Farmhouse (67%) vs. Industrial (33%)\nRound 2: Mid-Century Modern (61%) vs. Bohemian (39%)\nRound 3: Vintage/Rustic (45%) vs. Coastal (55%)\nRound 4: Eclectic (53%) vs. Traditional (47%)\nSemi-Finals 1: Modern Farmhouse (60%) vs. Coastal (40%)\nSemi-Finals 2: Mid-Century Modern (40%) vs. Eclectic (60%)\nFinals: Modern Farmhouse (75%) vs. Eclectic (25%) Are you surprised at all by any of these results? Do you agree that Modern Farmhouse deserved to win?\n\nCredit :camera:: @ourfergusonfarmhouse""",0,0,211,3,,,
B-qFSs5FQje,extraspace,2020-04-06 23:17:03.000000,no,False,b'',b'ceemcee31',b':police_car_light: Our Home Decor Bracket Challenge FINALS are today!\n\nVote now on our story between Modern Farmhouse and Eclectic! We will announce the winner and most popular home decor style on Thursday. (:camera:: @ceemcee31)',0,0,198,1,,,
B-k7A_YFZmi,extraspace,2020-04-04 23:11:03.000000,no,False,b'',b'leclairdecor',"b'Going a bit stir crazy spending so much time in your home? :upside-down_face:\n\nMake sure you open up your blinds! Allowing natural light to fill your living room will give your home life. Adding large windows can also be helpful when designing a living room in a small space, as the natural light will make your room feel larger and more open. (:camera:: @leclairdecor)'",0,0,301,1,,,
B-k7A_YFZmi,extraspace,2020-04-04 23:11:03.000000,no,False,b'',b'leclairdecor',"b'Going a bit stir crazy spending so much time in your home? :upside-down_face:\n\nMake sure you open up your blinds! Allowing natural light to fill your living room will give your home life. Adding large windows can also be helpful when designing a living room in a small space, as the natural light will make your room feel larger and more open. (:camera:: @leclairdecor)'",0,0,301,1,,,
B-fx_7zFr0G,extraspace,2020-04-02 23:16:05.000000,no,False,b'',b'mynwfarmhouse',"b""How have you kept entertained at home? :smiling_face_with_halo:\n\nWe hope our ongoing bracket challenge has provided some entertainment! Have you voted yet today? Check our story to decide which style you prefer between Mid-Century Modern and Eclectic. We're almost ready to determine the overall winner! (:camera:: @mynwfarmhouse)""",0,0,188,4,,,
B-YG9P3puBz,extraspace,2020-03-30 23:45:15.000000,no,False,b'',"b'jessicadevlindesign,caitlinmariedesign'","b"":police_car_light: Semi-Finals 1 of our home decor bracket challenge! Vote now on our Instagram Story, Facebook poll, and Twitter poll between Modern Farmhouse and Coastal.\n\nMost recognized as the style frequently used by Chip and Joanna Gaines from 'Fixer Upper', modern farmhouse has become one of the most popular home design styles. Combining elements of industrial, rustic, and minimalism, this interior decoration style uses a mix of high and low contrast pieces with a hint of barn-like details to create a home that\xe2\x80\x99s cozy.\n\nDesign a relaxing, comfortable environment with the coastal decorating style. This design trend\xe2\x80\x94also called Hamptons style\xe2\x80\x94uses elements inspired by the beach and ocean, featuring plush white sofas, beige woods, shades of blues and greens, and sometimes seashells or ropes.\n\nWho will win? You decide. (:camera:: Modern Farmhouse @jessicadevlindesign, Coastal @caitlinmariedesign)""",0,0,129,13,,,
B-N3dwtJuAm,extraspace,2020-03-27 00:17:28.000000,no,False,b'',"b'lizcaan,betweenporches'","b':police_car_light: Round 4 of our home decor bracket challenge! Vote now on our Instagram Story, Facebook poll, and Twitter poll between Eclectic and Traditional.\n\nEclectic style makes use of many colors, patterns, and decor from multiple eras! While eclectic style decor might look like a hodgepodge, a lot of thought goes into harmonizing the elements of multiple interior decorating styles. One way to do this is to pick out a color scheme, and then build your design around that.\n\nThere are no home decor styles quite as classic as traditional style! Homes featuring this trend are geared toward finished wood, rich hues, and fabrics with ornate details like silk and velvet that are rooted in 18th century European and Colonial styles.\n\nWho will win? You decide.\n\nCredit :camera:: Eclectic @lizcaan, Traditional @betweenporches'",0,0,96,3,,,
B-GAJlGp0Ho,extraspace,2020-03-23 22:59:26.000000,no,False,b'',"b'vintagemarketdayscntrlnr,caitlinmariedesign'","b':police_car_light: Round 3 of our home decor bracket challenge! Vote now on our Instagram Story, Facebook poll, and Twitter poll between Vintage/Rustic and Coastal.\n\nRustic style is a great way to bring the outdoors into your home! It embraces textures and colors that are influenced by nature, as well as organic shapes to help bring warmth to the area. Restore vintage items for that cozy charm!\n\nThe relaxing and comfortable coastal style\xe2\x80\x94also called Hamptons style\xe2\x80\x94uses elements inspired by the beach and ocean, featuring plush white sofas, beige woods, shades of blues and greens, and sometimes seashells or ropes.\n\nWho will win? You decide.\n\nCredit :camera:: Vintage-Rustic @vintagemarketdayscntrlnr, Coastal @caitlinmariedesign'",0,0,110,2,,,
B9-QG80HzIf,extraspace,2020-03-20 22:44:58.000000,no,False,b'',"b'magazinemerchanthouse,bohemianhomedecor'","b':police_car_light: Round 2 of our home decor bracket challenge! Vote now on our Instagram Story, Facebook poll, and Twitter poll between Mid-Century Modern and Bohemian.\n\nWhether you\xe2\x80\x99re looking to change up your living room or bedroom, Mid-Century Modern is one of the most versatile decorating styles to use in your home. This retro home design trend is influenced by the 1960s with an emphasis on eccentric patterns, bright colors, molded plastics, and modern furniture.\n\nBohemian style is an interior decorating trend often associated with free-spirited people, as this style encourages showcasing your individuality with unique color schemes and mismatched furniture. A home that uses boho style decor might include vintage light fixtures, globally-inspired patterned rugs, beaded pillows, and chairs that come in variety of shapes and colors.\n\nWho will win? You decide.\n\nCredit :camera:: Mid-Century Modern @magazinemerchanthouse, Bohemian @bohemianhomedecor'",0,0,125,1,,,
B95J9peFgJa,extraspace,2020-03-18 23:15:05.000000,no,False,b'',b'caseyjohelton',b'Lovely bedroom :green_heart: Looks so clean and fresh!\n\nSpring starts this week! Are you excited to begin spring cleaning? Or does that sound more tedious than enjoyable? (:camera:: @caseyjohelton)',0,0,115,2,,,
B90BXKBJvtF,extraspace,2020-03-16 23:23:42.000000,no,False,b'',"b'arpinharutunian,jessicadevlindesign'","b':police_car_light: Our bracket challenge to decide the most popular home decor style begins tomorrow! :police_car_light: Check out our Instagram Story, Facebook poll, and Twitter poll tomorrow to vote on the first bracket match-up between Industrial and Modern Farmhouse.\n\nWe were all looking forward to the NCAA basketball tournament, but we hope this will provide at least some entertainment. :winking_face:\n\nWho will win? You decide.\n\nCredit :camera:: Industrial - @arpinharutunian, Modern Farmhouse - @jessicadevlindesign'",0,0,152,9,,,
B9sTPudliNH,extraspace,2020-03-13 23:26:05.000000,no,False,b'',b'the_floridagirl',"b""What's an item you highly recommend for a baby room? :baby:\n\nNot only is adding a rug to the nursery a great way to incorporate color, pattern, and personality, but it\xe2\x80\x99s also good for reducing noise! Place a rug near the crib to muffle the sound of footsteps when checking on your sleeping baby. (:camera:: @the_floridagirl)""",0,0,185,6,,,
B9nJFOhFUeE,extraspace,2020-03-11 23:21:04.000000,no,False,b'',b'fournorthfarmhouse',"b'What does your dream kitchen look like? What colors do you imagine using? :thinking_face:\n\nDark, heavy-looking hardwood flooring makes any room look smaller than it really is. Keep your minimalist kitchen light, bright, and easy-to-clean by swapping out scratched-up hardwood or dingy linoleum with vinyl wood panel flooring, polished concrete, or ceramic tiles. These durable, modern flooring options will make your room look and feel more spacious. (:camera:: @fournorthfarmhouse)'",0,0,283,5,,,
B9h7mf8l2uL,extraspace,2020-03-09 22:47:04.000000,no,False,b'',b'beautifulinspireco',b'Sliding farmhouse door to the kitchen pantry :green_heart:\n\nFarmhouse decor is so cozy and charming! We put together 18 photos and tips for your farmhouse inspiration. Check out the link in our bio now! (:camera:: @beautifulinspireco)',0,0,375,8,,,
B9cy7U0FuB1,extraspace,2020-03-07 22:55:04.000000,no,False,b'',b'girlsbabyroom',"b""What's your favorite color for a baby room? :baby_angel:\n\nPaint color can make all the difference in a nursery! Want to make a large room seem cozier? Go with soft shades of yellow and pink. Need to make a small room look bigger? Opt for airy neutral colors like beiges, grays, and whites to help reflect light in the nursery.\n\nCheck the link in our bio for our recent blog post on designing a baby room! (:camera:: @girlsbabyroom)""",0,0,175,4,,,
B9XvZxjFVZu,extraspace,2020-03-05 23:48:05.000000,no,False,b'',b'housemadelovely',"b""Adorable :dog_face: and adorable :bus:\n\nThis RV renovation from @housemadelovely looks so cozy! In a home away from home, it's important to add items that make you feel comfortable and relaxed. Sometimes that means a favorite blanket, soft pillow, or delicious snack!\n\nWhen you're on a road trip, what's your favorite:\n- Snack? :candy:\n- Song? :musical_note:\n- Way to stay entertained? :game_die:""",0,0,290,5,,,
B9Sk5fBFpVi,extraspace,2020-03-03 23:40:04.000000,no,False,b'',b'kati_home13',b'Love this bathroom organization and style! :smiling_face_with_heart-eyes:\n\nDo you often find things left out on your bathroom counters? Would it be easier to keep things put away if you had easier organization? We want to hear your thoughts and tips for keeping the bathroom tidy! (:camera:: @kati_home13)',0,0,190,3,,,
B9NZ7wGl-1s,extraspace,2020-03-01 23:28:04.000000,no,False,b'',b'cottageandsea',b'Use a focal point in your design to balance out the room. :face_with_monocle:\n\nYou can create a focal point in many ways. Maybe it\xe2\x80\x99s a large mirror. Maybe it\xe2\x80\x99s a uniquely-shaped coffee table. Or maybe it\xe2\x80\x99s a quirky conversation piece you picked up from an antique store. How do you use this tip in your design? (@cottageandsea)',0,0,189,5,,,
B9IUPHildvl,extraspace,2020-02-29 00:02:05.000000,no,False,b'',b'nest_number_9',b'Let your personality show in your home! :green_heart:\n\nYou can follow minimalist design ideas and still mix your personality into your bedroom look. Maybe you prefer dark paint colors on your walls. Or maybe you love having tons of fuzzy throw pillows on your bed. Minimalism doesn\xe2\x80\x99t mean getting rid of everything and having nothing personal in your home. It\xe2\x80\x99s okay to keep items you love or add a little flair to your living space if that\xe2\x80\x99s what\xe2\x80\x99s comfortable for you! (:camera:: @nest_number_9)',0,0,313,6,,,
B9DIlkJnVl_,extraspace,2020-02-26 23:44:05.000000,no,False,b'',b'irisonelmstreet',"b""Renovated RV kitchen :smiling_face_with_heart-eyes::bus: The rug and cushioned seats really help soften the room. The backsplash wall paper adds great texture! What's your favorite part of this space? (:camera:: @irisonelmstreet)""",0,0,220,10,,,
B8-B21IFlGU,extraspace,2020-02-25 00:09:04.000000,no,False,b'',b'myzoodesign',b'Where does your furry feline friend like to hang out? :smiling_cat_face_with_heart-eyes: Check the link in our bio for more cat room photos and design inspiration! (:camera:: @myzoodesign)',0,0,99,9,,,
B8437Kylh7E,extraspace,2020-02-23 00:06:05.000000,no,False,b'',b'jeanstofferdesign',"b'Do you enjoy using rugs to soften your home? :house_with_garden:\n\nWhile most minimalist designs utilize hard-surfaced elements, it\xe2\x80\x99s important to throw in some extra dimension and soft touches as well. Use a simple rug with a neutral color to complement the rest of your room. (:camera:: @jeanstofferdesign)'",0,0,335,10,,,
B8zsKSfFB9y,extraspace,2020-02-20 23:47:05.000000,no,False,b'',b'nest_twenty_eight',"b'Do you prefer a bathroom to be completely white, or have some color/texture in it? :bathtub:\n\nYou can create lines and dimension using hexagonal floor tiles in a monochromatic color scheme. Alternate between black and white subway tiles to mix things up. Or give your bathroom a sophisticated minimalist look with a backsplash in your shower or behind your sink. (:camera:: @nest_twenty_eight)'",0,0,465,14,,,
B8ukScglnJw,extraspace,2020-02-19 00:02:06.000000,no,False,b'',b'homewithkelsey',"b'Plants look beautiful in minimalist spaces! :herb::smiling_face_with_heart-eyes: Plants are an easy way to add pops of color that accent the neutral color palette of your bedroom. Plus, they can help your room maintain a clean, natural, minimalist look that feels homey. (:camera:: @homewithkelsey)'",0,0,107,2,,,
B8pUvv0lHpM,extraspace,2020-02-16 23:10:05.000000,no,False,b'',b'rvsandtrees',"b""There used to actually be a large cabinet hanging over that counter space! :exploding_head:\n\nCute RV renovation from @rvsandtrees! :green_heart: The space feels overall more spacious, plus the open shelving allows for easier access. Good organization seems to be even more important when you're living in a small space! What tips do you have to share?""",0,0,212,3,,,
B8kMagdFC9o,extraspace,2020-02-14 23:21:07.000000,no,False,b'',b'decoratinglife.ca',"b""Happy Valentine's Day! :two_hearts: Here's a gorgeous kitchen to fall in love with! We've been romanticizing about this one all day. (:camera:: @decoratinglife.ca)""",0,0,155,4,,,
B8fK080Hm7a,extraspace,2020-02-13 00:30:58.000000,no,False,b'',b'simplymodernliving',b'Which KonMari category is most difficult to declutter? :thinking_face:\n\nClothing :woman\xe2\x80\x99s_clothes:\nBooks :books:\nPapers :page_facing_up:\nor Sentimental? (:camera:: @simplymodernliving)',0,0,153,6,,,
B8aBeVWFVe1,extraspace,2020-02-11 00:33:04.000000,no,False,b'',b'what.the.hygge',"b'Warm up your minimalist space :hugging_face:\n\nSimple, neutral designs are ideal for minimalism, but you don\xe2\x80\x99t want your bedroom to look and feel like a hospital with too much starkness. Look for ways to incorporate some warmth through subtle patterns, solid colors, or textured home decor like knitted throws, rugs, and pillows. (:camera:: @what.the.hygge)'",0,0,158,6,,,
B8UzTn5FylM,extraspace,2020-02-08 23:53:04.000000,no,False,b'',b'thehomeenvy',"b'Warm up coastal design with vintage decor :green_heart:\n\nA well-placed antique chair, desk, armoire, or end table can provide some warmth and depth to otherwise cool and airy rooms. Including vintage decor is especially important in coastal design styles if you\xe2\x80\x99re hoping to add more structure and prestige in relaxed rooms. (:camera:: @thehomeenvy)'",0,0,151,2,,,
B8PszuJFytm,extraspace,2020-02-07 00:20:05.000000,no,False,b'',b'nicolettenotes',"b'Smart open storage for this tiny home! :smiling_face_with_sunglasses:\n\nUsing open clothing racks, bins, and shelves keeps everything easily accessible. Waste no vertical space by placing the clothing rack over the storage bins. Like a puzzle coming together, this room maximizes space!\n\nWould you use an exposed wardrobe? Why or why not? :thinking_face: (:camera:: @nicolettenotes)'",0,0,239,7,,,
B8KhuwJla5g,extraspace,2020-02-05 00:07:06.000000,no,False,b'',b'theruthlessorganizer',"b'Store dry goods in uniform containers. :thumbs_up:\n\nSay goodbye to sloppy storage in your kitchen pantry and hello to a beautiful minimalist space! Transfer flour, sugar, spices, and other dry goods from their original packaging into matching jars or storage containers to totally transform the look, feel, and function of your pantry. Just make sure the containers you use are airtight! (:camera:: @theruthlessorganizer)'",0,0,286,8,,,
B8FQ0I9lHEQ,extraspace,2020-02-02 23:03:04.000000,no,False,b'',b'amybartiam',"b'Take a refreshing break from your day. :bathtub:\n\nMinimalism in the bathroom can make the space more rejuvenating. Bring the outdoors in, for example. Using greenery in the home makes a space feel more fresh and alive! (:camera:: @amybartiam)'",0,0,112,1,,,
B8AKVNTFucZ,extraspace,2020-01-31 23:30:12.000000,no,False,b'',b'freeyourmindjac',b'Do you enjoy vintage decor and DIY projects? :hammer:\n\nShabby chic home decor is an awesome way to experiment if you don\xe2\x80\x99t have the budget or patience to completely fill your home with antiques. This fusion of old and \xe2\x80\x9cnew made to look old\xe2\x80\x9d is a great way to test out your DIY skills and take on a home improvement project or two. (:camera:: @freeyourmindjac)',0,0,173,2,,,
B77ARQSlG4o,extraspace,2020-01-29 23:26:05.000000,no,False,b'',b'ugs_beddings',"b'Earth tones are comforting and calming :smiling_face_with_smiling_eyes:\n\nMinimalism uses hues of white, gray, beige and light browns to create a relaxing effect. Using the earth element from feng shui will also balance out the water element. (:camera:: @ugs_beddings)'",0,0,136,3,,,
B717XrSldba,extraspace,2020-01-28 00:07:04.000000,no,False,b'',b'bluebirdparkway',"b'Gorgeous skoolie conversion! :smiling_face_with_heart-eyes:\n\nSchool buses let in lots of natural light, which makes this polished wood counter dazzling! What do you think of all the wood elements? (:camera:: @bluebirdparkway)'",0,0,450,9,,,
B7wuALdlXfP,extraspace,2020-01-25 23:34:04.000000,no,False,b'',b'shelbyadrift',b'Check out this cute tiny home kitchen! :smiling_face_with_heart-eyes:\n\nSmall space living means you need to find creative ways to do more with less. Open shelving is a great way to bring in more decor or keep often-used items easily accessible.\n\nOur blog post on tiny home organization and storage was one of the most popular posts of 2019! Have you looked at the others? Go to the link in our bio! (:camera:: @shelbyadrift)',0,0,406,8,,,
B7rsij3FRq-,extraspace,2020-01-24 00:45:07.000000,no,False,b'',b'tinycottageonpetes',"b'We love these bathroom storage solutions! :green_heart:\n\nFind items that look great and serve a purpose! Use a ladder for hanging towels, or a basket for holding toilet paper.\n\nWhat do you use to keep your bathroom organized? (:camera:: @tinycottageonpetes)'",0,0,284,3,,,
B7mb-D_lnWS,extraspace,2020-01-21 23:44:05.000000,no,False,b'',b'loloirugs',"b'Minimalism doesn\xe2\x80\x99t mean get rid of everything! You might just need to find some extra space :winking_face:\n\nFocus first on creating a space that fits your needs. If there\xe2\x80\x99s a special pillow, blanket, chair, or knick-knack that you love but that doesn\xe2\x80\x99t perfectly fit into your design, it\xe2\x80\x99s okay to keep it. :thinking_face: So how do you decide whether or not to keep something? (:camera:: @loloirugs)'",0,0,180,5,,,
B7hNdO8F7Lk,extraspace,2020-01-19 23:01:04.000000,no,False,b'',b'simplecatlady',"b'RV renovations require so much creativity and hard work! :bus: What stands out to you from this beautiful RV?\n\nWe really like the flooring! Some of the most popular RV flooring ideas include vinyl planks or bamboo flooring, as they resemble real hardwood floors and are easy to clean when dirt or sand gets tracked inside. (:camera:: @simplecatlady)'",0,0,212,6,,,
B7cHEm4F2Gq,extraspace,2020-01-17 23:29:05.000000,no,False,b'',b'westelm',"b'Happy Friday! :beaming_face_with_smiling_eyes: Our tip of the day? Soften your room with a beautiful rug.\n\nEspecially if your living room has wood floors, it\xe2\x80\x99s good to add a rug into your minimalist design. Not only can having a rug in your space help keep noise in the room down, but it can also softens the starkness inherent in minimalist design. (:camera:: @westelm)'",0,0,159,3,,,
B7W_ivJltx3,extraspace,2020-01-15 23:47:05.000000,no,False,b'',b'thehouseofsilverlining',"b'This minimalist bedroom uses great balance :green_heart:\n\nIf your bedroom is more spacious or has high ceilings, having only a bed will make your room feel too empty and unbalanced. Consider adding a small dresser, storage bench, or accent chair with exposed legs to complement the bed and bring harmony to your minimalist bedroom layout.\n\nOr like this bedroom, you can use a canopy bed frame to fill space without cluttering your room with additional furniture. (:camera:: @thehouseofsilverlining)'",0,0,110,1,,,
B7Ry3M6ljWw,extraspace,2020-01-13 23:20:04.000000,no,False,b'',b'suolamaella',"b""Are you planning a trip for this summer? :beach_with_umbrella_selector: If you love to travel, it's great to show that off in your home!\n\nBring back souvenirs and display them proudly. Use a globe or world map as home decor.\n\nWhere is your next travel destination? (:camera:: @suolamaella)""",0,0,134,1,,,
B7Mqh-QF-dg,extraspace,2020-01-11 23:31:05.000000,no,False,b'',b'boneill_athome',"b'When it comes to minimalist design, size and scale are incredibly important. :face_with_monocle:\n\nIf you have a small living room, for example, a single large couch with a small coffee table may be less obtrusive than several small pieces of furniture.\n\nDon\xe2\x80\x99t be afraid to play with scale in your layout though! Mix and match different sizes with your furniture and home decor to create more depth in your living room. (:camera:: @boneill_athome)'",0,0,169,2,,,
B7HoCS2F9XO,extraspace,2020-01-10 00:33:04.000000,no,False,b'',b'littlecitybungalow',"b""Dogs + minimalism. It doesn't get much better, right? :dog_face: \nMinimalism starts with getting organized! Ideally, every item in your minimalist home should have its place. Not only will this help with keeping your living space clean and clutter-free, but it\xe2\x80\x99ll also alleviate the headache of having to hunt for the remote control or a phone charger when you need it. (:camera:: @littlecitybungalow)""",0,0,132,1,,,
B7CZLw1FxyY,extraspace,2020-01-07 23:47:04.000000,no,False,b'',b'whitehousemuddyfeet',"b""Tiny home style :smiling_face_with_heart-eyes: Details matter, even when they're small.\n\nExperiment in your home with small patterns and pops of color. A fun backsplash in the kitchen, a bright accent wall in the living room, or unexpected tile in the shower are all ways to get experimental with design without going overboard. (:camera:: @whitehousemuddyfeet)""",0,0,234,3,,,
