shortcode,username,date_utc,is_video,is_sponsored,hashtags,mentions,caption,video_view_count,video_length,likes,comments,likes+comments,location_name,location_latlong
CIYboiMhHzM,hm,2020-12-04 15:59:52.000000,no,False,b'hm',b'',b'Comfort can really be this easy. :cloud_selector: #HM\n\nCotton-blend sweatshirt: 0874113009\nCord Flared Leggings: 0943152002\nRibbed hat :0732409036\nPlatform boots: 0916256005',0,0,97717,175,,,
CIXruHoBmMr,hm,2020-12-04 09:01:11.000000,no,False,b'',b'',"b'Is it spring yet? Well, we just couldn\xe2\x80\x99t wait. Our mint-fresh news is ready for you.\n\nSweatshirt: 0926697003\nJoggers High Waist: 0759814044\nShort necklace: 0803609004'",0,0,94458,168,,,
CIWOH8thQyZ,hm,2020-12-03 19:23:27.000000,yes,False,"b'hmbringonthefuture,hm'",b'',b'The future always looks brighter after a blowout. :dizzy: #HMBringOnTheFuture #HM',505820,6.0,23449,137,,,
CIV9oDWB7Mg,hm,2020-12-03 16:59:31.000000,yes,False,"b'hmbringonthefuture,hm'",b'',b'2020 has taken its toll on us all.:black_heart: What are your hopes and wishes for the new year? :party_popper: #HMBringOnTheFuture #HM',225085,30.0,19753,122,,,
CIVjRDBh-5h,hm,2020-12-03 13:08:50.000000,no,False,"b'hmbringonthefuture,hm'",b'originalkoffee',"b""New Year's might be a little different this year.:red_heart_selector: Turn the sound on for our hopeful and heartwarming New Year's poem featuring @originalkoffee. #HMBringOnTheFuture #HM""",0,0,30621,146,,,
CIS5-RUhUNR,hm,2020-12-02 12:32:22.000000,yes,False,"b'hm,hmconsciousexclusive'",b'',"b'For the first time our design team welcomes you into their studio, following the design process behind the Waste collection for A/W20. #HM #HMConsciousExclusive'",222663,558.326,14364,141,,,
CISdw2mhrVv,hm,2020-12-02 08:23:02.000000,no,False,"b'womenandwavesxhm,hm'","b'jessicavanderleahy,oceanastrachan,elisetrigger,womenandwaves'","b""Somewhere in the world right now, the sun is shining and the surf's up! :water_wave: We\xe2\x80\x99re happy to announce that the Women & Waves collab is now available in Australia, New Zealand, South Africa, Peru, Chile and Uruguay. #WomenandWavesxHM #HM @jessicavanderleahy,@oceanastrachan, @elisetrigger @womenandwaves \n\nZip-up bikini top : 0880134001 \r\nBrazilian bikini bottoms: 0873058001\r\nSwimsuit High leg: 0873080001 \r\nLong-sleeved swimsuit: 0877485001""",0,0,80554,152,,b'Australia',-25.0 135.0
CIQn35UhGQj,hm,2020-12-01 15:12:53.000000,no,False,"b'hmconsciousexclusive,hmxme,hm,regram'","b'fiahamelijnck,sonnyturner___,paulienriemis,alaa.slm,vivid,bighairloudmouth,reeceking_,janitaautio,blancamiro'","b'You all look like poetry in motion! We can\xe2\x80\x99t wait to see more #HMConsciousExclusive looks. :green_heart:  The online collection starts launching today. #HMxME #HM #regram @fiahamelijnck, @sonnyturner___, @paulienriemis, @alaa.slm, @vivid, @bighairloudmouth, @reeceking_, @janitaautio, @blancamiro\n\nTulle dress: 0918109001\nLyocell-blend dress:0918126002 \nFabric flower-covered dress: 0914142001\nCropped silk-blend blazer: 0918110001\n\nTailored silk-blend trousers :0918142001\nJacquard-patterned shirt 0935192001\nJacquard-patterned trousers: 0918137001\nOff-the-shoulder dress: 0918128001'",0,0,52008,436,,,
CIP4QsNBgRS,hm,2020-12-01 08:16:51.000000,no,False,"b'hmconsciousexclusive,hm'","b'zinniakumar,selmapaulsen_,saptieu'",b'Creative forms of recycling and reuse take us one step closer to a circular fashion future.  #HMConsciousExclusive launches online from 1 December. @zinniakumar @selmapaulsen_ @saptieu #HM \n\nPicture 1.\nLeft: Fabric flower-covered dress: 0914142001\nMultifunctional clip earrings: 0908227001\nMiddle: Jacket and brooch: 0929164001\nRight: Off-the-shoulder dress: 0918128001\nLinked-ring necklace: 0908242002\nPicture 2.\nFabric flower-covered dress: 0914142001\nPicture 3.\nLeft: Fabric flower-covered dress: 0914142001\nMultifunctional clip earrings: 0908227001\nMultifunctional boots: 0908252001\nMiddle: Off-the-shoulder dress: 0918128001\nLinked-ring necklace: 0908242002\nRight: Jacket and brooch: 0929164001\nTailored silk-blend trousers: 0918142001',0,0,44029,207,,,
CIOGv6yhK7N,hm,2020-11-30 15:44:58.000000,no,False,"b'hmconsciousexclusive,hm'",b'zinniakumar',"b""Can we re-think silk? Conscious Exclusive is an incubator for innovative materials that are eventually used in H&M's main collections. #HMConsciousExclusive A/W20 launches online from 1 December. #HM @zinniakumar""",0,0,25329,174,,,
CINm92xBHZ2,hm,2020-11-30 11:07:15.000000,no,False,"b'hmconsciousexclusive,hm'","b'selmapaulsen_,saptieu'",b'Can you wear leftovers? #HMConsciousExclusive A/W20 launches online from 1 December. #HM @selmapaulsen_ @saptieu',0,0,48668,119,,,
CILMgh1hQiF,hm,2020-11-29 12:37:34.000000,no,False,"b'hmconsciousexclusive,hm'",b'zinniakumar',"b'Meet ecologist, activist and Conscious Exclusive model @zinniakumar #HMConsciousExclusive AW/20 launches online from 1 December. #HM'",0,0,54803,220,,,
CIIdzn3hKrQ,hm,2020-11-28 11:12:15.000000,yes,False,"b'hmconsciousexclusive,hm'","b'zinniakumar,selmapaulsen_,saptieu'",b'Can waste be beautiful? #HMConsciousExclusive A/W20 is made from waste. The poetic collection launches online from 1 December. @zinniakumar @selmapaulsen_ @saptieu #HM',288942,14.98,19028,200,,,
CIGUYmsBK4F,hm,2020-11-27 15:10:11.000000,no,False,b'hm',b'',b'Get your glam on with our IG-friendly LBDs. :party_popper::two_hearts::sparkles: #HM \n\nMesh dress: 0928352001\nVelvet-bow hair clip: 0878028002',0,0,95078,261,,,
CIF_4T7hHaK,hm,2020-11-27 12:11:01.000000,no,False,"b'hm,regram,hmxme'",b'laurennicolefk',b'Current mood: Friday! @laurennicolefk #HM #regram #HMxME\n\nDress: 0934990001 \nEarrings: 0949294001',0,0,66102,168,,,
CIDtzGzBJRv,hm,2020-11-26 14:54:32.000000,no,False,b'hm',b'',b'Musical nights at home. :red_heart: #HM\n\nDress: 0949587001',0,0,41951,168,,,
CIDWWMqB_fi,hm,2020-11-26 11:29:37.000000,no,False,"b'hm,regram,hmxme'",b'sofiaruutu',"b""Partywear isn't just for parties \xe2\x80\x94 @sofiaruutu shows us how to create an everyday outfit with a sparkly top! #HM #regram #HMxME\n\nGlitter top: 0948225001\nDenim: 0904017002""",0,0,84672,126,,,
CIBNUsEBCDK,hm,2020-11-25 15:32:17.000000,no,False,"b'hm,regram,hmxme'",b'iamcharlotteolivia',"b""When you're obsessed with cream-coloured softness.:cloud_selector: @iamcharlotteolivia #HM #regram #HMxME\nAlpaca-blend jumper: 0925565001""",0,0,120513,288,,,
CH-m8I9hjbP,hm,2020-11-24 15:18:24.000000,no,False,"b'hm,hmsport'",b'',b'Chilling out is part of working out. #HM #HMSport\n\nSports tights High Waist: 0748566037\nFleece outdoor jacket: 0889341002',0,0,40051,243,,,
CH7lfbuBK7e,hm,2020-11-23 11:08:01.000000,no,False,"b'hm,regram,hmxme'",b'h4nn_',"b""It's time to harvest some serious style points, @h4nn_! :sheaf_of_rice: #HM #regram #HMxME\n\nBalloon-sleeved dress: 0917984001""",0,0,68893,243,,,
CH45M49Bl4k,hm,2020-11-22 10:02:32.000000,no,False,"b'hm,hmxme,regram'",b'babmjb',b'@babmjb making the most of the cosy season. :cloud_selector: #HM #HMxME #regram\n\nPyjama set: 0892092002',0,0,60490,204,,,
CH0PhEkhnrW,hm,2020-11-20 14:41:19.000000,no,False,"b'hm,hmxme,regram'",b'joyclynragira',b'When your inner superstar decides to make an appearance. :dizzy: #HM #HMxME #regram @joyclynragira\n\nTrenchcoat: 0925246001',0,0,41139,207,,,
CHzk5b1Bi_o,hm,2020-11-20 08:28:55.000000,no,False,"b'hm,hmxme,regram'",b'surayatrendbook',"b""It's true \xe2\x80\x94 the denim-on-denim trend is back! :jeans: #HM #HMxME #regram @surayatrendbook\n\nKnit: 0916468003""",0,0,216555,401,,,
CHxsOPcBE3U,hm,2020-11-19 14:54:26.000000,no,False,b'hm',b'montana.marshall1',"b""@montana.marshall1 's checklist before buying something new: Do I need it? :check_mark: Do I have a similar item in my wardrobe? :check_mark: Can I swap it? :check_mark: #HM\n\nLong-sleeved sequined dress: 0924743001\nPatent strappy sandals: 0912453001\nSoft shoulder bag: 0866636008\nEarrings and ear cuffs: 0929594002""",0,0,54625,281,,,
CHxBYB7h7bY,hm,2020-11-19 08:41:37.000000,yes,False,b'hm',b'iconapop',b'Twinning for the holidays. @iconapop #HM\n\nStudded jumper: 0874372005\nImitation leather trousers: 0929275001\nPointed boots: 0907700001\nAirPods case necklace: 0932647002 \nSparkly stone earrings: 0687347001',419084,3.833,32013,198,,,
CHvC6w8HJkw,hm,2020-11-18 14:15:02.000000,no,False,"b'hm,hmsport'",b'',"b'Slow days at home call for casual,  comfortable sportswear. #HM #HMSport\n\nSeamless sports bodysuit: 0911329002\nModal-blend sports joggers: 0867087001\nModal-blend hoodie: 0912445001'",0,0,39769,237,,,
CHuY3BIBsdJ,hm,2020-11-18 08:07:31.000000,no,False,b'hm',b'',b'How to stay HOT through the cold? It\xe2\x80\x99s called a puffer. :dizzy: #HM\n\nDrawstring-waist puffer jacket: 0886553003\nTurtleneck top: 0902388003 \nCorduroy trousers: 0894643003',0,0,64789,124,,,
CHsiKCTBiU6,hm,2020-11-17 14:50:17.000000,no,False,"b'hm,hmsport'",b'',b'We highly recommend shutting everything out from time to time :folded_hands:  #HM #HMSport\n\nSeamless yoga jumpsuit: 0916537001\nRibbed leg warmers: 0822101005',0,0,35504,191,,,
CHr2z9mhvJy,hm,2020-11-17 08:31:32.000000,no,False,"b'hm,hmsport'",b'',b'Take a moment to connect with your inner self. #HM #HMSport\n\nSeamless sports bralette: 0929675002\nSeamless sports tights: 0866016001',0,0,35593,171,,,
CHp7CXhhUvD,hm,2020-11-16 14:29:58.000000,no,False,b'hm',b'prosenkilde',b'Holiday mood: serenity and sustainably sourced loungewear. :herb: @prosenkilde #HM \n\nCotton-blend hoodie: 0924742001\nCotton-blend joggers: 0928523001 \nRhinestone hoop earrings: 0952286001',0,0,54708,225,,,
CHpRz1jh2XN,hm,2020-11-16 08:29:43.000000,no,False,b'hmsport',b'',b'Relax. Retreat. Repeat. # HM #HMSport \n\nSeamless sports top: 0924453001\nSeamless sports tights: 0905957003',0,0,124461,293,,,
CHnhD8JB7eL,hm,2020-11-15 16:04:30.000000,no,False,b'hm',b'arizona_muse',"b'@arizona_muse shows what a conscious choice can look like, wearing our sustainably sourced loungewear set. :cloud_selector: #HM\n\nKnitted cardigan: 0951335001 \nRib-knit trousers: 0933989002'",0,0,94302,214,,,
CHnI0pQhhFc,hm,2020-11-15 12:32:42.000000,no,False,b'hm',b'',b'Are mom trousers the all-time ultimate fit? Cast your vote below. :beating_heart: #HM\n\nFront: Draped top: 0898109004 \nMom Loose-fit High Jeans: 0920929001\nMiddle: Cropped puff-sleeved top: 0922101002\nCorduroy trousers: 0894643001\nWaist belt: 0759483001\nBack: Puff-sleeved blouse: 0888455004\nMom High Ankle Jeans: 0920972002',0,0,110126,150,,,
CHmto_hBXtV,hm,2020-11-15 08:35:11.000000,no,False,b'hm',b'',b'Get into the vintage mood with our cute knitted pastels. :ribbon: #HM\n\nRib-knit hat: 0917119002\nFleece trousers: 0790383008\nCable-knit polo-neck jumper: 0906573001\nFaux fur slippers: 0838259004',0,0,218589,320,,,
CHk1NCRBofe,hm,2020-11-14 15:02:47.000000,no,False,"b'hmxme,hm,regram'",b'hangtw',"b'We would smile like that too if we had that outfit on, @hangtw! :fallen_leaf::orange_heart: #HMxME #HM #regram\n\nJacket: 0870989002'",0,0,107776,224,,,
CHkUjLKhhek,hm,2020-11-14 10:17:27.000000,no,False,b'hm',b'iconapop',"b""@iconapop 's style philosophy? \xe2\x80\x9cReuse your clothes, share and borrow.\xe2\x80\x9d #HM\n\nBalloon-sleeved wrap dress: 0924741001 \nWool-blend cardigan: 0928517001 \nRhinestone hoop earrings: 0950834001""",0,0,64745,154,,,
CHicsLMhylx,hm,2020-11-13 16:50:06.000000,no,False,"b'hmxme,hm,regram'",b'francislola',b'Keeping it cloud :cloud_selector: with @francislola. #HMxME #HM #regram \n\nSweater: 0906352001004\nSkirt: 0917447002002 \nShoes: 0898889002007',0,0,165345,371,,,
CHhhcUJh-Sz,hm,2020-11-13 08:12:23.000000,no,False,b'hm',b'iconapop',b'@iconapop BFFs in music and in fashion. :leopard::black_heart: #HM\n\nJacquard-weave dress: 0928516001\nRhinestone hoop earrings: 0952286001 \nPuff-sleeved dress: 0915625002 \nRhinestone hoop earrings: 0950834002\n22-pack rings: 0961782001',0,0,64575,153,,,
CHfP8DYhzxE,hm,2020-11-12 11:00:57.000000,no,False,b'hm',b'',"b""Say hello to the season's softest statement pieces. :glowing_star: #HM \n\nLeft: Flounce-trimmed jumper: 0928236002\nRight: Knitted jumper: 0902518001""",0,0,78265,231,,,
CHckZVIByzk,hm,2020-11-11 10:02:00.000000,no,False,"b'hmxme,hm,regram'",b'rocky_barnes',b'When you match your sweater with your lipstick. :lipstick: @rocky_barnes #HMxME #HM #regram \n\nCardigan: 0929165001',0,0,143371,392,,,
CHaUcCQBAKY,hm,2020-11-10 13:04:04.000000,no,False,"b'dvfxhmhome,hmhome'",b'hmhome',b'DVF x H&M HOME  Our friends at @hmhome are sharing some BIG news today: The Diane von Furstenberg x H&M HOME designer collaboration! Make sure to follow \xe2\x80\x94 you wouldn\xe2\x80\x99t want to miss a single detail! #dvfxhmhome #HMHome',0,0,27543,285,,,
CHXaudlhG5q,hm,2020-11-09 10:01:18.000000,no,False,b'hm',b'',b'Boost your curves. :yellow_heart::dizzy: These new jeggings are cut to flatter. #HM\n\nCurvy Jeggings: 0914441005\nCurvy Jeggings: 0914441003\nCurvy Jeggings: 0914441001',0,0,126462,327,,,
CHSznsMhkr8,hm,2020-11-07 15:02:37.000000,no,False,b'hm',b'',b'Style tip: need some quick chicness to your outfit? Add a stylish handbag! :purse: #HM\n\nShoulder bag: 0924091001',0,0,103784,443,,,
CHSYwdghf1h,hm,2020-11-07 11:07:53.000000,no,False,b'hm',b'',b'The top to reinvent your look. #HM\n\nCropped long-sleeved top: 0949232001\nMom High Ankle Jeans: 0572998007\nPlatform boots: 0916256005',0,0,97946,186,,,
CHP1QmdB4xm,hm,2020-11-06 11:19:13.000000,no,False,b'hm',b'prosenkilde',b'@prosenkilde knows a good chunky knit \xe2\x80\x94 and how to take care of the garments you love. See more of her and our cosy classics in our Stories! #HM',0,0,54917,351,,,
CHNp8WsBMLx,hm,2020-11-05 15:01:52.000000,no,False,b'hm',b'',b'Embrace forever. :blue_heart: Next-level jeans that flatter EVERY figure. #HM\n\nSkinny Ankle Jeans: 0882900013\nSkinny Ankle Jeans: 0882900007\nSkinny Ankle Jeans: 0882900008',0,0,68004,252,,,
CHNTJhshPGo,hm,2020-11-05 11:42:41.000000,no,False,b'hm',b'',"b""The sets you'll want to wear all day, err day. #HM\n\nHooded top: 0715624013\nSweatpants: 0547780003\nCropped sweatshirt: 0889753006\nJoggers High Waist: 0759814036""",0,0,108035,243,,,
CHKwVd_Bx-T,hm,2020-11-04 12:00:00.000000,no,False,"b'hm,regram,hmxme'",b'saraollila',b'Puffer + sunnies = amazing look! @saraollila #HM #regram #HMxME\n\nSunglasses: 0696737003\nPuffer Jacket: 0914363001',0,0,92667,285,,,
CHFwlWpBiQa,hm,2020-11-02 13:25:58.000000,no,False,b'hm',b'',"b""Chunky sole mates you'll love forever. :red_heart_selector: #HM\n\nPuff-sleeved blouse: 0942643001\nFleece-lined boots: 0921106002""",0,0,92512,779,,,
CHC4pBkBiwA,hm,2020-11-01 10:38:39.000000,no,False,"b'hm,hmxme,regram'",b'nadiaanya_',b'Looking for that chic autumn look? Add a long and light-coloured coat for that je-ne-sais-quoi feel. @nadiaanya_ #HM #HMxME #regram\n\nCoat: 0894768001',0,0,213412,659,,,
CHBEna2BKn2,hm,2020-10-31 17:44:48.000000,no,False,"b'hm,hmxme,regram'",b'alannanicolex',b'How to make the world your runway! :camera_with_flash:  #HM #HMxME #regram @alannanicolex\n\nKnitted sweater: 0873279003\nCoat: 0909014002 \nBag: 0866636007',0,0,83083,213,,,
CHALxILBMIx,hm,2020-10-31 09:28:03.000000,no,False,"b'hm,hmxme,regram'",b'yazzmou',b'These boots were made for walking (and looking fab!) @yazzmou #HM #HMxME #regram\n\nBoots: 0898886001',0,0,149170,591,,,
CG-QB9zhUpi,hm,2020-10-30 15:26:50.000000,no,False,"b'hm,hmxme,regram'",b'talk_curvy_to_me',"b""It's fri-yay and @talk_curvy_to_me is feeling the weekend vibes! #HM #HMxME #regram\n\nDress: 0832177001""",0,0,77441,331,,,
CG9dyt_BiyV,hm,2020-10-30 08:07:50.000000,no,False,"b'hm,hmxme,regram'",b'amina_blal',b'The pillars of high fashion. :castle: #HM #HMxME #regram @amina_blal\n\nJacket: 0929599002',0,0,78351,406,,,
CG7t7pTBHeG,hm,2020-10-29 15:50:23.000000,no,False,b'hm',b'',b'How to add some sparkle to your outfit? Just add a sparkling top! Works every time! #HM\n\nClutch bag: 0911111002\nRhinestone-decorated top: 0938156001\nOversized cotton shirt: 0938138001',0,0,76914,395,,,
CG7ZdZ-hsPc,hm,2020-10-29 12:51:30.000000,no,False,"b'hm,hmxme,regram'",b'carolineskjelbred',"b""A light autumn breeze? Yes, that's what we'd call this look, @carolineskjelbred! :sheaf_of_rice: #HM #HMxME #regram\n\nKnitted sweater: 0918525001""",0,0,84237,217,,,
CG66olcBbcw,hm,2020-10-29 08:22:50.000000,yes,False,"b'jointherecyclingrevolution,hm'","b'janegoodallinst,sza,vicbarrett_,andreeadiddy'",b'Meet the changemakers. @janegoodallinst @sza @vicbarrett_ and @andreeadiddy are inviting you to #jointherecyclingrevolution #HM',244667,59.966,16046,101,,,
CG463kNh49T,hm,2020-10-28 13:46:28.000000,yes,False,"b'jointherecyclingrevolution,hm'",b'andreeadiddy',"b""It's taught her many lessons and together, they share many memories. But it's time @andreeadiddy gave her old :martial_arts_uniform: a new life.  #jointherecyclingrevolution #HM""",253689,42.233,16338,183,,,
CG4Ti6MBMQ-,hm,2020-10-28 08:04:36.000000,yes,False,"b'hm,jointherecyclingrevolution'",b'vicbarrett_',"b""He's fighting for our :globe_showing_Americas: by making his voice heard. Now, climate justice activist @vicbarrett_ is joining the recycling revolution. #HM #jointherecyclingrevolution""",200432,59.966,13612,96,,,
CG2b9YChCpj,hm,2020-10-27 14:37:49.000000,yes,False,"b'jointherecyclingrevolution,hm'",b'sza',b'Guess what artist and activist @sza is remaking with our recycling machine Looop? :eyes:  #jointherecyclingrevolution #HM',247374,59.966,20492,217,,,
CG1u-Qvh3Td,hm,2020-10-27 08:04:50.000000,yes,False,"b'jointherecyclingrevolution,hm'",b'janegoodallinst',b'Co-creating a better fashion future with icon @janegoodallinst by recycling and remaking. Will you also #jointherecyclingrevolution ? #HM',300436,59.6,20156,175,,,
CG0FNlIhpEp,hm,2020-10-26 16:39:53.000000,no,False,"b'hm,hmxme,regram'",b'nimiblackwell',b'We love this modern twist on the classic mini skirt + high boots outfit! #HM #HMxME #regram @nimiblackwell\n\nJumper: 0887771003\nSkirt: 0842028010\nBag: 0934135001 \nBoots: 8988860010',0,0,148705,363,,,
CGzvNDHhiGo,hm,2020-10-26 13:27:35.000000,no,False,b'hm',b'',"b'Modern lace with a romantic touch? Yes, please! #HM\n\nWide trousers: 0937667002\nPatent ankle boots: 0898890002\nFlounced lace blouse: 0904411005'",0,0,228923,675,,,
CGzKqZVhWgG,hm,2020-10-26 08:08:16.000000,no,False,"b'hm,hmxme,regram'",b'brooklynblonde1',b'How to wear the monochrome look? Like this! @brooklynblonde1 #HM #HMxME #regram\n\nCoat: 0872537006\nKnitted sweater: 0887757001',0,0,116027,315,,,
CGrb6FpBhid,hm,2020-10-23 08:05:02.000000,no,False,b'hm',b'',"b""Look this way for autumn's most-wanted styles: knitwear. #HM\n\nKnitted jumper: 0902518010\nSlit-front velour skirt: 0925551002""",0,0,72197,543,,,
CGpnaiKhTMh,hm,2020-10-22 15:07:06.000000,no,False,b'thevampireswifexhm',b'',b'When night falls :bat: take flight. We adore all your #TheVampiresWifexHM looks.',0,0,53091,723,,,
CGowDnHhKsV,hm,2020-10-22 07:05:05.000000,yes,False,"b'thevampireswifexhm,hm'",b'',b'OUT NOW IN SELECTED STORES AND ONLINE. #TheVampiresWifexHM #HM',320422,14.98,24376,1026,,,
CGnGQtyBcfA,hm,2020-10-21 15:38:56.000000,no,False,"b'thevampireswifexhm,hmxme,regram'","b'emmanuellek_,annelauremais,paolaturani,thevampireswife'",b'Must be the season :crystal_ball::wilted_flower: :spider_web_selector: #TheVampiresWifexHM launches tomorrow. #HMxME #regram @emmanuellek_ @annelauremais @paolaturani @thevampireswife',0,0,46729,587,,,
CGj3z3WBtqj,hm,2020-10-20 09:34:56.000000,no,False,"b'thevampireswifexhm,hm'",b'',b':rose::raised_hand::lady_beetle::notebook_with_decorative_cover::high_voltage::beating_heart::eye::love_letter: \xe2\x80\x94 which is your lucky charm? \n\nCollection out on Thursday! #TheVampiresWifexHM #HM',0,0,51234,533,,,
CGhPPvThBq4,hm,2020-10-19 09:02:00.000000,no,False,"b'thevampireswifexhm,hm'","b'thevampireswife,evssofficial,gretabellamacina,samanthasnowtvw'","b'""My dresses allow women\'s fundamental power to shine through."" Susie Cave, founder & creative director of @TheVampiresWife\n\nWe want to thank the stars of #TheVampiresWifexHM that brought the story to life:\n:sparkles:  model and influencer @evssofficial\n:sparkles:  poet, actress and model @gretabellamacina, and \n:sparkles:  muse and model @samanthasnowtvw. \nGo online or to the app to preview the full campaign. #HM'",0,0,63874,551,,,
CGfGPunBGB0,hm,2020-10-18 13:04:52.000000,no,False,"b'hmsport,hm'",b'',b'Our new seamless sportswear gives you more freedom of movement and smoother workouts. #HMSport #HM \n\nSeamless sports top: 0856270003\nSeamless tights High Waist: 0918292011',0,0,52285,214,,,
CGeqSVzhu4Q,hm,2020-10-18 09:00:33.000000,no,False,"b'hm,hmxme,regram'",b'frilansfrida',b'Summer is over but @frilansfrida is giving us some much-needed :water_wave: vibes.  #HM #HMxME #regram \n\nShacket: 0891591001',0,0,103776,294,,,
CGcOsaFBdg_,hm,2020-10-17 10:20:58.000000,no,False,b'hm',b'',"b""What's your fave shade of green? #HM\n\nCotton-blend hoodie: 0925666004\nImitation leather puffer jacket: 0910613001""",0,0,40104,245,,,
CGaFk0uhu10,hm,2020-10-16 14:22:48.000000,no,False,b'hm',b'',"b""I'm not scared, you are. :zany_face: Comment your favourite horror movie below! #HM\n\nPrinted sweatshirt:\t0930368001\nOversized printed T-shirt: 0874118016\nOversized printed T-shirt: 0874118017""",0,0,127000,624,,,
CGZhTjDhwHt,hm,2020-10-16 09:05:52.000000,no,False,"b'thevampireswifexhm,hm'",b'samanthasnowtvw',b'Muse & model @samanthasnowtvw wears The Night Whisperer maxi dress from #TheVampiresWifexHM collaboration. Did you know all the pieces of the collection are made from sustainably sourced materials? Preview the full collection online & in the app now. #HM',0,0,44135,257,,,
CGXgyNfBOAx,hm,2020-10-15 14:22:51.000000,no,False,b'hm',b'',b'Black and silver \xe2\x80\x94 the timeless colour combo we love. :black_heart::spoon: #HM\n\nPadded shoulder bag: 0902715001\n5-pack rings: 0913196002\nEau de parfum: 0771506001\nWarm-lined boots: 0898894003',0,0,85579,343,,,
CGWvkSZBxhr,hm,2020-10-15 07:12:46.000000,no,False,"b'hm,regram,hmxme'",b'tylauren',b'When all you need is that one coat. @tylauren #HM #regram #HMxME\n\nJacket: 0891591003',0,0,92582,260,,,
CGUoST4Bs33,hm,2020-10-14 11:30:40.000000,no,False,"b'jointherecyclingrevolution,hm'",b'',"b'Circular solutions are the future. So, we\xe2\x80\x99re bringing them to you! Read more at hm.com/sustainability. #jointherecyclingrevolution #HM'",0,0,27711,231,,,
CGUKbDQBdwi,hm,2020-10-14 07:09:43.000000,no,False,"b'jointherecyclingrevolution,hm'",b'',"b'Technology meets history with Looop, our new recycling system turning the dream of circularity into reality. #jointherecyclingrevolution #HM'",0,0,23092,106,,,
CGSeY2rB47m,hm,2020-10-13 15:25:42.000000,no,False,"b'jointherecyclingrevolution,hm'",b'',b'Cotton candy? Think again. These purple shreds are fibres from an old garment about to be turned into a new one by Looop \xe2\x80\x93\xe2\x80\x93 our in-store recycling system. #jointherecyclingrevolution #HM',0,0,39143,311,,,
CGSQJL7hRw1,hm,2020-10-13 13:21:14.000000,no,False,"b'hm,regram,hmxme'",b'simply_kdell',b'\xe2\x80\xa6 and this is how you step into the new season. @simply_kdell  #HM #regram #HMxME \n\nShacket: 0898692003',0,0,102665,277,,,
CGRot3uhDPz,hm,2020-10-13 07:36:43.000000,no,False,"b'jointherecyclingrevolution,hm'",b'',"b'The glass box that\xe2\x80\x99ll change fashion forever (well, our new in-store recycling system inside of it will). Learn more at hm.com/sustainability. #jointherecyclingrevolution #HM'",0,0,28018,119,,,
CGPUuMOBLoB,hm,2020-10-12 10:05:23.000000,yes,False,"b'jointherecyclingrevolution,hm'",b'',"b'Let\xe2\x80\x99s remake and create a better fashion future. Introducing the world\xe2\x80\x99s first in-store recycling system turning old garments into new. Never again will your unwanted clothes be seen as waste. From now on, they are a resource. #jointherecyclingrevolution #HM'",470626,30.0,35792,321,,,
CGPB_ywBWgg,hm,2020-10-12 07:19:53.000000,no,False,"b'hm,regram,hmxme'",b'kristinazias',"b'Kicking off the week with the chillest vibe of them all, @kristinazias! #HM #regram #HMxME\n\nPants: 0910601002\nJacket: 0878190005\nTank: 0918835003'",0,0,109098,219,,,
CGMpIz0B2h5,hm,2020-10-11 09:04:11.000000,no,False,b'hm',b'',b'Mood rn: jumpers & cardis that leave a lasting impression. :yarn:  #HM\n\nKnitted jumper: 0936831001',0,0,169635,448,,,
CGKmqE9hJNr,hm,2020-10-10 14:04:02.000000,no,False,"b'hm,hmxme,regram'",b'orlaith_melia',b'We give you Minimalistic Perfection by @orlaith_melia. #HM #HMxME #regram\n\nTrousers: 0904022001',0,0,135828,313,,,
CGJ-ZagBDk9,hm,2020-10-10 08:12:14.000000,no,False,b'hm',b'',"b'""Shine bright like a diamond."" :smirking_face: We couldn\'t resist. #HM\n\nDress: 0931093001'",0,0,63508,429,,,
CGICcQHhX8F,hm,2020-10-09 14:09:06.000000,no,False,b'hm',b'',"b'Nothing says ""I\'m here"" like a lime green outfit. :green_heart:  #HM\n\nFaux shearling bucket hat: 0897464003\nShort mesh top: 0939997002\nBoxy shoulder bag: 0938737001'",0,0,53393,333,,,
CGHXgX_hq6A,hm,2020-10-09 07:53:55.000000,no,False,b'hm',b'',"b'Button, pressed. Next floor: party dresses. #HM\n\nBodycon dress: 0902486001\nOversized jacket: 0906741002\nCrinkled velour dress: 0902509001\nPatent handbag: 0842286001'",0,0,83396,187,,,
CGFbKCJhBu5,hm,2020-10-08 13:47:20.000000,no,False,b'hm',b'',"b'Style tip: create a 90s-inspired outfit with a cute scrunchie, shoulder bag and brightly coloured knits. #HM\n\nKnitted cardigan: 0893432003\nVelour scrunchie: 0556539023\nNail polish: 0616638015\nFitted turtleneck jumper: 0834924005\nSmall handbag: 0844996002'",0,0,159721,314,,,
CGEzPRaBHRi,hm,2020-10-08 07:58:32.000000,no,False,"b'hm,hmxme,regram'",b'andreaduro',"b""Cool doesn't even cut it \xe2\x80\x94 this look is amazing! #HM #HMxME #regram @andreaduro\n\nDress: 0909371001""",0,0,295141,619,,,
