shortcode,username,date_utc,is_video,is_sponsored,hashtags,mentions,caption,video_view_count,video_length,likes,comments,likes+comments,location_name,location_latlongCDRwnlbnW6c,krogerco,2020-07-30 19:11,yes,False,"feedyouforaday,vegan",willedmond,"b""@willedmond back to #FeedYouForADay with a favorite lunch specialty: #Vegan Empanadas! \n\nDo you travel just to eat? I do! I get excited to travel because I know there's going to be new food wherever I go and empanadas are one of my favorites. I've traveled to Spain, Mexico, Chile, and many other Latin countries and I'm always looking for the best empanadas. \n\nI can't travel to my favorite countries at the moment, so I decided to bring the flavor to my kitchen. These empanadas will have you going back for seconds. I promise ya! They're crispy on the outside and filled with Simple Truth Chorizo sausages, potatoes, peppers, and amazing seasonings. I bet you can't just eat one!""",5034,55.166,292,24,316,,
CDRilvGHqcJ,krogerco,2020-07-30 17:09,yes,False,"feedyouforaday,vegan",willedmond,"b""@willedmond here taking over Kroger\xe2\x80\x99s IG to #FeedYouForADay with my favorite recipes! Starting with a breakfast crowd-pleaser: Vegan Blueberry Pancakes\n\nWhen I think of my home in East Texas, it's the fond memories of growing up and being excited about breakfast. Momma would have the best breakfast prepared, and my grandma would make us those good old Southern biscuits that everyone loved. We always had pancakes too.  And I love some pancakes! Since it's Blueberry season I thought... Why not make some fluffy Homemade Vegan Blueberry Pancakes? \n\nThis pancake recipe may be the best #vegan pancake ever. This recipe is easy and simple and something that your entire family will love!""",3498,59.133,312,17,329,,
CDOrmmkjVO9,krogerco,2020-07-29 14:30,no,False,,restoring_radiance,b'From Mykonos to your local Kroger! Get these delicious Greek Chicken Skewers curated by @restoring_radiance with all the ingredients available for free pickup.',0,0,374,7,381,,
CDMDbD0jK4A,krogerco,2020-07-28 14:00,yes,False,,,b'A whole meal with just 6 ingredients? Dreams do come true! Watch Chef Paul Sturkey take you through this recipe for Cornmeal Cakes and Chipotle Cream.',3471,222.6,222,15,237,,
CDJfKs3nd0P,krogerco,2020-07-27 14:05,yes,False,,buzzfeedtasty,b'These one-of-a-kind cauliflower steaks will melt in your mouth! @Buzzfeedtasty knows how to celebrate summer. :smiling_face_with_heart-eyes: Find the recipe at the link in our bio.',3706,59.833,297,21,318,,
CDACW5tH1Ea,krogerco,2020-07-23 22:00,yes,False,feedyouforaday,toshpointfro,"b""@toshpointfro wrapping up #FeedYouForADay with my favorite childhood recipe! I absolutely love fried catfish and spaghetti. In the summer when I was a little girl, my dad would sneak into my room at 4am and ask me if I wanted to go fishing. My answer was ALWAYS yes! We would drive out and spend the morning together on the water enjoying nature and catching as many fish as we could. By noon, we would be in the backyard and I would watch my dad clean the fish so they would be ready for dinner. It's one of my fondest memories and always comes back when I take my first bite of that golden crunchy catfish crust.""",10679,50.966,481,65,546,,
CC_xCYlnk4h,krogerco,2020-07-23 19:29,yes,False,feedyouforaday,toshpointfro,"b""@toshpointfro back again for #FeedYouForADay to share an afternoon treat! Some think my secret to winning friends is my bubbly personality, but I have to tell you a secret...it's really these cookie truffles. :smiling_face_with_smiling_eyes: This recipe is always a hit. In the past, I would bring cookie truffles to every event and potluck, but lately it's been a lot of fun leaving them in the mailboxes of friends and family just so they know they are on my mind.""",9172,57.366,612,47,659,,
CC_Z5wUlG6W,krogerco,2020-07-23 16:06,yes,False,feedyouforaday,toshpointfro,"b""@toshpointfro here! I\xe2\x80\x99m taking over the Kroger IG to #FeedYouForADay and share some of my favorite recipes. First off: Seafood might be my greatest food love. I remember when I was in first grade I earned all A's on my report card, and my parents rewarded me with a massive seafood feast. Crab legs and jumbo shrimp danced on my taste buds! I have been hooked ever since. I'm not saying my parents bribed me to earn good grades, but those shrimp definitely motivated me to keep doing my best lol.""",7716,53.133,404,16,420,,
CC6B0LPAJ9Z,krogerco,2020-07-21 14:00,no,False,,muybuenocooking,b'The perfect summer pick-me-up is here from @muybuenocooking! Get all the ingredients with free pickup at Kroger.',0,0,370,38,408,,
CC3dBQWDMar,krogerco,2020-07-20 14:00,no,False,,dadwithapan,b'Shrimply delicious. @dadwithapan created a recipe that\xe2\x80\x99s a perfect summer treat! All the ingredients are available at your local Kroger with free pickup.',0,0,445,45,490,,
CC04OdpD1Mz,krogerco,2020-07-19 14:00,yes,False,nationalicecreamday,,"b'It\xe2\x80\x99s #NationalIceCreamDay! Time for a scoop (or three) of enchanted deliciousness. :rainbow::unicorn_face:Through July 28th, buy 2 Kroger Ice Creams & Get 1 Kroger Cones Free! Shop now at the link in our bio.'",4168,15.0,279,35,314,,
CCtUp6NFwbj,krogerco,2020-07-16 15:34,no,False,,jasminekatrina,b'Here\xe2\x80\x99s a little sugar and spice to make your week nice! Get everything you need to make @JasmineKatrina\xe2\x80\x99s Sock It To Me Cake with free pickup at your local Kroger.',0,0,487,69,556,,
CCrN_hxnLnM,krogerco,2020-07-15 19:58,yes,False,,,b'Sweet treats taste even better when they\xe2\x80\x99re easy to make. These ones by So Yummy are only 5 ingredients! :face_savoring_food::cookie: Find the recipe at the link in our bio.',9646,27.419,478,68,546,,
CCorrodHs_P,krogerco,2020-07-14 20:19,yes,False,,,"b'Sweet strawberries, cream, and milk is all you need to make this sweet summer treat! :smiling_face_with_heart-eyes::strawberry:Find the recipe at the link in our bio.'",6952,14.633,490,21,511,,
CCbIRvsnY6o,krogerco,2020-07-09 14:00,no,False,,howtofeedaloon,"b'Whether you\xe2\x80\x99re cooking inside or out, these wings from @HowToFeedALoon couldn\xe2\x80\x99t be any sweeter! :smiling_face_with_heart-eyes:'",0,0,380,38,418,,
CCYxPKEHIW0,krogerco,2020-07-08 16:00,yes,False,,,b'Watch Chef Paul Sturkey make this delicious Surf and Turf for Two with just 6 ingredients.',5003,267.182,381,18,399,,
