shortcode,username,date_utc,is_video,is_sponsored,hashtags,mentions,caption,video_view_count,video_length,likes,comments,likes+comments,location_name,location_latlongCCB6q8mnDgu,lidlus,2020-06-29 19:00:10.000000,no,False,"b'bigbluefuture,rethinkgrocery'",b'',"b'One of the best ways you can help support and preserve our oceans from overfishing is by choosing sustainable seafood. :fish: \nWhen you see the little blue MSC label, it means you\xe2\x80\x99re choosing reliably-sourced seafood with a big blue future so more generations can enjoy the same beautiful oceans like we do today. :water_wave: \n#BigBlueFuture #rethinkgrocery'",0,0,130,0,,,
CCBSv1SnmIH,lidlus,2020-06-29 13:11:19.000000,no,False,b'',b'',"b'Starting today, our store hours will change to 8 a.m. to 9 p.m. and we will continue to offer special shopping hours for higher risk individuals on Tuesday and Thursdays 7 a.m. to 8 a.m. :alarm_clock: We look forward to serving our customers with an additional hour of shopping! :shopping_cart: Click the link in our bio for more Covid-19 updates!'",0,0,361,36,,,
CB6FH1qH-bG,lidlus,2020-06-26 17:57:35.000000,no,False,b'rethinkgrocery',b'',b'Those who are dairy-free can still have their \xe2\x80\x9cice cream\xe2\x80\x9d and eat it too! :ice_cream::chocolate_bar: We offer a delicious selection of frozen desserts made with UTZ Certified cocoa and without any artificial flavors (and some without dairy!). :smiling_face_with_heart-eyes: Get inspired with a tasty dairy-free recipe \xe2\x80\x94 follow the link in our bio! #rethinkgrocery',0,0,195,4,,,
CB3iMgUHDVu,lidlus,2020-06-25 18:13:54.000000,no,False,"b'rethinkgrocery,summergrilling,salmon'",b'',"b'What\xe2\x80\x99s your favorite summer seafood dish? :fire: We love grilling our sustainably sourced Norwegian salmon fillets because of their fresh taste, flaky texture and BAP certification. :fish:\n\nVisit the link in our bio to discover our best tips and tricks to grilling seafood this summer. \n#rethinkgrocery #summergrilling #salmon'",0,0,141,7,,,
CB01ytnn9LM,lidlus,2020-06-24 17:07:32.000000,yes,False,b'rethinkgrocery',b'',b'\xe2\x80\x9cWow. Yes. Very comfy. No human allowed.\xe2\x80\x9d This \xe2\x80\x98ruff\xe2\x80\x99 translation of DoggoLingo means \xe2\x80\x9cI love my new pet bed!\xe2\x80\x9d. :dog_face::paw_prints: Bring home a dog cot with canopy for your precious pupper and they can tell you themselves!\n\nIn stores now while supplies last. #rethinkgrocery',5022,18.933,307,27,,,
CByZtJMHMen,lidlus,2020-06-23 18:23:30.000000,no,False,"b'bigbluefuture,rethinkgrocery'",b'',"b'The seafood you bring home from Lidl is part of something bigger. :lobster::shrimp: By choosing sustainable seafood with the blue MSC label, you\xe2\x80\x99re helping protect our oceans from overfishing and preserve its biodiversity. :water_wave: \n#BigBlueFuture #rethinkgrocery'",0,0,91,0,,,
CBvuI8unWxe,lidlus,2020-06-22 17:24:21.000000,no,False,b'',b'',"b'Got an insatiable sweet tooth?:face_savoring_food:There\xe2\x80\x99s a recipe for that. Discover what you can do with our delicious frozen summer sweets :soft_ice_cream: (a selection are UTZ certified and made without any artificial flavors, of course) by clicking the link in our bio!'",0,0,156,0,,,
CBsx_wsF6JA,lidlus,2020-06-21 14:00:19.000000,no,False,b'',b'',b'Happy Father\xe2\x80\x99s Day :family_man_girl_boy: to all the rad dads and father figures out there. Thanks for all that you do\xe2\x80\x94 today and every day. :glowing_star:\n\nComment below and let us know how you\xe2\x80\x99re celebrating! :party_popper:',0,0,177,3,,,
CBn8-H0DIyS,lidlus,2020-06-19 17:00:01.000000,no,False,"b'rethinkgrocery,tasteofspain,solymar'",b'',"b'You\xe2\x80\x99ll be on \xe2\x80\x98tapa\xe2\x80\x99 the world :globe_showing_Americas: when you try Sol y Mar, our line of Spanish-inspired specialties. Please check the myLidl app or log in to your account online for local store stock levels. Buen provecho! :shallow_pan_of_food:\n\n#rethinkgrocery #tasteofspain #solymar'",0,0,119,2,,,
CBlcgR_HgoC,lidlus,2020-06-18 17:37:50.000000,no,False,b'rethinkgrocery',b'',"b'Summer is for steaks, sun and suds. Give your neighbors grill envy by cooking up an organic grass fed ribeye steak along with some super tasty bevs. :cut_of_meat::clinking_beer_mugs: Please check the myLidl app or log in to your account online for local store stock levels. #rethinkgrocery'",0,0,123,2,,,
CBjGWqknFae,lidlus,2020-06-17 19:46:00.000000,yes,False,b'rethinkgrocery',b'',b'Cancel that conference call and make time for more adventures this summer. :sunrise: Get yourself an inflatable tandem kayak\xe2\x80\x94 available starting 6/17 while supplies last! :woman_rowing_boat_selector: Where will the water take you? #rethinkgrocery',2550,19.6,127,19,,,
CBgH2zWHDFn,lidlus,2020-06-16 16:01:13.000000,no,False,b'lidlsafeshopping',b'',"b'Have you entered our safe shopping sweepstakes yet? We\xe2\x80\x99d love to see your face mask style! :face_with_medical_mask: Every week until June 30, we\xe2\x80\x99ll choose one winner who\xe2\x80\x99ll receive a $100 Lidl gift card. Enter by posting a selfie in your protective gear next to the social distancing signs outside our store. :selfie:\n\nTag us and use the hashtag #LidlSafeShopping \xe2\x80\x94 don\xe2\x80\x99t forget to make your IG page public so we can see your entry! Click the link in our bio for more details about rules, terms and conditions.'",0,0,170,12,,,
CBdp2JKn6oD,lidlus,2020-06-15 17:00:30.000000,no,False,b'rethinkgrocery',b'',"b'If you couldn\xe2\x80\x99t already tell, we\xe2\x80\x99re sweet on you! :revolving_hearts: How sweet? One taste of Gelatelli, our selection of frozen summer treats made with UTZ certified cocoa and without artificial flavors, and you\xe2\x80\x99ll see for yourself! :soft_ice_cream: #rethinkgrocery'",0,0,338,15,,,
CBbSzoontM5,lidlus,2020-06-14 19:00:42.000000,no,False,"b'feelgoodseafood,bigbluefuture,rethinkgrocery'",b'',"b'One small choice at our seafood market. :fish: One huge difference to the planet. :globe_showing_Americas: When you see the blue MSC label, you\xe2\x80\x99re choosing sustainable seafood that helps keep the oceans thriving for generations to come. :water_wave: #FeelGoodSeafood #BigBlueFuture #rethinkgrocery'",0,0,165,4,,,
CBWJC73nLT_,lidlus,2020-06-12 18:59:12.000000,no,False,b'',b'',b'What kind of rad dad do you have? Is he an entertaining expert? :man_juggling_selector: Fitness fanatic? :man_lifting_weights_2: Or a heroic handyman? :man_mechanic: Check out our Father\xe2\x80\x99s Day gift guide by visiting the link in our bio!',0,0,105,7,,,
CBTcm-xnvyM,lidlus,2020-06-11 17:52:25.000000,no,False,b'',b'',"b'Some things are just meant to go together\xe2\x80\xa6 like fiery coals, grill grates and sustainable seafood! :fish::fire: Discover great grilling tips and delicious seafood recipes by visiting the link in our bio!'",0,0,124,7,,,
CBRCbFgnA4D,lidlus,2020-06-10 19:25:20.000000,yes,False,b'rethinkgrocery',b'',"b'Our new Lawrenceville, GA, location is officially open for business! :raising_hands: Meet Bianca and the team at 3520 Sugarloaf Parkway and pick up your essentials. :roll_of_paper::bread::tangerine::shopping_cart: To view a full list of protective measures you can expect in store, visit the link in our bio. #rethinkgrocery'",4424,24.833,282,27,,,
CBQ23lFjhPJ,lidlus,2020-06-10 17:44:10.000000,no,False,b'rethinkgrocery',b'',b'This deal will start a fire in your heart! :fire: Take home a new kettle grill \xe2\x80\x94 it\xe2\x80\x99ll be love at first \xe2\x80\x98light\xe2\x80\x99! Please check the myLidl app or log in to your account online for local store stock levels. :light_bulb::shopping_cart: #rethinkgrocery',0,0,162,3,,,
CBOX4zLnXoD,lidlus,2020-06-09 18:34:58.000000,no,False,b'rethinkgrocery',b'',"b""Have you checked out Lidl\xe2\x80\x99s new summer ice creams yet? We think you\xe2\x80\x99ll love spending time together! :ice_cream: Many are UTZ certified and made without any artificial flavors\xe2\x80\x94you\xe2\x80\x99ll love what you find! Welcome summer\xe2\x80\x99s sweetest BFFs into your freezer; they'll be there for you when you need it the most! :smiling_face_with_sunglasses: Visit the link in our bio to learn more. #rethinkgrocery""",0,0,297,12,,,
CBLj3d9HCmb,lidlus,2020-06-08 16:21:55.000000,no,False,"b'feelgoodseafood,worldoceansday,bigbluefuture,rethinkgrocery'",b'',"b'The wild-caught seafood you choose is more than just a drop in the ocean. :water_wave: When you bring home MSC-certified :fish::oyster::crab::shrimp:, you\xe2\x80\x99re making a sustainable choice to help preserve and protect our oceans from overfishing. Keep the oceans thriving for future generations by choosing the blue MSC label. Click the link in our bio to learn more! :blue_heart: #FeelGoodSeafood #WorldOceansDay #BigBlueFuture #rethinkgrocery'",0,0,170,6,,,
CBF8ZK7Hf9x,lidlus,2020-06-06 12:00:47.000000,no,False,b'rethinkgrocery',b'',"b'Whether you prefer it rare or well-done, we\xe2\x80\x99ll let you decide the best way to prepare our grass fed NY strip steak \xe2\x80\x94 on sale this weekend only, while supplies last. Tell us how you like your :cut_of_meat: in the comments! #rethinkgrocery'",0,0,150,2,,,
CBEDMrdnIcn,lidlus,2020-06-05 18:21:46.000000,no,False,b'',b'',"b'Helloooo happy campers! :waving_hand: We came up with some great ways to create the ultimate backyard camping trip.:camping_selector: Enjoy a night under the stars with toasty marshmallows, card games and pillows upon pillows in a pop-up tent \xe2\x80\x94 what could be better? :sparkles: Visit the link in our bio for fun ideas while staying at home!'",0,0,246,4,,,
CBBlssZH7hs,lidlus,2020-06-04 19:25:31.000000,no,False,"b'nationalcheeseday,rethinkgrocery'",b'',"b'So much cheese, so little time\xe2\x80\xa6 BUT! It\xe2\x80\x99s #NationalCheeseDay :cheese_wedge: which means you have the perfect excuse to create a beautiful charcuterie board with our award-winning Lidl Preferred Selection cheeses.:yellow_heart: Firm, creamy, mild and mature \xe2\x80\x94 we have it all! Discover our crave-worthy cheese collection on our website. :light_bulb::shopping_cart: #rethinkgrocery'",0,0,281,13,,,
CA-5AEdnjNY,lidlus,2020-06-03 18:16:28.000000,no,False,b'rethinkgrocery',b'',b'Don\xe2\x80\x99t snooze on these awesome items! Our crazy comfy PJs and sandals will be your go-to\xe2\x80\x99s for lounging all season long. :t-shirt::shorts: Please check the myLidl app :mobile_phone_with_arrow: or log in to your account online for local store stock levels. :light_bulb::shopping_cart: #rethinkgrocery',0,0,160,3,,,
CA54NrDnOyB,lidlus,2020-06-01 19:33:23.000000,no,False,b'',b'',"b'We\xe2\x80\x99ll stop the world and melt with you! :musical_notes: This \xe2\x80\x9880s throwback has us feeling pretty nostalgic\xe2\x80\xa6 Relive all those dreamy summer moments with a classic cookie sandwich, chocolate ice cream bar or fruit popsicle by Gelatelli! :soft_ice_cream::ice_cream::shaved_ice: These frozen delights are not only a delicious way to cool off on a hot day, but they\xe2\x80\x99re made from high-quality ingredients and select items feature an UTZ or Fairtrade International certification \xe2\x80\x94 Visit the link in our bio to learn more! :sun_selector::face_savoring_food:'",0,0,200,2,,,
CA5gsjNHBDs,lidlus,2020-06-01 16:07:53.000000,no,False,b'lidlsafeshopping',b'',"b'Have you entered our safe shopping sweepstakes yet? We\xe2\x80\x99d love to see your face mask style! :face_with_medical_mask: Every week until June 30, we\xe2\x80\x99ll choose one winner who\xe2\x80\x99ll receive a $100 Lidl gift card. :dollar_banknote: Enter by posting a selfie in your protective gear next to the social distancing signs outside our store. :selfie:\n\nTag us and use the hashtag #LidlSafeShopping \xe2\x80\x94 don\xe2\x80\x99t forget to make your IG page public so we can see your entry! Visit the link in our bio for more details about rules, terms and conditions.'",0,0,124,6,,,
CAxvqFfn4hC,lidlus,2020-05-29 15:44:42.000000,no,False,b'rethinkgrocery',b'',"b'It\xe2\x80\x99s a whole new world! :globe_showing_Asia-Australia: Take your taste buds on a culinary journey with 1001 Delights, our collection of Mediterranean-inspired specialties. Turkish-style pizza, exotic spices, stuffed grape leaves and more\xe2\x80\x94 discover the incredible flavors this very versatile cuisine has to offer. :dizzy: Visit our website for more fun ideas while at home! :house_with_garden: #rethinkgrocery'",0,0,232,8,,,
CAvP1UVH2Uf,lidlus,2020-05-28 16:28:08.000000,no,False,b'rethinkgrocery',b'',"b'Steak your claim \xe2\x80\x94 it\xe2\x80\x99s ribeye time! Rich, tender and well-marbled, this regal cut of meat is sure to be the crown jewel of your summer BBQ. :cut_of_meat::fire: Visit our website to learn more. #rethinkgrocery'",0,0,121,0,,,
CAsy8jlHoAE,lidlus,2020-05-27 17:37:25.000000,yes,False,b'rethinkgrocery',b'',"b""We are overjoyed to have officially opened :hundred_points: stores here in the U.S.! :partying_face:  Meet Travis, the store manager of our 100th location at 2985 Peachtree Parkway in Suwanee, GA. :waving_hand: Travis and his team will be delighted to help you with finding any of your essential needs. \nDon't forget to visit any of our stores from 5/27 until 6/2 and receive $10 off when you spend $100 or more \xe2\x80\x94 simply scan your myLidl app or enter your phone number at checkout. :mobile_phone_with_arrow::shopping_cart: #rethinkgrocery""",5780,22.566,388,16,,,
CAqaawZnu9-,lidlus,2020-05-26 19:24:25.000000,no,False,b'rethinkgrocery',b'',"b'This week, we\xe2\x80\x99ll be opening our :hundred_points: store and we want to celebrate this milestone with those that have supported us along the way \xe2\x80\x93 our customers! :party_popper: For all myLidl members, enjoy a coupon for $10 off your $100 purchase from 5/27 until 6/2 when scanning your app or providing your phone number at checkout. :mobile_phone_with_arrow: #rethinkgrocery'",0,0,457,39,,,
CAp8KfKn1fc,lidlus,2020-05-26 15:00:03.000000,no,False,b'',b'',b'Dreamy dessert alert! Have you tried Gelatelli yet? Our new line of delicious frozen summer sweets is just what you need to cool down during the hottest of days.:soft_ice_cream::face_savoring_food: Get the scoop and visit our website to learn more!',0,0,201,4,,,
CAnXXp4n-U8,lidlus,2020-05-25 15:00:03.000000,no,False,b'',b'',b'To each and every hero who put our country first: thank you.',0,0,290,5,,,
CAiG6UWnm8_,lidlus,2020-05-23 14:00:02.000000,no,False,b'rethinkgrocery',b'',"b'Strawberry season is upon us and with it brings bright jewels of juicy goodness. :strawberry: Enjoy the unofficial start of summer with a bowl of fresh strawberries, now only $1.49! :face_savoring_food: Please check the myLidl app or log in to your account online for local store stock levels. #rethinkgrocery'",0,0,226,3,,,
CAdTEQRnHf-,lidlus,2020-05-21 17:10:03.000000,no,False,b'rethinkgrocery',b'',b'Welcome the unofficial start of summer by making your holiday weekend at home the tastiest one ever! :hamburger: Check out our summer recipes for mouthwatering ideas the whole family will enjoy. :smiling_face_with_heart-eyes: Please check the myLidl app for stock levels at your local store. #rethinkgrocery',0,0,127,1,,,
CAVnjhwD2DG,lidlus,2020-05-18 18:08:54.000000,yes,False,b'wereinthistogether',b'feedingamerica',"b'Now more than ever, our communities are relying on food banks for support, which is why we\xe2\x80\x99ve chosen to expand our partnership with @FeedingAmerica and implement a food drive in all our stores this month.\n\nDuring your next trip to Lidl, help make a difference by purchasing Feeding America\xe2\x80\x99s most-needed items by following the signage for these items around our stores. Then, drop off your donations into the collection box near the exit of your store. We appreciate anything you\xe2\x80\x99re able to purchase and donate during your visit. #WereInThisTogether'",5282,85.78,217,5,,,
CAOSfRjDm3K,lidlus,2020-05-15 21:16:24.000000,no,False,"b'stonefruitseason,rethinkgrocery'",b'',"b'Have you heard!? It\xe2\x80\x99s #StoneFruitSeason! And the cherry on top? This Saturday and Sunday only, our sweet cherries are on sale for just $3.49 per pound! Slice \xe2\x80\x98em in oatmeal, add into smoothies or eat \xe2\x80\x98em by the handful! :cherries: #rethinkgrocery'",0,0,279,11,,,
CAK-i3Egpid,lidlus,2020-05-14 14:24:24.000000,no,False,b'rethinkgrocery',b'',"b'Spring is in full swing and with it brings a multitude of weather conditions. Sunny, stormy, chilly and everything in between\xe2\x80\x94 what\xe2\x80\x99s a gardener to do? :sun_selector: With our easily assembled four-tier greenhouse, withered plants will be a thing of the past! :seedling: Grow veggies, flowers and herbs with ease inside its sturdy metal construction, complete with a roll-up zippered door. :woman_farmer::man_farmer: Get it now for just $19.99\xe2\x80\x94 while supplies last!\n\nPlease check the myLidl app or log in to your account online for local store stock levels. #rethinkgrocery'",0,0,182,16,,,
CAJDI9kHpwm,lidlus,2020-05-13 20:26:16.000000,yes,False,"b'lidlsafeshopping,lidlsafeshopping'",b'',"b""We\xe2\x80\x99d love to see how you\xe2\x80\x99re social distancing and rocking your masks at our stores!\xc2\xa0:grinning_face_with_big_eyes:\xc2\xa0We'll be picking one winner of a $100 Lidl gift card each week for our #LidlSafeShopping sweepstakes until 6/16. To enter, post a selfie in your protective gear at Lidl or with our new social distancing signage we've installed in the line area outside of our stores.\xc2\xa0:selfie:\xc2\xa0Use the hashtag #LidlSafeShopping, tag us and make your IG page public so we can see your entry!\n\nCheck out the link in our bio for further details on the rules, terms and conditions.""",3467,32.833,189,10,,,
CAItjiLHAcK,lidlus,2020-05-13 17:17:28.000000,no,False,b'rethinkgrocery',b'',"b'There are treats, and then there are T R E A T S. See if you can taste the difference with Gelatelli, our new line of frozen summer sweets. :ice_cream: Cool, creamy and oh-so dreamy, these delectable delights were made for lazy days in the shade. :soft_ice_cream: Featuring a variety of flavors from glorious caramel swirls to crispy, chocolatey coatings, these luscious desserts start at just $1.99! :drooling_face: Find your favorite flavor and pick up a pack (or two\xe2\x80\xa6 or three) \xe2\x80\x94 in stores now!\n\nPlease check the myLidl app or log in to your account online for local store stock levels. #rethinkgrocery'",0,0,177,6,,,
B_5s9TGjBF5,lidlus,2020-05-07 21:23:38.000000,no,False,b'rethinkgrocery',b'',"b'Mom. Mum. Madre. Mutter. Whatever you call the mother figure in your life, show her how much she means to you by gifting her these captivating Mother\xe2\x80\x99s Day flowers starting at $2.99. :bouquet: With our 7-Day Vase Life Guarantee, she\xe2\x80\x99ll be able to enjoy her stunning bouquet for days on end. Even if you can\xe2\x80\x99t spend time with her this Sunday, we know she\xe2\x80\x99ll appreciate finding these beautiful blooms on her doorstep (with you lovingly waving from afar). :revolving_hearts:\n\nPlease check the myLidl app for local store stock levels. #rethinkgrocery'",0,0,170,2,,,
B_3WKjOjaBh,lidlus,2020-05-06 23:26:18.000000,yes,False,b'rethinkgrocery',b'',"b'This hair and beard trimmer has everything you need to give yourself a haircut at home. :man_getting_haircut_selector: Barber skills not included. :winking_face: Available in stores now for $14.99, while supplies last. #rethinkgrocery'",2592,29.141,88,6,,,
B_26WjNDOLw,lidlus,2020-05-06 19:22:57.000000,no,False,"b'breakfast,mothersday,rethinkgrocery'",b'',"b""This Sunday, mom deserves the royal treatment\xe2\x80\x94 no sleeping in! Create a homecooked meal fit for a queen :princess: by beginning her day with a luxurious #breakfast in bed. Whether she craves savory :cooking: or has a sweet side :pancakes:, our supremely special Mother's Day offerings will make mom (or, \xe2\x80\x9cher royal highness\xe2\x80\x9d as she may like to be called) the happiest person in the land. :smiling_face_with_3_hearts:\n\nPlease check the myLidl app for local store stock levels and review our website for more #MothersDay ideas. #rethinkgrocery""",0,0,178,0,,,
B_nAUGNjvWL,lidlus,2020-04-30 15:07:12.000000,no,False,b'rethinkgrocery',b'',"b""We've got all the ingredients you need to bring a Cinco de Mayo fiesta to your own cocina! :taco::woman_dancing: With great deals on your celebratory must-haves like our grass-fed Angus ground beef on sale for $2.99, fresh pico de gallo for $2.49 and Mother's Farms tortilla chips at $2.99 per bag, you'll be able to get all you need and more for under $20. All items are available in stores now, while supplies last. Please check the myLidl app for local store stock levels. #rethinkgrocery""",0,0,189,3,,,
B_YT5T6Dz3N,lidlus,2020-04-24 22:10:12.000000,yes,False,b'rethinkgrocery',b'',"b'This weekend, enjoy the best seat in or outside of your house with our portable inflatable air lounger! From 4/25 - 4/26 these loungers are available in a variety of colors and are $9.99, while supplies last. #rethinkgrocery'",3041,30.033,124,4,,,
B_XpglZDwVK,lidlus,2020-04-24 15:59:19.000000,no,False,b'wereinthistogether',b'',"b""In addition to our current protective measures and home delivery options, we're also making safe shopping accessible for those at higher risk for illness. We've implemented special shopping hours for customers over the age of 65, and those that are immunocompromised. The special shopping hours are from 7 - 8 a.m. each Tuesday and Thursday at all Lidl stores. Check out the link in our bio to learn more on all the actions we're taking during this public health emergency. #WereInThisTogether""",0,0,241,11,,,
B_XiWSJDwtu,lidlus,2020-04-24 14:57:09.000000,yes,False,b'rethinkgrocery',b'',"b""Weed 'em and reap! :seedling::shamrock_selector: Get weed whacking with this corded electric grass trimmer/lawn edger. It's available in stores now for $29.99, while supplies last. Please check the myLidl app for stock levels at your local store. #rethinkgrocery""",2120,24.553,67,4,,,
B_V7KWxDkVJ,lidlus,2020-04-23 23:55:05.000000,no,False,b'',b'shipt',"b'Our home delivery partner, @shipt, is recruiting more shoppers nationwide! Shipt Shoppers deliver fresh groceries, household essentials and more from Lidl and other local stores. :shopping_bags_selector: Get paid weekly and set your own schedule, with no-contact delivery available. Apply today at shipt.com/opportunities.'",0,0,111,11,,,
B_VxNVYDqHe,lidlus,2020-04-23 22:28:07.000000,no,False,"b'lidlsafeshopping,lidlsafeshopping'",b'',"b""We\xe2\x80\x99d love to see how you\xe2\x80\x99re social distancing and rocking your masks at our stores! :grinning_face_with_big_eyes: We'll be picking one winner of a $100 Lidl gift card each week for our #LidlSafeShopping sweepstakes. To enter, post a selfie in your protective gear at Lidl or with our new social distancing signage we've installed in the line area outside of participating stores. :selfie: Use the hashtag #LidlSafeShopping, tag us and make your IG page public so we can see your entry! Check out the link in our bio for further details on the rules, terms and conditions.""",0,0,244,8,,,
B_VbDe9jQzC,lidlus,2020-04-23 19:14:32.000000,no,False,b'rethinkgrocery',b'',"b'Show off your chops! Pan-seared, saut\xc3\xa9ed or prepared on the grill, our grass fed lamb loin chops are a wonderful menu choice. Available now for just $8.49, while supplies last. Please check the myLidl app for stock levels at your local store. #rethinkgrocery'",0,0,139,2,,,
B_Scjksj6VG,lidlus,2020-04-22 15:30:06.000000,yes,False,b'',b'',"b""We've analyzed recent customer shopping behaviors so you can determine the best time of day to shop. :shopping_cart: Our stores are busiest between noon and 3:00 p.m. The quietest times are from 8:00 to 10:00 a.m. and 6:00 p.m. until closing. :vertical_traffic_light: Check out the link in our bio to find more helpful information on what to expect on your next shopping trip during this public health emergency.""",4230,7.7,283,16,,,
B_QHS1AD95Z,lidlus,2020-04-21 17:46:09.000000,yes,False,b'rethinkgrocery',b'',"b""The presentation has changed. The flavors have not. Our mouthwatering croissants are baked throughout the day, packed fresh and starting 4/22 all bakery items are 20% off for myLidl members!\xc2\xa0:croissant::baguette_bread:\xc2\xa0Download the myLidl app, enter your phone number or scan your app's QR code at checkout to receive one 20% off bakery coupon. #rethinkgrocery""",6497,10.096,524,34,,,
B_FlI05jd3h,lidlus,2020-04-17 15:35:06.000000,yes,False,b'rethinkgrocery',b'',"b'Warmer weather means more pesky bugs. :mosquito: No need to worry, now you can enjoy your outdoor seating area bug-free with our citronella scented candles. These candles come in a variety of colors and are available now for $3.99, while supplies last. #rethinkgrocery'",2326,20.606,104,2,,,
B_FZcXtjHdT,lidlus,2020-04-17 13:52:51.000000,yes,False,b'rethinkgrocery',b'',"b'Brighten up your yard with eye-catching garden and patio d\xc3\xa9cor. Our vibrant wind catchers are available in stores now for $4.99, while supplies last. :flamingo::blossom: #rethinkgrocery'",1485,21.873,86,3,,,
B_DhGFrDnEE,lidlus,2020-04-16 20:20:59.000000,no,False,b'rethinkgrocery',b'',"b'This week, enjoy high-quality entr\xc3\xa9es, sides and desserts served throughout Italy! :Italy: Our Italiamo frozen fried calamari & shrimp is an easy-to-prepare appetizer filled with wild-caught seafood finger foods. :fried_shrimp::squid: Available now for $3.49, while supplies last. #rethinkgrocery'",0,0,218,4,,,
