shortcode,username,date_utc,is_video,is_sponsored,hashtags,mentions,caption,video_view_count,video_length,likes,comments,likes+comments,location_name,location_latlongCFfQP6knRCP,lidlus,2020-09-23 18:00:53.000000,no,False,b'',b'',"b'Getting rained on can be ruff. :dog_face::cloud_with_rain_selector: Whether you have a big hound or a little lap dog, keep your pooch comfortable and dry during rainy day walks with our dog raincoat \xe2\x80\x94 follow the link in our bio to learn more! :paw_prints: How do you get your pet rain-ready? :umbrella_with_rain_drops:'",0,0,160,12,,,
CFaBX8NjS98,lidlus,2020-09-21 17:28:56.000000,yes,False,b'',b'',b'A dessert ready in 20 minutes? Challenge accepted! Indulge in the iconic flavors of fall with our divinely delicious pecan oatmeal chip cookies. What\xe2\x80\x99s our secret to making these scrumptiously speedy treats? Follow the link in our bio for the recipe and find out! Pick up our fall magazine (in stores now) for more seasonal recipes.',2313,130.702,87,6,,,
CFSN5adnCNj,lidlus,2020-09-18 16:30:12.000000,no,False,b'',b'',"b'Home delivery is easy as 1, 2, 3 when you visit shopLidl.com: \n:keycap_1: Place your Lidl order online \n:keycap_2: Your personal shopper will shop for you \n:keycap_3: Get groceries delivered in as soon as one hour! \n\n:mobile_phone_with_arrow: Scroll through the aisles and place your order today! Follow the link in our bio for more! For participating stores only.'",0,0,138,10,,,
CFP21aZnsFU,lidlus,2020-09-17 18:30:12.000000,no,False,b'',b'',"b'Dreaming of flavors from across the pond? :thinking_face: Whether you fancy a comforting cuppa tea, crispy fish and chips or a hearty stout, our delightful selection of classic fare from Ireland and the British Isles is sure to satisfy your cravings. :fish::french_fries::beer_mug: Follow the link in our bio to learn more!'",0,0,264,11,,,
CFNcZMwH5Xq,lidlus,2020-09-16 20:00:41.000000,no,False,b'',b'',"b'What\xe2\x80\x99s scarier than ghosts, ghouls and goblins? :ghost::bat: The terrifying task of planning Halloween! But fear not\xe2\x80\x94 our collection of Halloween costumes and d\xc3\xa9cor is here to make your options (and budget) more fun and affordable than frightful. :jack-o-lantern:\n\nFollow the link in our bio (if you dare!). What are you planning to dress up as for the holiday?'",0,0,204,8,,,
CFNIcrVH2T6,lidlus,2020-09-16 17:06:23.000000,no,False,"b'internationalcoffeeday,justonecup'",b'fairtradecertified',"b'From now until #InternationalCoffeeDay on 9/29, please join us, @fairtradecertified and coffee producers around the globe in raising your mug to help build awareness. :hot_beverage: #JustOneCup is all it takes to make a real contribution. :brown_heart: Cheers!'",0,0,125,2,,,
CFIBOTujxFe,lidlus,2020-09-14 17:56:06.000000,yes,False,b'',b'',"b'When you\xe2\x80\x99d rather hit the snooze button than make breakfast, overnight oats will save the day. :bowl_with_spoon: This simple recipe is made the night before so all you have to do is grab from the fridge and enjoy. :face_savoring_food: Follow the link in our bio for more time-saving recipes! What are your go-to morning meals?'",2689,111.133,108,5,,,
CFATRvCHceJ,lidlus,2020-09-11 17:30:53.000000,no,False,b'',b'',"b'It\xe2\x80\x99s he-ere! Our Fall Magazine is now in stores! :maple_leaf: Inside you\xe2\x80\x99ll find tasty recipes, fun DIYs, frightfully delicious Halloween candy and more. :pie::jack-o-lantern::cat:\xe2\x80\x8d:black_large_square: Celebrate the start of a new season by picking up a copy today! Follow the link in our bio for more. What part of fall are you looking forward to the most?'",0,0,109,16,,,
CE93CYVHT-x,lidlus,2020-09-10 18:45:38.000000,no,False,b'',b'',"b'Cinnamon apple, pumpkin spice and sweet maple syrup \xe2\x80\x94 autumn\xe2\x80\x99s greatest hits are now in stores! :pie: Stock up on your favorites with our limited-time selection of delicious fall flavors and invite the season\xe2\x80\x99s wonderful aromas to waft through your home. :maple_leaf: What\xe2\x80\x99s your favorite fall flavor?'",0,0,160,16,,,
CE7cRx9H58I,lidlus,2020-09-09 20:13:20.000000,no,False,b'',b'',"b'Do you feel the season starting to change? :fallen_leaf: From snuggly blankets to lively lanterns, invite the warm aesthetic of autumn into your home by creating a cozy ambiance with our collection of fall de\xcc\x81cor!'",0,0,225,11,,,
CE60KwXDi1f,lidlus,2020-09-09 14:22:51.000000,no,False,b'lidlfreshlunchbox',b'',b'Congratulations :partying_face: to the wonderful winners of our #lidlfreshlunchbox Coloring Sweepstakes :artist_palette: and thank you to everyone who participated! :raising_hands: We were blown away by every creative and colorful entry! :star-struck:',0,0,415,12,,,
CE1n_denXzi,lidlus,2020-09-07 14:00:15.000000,no,False,b'',b'',b'Wishing you a safe and enjoyable Labor Day! :United_States:',0,0,218,5,,,
CEub8KOn5MG,lidlus,2020-09-04 19:00:15.000000,no,False,b'',b'',b'Convenience is a click away \xe2\x80\x94 order groceries from shopLidl.com today! :mobile_phone_with_arrow: Get groceries delivered in as soon as :keycap_1: hour (contactless delivery available). For participating stores only.',0,0,250,28,,,
CEuVFaMHJNJ,lidlus,2020-09-04 18:00:21.000000,no,False,b'',b'',b'Plant-based protein has never been tastier! :seedling::flexed_biceps: Our organic and vegetarian options provides the texture you want\xe2\x80\xa6 with flavors you won\xe2\x80\x99t believe. :star-struck: These delicious choices are great for vegetarians and meat lovers alike. :hamburger::hot_dog: Don\xe2\x80\x99t believe us? Follow the link in our bio and try our selection for yourself.',0,0,119,7,,,
CEuOPE9nY2M,lidlus,2020-09-04 17:00:53.000000,yes,False,b'',b'',"b'The best way to end the season? Serving the best summer flavors, of course! :sun_selector: Buffalo and seafood come together as a family favorite dish \xe2\x80\x94 quesadillas! Serve for lunch, dinner or snack time, these tasty bites are exactly what you waited all summer for. :drooling_face: Follow the link in our bio for more! What will you dip your \xe2\x80\x98dillas in?'",3112,59.933,79,4,,,
CEpQG3qnPyu,lidlus,2020-09-02 18:40:39.000000,no,False,b'',b'',"b'Your long-weekend gear is here! :star-struck: From hitting the trails to making s\xe2\x80\x99mores, get the family together for an outdoor camping trip. :camping_selector::woman_mountain_biking_selector: Follow the link in our bio for more! What\xe2\x80\x99s your favorite camping memory?'",0,0,101,5,,,
CEj-d07ADlc,lidlus,2020-08-31 17:30:36.000000,yes,False,b'backtoschool',b'',b'Give your kids a yummy boost of energy! :collision: These crispy everything chickpeas are packed with wholesome ingredients and great for making ahead of time so your little students have a quick pick-me-up ready once their school day ends. :books::school: Follow the link in our bio for the recipe! #backtoschool',3413,60.1,134,5,,,
CEcYoiiHgjF,lidlus,2020-08-28 18:45:02.000000,no,False,b'',b'',"b'Whether you\xe2\x80\x99re craving a Californian cabernet or an old world import, our delicious (and low-priced) wine selection knows no bounds. :wine_glass: Enjoy National Red Wine Day by savoring a glass of one of your favorites \xe2\x80\x94 no matter your taste or budget! :smiling_face_with_3_hearts:\n\nFollow the link in our bio and discover your next go-to. Offers valid in VA, NC, SC and GA. 21+. Please drink responsibly.'",0,0,173,18,,,
CEZyHsune-O,lidlus,2020-08-27 18:30:01.000000,no,False,b'',b'',"b'It\xe2\x80\x99s nearing the end of summer\xe2\x80\x94 make it count! :sun_selector: Before you light those coals for your cookout, stop in and stock up on your Labor Day grilling needs like tender baby back ribs and grass fed ribeye steak. :cut_of_meat::hot_dog::hamburger: Follow the link in our bio for more. How do you plan to spend your holiday weekend?'",0,0,133,12,,,
CEXQwnnnxJI,lidlus,2020-08-26 19:00:02.000000,no,False,b'',b'',"b'Nothing beats a stand mixer or immersion blender if you love cooking! :woman_cook: No matter if you want to pure\xcc\x81e soups or mix cake batter, these high-quality, low-priced kitchen appliances are must-haves for any home cook. :shallow_pan_of_food::birthday_cake: Follow the link in our bio to learn more! What delicious dish do you plan on creating? :fork_and_knife_with_plate_selector:'",0,0,229,17,,,
CEXH-_DnNVy,lidlus,2020-08-26 17:43:21.000000,no,False,b'nationaldogday',b'',b'Let\xe2\x80\x99s raise the \xe2\x80\x98ruff\xe2\x80\x99\xe2\x80\x94 it\xe2\x80\x99s National Dog Day! :dog_face: Give your BFF (best furry friend) some love by treating them to something special in our pet shop collection. :bone: Follow the link in our bio for more! :paw_prints: What\xe2\x80\x99s the funniest thing your dog does? #nationaldogday',0,0,334,6,,,
CESEmthntXL,lidlus,2020-08-24 18:37:42.000000,yes,False,b'',b'',"b'Give turkey rollups a try the next time you\xe2\x80\x99re making lunch for your little one. :burrito: These classic wraps are easy to make and feature high-quality turkey slices, creamy cheese and yummy condiments. :face_savoring_food: Follow the link in our bio for the recipe! What are your school lunch go-tos?'",2537,13.0,89,6,,,
CEPYJ8SHCRR,lidlus,2020-08-23 17:30:44.000000,no,False,b'',b'',"b'From shopping to schlepping, Lidl has high-quality groceries at discount prices! :white_heavy_check_mark: Visit shopLidl.com, scroll through the aisles and order today! :woman_technologist: For participating stores only. Click the link in our bio for more information.'",0,0,168,1,,,
CEKVdnBn_Po,lidlus,2020-08-21 18:31:00.000000,no,False,b'lidlfreshlunchbox',b'',"b'It\xe2\x80\x99s your last chance to enter our Fresh Lunch Box Coloring Sweepstakes for a chance to win a $500 Lidl gift card! :money-mouth_face: Enter by August 26 so you can fill your little one\xe2\x80\x99s lunch box with fresh fruits and veggies \xe2\x80\x94 just color, like, and post! :artist_palette::thumbs_up::mobile_phone_with_arrow: \n\nDon\xe2\x80\x99t forget to tag us and use the hashtag #LidlFreshLunchBox, and make your IG page public so we can see your entry. Follow the link in our bio for rules, terms and conditions.'",0,0,139,7,,,
CEHwoMcH8wa,lidlus,2020-08-20 18:30:39.000000,no,False,b'',b'',"b'Get ready to wok and roll because we have a feeling you\xe2\x80\x99re gonna love this SOY much. :dumpling::moon_cake::oden: We\xe2\x80\x99re featuring a selection of Asian-inspired fare this week\xe2\x80\x94 bring the family together for a taste of India, China, Japan and Thailand! :bento_box::steaming_bowl: Follow the link in our bio to learn more. What\xe2\x80\x99s your fave Asian-inspired dish?'",0,0,293,20,,,
CEFFeuAHR0e,lidlus,2020-08-19 17:35:08.000000,no,False,b'nationalpotatoday',b'',"b'Today we salute the splendid spud, the terrific tuber\xe2\x80\xa6the unparalleled potato! :potato::roasted_sweet_potato: It\xe2\x80\x99s #nationalpotatoday, and if you\xe2\x80\x99re anything like us, you\xe2\x80\x99ll want to whip up this versatile veggie in a delicious dish. :face_savoring_food: Try making a tasty potato salad with a light, herb-infused vinaigrette! Follow the link in our bio for the recipe.'",0,0,122,1,,,
CECI28nj-J2,lidlus,2020-08-18 14:08:30.000000,yes,False,b'',b'',"b'When you\xe2\x80\x99d rather put your feet up after a long day than cook for hours on end, try our honey buffalo wings recipe! :honey_pot::poultry_leg: With only 20 minutes of prep time, you can bake in the oven until it\xe2\x80\x99s hot, crispy and ready to serve. :fire: Guaranteed to satisfy your family (and your schedule) during hectic weeknights, it\xe2\x80\x99s great for meal prep, too! :thumbs_up:\n\nFollow the link in our bio to learn the recipe! What are your go-to weeknight dinners?'",2232,87.246,116,3,,,
CD4QeIlHdMK,lidlus,2020-08-14 18:01:03.000000,no,False,b'',b'',"b'Why wait in line when you can order groceries online? :laptop_computer: Through 8/23, get $50 off annual membership with shopLidl home delivery and enjoy $20 off your second order (if you\xe2\x80\x99re a new member). :money_bag: Plus, myLidl members save even more! For participating stores only.'",0,0,209,4,,,
CD1vGrzHR25,lidlus,2020-08-13 18:31:00.000000,no,False,b'',b'',"b'Before you do back-to-school shopping, consider adding more seafood to your grocery list. :fish: Captain Omega:trade_mark: is the fin-tastic hero of the seas who offers healthy, affordable nourishment to kids. :white_heavy_check_mark: Packed with protein and delicious flavor, these MSC Certified fish bites are sure to bring OMEGA fun to your little one\xe2\x80\x99s plate! :fork_and_knife_with_plate_selector: How do you get your kids to eat more seafood?'",0,0,111,6,,,
CDzG4Jvn43_,lidlus,2020-08-12 18:01:01.000000,no,False,b'',b'',"b'Stressed at the thought of planning lunches or weeknight dinners in advance? :confounded_face: Don\xe2\x80\x99t be! Meal prepping is meant to make your life easier, not harder. Just use our :keycap_3:-in-:keycap_1: indoor grill for delicious, quick-cooked meals in no time. :alarm_clock: Share your meal prep tips below! Follow the link in our bio to learn more.'",0,0,205,8,,,
CDuC2F3j_CP,lidlus,2020-08-10 18:50:51.000000,yes,False,b'',b'',"b'These delectable crispy rice squares are a sweet salute to the classic after-school snack\xe2\x80\xa6 with a special spin: creamy cookie butter! :face_savoring_food: Ready in just 30 minutes, these no-bake treats are a yummy surprise sure to satisfy any kid after a long day of learning. :books: Follow the link in our bio for the recipe!'",4645,66.0,157,4,,,
CDox8RlHUaS,lidlus,2020-08-08 17:45:40.000000,no,False,b'internationalcatday',b'',b'It\xe2\x80\x99s #InternationalCatDay :smiling_cat_face_with_heart-eyes: right meow \xe2\x80\x94 show your precious feline some love by treating them to something special in our pet shop collection! :cat: Follow the link in our bio \xe2\x80\x98fur\xe2\x80\x99 more! :paw_prints:',0,0,167,1,,,
CDmUA5Ontdf,lidlus,2020-08-07 18:45:41.000000,no,False,b'internationalbeerday',b'',"b'\xc2\xa1Salud! Salute! Sl\xc3\xa1inte! :clinking_beer_mugs: Let\xe2\x80\x99s cheers to #InternationalBeerDay! :party_popper: From West Coast IPAs to traditional German pilsners, our unbeatable selection of high-quality brews suit the taste and budget of beer lovers the world over. :smiling_face_with_3_hearts:\n\nFollow the link in our bio to discover your new favorite! Offers valid in VA, NC, NY, SC and GA. 21+. Please drink responsibly.'",0,0,183,10,,,
CDjtgJzHWT5,lidlus,2020-08-06 18:30:53.000000,yes,False,b'',b'',"b'If you\xe2\x80\x99re lookin\xe2\x80\x99 to get cookin\xe2\x80\x99 tonight, take home some of our organic grass fed ground beef and create a burger so juicy and delicious, it may just become your new go-to meal. :eyes::hamburger::cheese_wedge: Follow the link in our bio for the recipe!'",2867,23.3,138,3,,,
CDhJXOzHyt1,lidlus,2020-08-05 18:36:24.000000,no,False,"b'backtoschool,evenathome'",b'',"b'From gel pens to notebooks, our back-to-school essentials score top marks for savings. :books: Give your kids a smart start to their semester with nifty supplies at thrifty prices! :pencil_selector::crayon_selector::paintbrush_selector: \n\nWhat\xe2\x80\x99s on your school shopping list this year? #backtoschool #evenathome'",0,0,114,7,,,
CDb_ISCHEfc,lidlus,2020-08-03 18:31:04.000000,yes,False,b'meatlessmondays',b'',"b'What\xe2\x80\x99s better than ordering delivery from your favorite fast-casual restaurant? Creating a versatile vegan dish at home in half the time! :alarm_clock: These 23-minute meatless burrito bowls are powered by :seedling: plant protein, good grains, veggies and super filling legumes\xe2\x80\x94 great for busy school nights! :books: Follow the link in our bio to learn the recipe! #MeatlessMondays'",2475,60.066,131,8,,,
CDRr3V6n8NM,lidlus,2020-07-30 18:30:02.000000,no,False,b'',b'',b'More cluck for your buck? :chicken: Yup! Make a meal fit to feed the whole fam with our boneless chicken tenderloins and share what delicious dishes you come up with! :face_savoring_food:',0,0,163,6,,,
CDPDoyUnwjc,lidlus,2020-07-29 18:00:03.000000,no,False,b'',b'',b'No one likes a messy room or workspace! :woman_gesturing_NO_selector: Keep clutter in-check before your college semester starts with our must-have selection of organization essentials. :books: Let us know if you have any great organizing hacks!',0,0,154,2,,,
CDJ9fwYn8eY,lidlus,2020-07-27 18:30:23.000000,yes,False,b'',b'',b'This recipe is bananas \xe2\x80\x94 B-A-N-A-N-A-S! :peanuts::banana: Make a delicious school lunch your little ones will love with a kid-friendly sandwich full of nutrients and natural sweetness. :smiling_face_with_heart-eyes: Let us know what\xe2\x80\x99s your fave school lunch and follow the link in our bio to learn the recipe!',2527,29.066,84,17,,,
CDHHiEhHogk,lidlus,2020-07-26 16:00:21.000000,yes,False,"b'feelgoodseafood,littlebluelabel,bigbluefuture'",b'',"b'Oh say, can you SEA? :water_wave: We\xe2\x80\x99re proud to offer great-tasting and responsibly sourced seafood from the Marine Stewardship Council! :fish: When you choose sustainable seafood with a blue MSC fish label, you\xe2\x80\x99re helping safeguard ocean species, and protect their ecosystems. :blue_heart:\n\nClick the link in our bio to learn more! #FeelGoodSeafood #LittleBlueLabel #BigBlueFuture'",2430,30.033,130,2,,b'MSC - Marine Stewardship Council',51.51688 -0.10271
CDCIPgAnzb1,lidlus,2020-07-24 17:30:09.000000,no,False,b'',b'',"b'Ripe, fresh cherries muddled amidst decadent dark chocolate and layers of rich chocolate ice cream? :cherries::chocolate_bar::soft_ice_cream: Yes, please! \n\nDiscover our all-too tempting frozen desserts featuring a selection made with UTZ certified cocoa and without any artificial flavors. :man_gesturing_NO_selector: Follow the link in our bio for this delicious summer recipe!'",0,0,203,2,,,
CC_qUL-H3q1,lidlus,2020-07-23 18:30:10.000000,no,False,b'',b'',"b'Forget jarred salsa! :avocado::mango: Sweet and salty with a hint of lime, this colorful recipe is a simple mixture of fresh mangos, veggies and spices. :drooling_face: Serve alongside grilled seafood, tacos or tortilla chips! :taco::fried_shrimp: Follow the link in our bio for the recipe!'",0,0,163,0,,,
CC9JTNEHADR,lidlus,2020-07-22 19:03:12.000000,no,False,b'',b'',b'Hot and bothered by sweltering summer temps? :sun_selector: Don\xe2\x80\x99t sweat it! Cool your room with our portable evaporative air cooler! :dashing_away: This cost-effective alternative to central A/C lowers indoor temperatures without increasing your energy usage (or utility bills). :money_bag:',0,0,236,28,,,
CC375-hDBk5,lidlus,2020-07-20 18:32:03.000000,yes,False,b'',b'',"b'Get the kiddos excited for back-to-school season with a delicious breakfast recipe. :face_savoring_food: Our vanilla blueberry French toast bake is great for meal prepping the day before so all you have to do is heat, serve and enjoy! :bread:\n\nFollow the Back To School link in our bio for the recipe! :open_book:'",5254,119.471,274,16,,,
CC0_KZNnk1N,lidlus,2020-07-19 15:00:41.000000,no,False,b'nationalicecreamday',b'',b'Mood: hungry. :confounded_face: The cure? Celebrating #nationalicecreamday with our selection of summer sweets! :peach::soft_ice_cream::honey_pot: \n\nDiscover an assortment of frozen desserts featuring a selection made with UTZ certified cocoa and without any artificial flavors. Follow the link in our bio and get inspired with a delicious summer recipe!',0,0,267,14,,,
CCwNm1uHuzN,lidlus,2020-07-17 18:30:42.000000,no,False,"b'feelgoodseafood,bigbluefuture'",b'',"b'One fish, two fish\xe2\x80\xa6 blue fish! :fish: Our wild caught ahi tuna steaks are certified sustainable by the Marine Stewardship Council \xe2\x80\x94 making it a smart choice for your summer grilling. :light_bulb:\n\nWhen you choose sustainable seafood with a blue MSC fish label, you\xe2\x80\x99re helping safeguard marine species and protect their ecosystems. :water_wave:\n\n#FeelGoodSeafood #bigbluefuture'",0,0,138,9,,,
CCtkANTnVCP,lidlus,2020-07-16 17:48:41.000000,no,False,b'tasteofmexico',b'',"b'Savory, tangy or spicy\xe2\x80\x94 create your favorite Mexican-inspired meal at home with our high-quality entr\xc3\xa9es, appetizers and ingredients! :taco::burrito:\xf0\x9f\xab\x94 Let us know what delicious dish you\xe2\x80\x99ve made! :face_savoring_food:\n\n#TasteofMexico'",0,0,218,5,,,
CCqr9j1FV7m,lidlus,2020-07-15 15:00:30.000000,no,False,b'',b'',"b'Be swept off your feet with the first Lidl athletic shoes :running_shoe: to be partly made with recycled :recycling_symbol_selector: ocean-bound plastic collected from beaches and coastal regions, :water_wave:which helps protect ecosystems and reduces plastic waste.\n\nYou can help make a difference for a better tomorrow\xe2\x80\x94 tread happier :smiling_face_with_smiling_eyes: in our new sustainable shoes while making a positive environmental impact!'",0,0,162,24,,,
CCl6aA-HxMa,lidlus,2020-07-13 18:30:31.000000,no,False,b'',b'',"b'Ciao, bella! :smiling_face_with_heart-eyes: Make an Italian-inspired meal with our Italiamo collection \xe2\x80\x94 featuring delicious dishes from pizza and pasta to seafood and sweets. :spaghetti: Now THAT\xe2\x80\x99S amore! Comment below and let us know what\xe2\x80\x99s your favorite Italiamo find! :Italy:'",0,0,164,5,,,
CCeMBQ4HwN7,lidlus,2020-07-10 18:30:30.000000,no,False,"b'summericecream,frozenlemonblueberryterrine'",b'',b'It\xe2\x80\x99s getting hot out there \xe2\x80\x94 cool off with some of our frozen desserts featuring a selection made with UTZ certified cocoa and without any artificial flavors. :lemon:Follow the link in our bio and get inspired with a sweet summer recipe! :sun_selector:\n\n#SummerIceCream #frozenlemonblueberryterrine',0,0,188,6,,,
CCbuF8OjxCU,lidlus,2020-07-09 19:30:44.000000,yes,False,b'',b'',b'It\xe2\x80\x99s almost that time again\xe2\x80\xa6 back-to-school season! :red_apple:Stock up on the supplies every student needs to succeed from :pencil_selector: to :notebook:. We\xe2\x80\x99re here for you and your family every step of the way. Check out our back-to-school guide in our bio and discover how to prepare for the year ahead. :check_mark:',2309,33.2,60,6,,,
CCbc7O8g7XJ,lidlus,2020-07-09 17:00:30.000000,no,False,"b'feelgoodseafood,bigbluefuture,scallops,summergrilling'",b'',"b'Feel good about the food you bring home! :smiling_face_with_smiling_eyes: Our jumbo sea scallops are sustainably sourced and certified by the Marine Stewardship Council. :oyster: When you choose sustainable seafood with a blue MSC fish label, you\xe2\x80\x99re helping safeguard marine species and protect their ecosystems. :water_wave:\n\n#FeelGoodSeafood #BigBlueFuture #Scallops #summergrilling'",0,0,166,15,,,
CCZNlEhnAlD,lidlus,2020-07-08 20:08:08.000000,yes,False,b'',b'',"b'The ribbon has been cut and low prices on groceries are now available in Brookhaven, GA! :party_popper: Come see what the hype is about at our new store on 2480 Briarcliff Road NE and say hi to our Store Manager, Khaison. :waving_hand:\n\nClick the link in our bio to view a list of the protective measures implemented in our stores!'",4164,29.8,192,6,,,
CCWhHVaHaFJ,lidlus,2020-07-07 19:00:55.000000,no,False,b'worldchocolateday',b'',"b'Enjoying a Lidl chocolate bar just hits different today. :chocolate_bar: From caramel & sea salt to candied orange peel, celebrate #WorldChocolateDay with our selection of 75+ chocolate items \xe2\x80\x94 follow the link in our bio to discover our delicious offerings! :star-struck: Comment below and tell us which one is your fave!'",0,0,196,14,,,
CCWXtH5nR8x,lidlus,2020-07-07 17:38:41.000000,no,False,b'bigbluefuture',b'',"b'For the well-being of our oceans and the seafood we love, look for the blue MSC label. :blue_heart: By choosing sustainable seafood, you\xe2\x80\x99re helping protect sea life from overfishing now and for generations to come. :water_wave: #bigbluefuture'",0,0,148,3,,,
CCOr23YH-Nh,lidlus,2020-07-04 18:00:51.000000,no,False,b'',b'',"b'Happy Independence Day! :United_States: We hope it\xe2\x80\x99s filled with good food, good times and all the Fourth of July feels. :fireworks: Comment and let us know how you\xe2\x80\x99re spending the holiday!'",0,0,143,3,,,
CCL5VBeHb6p,lidlus,2020-07-03 16:00:51.000000,no,False,b'',b'',"b'In honor of July 4th, our stores will be closing early at 6pm so our team members can enjoy the holiday with their loved ones. :red_heart_selector::white_heart::blue_heart:'",0,0,212,10,,,
CCJpIjlnXIV,lidlus,2020-07-02 19:00:51.000000,no,False,"b'4thofjuly,summerbbq'",b'',"b'Nothing says Fourth of July like a good old fashioned cookout! :hamburger::hot_dog: Make Saturday\xe2\x80\x99s barbecue the best on the block with our selection of snacks, grill-worthy mains, drinks and desserts. :face_savoring_food:\n\n#4thofjuly #summerbbq'",0,0,121,2,,,
CCHEPznHUJL,lidlus,2020-07-01 19:00:03.000000,no,False,b'',b'',b'Is this the real life? Is this just fantasy? :soft_ice_cream: Make your ice cream dreams a reality with our frozen desserts \xe2\x80\x94 featuring a selection made with UTZ certified cocoa and without any artificial flavors. :drooling_face: Magnifico-o-o-o! Follow the link in our bio and get inspired with a sweet summer recipe!',0,0,263,17,,,
CCG2q6QnwO2,lidlus,2020-07-01 17:01:25.000000,no,False,b'',b'',b'Don\xe2\x80\x99t leave your leftovers feeling lonely \xe2\x80\x94 store \xe2\x80\x98em in our affordable food storage containers! :shallow_pan_of_food: Available in stores now while supplies last.',0,0,100,0,,,
CCERu7ZHG3Z,lidlus,2020-06-30 17:00:11.000000,no,False,b'rethinkgrocery',b'',"b'Drinks :check_mark: Snacks :check_mark: Red, white & blue d\xc3\xa9cor :check_mark: Find just what you need for Saturday\xe2\x80\x99s cookout with our special Fourth of July offerings!\n\nPlease check the myLidl app or log in to your account online for local store stock levels. #rethinkgrocery'",0,0,143,2,,,
