shortcode,username,date_utc,is_video,is_sponsored,hashtags,mentions,caption,video_view_count,video_length,likes,comments,likes+comments,location_name,location_latlongB_BNLEPD-3U,lidlus,2020-04-15 22:48:25.000000,no,False,b'rethinkgrocery',b'',"b'Just \xe2\x80\x98sew\xe2\x80\x99 you know, we have sewing accessories and equipment for every at-home tailor. :thread: This sewing machine is available in stores now for $79.99, and sewing kits are starting at $1.99, while supplies last. Download and check the myLidl app for stock levels at your local Lidl. #rethinkgrocery'",0,0,143,4,,,
B-z0YIMjbyZ,lidlus,2020-04-10 18:01:38.000000,no,False,b'wereinthistogether',b'',"b""Our highest priority is the health and safety of our customers and employees. For that reason, we've implemented even more protective measures across all stores. Here are a few of our latest measures to encourage social distancing and to keep everyone in our stores safe:\n.\n\xe2\x80\xa2 Starting April 11, we will be temporarily limiting the number of customers in our stores to encourage social distancing throughout your shopping experience. A designated team member will be stationed at the entrance of our store and will keep track of customer counts, while disinfecting carts and directing customers to stand in a queue once that limit has been reached.\n.\n\xe2\x80\xa2 Protective masks and gloves have been secured for all team members on each shift.\n.\n\xe2\x80\xa2 We suggest paying with any major credit card, EBT, Apple Pay, or Google Pay for a contactless transaction at checkout.\n\nPlease review our website to learn more on all the actions we're taking during this public health emergency by visiting the link in our bio. #WereInThisTogether""",0,0,279,20,,,
B-xg0ZRDYVv,lidlus,2020-04-09 20:32:14.000000,no,False,"b'easter,ham,pineapples,rethinkgrocery'",b'',"b""Take your #Easter outdoors and have a family barbecue! Our delicious smoked #ham portion is $0.69/lb. and #pineapples are $1.99 each, while supplies last. We have the perfect recipe for these items that'll be the talk of your household! Check out the recipe for our pineapple sweet glazed ham on our website and myLidl app. :pineapple::fork_and_knife_with_plate_selector: #rethinkgrocery""",0,0,119,0,,,
B-xImaADyml,lidlus,2020-04-09 17:00:37.000000,no,False,"b'wafflemaker,brunch,rethinkgrocery'",b'',"b'Make the mornings fun for the whole family with our 3-in-1 #wafflemaker which comes in two cute pastel colors, pink and green. It includes 3 interchangeable cooking plates so you can make Belgian waffles for yourself and donuts or teddy bear waffles for the kids. :waffle: This item is a perfect #brunch staple at $24.99, in stores now, while supplies last. #rethinkgrocery'",0,0,236,14,,,
B-hmWC-j-TK,lidlus,2020-04-03 16:12:58.000000,yes,False,b'rethinkgrocery',b'',"b""Get some fresh air while enjoying your outdoor space. Give your patio, balcony or porch that finishing touch with a 9.5' patio umbrella for $19.99, after 20% discount at checkout, while supplies last. Available in store 4/4 - 4/5. #rethinkgrocery""",4315,24.219,145,12,,,
B-fkCkIDJqy,lidlus,2020-04-02 21:14:04.000000,no,False,b'',b'',"b""The safety of our customers and employees is our top priority. While visiting our stores, you'll begin to see steps that we've implemented to ensure your safety. Here's what you'll notice in store:\n\nWe are installing protective shields in all of our checkout lanes to protect employees and customers.\n\nWe are placing social distancing stickers across the store, as well as reminder announcements over the loudspeaker.\n\nWe are offering employees the option to wear protective masks or gloves during their shift.\n\nWe are actively working to secure this personal protective equipment for our store and warehouse employees, and are already providing gloves to all employees.\n\nWe are offering disinfecting wipes to all customers.\n\nWe have dramatically upped our cleaning regimen in our stores, focusing on the most high-traffic, high-touch areas.\n\nIn addition to enhanced cleaning that is completed daily with EPA-recommended sanitizing solutions approved for use in mitigating against COVID-19, we have implemented weekly, third-party specialized cleaning support for regular sweeps of our stores and most impacted areas.\n\nCheck out our website to learn more about the actions we're taking during this public health emergency.""",0,0,1073,40,,,
B-QUKYgjQjE,lidlus,2020-03-27 23:11:39.000000,yes,False,b'',b'',"b""We're rolling out enhanced cleaning measures at all of our stores to help you and our team stay safe and healthy.\n\nCheck out our website to learn more about the actions we're taking during this public health emergency.""",4917,48.533,341,26,,,
B-LE0WBDICK,lidlus,2020-03-25 22:16:51.000000,yes,False,b'',b'',"b'We\xe2\x80\x99d like to thank all our customers for the outpouring of support we\xe2\x80\x99ve received thus far. :folded_hands: It gives us the strength to continue our work, serving you amid these trying times.'",4251,60.013,396,30,,,
B-KOEHtDrA5,lidlus,2020-03-25 14:17:59.000000,no,False,"b'easter,baking,rethinkgrocery'",b'',"b'Give the kids a lesson in baking this week with our #Easter baking molds and pans. :rabbit_face: They will love using these fun #baking accessories that come in a variety of sizes, colors and shapes. :cupcake::shortcake: Available in stores now for $3.19 each after 20% discount taken at checkout, while supplies last. #rethinkgrocery'",0,0,127,6,,,
B-HtMJbDr0S,lidlus,2020-03-24 14:52:17.000000,no,False,b'',b'',"b'We\xe2\x80\x99re implementing enhanced protective measures over the coming weeks to shield our store teams from the spread of COVID-19. This will include protective barriers installed in all checkout lanes to protect both our employees and customers during checkout.\n\nTo read more on our procedures to ensure all are safe and healthy when working and shopping with us, check out our website at lidl.com/coronavirus-update.'",0,0,1632,94,,,
B94XCJOjdoQ,lidlus,2020-03-18 15:50:24.000000,yes,False,b'',b'',"b""A message to our communties: we're here for you.""",6520,59.088,604,42,,,
B9z2l8mF1PB,lidlus,2020-03-16 21:49:38.000000,no,False,b'',b'',"b'EDIT 04/01/2020: To better serve our customers in this period of increased traffic and demand, we have updated our store hours. All stores, except those in New Jersey, will open from 8 a.m. to 8 p.m until further notice. In New Jersey, starting April 1, all stores will be open from 8 a.m. to 7 p.m. until further notice.\n\nThis temporary reduction in store hours will give our team members extra time to work diligently to restock our shelves, clean our stores and recharge during these busy times.\n\nWe will return to our regular hours as soon as we can.\n\nLearn how we\xe2\x80\x99re better serving the needs of our communities at lidl.com.'",0,0,715,43,,,
B9sGTUognWI,lidlus,2020-03-13 21:37:55.000000,yes,False,b'rethinkgrocery',b'',"b""It's been a long week. This weekend, relax and have a seat on our comfy chair cushions for just $3.99 each. :chair::relieved_face: Available 3/14 - 3/15, while supplies last. #rethinkgrocery""",3232,24.233,60,3,,,
B9rwcQgjqCN,lidlus,2020-03-13 18:22:53.000000,yes,False,"b'stpatricksday,chickenwings,rethinkgrocery'",b'guinness',"b'These @guinness glazed chicken wings will be your pot of gold this #StPatricksDay. :rainbow: See how to make this boozy-good appetizer on our website or on the myLidl app. Our family pack of #chickenwings are on sale for $1.99, while supplies last. :poultry_leg: #rethinkgrocery'",2276,60.013,88,4,,,
B9m7G7CjbUO,lidlus,2020-03-11 21:18:55.000000,no,False,"b'stpatricksday,rethinkgrocery'","b'alexcalame,little.mama.shark'","b'If you need attire for #StPatricksDay, you\xe2\x80\x99re in luck! :top_hat::four_leaf_clover: Get green shirts and festive socks that @alexcalame and @little.mama.shark picked up in-store for just $7, while supplies last. #rethinkgrocery'",0,0,117,1,,,
B9VEYPLDTFU,lidlus,2020-03-04 22:54:44.000000,yes,False,"b'scallops,rethinkgrocery'",b'mothertougher',"b'One thing is for certain and two things are for sure, our Preferred Selection jumbo sea #scallops are wild caught, MSC-certified and on sale this week! Listen to @mothertougher and get yours now for $6.99, while supplies last. :face_savoring_food: #rethinkgrocery'",2878,59.833,104,7,,,
B9UcdPZDfDr,lidlus,2020-03-04 17:05:22.000000,yes,False,"b'pressurewasher,springcleaning,rethinkgrocery'",b'',"b'Time to apply pressure to all that built up gunk on the ground, siding and more! Our #pressurewasher includes 7 attachments to help you wash away years of outdoor stains. Available now for $99.99, while supplies last. #springcleaning #rethinkgrocery'",2300,34.98,68,3,,,
B9H7G6ujwaD,lidlus,2020-02-28 20:25:34.000000,yes,False,"b'storagesolution,rethinkgrocery'",b'',"b'No space for a mudroom? Let this six-drawer storage bench provide you with a #storagesolution. :running_shoe::scarf::gloves: It\xe2\x80\x99s perfect for stashing those things that are needed right before heading out the door, while also giving you a place to rest. On sale 2/29 - 3/1 for $29.99, while supplies last.  #rethinkgrocery'",2902,28.241,131,6,,,
B9FZ2NmjAKN,lidlus,2020-02-27 20:54:45.000000,yes,False,"b'grapes,rethinkgrocery'",b'',"b'Our fruit buyer ensures that the #grapes we sell are the largest, sweetest and crunchiest of the bunch. :grapes: We have fresh red seedless grapes on now for 79\xc2\xa2/lb. #rethinkgrocery :television: Check out IGTV to view the full video.'",3406,88.713,127,2,,,
B9DIlO9j89R,lidlus,2020-02-26 23:44:00.000000,no,False,"b'lasagna,rethinkgrocery'","b'alexcalame,little.mama.shark'","b""Looking for an easy meal that satisfies the whole family's cravings? Try our meat #lasagna packed with 3 layers of :cheese_wedge: on sale now for just $3.99! This was a win in both @alexcalame and @little.mama.shark's households tonight. :face_savoring_food: #rethinkgrocery""",0,0,137,6,,,
B9CyAB-jgOL,lidlus,2020-02-26 20:26:41.000000,no,False,"b'wine,rethinkgrocery'",b'',"b'Bright, sunny days are ahead! :sun_selector: Find the perfect warm-weather #wine to sip in the sunshine. :wine_glass::relieved_face: Our spring wine collection starts at just $5.99. Available in stores now. #rethinkgrocery\n\nOffers valid in VA, NC and SC. 21+. Drink responsibly.'",0,0,91,4,,,
B9CXS8ADVjD,lidlus,2020-02-26 16:33:20.000000,no,False,"b'kitchen,rethinkgrocery'",b'',"b'It\xe2\x80\x99s baaaaack! :beaming_face_with_smiling_eyes: The perfect staple that will compliment any #kitchen this spring: our best-selling cast iron roaster now in :sunflower: yellow.\n\nOur cast iron roasters are ovenproof up to 464\xc2\xb0 and can be used on all stovetops\xe2\x80\x94including induction! Available in stores now for $24.99, while supplies last. :pot_of_food: #rethinkgrocery'",0,0,226,17,,,
B8wbTl6ja5I,lidlus,2020-02-19 17:22:03.000000,no,False,"b'steak,asparagus,rethinkgrocery'",b'mothertougher',"b""Looking to 'beef' up your plate? :cut_of_meat: Let this 10 oz. grass fed ribeye #steak @mothertougher picked up be at the top of your grocery list this week for a dinner your whole family will appreciate. It's on sale now for $4.99 and pairs perfectly with the #asparagus at $1.99/pk., while supplies last. #rethinkgrocery""",0,0,217,3,,,
B8uLHfTDzA_,lidlus,2020-02-18 20:22:19.000000,yes,False,"b'gardening,rethinkgrocery'",b'',"b""Don't think you have a green thumb? Well, we're 'rooting' for you! :clapping_hands: Try your hand at #gardening with this raised planter box on sale starting 2/19 for $29.99, while supplies last. :seedling: #rethinkgrocery""",5094,15.033,257,17,,,
B8jXeSOjUp3,lidlus,2020-02-14 15:38:25.000000,no,False,b'rethinkgrocery',b'',"b""Nobody leaves baby in the corner. :baby: Share some :red_heart_selector: with your little ones this weekend by picking up these long sleeve onesies. They're on sale 2/15 - 2/16 at $2.99 per 2-count pack, while supplies last. #rethinkgrocery""",0,0,171,7,,,
B8goTywDT3u,lidlus,2020-02-13 14:07:49.000000,no,False,"b'galentinesday,rethinkgrocery'","b'little.mama.shark,alexcalame'","b'Grab your BFF, head to Lidl and get all your #GalentinesDay needs for a ladies night in. :woman_tipping_hand_selector: This cozy bath robe that @little.mama.shark and @alexcalame are wearing comes in two prints and is only $9.99, while supplies last. #rethinkgrocery'",0,0,118,3,,,
B8cXtixj8yJ,lidlus,2020-02-11 22:25:49.000000,no,False,"b'valentinesday,rethinkgrocery'",b'',"b""Spread the love this #ValentinesDay with a rose bouquet that's guaranteed to last past the holiday with our 7-Day Freshness Guarantee. :rose: Our limited time bouquets are available in store 2/12 starting at $9.99. Tag your :red_heart_selector: who needs a friendly reminder that they've got 3 days left. #rethinkgrocery""",0,0,192,7,,,
B8XPoWKjgpG,lidlus,2020-02-09 22:39:21.000000,yes,False,"b'roses,rethinkgrocery'",b'',b'Take their breath away with roses that will last longer than a week. :rose: We put our 7-Day Freshness Guarantee to the test so you can buy #roses for your loved ones worry-free this Valentine\xe2\x80\x99s Day. :heart_with_ribbon: Available in stores now. #rethinkgrocery',1714,60.013,87,4,,,
B8RXJikDue3,lidlus,2020-02-07 15:49:56.000000,yes,False,"b'umbrella,rethinkgrocery'",b'',"b'Stay dry out there, folks! :umbrella_with_rain_drops: This inverted #umbrella will not only keep you dry but also keeps the rain away from your floor and inside your car thanks to its easy-close mechanism. Available in store for $9.99 2/8 - 2/9, while supplies last. #rethinkgrocery'",2995,6.333,124,5,,,
B8MQeaTD9Xx,lidlus,2020-02-05 16:14:44.000000,no,False,"b'scallops,rethinkgrocery'",b'mothertougher',"b'Ditch dinner reservations and prepare a romantic dinner for two in your own home. :wine_glass::fork_and_knife_with_plate_selector: Take a tip from @mothertougher and get this deal on a family-sized bag of Lidl Preferred Selection MSC-certified jumbo sea #scallops for $9.99, while supplies last. #rethinkgrocery'",0,0,175,4,,,
B8L_JfWDuwf,lidlus,2020-02-05 13:43:44.000000,yes,False,b'rethinkgrocery',b'',"b'Saut\xc3\xa9 all day with this 11-inch aluminum wok/frying pan for just $12.99, while supplies last. :cooking: #rethinkgrocery'",2634,26.253,96,3,,,
B79l6OyDkWV,lidlus,2020-01-30 23:33:26.000000,no,False,b'rethinkgrocery',"b'little.mama.shark,alexcalame'",b'Don\xe2\x80\x99t have a game day spread planned yet? Just wing it! @little.mama.shark and @alexcalame spent under 25 bucks for all their essentials by shopping at Lidl. :raising_hands: #rethinkgrocery',0,0,108,1,,,
B77Fn5jjQLN,lidlus,2020-01-30 00:13:53.000000,yes,False,b'rethinkgrocery',b'',"b""This football helmet helps you 'snackle' your game day feast. :american_football: Score yours for $19.99, while supplies last. #rethinkgrocery""",2703,5.033,95,5,,,
B76WZqfD-EW,lidlus,2020-01-29 17:20:12.000000,no,False,b'rethinkgrocery',b'',"b""Whether they're hot, mild, BBQ, lemon-pepper or teriyaki, wings will be the star of the show this Sunday. :chicken: Begin prepping your party spread with these fresh never frozen chicken wings at $1.79/lb. for a family pack, while supplies last. #rethinkgrocery""",0,0,103,1,,,
B76JOZrD8pf,lidlus,2020-01-29 15:25:47.000000,yes,False,b'rethinkgrocery',b'',"b'No cable? No problem! Watch the Big Game from your big screen with an HDTV antenna for just $9.99, while supplies last. :television: #rethinkgrocery'",3988,22.006,82,5,,,
B7uPnKYDPYf,lidlus,2020-01-25 00:29:59.000000,no,False,b'dollypartonchallenge',b'',"b'However it\xe2\x80\x99s served, Lidl is always smoking hot. :smiling_face_with_sunglasses: #dollypartonchallenge'",0,0,445,20,,,
B7rgTtlDhxe,lidlus,2020-01-23 22:58:09.000000,no,False,b'rethinkgrocery',b'',b'Find your center :person_in_lotus_position: with yoga products that will help you achieve complete Zen. #rethinkgrocery',0,0,94,6,,,
B7n43FUjfQ0,lidlus,2020-01-22 13:15:44.000000,no,False,b'rethinkgrocery',b'mothertougher',"b""Treat your valentine this holiday to a romantic breakfast with heart-shaped waffles. :waffle: Just ask @mothertougher, she knows all about creating a 'hearty' meal. :red_heart_selector: This waffle maker is in stores now for $14.99, while supplies last. #rethinkgrocery""",0,0,312,12,,,
B7ekRCqDlk-,lidlus,2020-01-18 22:22:37.000000,no,False,b'rethinkgrocery',"b'alexcalame,little.mama.shark'","b'@alexcalame and @little.mama.shark are prepared for a cozy night in with their ladies knit cardigans and high waisted leggings for just $15. Find these in store now, while supplies last. #rethinkgrocery'",0,0,164,3,,,
B7bxFqcDSYI,lidlus,2020-01-17 20:17:39.000000,yes,False,b'',b'',"b""Skip the smoothie bar and create your own at home. We've got 6 ingredients for crafting the perfect smoothie recipe. :strawberry::leafy_green:""",3098,15.333,127,0,,,
B7XBfitjdFl,lidlus,2020-01-16 00:04:52.000000,yes,False,b'rethinkgrocery',b'',"b'Need a pair of pants that work as hard as you do? Pick up a pair this week for $14.99, while supplies last. #rethinkgrocery'",2859,20.414,82,4,,,
B66SA7ADYla,lidlus,2020-01-04 20:10:28.000000,no,False,b'rethinkgrocery',"b'puremomblog,littlesouthernwife,findingournextadventure'","b'@puremomblog, @littlesouthernwife and @findingournextadventure know a ""new year, new you,"" doesn\'t have to break the bank. Discover healthy options for your family everyday at Lidl. #rethinkgrocery'",0,0,257,11,,,
