shortcode,username,date_utc,is_video,is_sponsored,hashtags,mentions,caption,video_view_count,video_length,likes,comments,likes+comments,location_name,location_latlongCFzsjYjh_GZ,lloydsbankinggroup,2020-10-01 16:33:01.000000,no,False,"b'lbgvoices,blackhistorymonth,diversityandinclusion'",b'',"b'\xe2\x80\x9cI became a volunteer of the REACH (Race, Ethnicity & Cultural Heritage) network whilst on the Lloyds Banking Group graduate scheme and have continued to be involved ever since. REACH aims to support members to realise their full potential and achieve their aspirations, while promoting an ethnically and culturally diverse workforce. It\xe2\x80\x99s something I support alongside my role that is very rewarding and opens up many opportunities to meet different people across the Group with varying cultures and backgrounds; and as a Black female it\xe2\x80\x99s so important to me to work in an environment that is inclusive and enables me to bring my whole self to work. \n\nInitially I joined the network supporting with our regular communications e.g. newsletters and blogs, however, I started to get more involved with events and signature initiatives such as our Black History Month campaigns. Last year, I took part in various conversations and activity that focussed on sharing the need and importance of increasing Black representation at senior levels within the organisation. \n\nThis year the Group introduced the Race Action Plan and committed to increasing Black representation at senior level to at least 3% by 2025. I am so pleased that the Group have made a public commitment to reaching this goal and supporting Black colleagues with progression within the organisation which will complement the overall Black, Asian and Ethnic Minority targets. \nI feel really proud and honoured to be part of the many changes that are to come across the Group.\xe2\x80\x9d \n\n- Chanae, REACH Network Volunteer\n\n#LBGVoices #BlackHistoryMonth #DiversityandInclusion'",0,0,81,2,,,
CFuNkp1BLjh,lloydsbankinggroup,2020-09-29 13:28:27.000000,yes,False,"b'lbgvoices,blackhistorymonth,diversityandinclusion,diversity,inclusionmatters'",b'',"b'Meet Chanae. She is part of our REACH (Race, Ethnicity & Cultural Heritage) Network, working on initiatives that aim to promote an ethically and culturally diverse culture within the Group. \n\n#LBGVoices #BlackHistoryMonth #DiversityandInclusion #Diversity #InclusionMatters'",903,48.873,161,1,,,
CFRQFS0BOLG,lloydsbankinggroup,2020-09-18 07:30:04.000000,no,False,b'lbgvoices',b'',"b'\xe2\x80\x9cI\xe2\x80\x99ve led our property design team for almost a year now, and it\xe2\x80\x99s a job I really love. I get a lot of fulfilment from our purpose to reduce the carbon footprint of our buildings and support our colleagues to make sustainable changes. I\xe2\x80\x99ve made some new habits of my own recently, like taking the train rather than flying and eating less meat. This job lets me multiply the potential impact of those actions by 65000 by supporting others to make changes to how they live and work.\n\nMy team play a simple but critical role within our broader sustainability strategy, demonstrating our commitment to take action on our own carbon footprint.\n\nThis year, the Group announced a truly impactful goal to help reduce the carbon emissions we finance by more than 50% by 2030. A goal of that scale, working with our 26 million customers, takes our influence to another level. My team have the opportunity to show those 26 million customers, in particular those who own businesses, how they can take action on their own carbon footprint.\n\nI feel really proud that the Group is investing so much time in taking action against climate change, and really support our stance that businesses that can move faster and go further should do so.\xe2\x80\x9d\n\nNaomi, Head of Property Design\n\n#LBGVoices'",0,0,71,3,,,
CFO2l3nhwny,lloydsbankinggroup,2020-09-17 09:08:50.000000,no,False,"b'financingagreenfuture,sustainability,sustainablebusiness,renewableenergy'",b'',"b""A sustainable and responsible approach to doing business is integral to everything we do. That's why, since January 2019, 100% of our global electricity demand has come from renewable sources. #FinancingAGreenFuture\n\n#Sustainability #SustainableBusiness #RenewableEnergy""",0,0,63,3,,,
CFHJkuuBS7W,lloydsbankinggroup,2020-09-14 09:21:07.000000,yes,False,"b'sustainability,sustainablebusiness,sustainabilitymatters,lbgvoices'",b'',b'Meet Naomi. She leads a team responsible for making our buildings and our colleagues more environmentally sustainable.\n\n#Sustainability #SustainableBusiness #SustainabilityMatters #LBGVoices',23232,53.233,180,12,,,
CE9yDEbhfyq,lloydsbankinggroup,2020-09-10 18:02:03.000000,no,False,b'mentalhealth',b'',"b'We know the importance of having good #MentalHealth. That\xe2\x80\x99s why we\xe2\x80\x99ll train 2,500 colleagues as Mental Health Advocates by the end of 2021.'",0,0,1335,55,,,
CE8kO3dBSZP,lloydsbankinggroup,2020-09-10 06:42:05.000000,no,False,"b'lbgvoices,mentalhealth,yoga'",b'',"b'""I grew up surrounded by yoga but also meditation. My father would meditate daily and I loved sitting with him \xe2\x80\x93 I always felt so peaceful and connected to my thoughts and feelings so as I grew older and \xe2\x80\x9clife happened\xe2\x80\x9d I continued to explore the many aspects of yoga. For me, yoga is my way of life \xe2\x80\x93 it\xe2\x80\x99s what I eat, drink sleep and breathe. It helps me make decisions and have a perspective to everything in life \xe2\x80\x93 even COVID-19!""\n\nNiki, one of our Mental Health Advocates has helped colleagues by running virtual Yoga sessions during lockdown in partnership with our gender diversity network, Breakthrough. \n\n""From day one of lockdown, I had requests to run yoga and meditation classes online both through colleagues and via friends & family on social media. It demonstrated how important it was to manage our health and wellbeing during this time. \n\nI was acutely aware of my own role in the Group and how it wasn\xe2\x80\x99t impacted as much as all the key workers supporting colleagues and customers. I responded to the internal request from Breakthrough and agreed with them to host yoga sessions and make them available for all LBG colleagues. We ran the first session on the 25th March and there was a huge response! \n\nSince lockdown I have the blessing of time so I\'ve spent more time each day exploring my ever changing feelings and emotions from day to day. Breathing through anxiety has been especially helpful for me \xe2\x80\x93 we\'ve all had to make changes to our lives to get through a time in which we all experienced worry, stress or panic in some way. \n\nIt\xe2\x80\x99s important to recognise what we\xe2\x80\x99re feeling and have coping strategies to help keep us calm \xe2\x80\x93 for me it\xe2\x80\x99s closing my eyes and breathing."" :woman_in_lotus_position_selector: \n\n#LBGVoices #MentalHealth #yoga'",0,0,46,2,,,
CE6CptuBhDH,lloydsbankinggroup,2020-09-09 07:15:58.000000,yes,False,"b'mentalhealth,mentalhealthatwork,mentalhealthadvocate,lbgvoices'",b'',"b'Meet Niki. As one of our Mental Health Advocates, she is responsible for encouraging colleagues to be open about their own mental health and ensuring they have access to the support they need. #MentalHealth #MentalHealthAtWork #MentalHealthAdvocate #LBGVoices'",593,38.433,47,3,,,
CE3b00OB9JS,lloydsbankinggroup,2020-09-08 06:52:25.000000,no,False,"b'lloydsbankinggroup,lbgvoices'",b'',"b'Welcome to the Instagram channel for #LloydsBankingGroup, where we\xe2\x80\x99ll show you how our colleagues are helping people, businesses and communities across the UK.\n\nFrom tomorrow, we\xe2\x80\x99ll introduce you to our #LBGVoices - passionate and dedicated colleagues from across the Group who are working to make a real difference.'",0,0,73,4,,b'United Kingdom',54.0 -2.0
CE1FvT3h1Xr,lloydsbankinggroup,2020-09-07 09:00:57.000000,no,False,b'lloydsbankinggroup',b'',"b'We serve more than 26 million customers and over a million businesses, but we want to go beyond business as usual and help address the social, economic and environmental issues that matter most to Britain. \n\n#LloydsBankingGroup'",0,0,34,8,,b'United Kingdom',54.0 -2.0
CDbb8GcBexA,lloydsbankinggroup,2020-08-03 13:26:22.000000,yes,False,"b'helpingbritainprosper,lloydsbankinggroup'",b'',b'We are Lloyds Banking Group. Follow us to see how we\xe2\x80\x99re #HelpingBritainProsper :horse: \n\n#LloydsBankingGroup',1013,19.0,72,7,,b'United Kingdom',54.0 -2.0
