shortcode,username,date_utc,is_video,is_sponsored,hashtags,mentions,caption,video_view_count,video_length,likes,comments,likes+comments,location_name,location_latlong
CIYAOs8jaTx,natwest,2020-12-04 12:00:24.000000,no,False,"b'natwest,takefive,scamming,scams,scammers,scamalert,fraud,beware,friendsagainstscams,actionfraud,stayalert,fraudalert,protectyourself'",b'',"b""Have you noticed how much more email you get around this time of year? Scammers love to catch people out with fake offers. So don't open anything you didn't sign up for and watch out for emails or texts offering free gifts. Click on the link and you could end up with a computer virus. Delete anything that looks suspicious. And don't forget, if an offer looks too good to be true, it's probably a scam.\n\nSee link in bio to read up on how to protect yourself from the latest scams.\n.\n.\n.\n.\n.\n#NatWest #TakeFive #Scamming #Scams #Scammers #ScamAlert #Fraud #Beware #FriendsAgainstScams #ActionFraud #StayAlert #FraudAlert #ProtectYourself\n.\n.\nhttps://personal.natwest.com/personal/fraud-and-security/fraud-guide.html?extcam=SCM_INST_ORG""",0,0,33,3,,,
CIXrm3ZnUdx,natwest,2020-12-04 09:00:12.000000,no,False,"b'natwest,takefive,scamming,scams,scammers,scamalert,fraud,beware,friendsagainstscams,actionfraud,stayalert,fraudalert,protectyourself'",b'',"b'Send delivery scams packing! If you\xe2\x80\x99ve done your Christmas shopping online, you\xe2\x80\x99ll now be swamped with text and email delivery updates. But keep a close eye on them. Fake delivery notices are being reported by customers right now and we don\xe2\x80\x99t want anyone to be caught out. Please share this with loved ones who may not be on social media.\n\n*What to look out for*\nAny message stating a driver has tried to deliver your parcel and asking you to click a link to reschedule. Then, being asked to enter sensitive info like your date of birth, mobile number and card details. If you submit personal data, scammers could use it to call you up or access your bank account. \n\n*How to stay safe*\n- Double and triple check delivery messages. \n- Make sure they link up to genuine orders. Does the message mention the goods you ordered or the company you ordered from?\n- Check the message addresses you by name rather than just your email address or a basic \xe2\x80\x98Dear customer\xe2\x80\x99. \n- Look for tell-tale signs such as spelling and grammar mistakes.\n- Don\xe2\x80\x99t submit any personal info like date of birth, card details or mobile number. Genuine delivery messages don\xe2\x80\x99t ask for this and don\xe2\x80\x99t ask for payment to re-deliver parcels.\n- Delete anything dodgy, especially if you\xe2\x80\x99re not expecting a delivery, and if you\xe2\x80\x99re not sure, don\xe2\x80\x99t click the link. Delete the message and get in touch with the retailer you purchased from.\n\nTo stay up to date on the latest scams, see link in bio to check out our fraud guide.\n.\n.\n.\n.\n.\n#NatWest #TakeFive #Scamming #Scams #Scammers #ScamAlert #Fraud #Beware #FriendsAgainstScams #ActionFraud #StayAlert #FraudAlert #ProtectYourself\n.\n.\nhttps://personal.natwest.com/personal/fraud-and-security/fraud-guide.html?extcam=SCM_INST_ORG'",0,0,49,6,,,
CIXkwx7j9s1,natwest,2020-12-04 08:00:23.000000,no,False,"b'natwest,takefive,scamming,scams,scammers,scamalert,fraud,beware,friendsagainstscams,actionfraud,stayalert,fraudalert,protectyourself'",b'',"b""Are you still rushing to tick everything off the Christmas online shopping list?  Make sure you take time to think about the websites you're using to keep your personal data safe.\n\nDon't give away any personal or secure information on sites you're not sure about. And if anyone ever asks you for info such as bank login details, passcodes, card reader codes, remote access to your device or asks you to move money from your account, don't do it. It's a scam.\n\nFor all the latest updates on protecting yourself from fraud and scams, see link in bio to visit our fraud guide.\n.\n.\n.\n.\n.\n#NatWest #TakeFive #Scamming #Scams #Scammers #ScamAlert #Fraud #Beware #FriendsAgainstScams #ActionFraud #StayAlert #FraudAlert #ProtectYourself\n.\n.\nhttps://personal.natwest.com/personal/fraud-and-security/fraud-guide.html?extcam=SCM_INST_ORG""",0,0,28,0,,,
CIS2r_yo-gK,natwest,2020-12-02 12:01:07.000000,yes,False,"b'natwest,moneydiaries,cosmopolitanuk,natwestmobileapp,mobilebanking,moneymakeover,moneysavingtips,moneytips,savingsgoals,moneysaver,financialplanning,budgeting'",b'cosmopolitanuk',"b'In your pocket 24/7. From keeping tabs on what you\xe2\x80\x99re spending and saving to withdrawing cash without your card, the NatWest app helps you manage your money better. It\xe2\x80\x99s easy to use, simple to navigate and could help you get into better money habits. It\xe2\x80\x99s also getting a thumbs up from the women in @CosmopolitanUK \xe2\x80\x99s Home Made House. For more info see link in bio. \n\nApp available to customers aged 11+ with compatible iOS and Android devices and a UK or international mobile number in specific countries. Withdraw up to \xc2\xa3130 every 24 hours at our branded ATMs. You must have at least \xc2\xa310 available in your account and an active debit card (locked or unlocked).\n.\n.\n.\n.\n.\n#NatWest #MoneyDiaries #CosmopolitanUK #NatWestMobileApp #MobileBanking #MoneyMakeOver #MoneySavingTips #MoneyTips #SavingsGoals #MoneySaver #FinancialPlanning #Budgeting\n.\n.\nhttps://personal.natwest.com/personal/banking-with-natwest/natwest-app/features.html?extcam=SCM_INST_ORG'",278,50.666,16,0,,,
CISo9AEo7_9,natwest,2020-12-02 10:01:06.000000,yes,False,"b'natwest,cosmopolitanuk,moneydiaries,moneymakeover,financialhealthcheck,moneysavingtips,moneytips,savingsgoals,moneysaver,financialplanning,budgeting,futureplanning,frugalliving,frugallife,debtfreejourney'",b'',b'Get help turning your goals into reality. Book in for your own Financial Health Check and find out how we could help you hit your money goals. One of our Senior Personal Bankers will listen to your money situation and talk you through what you could do to make things better.  Speak to us either via video or over the phone and we can help you put a plan together. \n\nAnyone can book a Financial Health Check. You don\xe2\x80\x99t have to be a NatWest customer. For more info see link in bio. \n\nFinancial Health Checks via Video Banking available between 8am \xe2\x80\x93 8pm Monday to Friday and 9am \xe2\x80\x93 3pm Saturdays. Video Banking may be recorded.\n.\n.\n.\n.\n.\n#NatWest #CosmopolitanUK #MoneyDiaries #MoneyMakeOver #FinancialHealthCheck #MoneySavingTips #MoneyTips #SavingsGoals #MoneySaver #FinancialPlanning #Budgeting #FuturePlanning #FrugalLiving #FrugalLife #DebtFreeJourney\n.\n.\nhttps://personal.natwest.com/personal/financial-health-check.html?extcam=SCM_INST_ORG',224,59.966,11,0,,,
CISbO8voPBT,natwest,2020-12-02 08:01:10.000000,yes,False,"b'natwest,cosmopolitanuk,moneydiaries,moneymakeover,natwestaccount,bankaccount,bestbankaccounts,currentaccounts,savingsgoals,studentbankaccounts,mobilebanking'",b'',b'Tick it off your to do list. It\xe2\x80\x99s super easy to set up a NatWest account via our website. Once your account\xe2\x80\x99s set up you can download the app and use it to manage your money. Why not use it to help you save more in 2021? For more info see link in bio.\xef\xbf\xbd\xef\xbf\xbdApp available to customers aged 11+ with compatible iOS and Android devices and a UK or international mobile number in specific countries.\n.\n.\n.\n.\n.\n#NatWest #CosmopolitanUK #MoneyDiaries #MoneyMakeOver #NatWestAccount #BankAccount #BestBankAccounts #CurrentAccounts #SavingsGoals #StudentBankAccounts #MobileBanking \n.\n.\nhttps://personal.natwest.com/personal/current_accounts.html?extcam=SCM_INST_ORG',237,48.933,14,0,,,
CIQR3wAod4-,natwest,2020-12-01 12:00:38.000000,no,False,"b'natwest,savingsgoals,moneysavingtips,moneytips,savingsgoals,moneysaver,financialplanning,budgeting,futureplanning,frugalliving,frugallife'",b'',"b'Finding small ways to save daily all adds ups. Like swapping brand names for supermarket own or learning how to meal plan. It\xe2\x80\x99s all about getting into the habit till it becomes routine. Open a Digital Regular Saver account and get into the habit of saving up to \xc2\xa350 monthly and we\xe2\x80\x99ll reward you with 3% Gross/3.04% AER p.a. (variable) interest on your first \xc2\xa31,000 of savings. \n\nTo find out about all the savings accounts we offer, including Digital Regular Saver, see link in bio. \n\nPay in \xc2\xa31- \xc2\xa350 a month, 18+, UK resident with existing current account. Balances over \xc2\xa31,000, 0.01% AER/Gross p.a. (variable).\n.\n.\n.\n.\n.\n#NatWest #SavingsGoals #MoneySavingTips #MoneyTips #SavingsGoals #MoneySaver #FinancialPlanning #Budgeting #FuturePlanning #FrugalLiving #FrugalLife \n.\n.\nhttps://personal.natwest.com/personal/savings.html?extcam=SCM_INST_ORG'",0,0,35,1,,,
CIP9RFyDOCY,natwest,2020-12-01 09:00:35.000000,no,False,"b'givingtuesday,natwest,natwestrewards,myrewards,community,socialgood,instagood,donation,doubledonation,donate'",b'',"b'#GivingTuesday is a time people across the globe come together to give something back to the causes that mean the most to them. It doesn\xe2\x80\x99t have to be money. There are many other ways to give back. Your time, your skills, even a small donation to a food bank.\n\nYou can also donate your Rewards to one of our 11 nominated charities. When you do, we\xe2\x80\x99ll match what you give up to the value of \xc2\xa350, from 19th November to 31st December, until we reach a total of \xc2\xa3100,000.\n\xc2\xa0\nTo find out how to check your Rewards balance and make a donation, see link in bio.\n\nTo apply for any Reward account, you must be 18+ and a UK resident. Specific Reward eligibility criteria apply. Account fees apply. To donate Rewards you need to have a balance equivalent of \xc2\xa35 or more.\n.\n.\n.\n.\n.\n#NatWest #NatWestRewards #MyRewards #Community #SocialGood #InstaGood #Donation #DoubleDonation #Donate\n.\n.\nhttps://personal.natwest.com/personal/myrewards.html?extcam=SCM_INST_ORG'",0,0,24,0,,,
CIP2XQrD9Ot,natwest,2020-12-01 08:00:16.000000,no,False,"b'natwest,savingsgoals,moneysavingtips,moneytips,savingsgoals,moneysaver,financialplanning,budgeting,futureplanning,frugalliving,frugallife'",b'',"b'We all have projects, plans and dreams that we want to save for. To help get you started, why not think about opening a Digital Regular Saver account. If you save between \xc2\xa31 to \xc2\xa350 monthly, we\xe2\x80\x99ll reward you with 3% Gross / 3.04% AER p.a. (variable) interest on your first \xc2\xa31,000 of savings. \xef\xbf\xbd\xef\xbf\xbdTo find out about all the savings accounts we offer, including Digital Regular Saver, see link in bio. \n\n18+, UK resident with existing current account. Balances over \xc2\xa31,000, 0.01% AER/Gross p.a. (variable).\n.\n.\n.\n.\n.\n#NatWest #SavingsGoals #MoneySavingTips #MoneyTips #SavingsGoals #MoneySaver #FinancialPlanning #Budgeting #FuturePlanning #FrugalLiving #FrugalLife \n.\n.\nhttps://personal.natwest.com/personal/savings.html?extcam=SCM_INST_ORG'",0,0,28,1,,,
CINtCF3oBvj,natwest,2020-11-30 12:00:15.000000,no,False,"b'natwest,savingsgoals,natwestsavingsgoals,moneysavingtips,frugal,moneytips,moneysaver,financialplanning,budgeting,savingmoney,saving,moneysaver,personalfinance,frugalliving'",b'',"b'We can often feel the pressure to keep up with a partner or friends in terms of spending, even if we can\xe2\x80\x99t really afford it. Having an honest conversation with them about your money situation and your goals can make it a lot easier. You can then try and find less expensive activities to do together in future, which could help you stick to your savings goal.\n.\n.\n.\n.\n.\n#NatWest #SavingsGoals #NatWestSavingsGoals #MoneySavingTips #Frugal #MoneyTips #MoneySaver #FinancialPlanning #Budgeting #SavingMoney #Saving #MoneySaver #PersonalFinance #FrugalLiving'",0,0,24,1,,,
CINfWwbIu0m,natwest,2020-11-30 10:00:44.000000,no,False,"b'natwest,takefive,friendsagainstscams,scams,scamalert,stayalert,fraud,beware,cybercrime'",b'',"b'Desperate to get your hands on the latest PlayStation? Then look out for scam ads on social right now offering freebies. You might get a offered the chance to win or to beta test the latest console for free. Don\xe2\x80\x99t click, don\xe2\x80\x99t sign up. They\xe2\x80\x99re a con.\n\nScammers use these ads to steal your info and card details when you try to sign up. Don\xe2\x80\x99t click unless they\xe2\x80\x99re offers from well-known and trustworthy brands.\n\nTo get the latest on scams see link in bio.\n.\n.\n.\n.\n.\n#NatWest #TakeFive #FriendsAgainstScams #Scams #ScamAlert #StayAlert #Fraud #Beware #CyberCrime\n.\n.\nhttps://personal.natwest.com/personal/fraud-and-security/fraud-guide.html?extcam=SCM_INST_ORG'",0,0,35,3,,,
CINRjhooYq4,natwest,2020-11-30 08:00:09.000000,no,False,"b'natwest,savingsgoals,natwestsavingsgoals,moneysavingtips,frugal,moneytips,moneysaver,financialplanning,budgeting,savingmoney,saving,moneysaver,personalfinance,frugalliving'",b'',"b'Did you know 1 in 3 of us have Direct Debits for things we don\xe2\x80\x99t actually use*? \nTake a few minutes to review what\xe2\x80\x99s going out of your account every month and cancel anything you don\xe2\x80\x99t need.\n\n*Source: ICM Omnibus, Dec 2019\n.\n.\n.\n.\n.\n#NatWest #SavingsGoals #NatWestSavingsGoals #MoneySavingTips #Frugal #MoneyTips #MoneySaver #FinancialPlanning #Budgeting #SavingMoney #Saving #MoneySaver #PersonalFinance #FrugalLiving'",0,0,25,1,,,
CIDZ3KloFsD,natwest,2020-11-26 12:00:20.000000,no,False,"b'natwest,takefive,friendsagainstscams,scamming,scams,scammers,scamalert,fraud,beware,actionfraud,stayalert,protectyourself,blackfriday'",b'',"b'Bargain or fake? Apple AirPods, Xbox Series X, 4K TVs, the new iPhone 12\xe2\x80\xa6 wouldn\xe2\x80\x99t it be great to find a deal this Black Friday?\xc2\xa0\n\nJust watch out for ads for fake goods on social media.\xc2\xa0They\xe2\x80\x99re not hard to spot when you know what to look for.\n\nFirstly, if the deal looks too good to be true, it probably is. The second tactic scammers use is asking you to pay by direct bank transfer. That way, if they send you fake goods or nothing at all, they can just keep your money. And you lose it.\n\nStick to shopping on websites you know and trust and always pay by bank card, so you have some protection.\n\nTo\xc2\xa0keep yourself safe and\xc2\xa0stay up to date\xc2\xa0on\xc2\xa0the latest scams\xc2\xa0check out our fraud guide - see link in bio.\n.\n.\n.\n.\n.\n#NatWest #TakeFive #FriendsAgainstScams #Scamming #Scams #Scammers #ScamAlert #Fraud #Beware #ActionFraud #StayAlert #ProtectYourself #BlackFriday\n.\n.\xc2\xa0\xc2\xa0\nhttps://personal.natwest.com/personal/fraud-and-security/fraud-guide.html?extcam=SCM_INST_ORG'",0,0,18,1,,,
CIDMIUJjGe-,natwest,2020-11-26 10:00:20.000000,no,False,"b'natwest,blackfriday,safeshopping,takefive,friendsagainstscams,scams,scamalert,cybercrime,stayalert,fraud,beware'",b'',"b""Grab a bargain but avoid scams and fakes this Black Friday. Here's how to stay safe shopping online:\n\nBackground checks\nDo your research on the seller and check contact details on their website. Alarm bells should ring if there\xe2\x80\x99s no phone number or no physical address. Be aware that some sites may use a .co.uk web address, even if they\xe2\x80\x99re located abroad. If in doubt, don\xe2\x80\x99t shop there.\n\nYour card is king\nIt\xe2\x80\x99s always safer to shop online using your debit or credit card. NEVER pay by\xc2\xa0bank transfer. Would you hand over cash to a stranger? No. It\xe2\x80\x99s the same with paying by bank transfer as you\xe2\x80\x99ll lose your money if something goes wrong. Be suspicious of anyone asking you to do that \xe2\x80\x93 it\xe2\x80\x99s a classic trick.\n\nKeep your data safe\nDon\xe2\x80\x99t give away any personal or secure information on websites you\xe2\x80\x99re not sure about. And if anyone ever asks for info such as bank login details, passcodes, card reader codes, remote access to your device or asks you to move money from your account, don\xe2\x80\x99t do it. It\xe2\x80\x99s a scam.\n\nBeware of surprise emails\nHave you noticed how many emails you get around Black Friday? Scammers love to catch people out with fake offers. So don\xe2\x80\x99t open anything you didn\xe2\x80\x99t sign up for and watch out for emails or texts offering free gifts. Click on the link and you could end up with a computer virus. Delete anything that looks suspicious.\n\nSee link in bio to visit our fraud guide for the latest info on staying safe online. \n.\n.\n.\n.\n.\n#NatWest #BlackFriday #SafeShopping #TakeFive #FriendsAgainstScams #Scams #ScamAlert #CyberCrime #StayAlert #Fraud #Beware\n.\n.\nhttps://personal.natwest.com/personal/fraud-and-security/fraud-guide.html?extcam=SCM_INST_ORG""",0,0,24,10,,,
CIC-eM1Atzx,natwest,2020-11-26 08:01:04.000000,yes,False,"b'natwest,debitcard,creditcard,blackfriday,takefive,friendsagainstscams,scams,fraud,cybercrime,stayalert,blackfridaydeals,safeshopping'",b'',"b'There\xe2\x80\x99s only one way to pay safely when you\xe2\x80\x99re shopping online and that\xe2\x80\x99s using your\xc2\xa0bank card.\n\nIt means we\xe2\x80\x99ve got your back if the worst happens. We can help if you\xe2\x80\x99ve paid for something that doesn\xe2\x80\x99t turn up, if there\xe2\x80\x99s a problem with it or if you\xe2\x80\x99ve been charged more than once, or the wrong amount.\n\nAlways look out for dodgy deals. A classic trick used by scammers is to ask people to pay by bank transfer. Never do this. If the price is too good to be true, chances are it\xe2\x80\x99s a fake. And if it is, you\xe2\x80\x99ll lose your money.\n\nSee link in bio to visit our fraud guide for more on how to keep your money safe online.\n.\n.\n.\n.\n.\n#NatWest #DebitCard #CreditCard #BlackFriday #TakeFive #FriendsAgainstScams #Scams #Fraud #CyberCrime #StayAlert #BlackFridayDeals #SafeShopping\n.\n.\nhttps://personal.natwest.com/personal/fraud-and-security/fraud-guide.html?extcam=SCM_INST_ORG'",1405,6.033,65,0,,,
CIA1FFgD0wu,natwest,2020-11-25 12:00:26.000000,no,False,"b'natwest,blackfriday,blackfridaysale,blackfriday2020,blackfridaydeals,blackfridayshopping,moneytips,budgeting,budgetingtips,moneysaver,moneysavingtips,frugal,frugalliving'",b'',"b'It\xe2\x80\x99s a chemical fact that spending makes us feel good*. So does shopping. That\xe2\x80\x99s  why it\xe2\x80\x99s called retail therapy. We get a buzz from it. Spending money when we\xe2\x80\x99re paying a lower than expected price can feel even better. But no one wants a spending hangover. So be logical; give yourself a little breathing space. You could turn off one-click spending altogether or put the item in your basket and hold off clicking pay for a bit. Then, ask yourself if you really need it. Is it worth it? Or would you rather put the money towards a longer-term goal? \n\n*See link in bio to read the science.\n.\n.\n.\n.\n.\n#NatWest #BlackFriday #BlackFridaySale #BlackFriday2020 #BlackFridayDeals #BlackFridayShopping #MoneyTips #Budgeting #BudgetingTips #MoneySaver #MoneySavingTips #Frugal #FrugalLiving\n.\n.\nhttps://gizmodo.com/why-does-spending-money-feel-so-good-1842593770'",0,0,25,0,,,
CIAnTv-jKZl,natwest,2020-11-25 10:00:06.000000,no,False,"b'natwest,blackfriday,blackfridaysale,blackfriday2020,blackfridaydeals,blackfridayshopping,moneytips,budgeting,budgetingtips,moneysaver,moneysavingtips,frugal,frugalliving'",b'',"b'Big discounts and the chance to nab a bargain can make us put things in our basket that we might not really need. No matter how good the deal is, it\xe2\x80\x99s not saving money if it\xe2\x80\x99s something you don\xe2\x80\x99t need.\n.\n.\n.\n.\n.\n#NatWest #BlackFriday #BlackFridaySale #BlackFriday2020 #BlackFridayDeals #BlackFridayShopping #MoneyTips #Budgeting #BudgetingTips #MoneySaver #MoneySavingTips #Frugal #FrugalLiving'",0,0,63,4,,,
CIAZkmVjA7I,natwest,2020-11-25 08:00:04.000000,no,False,"b'natwest,blackfriday,blackfridaysale,blackfriday2020,blackfridaydeals,blackfridayshopping,moneytips,budgeting,budgetingtips,moneysaver,moneysavingtips,frugal,frugalliving'",b'',"b'Stick to your list. Stick to your budget. You might be tempted to add a lil\xe2\x80\x99 something to your basket you hadn\xe2\x80\x99t planned for. Or spend another fiver on a few people\xe2\x80\x99s gifts than you\xe2\x80\x99d meant to. But if you\xe2\x80\x99re buying for 10 people say, that adds up to an extra \xc2\xa350. So set a hard limit on the amount you want to spend and keep to it. \n.\n.\n.\n.\n.\n#NatWest #BlackFriday #BlackFridaySale #BlackFriday2020 #BlackFridayDeals #BlackFridayShopping #MoneyTips #Budgeting #BudgetingTips #MoneySaver #MoneySavingTips #Frugal #FrugalLiving'",0,0,82,1,,,
CH7rfU5jNID,natwest,2020-11-23 12:00:26.000000,no,False,"b'natwest,creditcard,creditcards,creditcarddebt,debtfreegoals,moneytips,moneymanagement,moneypositive,financialplanning,debtfreejourney,debtfreeuk'",b'',"b'Tempted to get cash out with your credit card when your bank balance is a little low? It could mean an unexpected fee.\n\nIt\xe2\x80\x99s called a cash advance fee and can be charged if you use your credit card in other situations too. For example:\n- Gambling (including buying your lottery ticket online)\n- Transferring money from your credit card into your bank account\n- Topping up your mobile phone\n- Buying foreign currency\n- Paying your mortgage\n\nTry to avoid these if you want to stop your credit card debt growing. \n\nIf you\xe2\x80\x99re not sure when you might be charged for a certain type of payment, just ask. That\xe2\x80\x99s what we\xe2\x80\x99re here for. \n\nYou can also find more helpful info on our website - see link in bio. \n.\n.\n.\n.\n.\n\n#NatWest #CreditCard #CreditCards #CreditCardDebt #DebtFreeGoals #MoneyTips #MoneyManagement #MoneyPositive #FinancialPlanning #DebtFreeJourney #DebtFreeUK \n.\n.\nhttps://personal.natwest.com/personal/credit-cards/existing-customers/fees-and-charges.html?extcam=SCM_INST_ORG'",0,0,27,17,,,
CH7dy27AZJ_,natwest,2020-11-23 10:00:46.000000,no,False,"b'natwest,mobilebanking,safergambling,safergamblingweek,gamblingblock,gambling,addiction,gamcare,gamstop,gamblingaddiction,gambleresponsibly'",b'',"b""Are you worried you're gambling a little too much?\nIf you are, you can use our app to block payments to gambling sites.\n\xc2\xa0\nYou're also not alone. Lockdown has seen some gamblers take more risks. Especially young people. In fact, according to the Gambling Commission, regular gamblers aged 18-34 are more likely than average to increase the time and money they spend on gambling. \n\nIf you want help to slow down your gambling, you can block those payments on both your NatWest credit card and debit card. As soon as you switch off gambling in the app, you can't place any bets. And if you think you might be tempted and switch it back on straight away, there\xe2\x80\x99s a built-in 48-hour cooling-off period. This means you\xe2\x80\x99ll have to wait two days after unblocking before you gamble again. See link in bio for more info.\n\nIf you're concerned about your gambling, there are charities like GamCare that can help. There\xe2\x80\x99s also more on our website about how we can help if you\xe2\x80\x99re worried about gambling.\n\nApp available to customers aged 11+ with compatible iOS and Android devices and a UK or international mobile number in specific countries.\n.\n.\n.\n.\n.\n#NatWest #MobileBanking #SaferGambling #SaferGamblingWeek #GamblingBlock #Gambling #Addiction #GamCare #GamStop #GamblingAddiction #GambleResponsibly \n.\n.\nhttps://personal.natwest.com/personal/life-moments/Struggling-financially/managing-your-gambling.html?extcam=SCM_INST_ORG""",0,0,29,0,,,
CH7QEYIDO2d,natwest,2020-11-23 08:00:50.000000,no,False,"b'natwest,creditcard,creditcards,creditcarddebt,debtfreegoals,moneytips,moneymanagement,moneypositive,financialplanning,debtfreejourney,debtfreeuk'",b'',"b'Avoiding unnecessary charges on your credit card is essential if you want to stop your debt growing. There\xe2\x80\x99s a \xc2\xa312 fee if you go \xc2\xa312 or more over your credit limit at any point during your monthly statement period. That could soon rack up if you let it happen a few times, even if you\xe2\x80\x99re only spending a little over your limit.\n\nIt\xe2\x80\x99s easy to keep tabs on how much you\xe2\x80\x99re spending. Check your credit card balance regularly in the mobile app and make sure we have an up to date mobile number for you. That way, we can text you as soon as you reach 95% of your credit limit. \n\nApp eligibility criteria apply.\nFor more on other credit card fees that could affect you, see link in bio. \n.\n.\n.\n.\n.\n#NatWest #CreditCard #CreditCards #CreditCardDebt #DebtFreeGoals #MoneyTips #MoneyManagement #MoneyPositive #FinancialPlanning #DebtFreeJourney #DebtFreeUK\n.\n.\nhttps://personal.natwest.com/personal/credit-cards/existing-customers/fees-and-charges.html?extcam=SCM_INST_ORG'",0,0,26,0,,,
CH5GvY_gxun,natwest,2020-11-22 12:00:50.000000,no,False,"b'natwest,blackfriday,blackfridaysale,blackfriday2020,blackfridaydeals,blackfridayshopping,moneytips,budgeting,budgetingtips,moneysaver,moneysavingtips,frugal,frugalliving'",b'',b'Make a list of everyone you need to buy a gift for this Christmas then search for the best deals online ahead of time. You could also compare discounts on similar items from different brands or use price comparison sites to make sure you\xe2\x80\x99re getting value. Budgeting and planning could help you stop making impulse buys.\n.\n.\n.\n.\n.\n#NatWest #BlackFriday #BlackFridaySale #BlackFriday2020 #BlackFridayDeals #BlackFridayShopping #MoneyTips #Budgeting #BudgetingTips #MoneySaver #MoneySavingTips #Frugal #FrugalLiving',0,0,32,0,,,
