shortcode,username,date_utc,is_video,is_sponsored,hashtags,mentions,caption,video_view_count,video_length,likes,comments,likes+comments,location_name,location_latlongCEyTKIDoqwf,natwest,2020-09-06 07:00:29.000000,no,False,"b'natwest,students,studentlife,uni,unilife,freshers,studentuk,uniuk,freshersuk,managingmoney,moneyadvice,financialwellbeing,moneymanagment,moneyhelp,renting,studenthousing,movinghouse,studentliving'",b'',"b'There are a lot of things to think about when you\xe2\x80\x99re renting a house at\xc2\xa0uni\xc2\xa0or\xc2\xa0moving\xc2\xa0into\xc2\xa0student accommodation. You need to understand your bills, work out your budget and\xc2\xa0know your rights. We\xe2\x80\x99ve pulled together a handy guide that will walk you through the basics. To read it, see link in bio.  Photo by Dean Mitchell\n.\n.\n.\n.\n.\n#NatWest\xc2\xa0#Students\xc2\xa0#Studentlife\xc2\xa0#Uni\xc2\xa0#UniLife\xc2\xa0#Freshers\xc2\xa0#StudentUK\xc2\xa0#UniUK\xc2\xa0#FreshersUK\xc2\xa0#ManagingMoney\xc2\xa0#MoneyAdvice\xc2\xa0#FinancialWellbeing\xc2\xa0#MoneyManagment\xc2\xa0#MoneyHelp\xc2\xa0#Renting #StudentHousing #MovingHouse #StudentLiving\n.\n.\nhttps://personal.natwest.com/personal/life-moments/renting-guide.html?extcam=SCM_INST_ORG'",0,0,32,1,,,
CEwsL69j1Re,natwest,2020-09-05 16:00:42.000000,no,False,"b'natwest,students,studentlife,uni,unilife,freshers,studentbanking,studentbank,studentaccount,freebies,studentfreebies,studentdiscount,educationuk,studentuk,uniuk,freshersuk,movienight,amazonprime,amazon,amazonprimestudent,nationalexpress,travel,tastecard,eatingout,eatout,diningout'",b'',"b""Apply today and get a \xc2\xa3500 interest-free student overdraft in your first term, with the option to increase it up to \xc2\xa32,000. You'll also get a contactless Visa debit card, be able to do all your banking via our app, and choose from one of three great offers to help make your money stretch. To open an account see link in bio.\n\nOffer and account eligibility criteria apply. You must be 18+ to apply for an overdraft. App criteria apply.\n.\n.\n.\n.\n.\n#NatWest #Students #Studentlife #Uni #Unilife #Freshers #StudentBanking #StudentBank #StudentAccount #Freebies #StudentFreebies #StudentDiscount #EducationUK #StudentUK #UniUK #FreshersUK #MovieNight #AmazonPrime #Amazon #AmazonPrimeStudent #NationalExpress #Travel #TasteCard #EatingOut #EatOut #DiningOut\n.\n.\nhttps://personal.natwest.com/personal/current-accounts/student_account.html?extcam=SCM_INST_ORG""",0,0,24,1,,,
CEwNSL_lrn7,natwest,2020-09-05 11:30:45.000000,yes,False,"b'takefive,scamming,scams,scammers,scamalert,fraud,beware,messenger,friendsagainstscams,actionfraud,stayalert,fraudalert,cybercrime,protectyourself'",b'',"b""Does your mate really need help? Scammers are cloning Facebook profiles and sending messages posing as your real friends. You'll suddenly get a message out of the blue, where the 'friend' claims they need money urgently. \n\nIf this happens to you, be suspicious. Never send any money to a Facebook friend unless you\xe2\x80\x99ve checked with them personally by calling on a number you know is really theirs.\xe2\x80\x8b\n\nSee link in bio for some other scams to watch out for.\xe2\x80\x8b\n.\xe2\x80\x8b\n.\xe2\x80\x8b\n.\xe2\x80\x8b\n.\xe2\x80\x8b\n.\xe2\x80\x8b\n#TakeFive #Scamming #Scams #Scammers #ScamAlert #Fraud #Beware #Messenger #FriendsAgainstScams #ActionFraud #StayAlert #FraudAlert #CyberCrime #ProtectYourself\xe2\x80\x8b\n.\xe2\x80\x8b\n.\xe2\x80\x8b\nhttps://personal.natwest.com/personal/fraud-and-security/fraud-guide.html\xe2\x80\x8b?extcam=SCM_INST_ORG""",510,29.033,21,1,,,
CEvuYrZDt3P,natwest,2020-09-05 07:00:40.000000,no,False,"b'natwest,students,studentlife,uni,unilife,freshers,studentbanking,studentbank,studentaccount,ecoliving,ecofriendly,ecolivingtips,paperless,sustainablelifestyle'",b'',"b'We know you care about the planet and that\xe2\x80\x99s why all our Student accounts are paperless. Not only is it speedy and convenient, but it also helps reduce paper waste. Use the app and you can view all your statements and other mail in your Mailbox. \n\nTo open an account see link in bio. Account and app criteria apply.\n.\n.\n.\n.\n.\n#NatWest #Students #Studentlife #Uni #Unilife #Freshers #StudentBanking #StudentBank #StudentAccount\n#ecoliving #ecofriendly #ecolivingtips #paperless #sustainablelifestyle\n.\n.\nhttps://personal.natwest.com/personal/current-accounts/student_account.html?extcam=SCM_INST_ORG'",0,0,36,2,,,
CEYjMXWou0c,natwest,2020-08-27 07:00:20.000000,no,False,"b'natwest,students,studentlife,uni,unilife,freshers,studentbanking,studentbank,studentaccount,budgeting,makeyourmoneystretch,spendcategories,setabudget,mobilebanking,freebies,studentfreebies,managingmoney,financialplanningtips,moneyadvice,financialwellbeing,moneymanagment,moneyhelp,frugal,savingmoney,frugallife,frugalliving,budgettips'",b'',"b'To help you make your money last while you\xe2\x80\x99re at uni, try the budgeting feature in our app. You can set budgets for everything from groceries, shopping and eating out. To apply for NatWest Student account see link in bio.\nAccount and app criteria apply.\n.\n.\n.\n.\n.\n#NatWest\xc2\xa0#Students\xc2\xa0#Studentlife\xc2\xa0#Uni\xc2\xa0#Unilife\xc2\xa0#Freshers\xc2\xa0#StudentBanking\xc2\xa0#StudentBank\xc2\xa0#StudentAccount\xc2\xa0#Budgeting\xc2\xa0#MakeYourMoneyStretch\xc2\xa0#SpendCategories\xc2\xa0#SetABudget\xc2\xa0#MobileBanking\xc2\xa0#Freebies\xc2\xa0#StudentFreebies\xc2\xa0#ManagingMoney\xc2\xa0#FinancialPlanningTips\xc2\xa0#MoneyAdvice\xc2\xa0#FinancialWellbeing\xc2\xa0#MoneyManagment\xc2\xa0#MoneyHelp\xc2\xa0#Frugal\xc2\xa0#SavingMoney\xc2\xa0#FrugalLife\xc2\xa0#FrugalLiving\xc2\xa0#BudgetTips\n.\n.\nhttps://personal.natwest.com/personal/current-accounts/student_account.html?extcam=SCM_INST_ORG'",0,0,61,27,,,
CEWjR7toXvD,natwest,2020-08-26 12:22:45.000000,yes,False,"b'natwest,bankingmyway,access,accessibility,accessiblebanking,deafcommunity,bsl,visuallyimpaired,disability,partiallysighted,disabilityawareness,inclusion,disabilityinclusion,invisibledisability'",b'signvideo',"b'Do you need extra help with your banking\xc2\xa0due to\xc2\xa0a disability or health condition?\xc2\xa0If so,\xc2\xa0Banking My Way can help. Tell us how we\xc2\xa0can\xc2\xa0tailor our services to suit you. Like providing you with braille or audio CD bank statements, or alternatively making sure you can bank using our Sign Language translation service, @signvideo.\n\nJust tell us online, by phone, or in branch about your circumstances. Tell us once, and we will\xc2\xa0share\xc2\xa0the information securely with\xc2\xa0our colleagues. This means that\xc2\xa0whenever you contact us,\xc2\xa0you won\xe2\x80\x99t\xc2\xa0have to repeat yourself\xc2\xa0and\xc2\xa0will\xc2\xa0always get the service that\xe2\x80\x99s right for you.\xc2\xa0To find out more and tell us about your needs, see link in bio.\n.\n.\n.\n.\n.\n#NatWest #BankingMyWay #Access #Accessibility #AccessibleBanking #DeafCommunity #BSL #VisuallyImpaired #Disability #PartiallySighted #DisabilityAwareness #Inclusion #DisabilityInclusion #InvisibleDisability\n.\n.\nhttps://personal.natwest.com/personal/accessibility/banking-my-way.html?extcam=SCM_INST_ORG'",723,18.033,41,26,,,
CETZpxdIlBf,natwest,2020-08-25 07:00:46.000000,no,False,"b'natwest,students,studentlife,uni,unilife,freshers,studentbanking,studentbank,studentaccount,studentspending,studentfinance,educationcost,budgeting,makeyourmoneystretch,spendcategories,setabudget,mobilebankingapp'",b'',"b'To help you make your money stretch while you\xe2\x80\x99re at uni, try the budgeting feature in our app. You can set budgets for everything from groceries, shopping and of course, eating out on the way home. Does food ever taste better? To apply for a NatWest Student account see link in bio.\n\nAccount and app criteria apply.\n\xe2\x80\xa2\n\xe2\x80\xa2\n\xe2\x80\xa2\n\xe2\x80\xa2\n\xe2\x80\xa2\n#NatWest #Students #StudentLife #Uni #UniLife #Freshers #StudentBanking #StudentBank #StudentAccount #StudentSpending #StudentFinance #EducationCost #Budgeting #MakeYourMoneyStretch #SpendCategories #SetABudget #MobileBankingApp\n\xe2\x80\xa2\n\xe2\x80\xa2\nhttps://personal.natwest.com/personal/current-accounts/student_account.html?extcam=SCM_INST_ORG'",0,0,32,5,,,
CERyra5jAsB,natwest,2020-08-24 16:00:58.000000,no,False,"b'natwesthomegoals,homegoals,homebuyertips,financialplanning,homebuying,saving,savinggforahouse,moneytips,savingtips,moneysavingtips,homeownershipgoals,moneymanagement,budgettips,mobilebanking'","b'dzeninaphoto,pexels'","b'Are you getting the best deal on your gas and electricity? Switch to a\xc2\xa0lower cost provider and the savings could go towards your deposit. If you already have a great deal, there\xe2\x80\x99s other ways you can save money, like\xc2\xa0turning off devices that\xe2\x80\x99re on standby mode or switching to super-efficient LED lightbulbs.\nFollow #NatWestHomeGoals for more tips. \n\nPhoto by @dzeninaphoto via @pexels.\n.\n.\n.\n.\n.\n#HomeGoals #HomeBuyerTips #FinancialPlanning #HomeBuying #Saving #SavinggForAHouse #MoneyTips #SavingTips #MoneySavingTips #HomeOwnershipGoals #MoneyManagement #BudgetTips #MobileBanking'",0,0,22,1,,,
CERXNsOjAOb,natwest,2020-08-24 12:00:59.000000,no,False,"b'homegoals,homebuyertips,financialplanning,homebuying,saving,savinggforahouse,moneytips,savingtips,moneysavingtips,homeownershipgoals,moneymanagement,budgettips,mobilebanking'",b'',b'Working out a budget is one of the best ways to save for a deposit on your first home. To get started why not set up a budget using the Spending feature in the NatWest app? It could help you avoid\xc2\xa0spontaneous splurges and keep you focussed on building those savings.\xc2\xa0\nYou must be aged 16+ to view\xc2\xa0Spending. Only available for Personal and\xc2\xa0Premier Current accounts. App criteria apply.\n\nSee link in bio for how to set up a budget in our app.\n.\n.\n.\n.\n.\n#HomeGoals #HomeBuyerTips #FinancialPlanning #HomeBuying #Saving #SavinggForAHouse #MoneyTips #SavingTips #MoneySavingTips #HomeOwnershipGoals #MoneyManagement #BudgetTips #MobileBanking\n.\n.\nhttps://personal.natwest.com/personal/banking-with-natwest/natwest-app/features/spending-and-budgets.html?extcam=SCM_INST_ORG',0,0,22,3,,,
CEQ04GqD5TB,natwest,2020-08-24 07:00:56.000000,no,False,"b'natwesthomegoals,homegoals,homebuyertips,financialplanning,homebuying,saving,savinggforahouse,moneytips,savingtips,moneysavingtips,homeownershipgoals'",b'pexels',"b'It can feel pretty daunting saving for a deposit for your first home. This week we\xe2\x80\x99re sharing some tips to help you build your savings and turn your dream home into a reality. One of the easiest ways to save is by making lifestyle changes. For example,\xc2\xa0trade\xc2\xa0takeaways for DIY meals and when you do your weekly food shop, try swapping pricier branded goods for supermarket own.\n\nFor more tips use #NatWestHomeGoals.\n\nPhoto by August de Richelieu via @pexels.\n.\n.\n.\n.\n.\n#HomeGoals #HomeBuyerTips #FinancialPlanning #HomeBuying #Saving #SavinggForAHouse #MoneyTips #SavingTips #MoneySavingTips #HomeOwnershipGoals'",0,0,31,5,,,
CEMpFsdn8bv,natwest,2020-08-22 16:00:58.000000,no,False,"b'dreambigger,natwest,entrepreneurship,ownyourlife,careerdevelopment,dreamersanddoers,dreamjobmakers,mindsetiseverything,buildyourbusiness,herbusiness,upskill,aspiringentrepreneur,womeninbusinessuk,youngminds,upskilling,onlineclasses,freeclass,welsh,welshlanguage,welshteaching,wales,cardiff,swansea,newport,wrexham,buckley,tonypandy,brigend,barry,llanelli'",b'',"b""[Click \xe2\x80\x98more\xe2\x80\x99 for English translation]\xe2\x80\x8b\nSiaradwyr Cymraeg! Yr wythnos yma rydym yn rhedeg ein rhaglen Anelu\xe2\x80\x99n Uwch trwy gyfrwng y gymraeg ar gyfer pobl ifanc rhwng yr oedran 16-18. Yn dechrau gyda 'cyflwyniad i Entrepreneuriaeth' sydd yn cychwyn am 11yb ar 25 Awst. Y mae Entrepreneuriaeth neu dechrau busnes eich hun yn boblogaidd. Mae\xe2\x80\x99n cymryd penderfyniad, awydd, y meddylfryd cywir ac wrth gwrs, syniad gwych. I gofrestru gwelwch y linc yn y bio.\n.\nCalling Welsh speakers! This week we're running our Dream Bigger programme in Welsh for Welsh-speaking young women aged 16-18. The first class \xe2\x80\x98Introduction to Entrepreneurship\xe2\x80\x99 starts at 11am on 25th August. Entrepreneurship or starting your own business is something lots of people do. It takes drive, the right mindset and a great idea. To sign up see link in bio.\xe2\x80\x8b\n.\n.\xe2\x80\x8b\n.\xe2\x80\x8b\n.\xe2\x80\x8b\n.\xe2\x80\x8b\n#DreamBigger #NatWest #Entrepreneurship #OwnYourLife #CareerDevelopment #DreamersAndDoers #DreamJobMakers #MindsetIsEverything #BuildYourBusiness #HerBusiness #UpSkill #AspiringEntrepreneur #WomenInBusinessUK #YoungMinds #UpSkilling #OnlineClasses #FreeClass #Welsh #WelshLanguage #WelshTeaching #Wales #Cardiff #Swansea #Newport #Wrexham #Buckley #Tonypandy #Brigend #Barry #Llanelli\n.\xe2\x80\x8b\n.\xe2\x80\x8b\nhttps://www.eventbrite.co.uk/o/anelun-uwch-natwest-30730671364""",0,0,35,2,,,
CEMNnkoliRU,natwest,2020-08-22 12:00:56.000000,no,False,"b'dreambigger,natwest,entrepreneurship,ownyourlife,careerdevelopment,dreamersanddoers,dreamjobmakers,mindsetiseverything,buildyourbusiness,herbusiness,upskill,aspiringentrepreneur,womeninbusinessuk,youngminds,upskilling,onlineclasses,freeclass,welsh,welshlanguage,welshteaching,wales,cardiff,swansea,newport,wrexham,buckley,tonypandy,bridgend,barry,llanelli'",b'',"b'[Click \xe2\x80\x98more\xe2\x80\x99 for English translation]\xe2\x80\x8b\nAthrawon Cymru, allech chi annog eich myfyrwyr i gofrestru am sesiynau Anelu\xe2\x80\x99n Uwch yr wythnos yma. Mae Anelu\xe2\x80\x99n Uwch yn cyfres o gweithdau digidol sydd yn cyflwyniad i\xe2\x80\x99r ymddygiadau, meddylfryd a sgiliau sydd angen i llwyddo yn y byd Gwaith. Mae yna tair sesiwn i gyd gyda llawlyfr o weithgareddau. Mae\xe2\x80\x99r sesiynau yn rhedeg 25/26/27 Awst. Am fwy o wybodaeth gwelwch y linc yn y bio. \n.\xe2\x80\x8b\nIf you\xe2\x80\x99re a teacher in Wales, encourage your students to sign up to Dream Bigger this week. It\xe2\x80\x99s a series of free online interactive classes that introduces young women to the behaviours, skills and mindset they need to get ahead in the world of work. There are three classes in total and each comes with a workbook. Classes run on the 25th, 26th and 27th August. For more info see link in bio.\xe2\x80\x8b\n.\xe2\x80\x8b\n.\xe2\x80\x8b\n.\xe2\x80\x8b\n.\xe2\x80\x8b\n.\xe2\x80\x8b\n#DreamBigger #NatWest #Entrepreneurship #OwnYourLife #CareerDevelopment #DreamersAndDoers #DreamJobMakers #MindsetIsEverything #BuildYourBusiness #HerBusiness #UpSkill #AspiringEntrepreneur #WomenInBusinessUK #YoungMinds #UpSkilling #OnlineClasses #FreeClass #Welsh #WelshLanguage #WelshTeaching #Wales #Cardiff #Swansea #Newport #Wrexham #Buckley #Tonypandy #Bridgend #Barry #Llanelli\n.\xe2\x80\x8b\n.\xe2\x80\x8b\nhttps://www.eventbrite.co.uk/o/anelun-uwch-natwest-30730671364'",0,0,34,1,,,
CELrOGvDH3I,natwest,2020-08-22 07:00:21.000000,no,False,"b'dreambigger,natwest,entrepreneurship,ownyourlife,careerdevelopment,dreamersanddoers,dreamjobmakers,mindsetiseverything,buildyourbusiness,herbusiness,upskill,aspiringentrepreneur,womeninbusinessuk,youngminds,upskilling,onlineclasses,freeclass,welsh,welshlanguage,welshteaching,wales,cardiff,swansea,newport,wrexham,buckley,tonypandy,bridgend,barry,llanelli'",b'',"b'[Click \xe2\x80\x98more\xe2\x80\x99 for English translation]\xe2\x80\x8b\nOs ydych chi rhwng yr oedran 16-18 mlwydd oed ac yn siarad cymraeg, mae yna cyfle arbennig i gofrestru am sesiynau Anelu\xe2\x80\x99n Uwch sydd yn rhedeg am UN WYTHNOS UN UNIG yr wythnos yma. Mae Anelu\xe2\x80\x99n Uwch yn cyfres o gweithdau digidol AM DDIM a fydd yn eich helpu i deall mwy am y cyfleoedd sydd ar gael yn eich dyfodol, entrepreneuriaeth ac hefyd y sgiliau, yr ymddygiadau ac yn hefyd y meddylfryd sydd angen i llwyddo yn yr gyrfa a ddewiswyd. Mi fydd y sesiwn gyntaf yn cychwyn am 11yb ar 25 Awst. I gofrestru gwelwch y linc yn ein bio.\n.\nIf you\xe2\x80\x99re a young Welsh-speaking woman aged between 16-18, then sign up for Dream Bigger this week which is running, for one-week only, in Welsh! Dream Bigger is a series of FREE online classes that\xe2\x80\x99ll help you explore your career options, introduce you to the idea of entrepreneurship and explain what skills, behaviours and mindsets lead to career success. The first class starts at 11am on 25th August. To book your place see link in bio.\xe2\x80\x8b\n.\xe2\x80\x8b\n.\xe2\x80\x8b\n.\xe2\x80\x8b\n.\xe2\x80\x8b\n.\xe2\x80\x8b\n#DreamBigger #NatWest #Entrepreneurship #OwnYourLife #CareerDevelopment #DreamersAndDoers #DreamJobMakers #MindsetIsEverything #BuildYourBusiness #HerBusiness #UpSkill #AspiringEntrepreneur #WomenInBusinessUK #YoungMinds #UpSkilling #OnlineClasses #FreeClass #Welsh #WelshLanguage #WelshTeaching #Wales #Cardiff #Swansea #Newport #Wrexham #Buckley #Tonypandy #Bridgend #Barry #Llanelli\n.\xe2\x80\x8b\n.\xe2\x80\x8b\nhttps://www.eventbrite.co.uk/o/anelun-uwch-natwest-30730671364\xe2\x80\x8b'",0,0,35,4,,,
CEKENJAj1QQ,natwest,2020-08-21 16:00:12.000000,no,False,"b'natwest,students,studentlife,uni,unilife,freshers,studentbanking,studentbank,studentaccount,studentspending,studentfinance,educationcost,budgeting,makeyourmoneystretch,spendcategories,setabudget,mobilebankingapp'",b'',"b'When your student finance lands in your account, you\xe2\x80\x99ll want to make it last till the end of term. With the NatWest app, you can set a budget for every category from groceries and shopping to health and beauty. It could help you make sure you don\xe2\x80\x99t spend too much on  food shops, takeaways, or online clothes hauls. For more help budgeting see link in bio. Account and app criteria apply.\n\xe2\x80\xa2\n\xe2\x80\xa2\n\xe2\x80\xa2\n\xe2\x80\xa2\n\xe2\x80\xa2\n#NatWest #Students #Studentlife #Uni #Unilife #Freshers #StudentBanking #StudentBank #StudentAccount #Studentspending #Studentfinance #EducationCost #Budgeting #MakeYourMoneyStretch #SpendCategories #SetABudget #MobileBankingApp \n\xe2\x80\xa2\n\xe2\x80\xa2\nhttps://personal.natwest.com/personal/life-moments/students-and-graduates/Student-budgeting-Natwest.html?extcam=SCM_INST_ORG'",0,0,23,1,,,
CEJGaHWjcJ1,natwest,2020-08-21 07:00:12.000000,no,False,"b'natwest,students,studentlife,uni,unilife,freshers,studentbanking,studentbank,studentaccount,educationuk,studentuk,uniuk,freshersuk,mobilebanking,mobilebankingapp,bankingapp,managingmoney,financialplanningtips,moneyadvice,financialwellbeing,moneymanagment,moneyhelp,frugal,savingmoney,frugallife,frugalliving,budgettips'",b'',"b""Bank with the best and do it all from your phone. Open a NatWest Student account and you\xe2\x80\x99ll be able to bank via our app. It takes minutes to open an account and you\xe2\x80\x99ll get to choose one of three great offers; an Amazon Prime Student Membership; a National Express Coachcard or a tastecard.\n\n* Voted Britain's Best Online Student Banking Provider 'YourMoney.com Awards' 2019. To open an account see link in bio. Offer and account eligibility criteria apply. App criteria apply.\n\xe2\x80\xa2\n\xe2\x80\xa2\n\xe2\x80\xa2\n\xe2\x80\xa2\n\xe2\x80\xa2\n#NatWest #Students #Studentlife #Uni #Unilife #Freshers #StudentBanking #StudentBank #StudentAccount #EducationUK #StudentUK #UniUK #FreshersUK\n#MobileBanking #MobileBankingApp #BankingApp #ManagingMoney #FinancialPlanningTips #MoneyAdvice #FinancialWellbeing #MoneyManagment #MoneyHelp #Frugal #SavingMoney #FrugalLife #FrugalLiving #BudgetTips\n\xe2\x80\xa2\n\xe2\x80\xa2\nhttps://personal.natwest.com/personal/current-accounts/student_account.html?extcam=SCM_INST_ORG""",0,0,27,3,,,
CEGhrZDDRga,natwest,2020-08-20 07:00:53.000000,yes,False,"b'natwest,natwestmobileapp,moneytips,moneyhabits,moneymanagement,appsecurity,mobilebanking,touchid,fingerprintlogin,biometrics'",b'',"b'Not a fan of remembering passcodes? Give fingerprint login a try on your NatWest mobile app. Simple to set up, super secure and giving you near instant access to your accounts. Link in bio for more info.\xe2\x80\x8b\nCriteria apply.\xe2\x80\x8b\n.\xe2\x80\x8b\n.\xe2\x80\x8b\n.\xe2\x80\x8b\n.\xe2\x80\x8b\n.\xe2\x80\x8b\n#NatWest #NatWestMobileApp #MoneyTips #MoneyHabits #MoneyManagement #AppSecurity #MobileBanking #TouchID #FingerprintLogin #Biometrics\xe2\x80\x8b\n.\xe2\x80\x8b\n.\xe2\x80\x8b\nhttps://personal.natwest.com/personal/banking-with-natwest/how-to/set-up-fingerprint-login.html?extcam=SCM_INST_ORG'",560,30.666,17,2,,,
CEE6mznqevf,natwest,2020-08-19 16:00:07.000000,no,False,"b'natwest,students,studentlife,uni,unilife,freshers,studentbanking,studentbank,studentaccount,studentuk,uniuk,freshersuk,freshersweek,studentdiscount,studentuk,makeyourmoneystretch,studentdeals'","b'myunidays,studentbeans'","b'\xe2\x80\x9cUse student discount for everything! Sign up for @myunidays and @studentbeans and take your student card everywhere.\xe2\x80\x9d\n\nAnna, University of Leeds\n\nWant to know what student life costs in your future uni town? See link in bio for our 2020 Student Living Index.\n.\n.\n.\n.\n.\n#NatWest #Students #Studentlife #Uni #Unilife #Freshers #StudentBanking #StudentBank #StudentAccount #StudentUK #UniUK #FreshersUK #FreshersWeek #StudentDiscount #StudentUK #MakeYourMoneyStretch #StudentDeals\n.\n.\nhttps://personal.natwest.com/personal/life-moments/students-and-graduates/student-living-index.html?extcam=SCM_INST_ORG'",0,0,30,1,,,
CEEfIu2qqO2,natwest,2020-08-19 12:00:05.000000,no,False,"b'natwest,students,studentlife,uni,unilife,freshers,studentbanking,studentbank,studentaccount,studentuk,makeyourmoneystretch,studenttips,studentuk,uniuk,freshersuk,frugallife,frugalliving'",b'',"b'\xe2\x80\x9cBe prepared to walk a mile to get your groceries. Union shops on campus cam sometimes be a bit of a rip off.\xe2\x80\x9d\n\nMuhammad Hamza Yousuf, Royal Holloway\n\nTo find out what students in your uni town typically spend on food, check out our 2020 Student Living Index. See link in bio.\n.\n.\n.\n.\n.\n#NatWest #Students #Studentlife #Uni #Unilife #Freshers #StudentBanking #StudentBank #StudentAccount #StudentUK #MakeYourMoneyStretch #StudentTips #StudentUK #UniUK #FreshersUK #FrugalLife #FrugalLiving\n.\n.\nhttps://personal.natwest.com/personal/life-moments/students-and-graduates/student-living-index.html?extcam=SCM_INST_ORG'",0,0,26,1,,,
CEEDrBzK_w6,natwest,2020-08-19 08:00:06.000000,no,False,"b'natwest,students,studentlife,uni,unilife,freshers,studentbanking,studentbank,studentaccount,studentuk,makeyourmoneystretch,studenttips,studentuk,uniuk,freshersuk,studenthouse,studentstyle'",b'',"b'\xe2\x80\x9cBuy uni essentials like cutlery, pots and decoration from charity shops!\xe2\x80\x9d\n\nAmanda, University of Warwick\n\nTo learn more about how much student life costs, look up your uni town in our 2020 Student Living Index. See link in bio.\n.\n.\n.\n.\n.\n#NatWest #Students #Studentlife #Uni #Unilife #Freshers #StudentBanking #StudentBank #StudentAccount #StudentUK #MakeYourMoneyStretch #StudentTips #StudentUK #UniUK #FreshersUK #StudentHouse #StudentStyle\n.\n.\nhttps://personal.natwest.com/personal/life-moments/students-and-graduates/student-living-index.html?extcam=SCM_INST_ORG'",0,0,27,3,,,
CD_xF0XIhGa,natwest,2020-08-17 16:00:46.000000,no,False,"b'moneysensemondays,wearewhatwedo,natwest,moneysense,mymoneysense,natwestmoneysense,homelearning,learningfromhome,kidsathome,learningisfun,learnathome,kidsactivitiesathome,homelearningfun,homelearningideas'",b'',"b'Is your teenager wanting to earn a little bit of extra cash on the side? While there\xe2\x80\x99s plenty of legitimate ways to earn a few quid, some teens unknowingly become money mules. Our handy guide tells them what to look out for and could help you recognise dodgy schemes. Suitable for teens aged 12-16 years.\xe2\x80\x8b\n\nTo download the guide, see link in bio.\xe2\x80\x8b\n.\xe2\x80\x8b\n.\xe2\x80\x8b\n.\xe2\x80\x8b\n.\xe2\x80\x8b\n. \xe2\x80\x8b\n#MoneySenseMondays #WeAreWhatWeDo #NatWest #MoneySense #MyMoneySense #NatWestMoneySense #HomeLearning #LearningFromHome #KidsAtHome #LearningIsFun #LearnAtHome #KidsActivitiesAtHome #HomeLearningFun #HomeLearningIdeas\xe2\x80\x8b\n.\xe2\x80\x8b\n.\xe2\x80\x8b\nhttps://natwest.mymoneysense.com/media/5763/12_16_money_mules_fact_sheet.pdf\xe2\x80\x8b'",0,0,24,14,,,
CD_WHIGoX6f,natwest,2020-08-17 12:05:01.000000,no,False,"b'moneysensemondays,wearewhatwedo,natwest,moneysense,mymoneysense,natwestmoneysense,homelearning,learningfromhome,kidsathome,learningisfun,learnathome,kidsactivitiesathome,homelearningfun,homelearningideas'",b'',"b'Are your kids constantly losing money while they\xe2\x80\x99re out and about? If you\xe2\x80\x99re always shelling out replacement pocket money, it can really take its toll on your finances. To help you, we\xe2\x80\x99ve suggested a few easy ways they can keep their money safe. Suitable for children aged 8-12. \xe2\x80\x8b\n\nTo read more, see link in bio.\xe2\x80\x8b\n.\xe2\x80\x8b\n.\xe2\x80\x8b\n.\xe2\x80\x8b\n.\n.\xe2\x80\x8b\n#MoneySenseMondays #WeAreWhatWeDo #NatWest #MoneySense #MyMoneySense #NatWestMoneySense #HomeLearning #LearningFromHome #KidsAtHome #LearningIsFun #LearnAtHome #KidsActivitiesAtHome #HomeLearningFun #HomeLearningIdeas\xe2\x80\x8b\n.\xe2\x80\x8b\n.\xe2\x80\x8b\nhttps://natwest.mymoneysense.com/media/4599/8_12_keeping_money_safe_activities_nw.pdf'",0,0,31,1,,,
