shortcode,username,date_utc,is_video,is_sponsored,hashtags,mentions,caption,video_view_count,video_length,likes,comments,likes+comments,location_name,location_latlongB738ZZCIpKJ,northwesternmutual,2020-01-28 18:54:29.000000,no,False,"b'repost,spendlifeliving,sponsoredad,linkinbio'","b'nickandgrant,northwesternmutual,northwesternmutual'","b'#Repost @nickandgrant: Discussing finances has always been a key part in keeping our relationship on track. Whether it was planning for our wedding or planning for our next vacation, we are firm believers that everyone should gain control of their money and take their financial stability seriously. That is why in 2020, we are teaming up again with\xc2\xa0@northwesternmutual\xc2\xa0to give you an update on our progress and inspire others to set a plan for their own goals and dreams today!:smiling_face_with_smiling_eyes:\n.\nIn 2020, our goals are to travel more, build a home and grow our family. Our advisor showed us that by making a couple of changes on how we manage our finances, we can achieve our dreams and truly be able to\xc2\xa0#spendlifeliving\xc2\xa0If you\xe2\x80\x99re looking to start the New Year feeling confident about making a plan \xe2\x80\x94 and sticking to it \xe2\x80\x94 we encourage you to meet with someone! Give\xc2\xa0@northwesternmutual\xc2\xa0a try because they not only helped us financially, but also helped us have the tough conversations that ultimately strengthened our relationship. We cannot wait to see where we end up at the end of this year, and we\xe2\x80\x99re confident that with the tools and guidance we now have, our goals this year will be ones that we see through! What goals are you working toward this year? Let us know in the comments below!:raising_hands_light_skin_tone:#sponsoredad *\xe2\x81\xa3\n*\xe2\x81\xa3\n*\xe2\x81\xa3\nSee our #LinkInBio to get started!'",0,0,179,3,,,
B7tVpmPn9PC,northwesternmutual,2020-01-24 16:04:29.000000,yes,False,b'linkinbio',b'',b'They made an offer! See our #LinkInBio to make sure benefits and other life perks don\xe2\x80\x99t fly under the radar.',3320,18.05,137,2,,,
B7bNMgXHOOg,northwesternmutual,2020-01-17 15:03:36.000000,yes,False,b'linkinbio',b'',"b'Yes, you can travel with small children. For the best cities to navigate nap times, find restaurants, and schedule down time, go to #LinkInBio.'",29075,19.416,211,5,,,
B7JrzkvHQlX,northwesternmutual,2020-01-10 19:44:27.000000,no,False,b'linkinbio',b'',"b'If going for a new job is part of your 2020 dreams, planning is key. To make an exit that benefits you both financially and professionally, see our #LinkInBio.'",0,0,152,1,,,
B7D8h6lHwK7,northwesternmutual,2020-01-08 14:15:08.000000,no,False,"b'linkinbio,spendlifeliving'",b'',"b'This spring break, think beyond the theme park. See our #LinkInBio for 4 unexpected trips your family will always remember. #SpendLifeLiving'",0,0,205,3,,,
B6-1IJmn3Zh,northwesternmutual,2020-01-06 14:34:15.000000,no,False,"b'linkinbio,spendlifeliving'",b'',b'Overspent over the holidays? See our #LinkInBio for 12 ways to save in the new year. #SpendLifeLiving',0,0,216,4,,,
B63z0xrHjmb,northwesternmutual,2020-01-03 21:08:11.000000,no,False,"b'linkinbio,spendlifeliving'",b'',"b'Make this the year you keep your resolutions, minus the financial stress that can come with it. Get the tips in our #LinkInBio and #SpendLifeLiving.'",0,0,195,1,,,
B6yWyeEH3BI,northwesternmutual,2020-01-01 18:18:16.000000,no,False,b'spendlifeliving',"b'rose_parade,northwesternmutual'","b'Meet our whimsical family of llovable llamas vacationing in a tropical paradise, floating down a llong, llazy river. This year\xe2\x80\x99s @rose_parade float celebrates spending quality time with those you love most (preferably on vacation!). These types of experiences bring families together and give them memories that will last forever. At @NorthwesternMutual we\xe2\x80\x99ll help you turn dreaming into living. #SpendLifeLiving'",0,0,1771,25,,,
