shortcode,username,date_utc,is_video,is_sponsored,hashtags,mentions,caption,video_view_count,video_length,likes,comments,likes+comments,location_name,location_latlong
CIB3qp-Aq74,purina,2020-11-25 21:42:39.000000,yes,False,b'',b'',"b'This doggie-centric commercial will air tomorrow during the 2020 National Dog Show, which airs on NBC at noon in all time zones! :dog: But I wanted to give you a sneak peek now because Fred and Rusty were such very good good boys when we filmed it. :loudly_crying_face: I\xe2\x80\x99m going to let them watch the dog show on the couch...it oughta keep them occupied for awhile! :smiling_face_with_smiling_eyes: Sending you all lots of love. Hope this makes you smile.'",2235,60.033,256,20,,,
CH6GFl3gnfx,purina,2020-11-22 21:14:22.000000,no,False,b'',b'',"b""While Thanksgiving traditions may look a bit different this year, the spirit of giving during the season is more important than ever with so many individuals and organizations struggling to make ends meet. This week, leading into the Thanksgiving holiday, we'll be turning over our social media channels to our nonprofit partners, highlighting each of the organizations to drive awareness of their unique missions and encourage fellow pet lovers to give and get involved as well. We hope you will follow along, and join us in supporting these amazing organizations!""",0,0,412,18,,,
CGqPSShA2_l,purina,2020-10-22 20:56:49.000000,yes,False,"b'purplethursday,purpleleashproject'",b'redroverorg',"b'Today is #PurpleThursday. Did you know that 48% of domestic violence victims stay because they don\xe2\x80\x99t want to leave their pets behind? Purina & @redroverorg are taking the lead to change that. Through The Purple Leash Project, we\xe2\x80\x99re working to create more pet-friendly domestic violence shelters. Snap a pic with your dog (while wearing purple!), share it using the hashtag #PurpleLeashProject and help us raise awareness around this very important issue.'",1317,82.3,265,21,,,
CGnejjBHqfu,purina,2020-10-21 19:11:13.000000,no,False,"b'regram,purpleleashproject'","b'_ashley_noel_,purina,redroverorg'","b""#Regram via @_ashley_noel_ \xe2\x80\x9cOctober is Domestic Violence Awareness Month, and Rue and I are excited to partner with @Purina and @RedRoverOrg to spread the word about the #PurpleLeashProject and its mission to help more Domestic Violence shelters become pet-friendly. Did you know that only 10% of shelters are pet-friendly? Every survivor should have their full support system when escaping abuse \xe2\x80\x93 and that includes their pet. They shouldn't need to worry about leaving them behind.\xe2\x80\x9d""",0,0,533,8,,,
CGlFz0SA6uN,purina,2020-10-20 20:56:30.000000,no,True,"b'regram,purpleleashproject'","b'tamronhall,purina,redroverorg'","b'#Regram Via @tamronhall\n""Nearly half of domestic violence victims remain in abusive situations out of fear for their pets\xe2\x80\x99 safety. As a dog mom myself, I believe that nobody should have to make that unfathomable choice to leave their precious pet behind. I\xe2\x80\x99m teaming with @purina and @redroverorg to raise awareness of bringing animals and their owners from crisis to care, together."" #PurpleLeashProject'",0,0,539,14,,,
CGU8XG2gA-o,purina,2020-10-14 14:39:24.000000,yes,False,b'purpleleashproject',b'redroverorg',"b'October is Domestic Violence Awareness Month. Did you know that less than 10% of domestic violence shelters in the U.S. accept pets? Purina & @redroverorg are taking the lead to change that. Through the #PurpleLeashProject, we\xe2\x80\x99re working to create more pet-friendly domestic violence shelters. Check out the link in our bio to see how you can help'",1514,29.108,283,12,,,
CF2m8xjg9H1,purina,2020-10-02 19:41:47.000000,no,False,b'purpleleashproject',b'',b'October is Domestic Violence Awareness month. Help spread the word about the need for pet-friendly domestic violence shelters with our #PurpleLeashProject Instagram effect. Check out our profile & click on the Effect icon & show your support.',0,0,487,25,,,
CD10iYAg6PQ,purina,2020-08-13 19:18:40.000000,yes,False,b'',"b'urbanchestnut,petfinderfoundation'","b""We're teaming up with @urbanchestnut to save your dinner plans and help local pet shelters! For every Urban Underdog Dinner Pack sold, Purina will donate $10 to the @petfinderfoundation. Help us 'Raise a Pint for Pets' and pick your dinner pack up today! Link to buy in bio.""",2054,11.866,443,41,,,
CAVDUiDABR9,purina,2020-05-18 12:18:32.000000,no,False,"b'bevhillsdogshow,bhdogshow'",b'proplan',"b'Congratulations to all the champions of the #BevHillsDogShow, including the 6 @proplan fed Group Winners! Purina is proud to fuel these extraordinary dogs. \n#BHDogShow'",0,0,856,87,,,
CATSe2Bgo2e,purina,2020-05-17 19:52:32.000000,no,False,"b'regram,bevhillsdogshow,bhdogshow'","b'itsdougthepug,bevhillsdogshow,purina'","b'#Regram via @itsdougthepug - \xe2\x80\x9cAm I best dressed or what?\xe2\x80\x9d -Doug\n\nCatch me & many more of ur favorite celebs during the @BevHillsDogShow presented by @Purina TONIGHT at 8 pm ET/PT and 7 pm CT/MT on NBC!! :dog_face::guide_dog::poodle::dog: #BevHillsDogShow #BHDogShow ""'",0,0,792,21,,,
CAS4uMmgDDR,purina,2020-05-17 16:12:11.000000,yes,False,"b'bevhillsdogshow,bhdogshow'","b'bevhillsdogshow,nbc'","b'The stage is set for the 2020 @bevhillsdogshow! \nGrab your furry friend, popcorn and a cozy blanket & tune-in to the #BevHillsDogShow presented by \nPurina tonight at 8pm ET/PT & 7pm CT/MT on @NBC! \n#BHDogShow'",2891,5.033,584,14,,,
CARUAGlge2U,purina,2020-05-17 01:27:20.000000,no,False,"b'regram,bevhillsdogshow,sponsored,bevhillsdogshow,bhdogshow'","b'madpuplife,purina'","b'#Regram via @madpuplife - ""We were going to host a watch party with all of our friends for the #BevHillsDogShow, but since that can\xe2\x80\x99t happen anymore, I\xe2\x80\x99m showing you exactly how to host your own self quarantined watch party for you and your pet this weekend over on stories! \xe2\x80\x9cSometimes you have to work a little so you can ball a lot\xe2\x80\x9d - Tom Haverford :princess_medium-light_skin_tone::dog_face: (anyone else here a Parks and Rec fan?!:waving_hand_medium-light_skin_tone:) That\xe2\x80\x99s exactly what we will be doing \xe2\x80\xaathis Sunday when we watch the Beverly Hills Dog Show Presented by @Purina :sparkles:\nBe sure to tune into NBC \xe2\x80\xaaon Sunday May 17th at 8pm ET/PT and 7pm CT/MT to watch - and don\xe2\x80\x99t forget the treats ;) #sponsored #BevHillsDogShow #BHDogShow""'",0,0,671,10,,,
CAQiQXdgfze,purina,2020-05-16 18:15:10.000000,yes,False,"b'bevhillsdogshow,bhdogshow'",b'nbc',"b""Need something else to do besides chase your tail all day? \nWe're one day out from the #BevHillsDogShow presented by Purina! Tune in tomorrow at 8 pm ET / 7 pm CT on  @NBC! \n#BHDogShow""",1199,9.438,295,7,,,
CAOP9PIAcLy,purina,2020-05-15 20:54:16.000000,no,False,"b'bevhillsdogshow,bhdshow'",b'nbc',b'We\xe2\x80\x99re thrilled to debut our NEW Instagram Lens/Effect... just in time for the #BevHillsDogShow! Check out our profile & click on the Effect icon & bask in the glitz & glam of the red carpet! And don\xe2\x80\x99t forget to tune-in to the #BHDShow this Sunday 5/17 at 8pm ET/PT & 7pm CT/MT on @NBC! :poodle: :camera_with_flash: :dog:',0,0,373,3,,,
CANpdxUgMKl,purina,2020-05-15 15:19:23.000000,yes,False,"b'regram,bevhillsdogshow,bhdogshow,partner'","b'emwng,purina,nbc'","b""#Regram via @emwng - \xe2\x80\x9cWe're rolling out the red carpet for Kokoro & Chibi to give them a taste of Hollywood here at home! \nBack in February, we attended the taping of this year's #BevHillsDogShow presented by @Purina, and the time has finally come for the show to air! Tune in with your pup this Sunday, May 17 @ 8pm et/pt and 7pm ct/mt on @NBC to see the stars of the dog world and Hollywood come together and find out who wins Best In Show. #BHDogShow #partner\xe2\x80\x9d""",1754,12.139,383,13,,,
CALdtgYAZMI,purina,2020-05-14 18:57:18.000000,yes,False,"b'bevhillsdogshow,bhdogshow'","b'bevhillsdogshow,nbc'","b""The @bevhillsdogshow presented by Purina is only 3 days away! Don't miss it Sunday, May 17th at 8 pm ET/PT and 7 pm CT/MT on @NBC! #BevHillsDogShow #BHDogShow""",938,9.438,228,5,,,
CAGGo5kAfnZ,purina,2020-05-12 16:59:59.000000,yes,False,b'bevhillsdogshow',b'nbc',b'We\xe2\x80\x99re paws-itive you\xe2\x80\x99re going to love the #BevHillsDogShow presented by Purina in 5 days!\nDon\xe2\x80\x99t miss an ounce of fluffiness this Sunday starting at 8 pm ET/PT & 7 pm CT/MT on @NBC!',1133,9.438,249,4,,,
CADBBaagcg9,purina,2020-05-11 12:12:07.000000,no,False,"b'regram,ad,purpleleashproject'","b'charlie_the_golden18,purina'","b'#Regram via  @charlie_the_golden18 - ""Beggin is proud to turn its packaging purple in May in support of the Purple Leash Project to help keep domestic violence victims and their pets together #ad .\n\nShow your support - Post a photo of your dog and their favorite Beggin treat using #purpleleashproject and tag @purina. Every post, Purina will donate $5 to RedRover, up to $25,000.\n\nLearn more about the Purple Leash Project at www.PurpleLeashProject.com""'",0,0,665,14,,,
CABuSGtAGw7,purina,2020-05-11 00:10:28.000000,yes,False,b'',"b'bevhillsdogshow,nbc'","b""This is going to be PAWsome! We're one week out from the @bevhillsdogshow presented by Purina. \nTune in next Sunday, May 17th starting at 8pm ET/PT & 7pm CT/MT on \n@NBC! BevHillsDogShow""",1275,9.438,219,4,,,
B_2zrKjgoNu,purina,2020-05-06 18:24:36.000000,no,False,"b'regram,purpleleashproject,itsbeggin,begginpartner,sponsored'","b'simbacorg,purina'","b'#regram via @simbacorg -\n""Beggin is proud to turn packaging purple in May in support of the Purple Leash Project to help keep domestic violent victims together with their pets by increasing the number of pet friendly domestic violence shelters across the US. Show your support\xe2\x80\x94post a photo of your dog and their favorite Beggin\xe2\x80\x99 treat using #PurpleLeashProject and tag @Purina. For every post, Purina will donate $5 to RedRover, up to $25,000."" #ItsBeggin #BegginPartner #Sponsored'",0,0,802,91,,,
B_vq9PXAm3N,purina,2020-05-03 23:54:14.000000,yes,False,b'bevhillsdogshow',b'nbc',"b""The countdown begins! We're looking forward to some tail-wagging family programming in just TWO WEEKS. The #BevHillsDogShow presented by Purina returns on Sunday, May 17th at 8 pm ET/8 pm PT on @NBC.""",1782,9.438,274,60,,,
B-kLCYZAB84,purina,2020-04-04 16:13:05.000000,yes,False,b'bevhillsdogshow',b'nbc',"b'The Lopez family was Team Frenchie all the way last year! Re-live moments like this from the 2019 #BevHillsDogShow Presented by Purina during the re-air Sunday, April 5th at 12:30 EST on @nbc!'",3796,57.755,367,69,,,
B-hlUW7AI8J,purina,2020-04-03 16:06:20.000000,yes,False,b'',"b'greatergoodorg,redroverorg,petfinder'","b'During this challenging time, Purina has stepped up our support of organizations dedicated to bringing and keeping pets and people together. If you can, please join us in support of @greatergoodorg, @redroverorg, @petfinder & Take the Lead'",2019,14.81,369,34,,,
B-fK6zzAlec,purina,2020-04-02 17:34:33.000000,no,False,b'',b'',"b'We\xe2\x80\x99re all in this together. That\xe2\x80\x99s why we\xe2\x80\x99re teaming up with Purina Veterinarian, Dr. Callie, to help pet owners navigate through these uncertain times. Join us on Facebook this Friday, April 3rd, for a FB LIVE at 12:30 pm ET for tips on how to keep your pet happy, healthy, and engaged. Comment with your pet wellness questions below :backhand_index_pointing_down:'",0,0,443,20,,,
B-Pf2EQg1Vd,purina,2020-03-27 15:29:33.000000,no,False,b'bevhillsdogshow',b'bevhillsdogshow',"b'Due to post-production delays, the 2020 @bevhillsdogshow Presented by Purina, which was taped on February 29 and scheduled to air on Sunday, April 5 on NBC will now air at a later date. NBC will broadcast the 2019 Beverly Hills Dog Show from 12:30-2:30 ET (9:30-11:30am PT) during that time slot. We will share updates on the 2020 show air date when they become available. Stay well, friends.  #bevhillsdogshow'",0,0,266,11,,,
B9-RR2ogoJk,purina,2020-03-20 22:55:11.000000,no,False,b'',b'petfinderfoundation',"b'We\xe2\x80\x99re all in this together, including our pets. Above is more info that details what Purina is doing to help keep the food bowls (and litter boxes) of your pets and shelter pets full during this time of uncertainty.\n\nAlso, if you are looking for ways to help shelters, see the link in our bio for ideas from our friends at @petfinderfoundation'",0,0,1134,75,,,
B8jUF2Bg461,purina,2020-02-14 15:09:47.000000,yes,False,b'valentinesday',b'',"b'We care about bringing people and pets together, it\xe2\x80\x99s the heart of what we do. :heart_suit_selector: Here\xe2\x80\x99s a story about how our employees recently did that. Sending a little love from Purina this #ValentinesDay.'",2637,54.05,453,44,,,
B8hhV-ogfFQ,purina,2020-02-13 22:27:48.000000,yes,False,b'',b'opendooranimals',"b'Sunday\xe2\x80\x99s STL forecast calls for sunny skies, 52 degrees and DOGS! :dog_face:The Purina Pet Parade returns for its 27th Year and you don\xe2\x80\x99t want to miss a party this good. :party_popper:Registration closes soon, so sign up today to walk in the parade with your human. Registration is $10 per pet, and ALL proceeds benefit @opendooranimals. See link in bio!'",2294,7.0,313,7,,,
