shortcode,username,date_utc,is_video,is_sponsored,hashtags,mentions,caption,video_view_count,video_length,likes,comments,likes+comments,location_name,location_latlong
CITelBSiFXI,saipem_official,2020-12-02 17:49:23.000000,no,False,"b'extraordinaryisourchoice,saipem,castorone'",b'',"b'Saipem CASTORONE safely completed the laying operations for the ALEN Gas Export line offshore Equatorial Guinea. Once again, SAIPEM demonstrated its capacity to deliver despite the challenges of COVID-19 environment. #extraordinaryisourchoice #saipem #castorone'",0,0,1291,12,,,
CINfN7iCFHs,saipem_official,2020-11-30 10:01:55.000000,yes,False,b'',b'',"b'""I highly appreciate Saipem company culture because gender was never an issue for me. In my 11 years in Saipem, I have been given equal opportunity to grow and to explore my potential."" Sisca Tjokro is a project engineer who guides a team in Saipem for the Tangguh LNG Project in Indonesia. \n\nDo you want to know how she dealt with extraordinary complexities? Watch our video'",4480,99.993,547,17,,,
CIBIyhLi4Hs,saipem_official,2020-11-25 14:53:41.000000,yes,False,"b'ukwindweek,extraordinaryisourchoice,saipem'",b'',"b'In celebration of #UKwindweek, watch the NnG/Forth Ports video on the preparation of casings for piles at the Port of Leith for the Neart na Gaoithe (NnG) offshore wind project in Scottish waters where Saipem is carrying out installation work, marking the start of offshore construction on this important project. #extraordinaryisourchoice #saipem'",3694,34.873,453,1,,,
CH0eymHgWsD,saipem_official,2020-11-20 16:56:34.000000,yes,False,"b'extraordinaryisourchoice,thisissaipem,peopleofsaipem'",b'',"b'""Anyone who says that engineering and creativity are two parallel lines that don\xe2\x80\x99t meet, well, probably has never been working for Saipem\xe2\x80\x9d. Francesca Fusco, vessel asset manager at Saipem, talks about the challenges and the extraordinary solutions she and her team had to find to let the Scarabeo 9 pass under the Istanbul bridges.\n\nFind out how they managed this extraordinary challenge\n\nAnd don\xe2\x80\x99t miss the Saipem people\xe2\x80\x99s stories in Our People highlights! :thumbs_up: \n#ExtraordinaryIsOurChoice\n#ThisIsSaipem\n#PeopleOfSaipem'",3337,73.519,338,14,,,
CHsWjW6CqZZ,saipem_official,2020-11-17 13:08:53.000000,no,False,"b'extraordinaryisourchoice,saipem'",b'',"b'ZohrRup project is currently in offshore phase with the S3000 in the Egyptian field.\nOver the past few days, crews have lifted a 30 inch spool from the PMS48 cargo barge alongside the S3000.\nThe purpose of this new installation is to replace a temporary spool previously installed by the Saipem FDS in August 2018 on Zohr ORU\xe2\x80\x99s project. In the same campaign, installation of a 26-inch spool has been done. #extraordinaryisourchoice #saipem'",0,0,1003,15,,,
CHqEz1NiC5N,saipem_official,2020-11-16 15:56:37.000000,yes,False,b'',b'',"b':high-speed_train: From here to there in an instant! Not everybody knows that Saipem, renowned for its work in the energy sector, also boasts major successes in other areas, such as building high-speed/high-capacity rail lines. Specifically, the Milan-Bologna, Treviglio-Brescia and now the Brescia-Verona lines.'",2173,95.4,188,3,,,
CHfkRRqCpYt,saipem_official,2020-11-12 13:58:52.000000,yes,False,"b'extraordinaryisourchoice,saipem'",b'',"b'Sometimes it\xe2\x80\x99s not easy to understand what we do, so we gave center stage to our people to tell you more about their job. Discover how they face new challenges and work together to realize extraordinary projects all around the globe! Keep an eye on our stories!\n\n#ExtraordinaryIsOurChoice\n#Saipem'",1556,9.993,168,2,,,
CHfKkJslD_b,saipem_official,2020-11-12 10:14:00.000000,no,False,b'',b'',"b'Built in 1977, the Perro Negro 4 is a self elevating drilling platform. This engineering beauty carries a Portuguese flag and can reach the depth of the oceans.'",0,0,663,17,,,
CHaaqlJizuq,saipem_official,2020-11-10 13:58:58.000000,yes,False,b'',b'',b'A technology to capture CO2 for a low carbon future. Let\xe2\x80\x99s find out how the carbon economy works!',1341,14.96,138,0,,,
CHX9-i9HuLf,saipem_official,2020-11-09 15:11:17.000000,yes,False,"b'extraordinaryisourchoice,saipem'",b'',b'We contribute to the innovation and transformation process of Italy by promoting initiatives with a sustainable background oriented towards the energy transition. Check this video to learn what Saipem does to create sustainable value in Italy. \n\n#ExtraordinaryIsOurChoice \n#Saipem',1513,143.446,169,2,,,
CHP5BP0iwh4,saipem_official,2020-11-06 11:52:05.000000,no,False,b'',b'',"b'Located in Kazakhstan, the Kuryk yard spans over an area of 2,200,000 sq.m that is about as big as Grand Central Station in New York, the largest train station in the world. Do you know how many people can it accomodate?'",0,0,618,10,,,
CHNvb2gH7N0,saipem_official,2020-11-05 16:18:14.000000,yes,False,b'',b'',"b'In 50 years, Saipem Offices in Fano is pushing beyond the frontiers of innovation becoming a global center of excellence. From onshore to offshore projects, the center designs and executes important projects that are both sustainable and safe for people and environment.\nThanks to tradition, innovation and sustainability we can leverage on historical knowledge to lead the energy transition and contribute to create the future of energy.\nWe want to thanks the local institutions for the long-lasting support to Saipem, and all the people that put their creativity, ingenuity and skills to realized extraordinary projects around the world.'",3141,141.98,345,3,,,
CG7juKLF2t_,saipem_official,2020-10-29 14:21:10.000000,no,False,"b'extraordinaryisourchoice,saipem,scarabeo8'",b'',"b'Scarabeo 8, the \xe2\x80\x9czero-pollution\xe2\x80\x9d giant! Scarabeo 8 is a 6th generation semi submersible drilling rig. It represents the state of the art of harsh environment and unmanned operation drilling units. Do you know that it can operate in the Barents sea all year around?\n\nLearn more\n\n#ExtraordinaryIsOurChoice\n#Saipem\n#Scarabeo8'",0,0,611,4,,,
CGmSdaYFzcg,saipem_official,2020-10-21 08:06:17.000000,no,False,"b'extraordinaryisourchoice,saipem'",b'',"b'Three fundamental letters of our services: MMO (Maintenance, Modification, Operation). As an historic part of our offering, we keep on providing our clients the right support when it comes to inspection and maintenance, thanks to advanced risk analysis and upgraded inspection techniques. \n#ExtraordinaryIsOurChoice\n#Saipem'",0,0,214,3,,,
CGP3ModCbE-,saipem_official,2020-10-12 15:04:46.000000,no,False,"b'immaginarioscientifico,immaginarioscientifico'",b'',"b""Some shots from the grand opening of the Saipem exhibition at #ImmaginarioScientifico, the recently inaugurated interactive science museum in Trieste, Italy. \n\n:water_wave: Give your kids an extraordinary experience! For more info check our stories.\n\n...................\n\nAlcuni scatti dell'inaugurazione della mostra Saipem presso #ImmaginarioScientifico, il museo della scienza interattivo recentemente inaugurato a Trieste, in Italia.\n\n:water_wave: Condividi coi tuoi figli un'esperienza straordinaria! Maggiori info nelle stories""",0,0,500,3,,,
CGFX3t6HRvM,saipem_official,2020-10-08 13:22:37.000000,yes,False,"b'immaginarioscientifico,science,exhibition,kids'",b'',"b'Learn, play, discover, imagine! On the 10th of October, it\xe2\x80\x99s the grand opening of #ImmaginarioScientifico, the #science centre in Trieste, Italy. Saipem has curated an interactive #exhibition dedicated to our innovative marine technologies and its use for offshore energy resources. We want to inspire the next generation of energy experts. Bring your #kids!'",2635,81.071,209,3,,,
CF9x5NHl0mD,saipem_official,2020-10-05 14:32:05.000000,no,False,"b'extraordinaryisourchoice,saipem'",b'',"b'We are certainly not a newcomer to the research and development efforts to find renewable energy sources and energy storage solutions, but now more than ever we are shifting towards a new wave of public awareness in global warming and energy transition. Our role in this scenario is the \xe2\x80\x9coperating arm\xe2\x80\x9d that facilitates the exploitation, transformation and transportation of the natural gas, but it is also the ability to innovate and to push our technological boundaries day by day to make this change really possible. Here\xe2\x80\x99s the important message of Stefano Cao, Saipem CEO.\n\n#ExtraordinaryIsOurChoice\n#Saipem'",0,0,230,4,,,
CFtoEvCigtw,saipem_official,2020-09-29 07:59:42.000000,yes,False,"b'health,safety'",b'',"b'When it comes to #health and #safety our motto is The Safer, The Better! For us, caring for people means upholding the highest health and safety standards and contributing to sustaining a solid culture of safety. That\xe2\x80\x99s why our Leadership in Health & Safety (LiHS) programme is designed to drive a cultural change and to significantly reduce accidents and injuries, and protect our people. The LiHS programme is considered not only an industry benchmark and best practice, but also a powerful tool that helps shape a broader health and safety culture.\n\nLearn more about Leadership in Health & Safety in our video!'",1955,72.926,181,1,,,
CFJpF48iwgA,saipem_official,2020-09-15 08:34:40.000000,no,False,"b'extraordinaryisourchoice,saipem,saipem3000'",b'',"b'Saipem has converted the former vessel \xe2\x80\x9cMaxita"" into a fully redundant DP Heavy Lift vessel named \xe2\x80\x9cSaipem 3000\xe2\x80\x9d by replacing a completely new stern section and installing a CLYDE 76 model 2.400 st crane. A beast suited for the most extreme environments!  #extraordinaryisourchoice #saipem #saipem3000'",0,0,999,10,,,
CE66SHKi2TT,saipem_official,2020-09-09 15:23:49.000000,yes,False,"b'extraordinaryisourchoice,saipem,thisissaipem'",b'',"b'How many times you were asked about your job and the answer was met with fascination and disbelief? Your friends and family might not understand what you do, but they know your job is unique.\n\nWhat Saipem\xe2\x80\x99s people do is not always easy to fully understand but the extraordinary nature of the projects we achieve together, well, that is understood immediately by everyone.\n\nSaipem is like a large orchestra: the ingenuity and creativity of our people come together to compose the perfect symphony. \n\nDiscover how. \n\n#ExtraordinaryIsOurChoice\n\n#Saipem\n\n#ThisIsSaipem'",6281,87.033,588,29,,,
CE1HpEtCLRh,saipem_official,2020-09-07 09:17:34.000000,no,False,"b'extraordinaryisourchoice,saipem'",b'',"b'What does it mean to work at Saipem?\n\nIt means finding original and innovative solutions for the most challenging projects in the energy and infrastructure sector. The complex nature of Saipem projects it is indeed very fascinating, but it can be hard to understand for non-experts.\n\nWith our new movie, we are going to guide you into the Saipem world, made of adventures, exciting experiences and sometimes amusing misunderstandings. \n\nFind out more in the next days! Stay tuned!\n\n#ExtraordinaryIsOurChoice\n#Saipem'",0,0,797,14,,,
CEtWMqDClOU,saipem_official,2020-09-04 08:50:50.000000,no,False,"b'extraordinaryisourchoice,saipem'",b'',"b'Everyone knows that Scarabeo 5 is one of the best in class unit of its generation. This epic fourth generation semi submersible drilling unit can operate also \xe2\x80\x9cmoored thruster assisted\xe2\x80\x9d, reducing fuel consumption and environmental impacts. The special rig is winterized and has been operating in a subarctic environment for more than 20 years, making it perfect to win every extraordinary challenge made in Saipem.\n\n#ExtraordinaryIsOurChoice\n#Saipem'",0,0,963,12,,,
CEo5MjGCzLM,saipem_official,2020-09-02 15:20:27.000000,no,False,"b'extraordinaryisourchoice,esof2020,saipem,innovation'",b'',"b'ESOF is inaugurating its 2020 edition, which this year is taking place in Trieste. ESOF is a biennial, pan-European, general science conference where more than 4,500 leading thinkers, innovators, \npolicy makers, journalists and educators from more than 90 countries gather to discuss current and future breakthroughs in contemporary science. Saipem is among the main sponsors of the conference and today is opening the doors of its operational base in Trieste \nwhere Saipem experts will guide guests on a tour showcasing technological and innovative equipment utilized for subsea operations and interventions, such as the Offset Installation Equipment (OIE), the Hydrone-R and the Innovator.\n\n#extraordinaryisourchoice #esof2020 #saipem #innovation'",0,0,611,0,,,
CElhlKkC6WJ,saipem_official,2020-09-01 07:56:23.000000,no,False,"b'fornature,extraordinaryisourchoice,saipem,fornature'",b'',"b'A water drop can bring life, especially in water stressed areas. At the Saipem Drilling Onshore Saudi Arabian base and on Kuwait rigs, we turned our commitment #ForNature into action. Thanks to the implementation of a water reuse solution, we take discharge water, treat it and then use it for plant irrigation. We are growing trees between the accommodations, flowers in the offices and aromatic herbs in small greenhouses. With recycled water we grow the seeds of environmental care.\n\n#ExtraordinaryIsOurChoice\n#Saipem\n\n#ForNature'",0,0,776,13,,,
CEWEE-9iGct,saipem_official,2020-08-26 07:49:58.000000,no,False,"b'extraordinaryisourchoice,saipem'",b'',"b'The Crane Ship Saipem FDS 2 it\xe2\x80\x99s only 9 years old and we\xe2\x80\x99re so proud of our deepwater field development ship. It has a maximum length of 183 metres, a moulded breadth of 32 metres and a moulded depth of 14.5 metres and it\xe2\x80\x99s equipped with a vertical J-lay tower with a maximum capacity of 2,000 tons designed to J-lay sealines of up to 36\xe2\x80\x9d diameter, in water depths of up to 3,000 metres. It is also capable of S-laying sealines of the same diameter and equipped with the cutting-edge DP3 dynamic-positioning system with a maximum transit speed of 13 knots. Only the best for its extraordinary crew of 325 people! \n\n#ExtraordinaryIsOurChoice \n#Saipem'",0,0,796,11,,,
CDlGptLC7hr,saipem_official,2020-08-07 07:30:48.000000,yes,False,"b'saipem,extraordinaryisourchoice,makingchangepossible'",b'',"b'In Indonesian language \xe2\x80\x9cTangguh\xe2\x80\x9d means strength, and certainly this was the source of our LNG expansion project here. The relationship with local people is the key to keep improving and growing professionally, day by day, even when times are challenging. Watch our video to learn more!\n\n#Saipem \n#ExtraordinaryIsOurChoice \n#MakingChangePossible'",2840,89.675,291,7,,,
CDjBVwei-2a,saipem_official,2020-08-07 07:30:39.000000,yes,False,"b'peopleofsaipem,extraordinarilytogether,saipem,extraordinaryisourchoice'",b'',"b'Due to the global emergency the #PeopleOfSaipem must be brave, resilient, and focused on safe operations. Some of our colleagues are still far away from their families and their homes. They were asked to be stronger and to extend their shifts for a further 4 months in some cases. With this video, we want to thank our colleagues onshore drilling for their enduring commitment, their teamwork, competence and stamina.\n\nStay safe, stay strong. We are #ExtraordinarilyTogether\n\n:construction_worker: The personnel in the video is only one part of our teams who extended their shift\n\n#Saipem\n#ExtraordinaryIsOurChoice'",1813,57.133,182,1,,,
CDikUDYCKlU,saipem_official,2020-08-06 07:51:08.000000,no,False,"b'extraordinaryisourchoice,saipem'",b'',"b'TAD stands for Tender assisted drilling: a drill barge that was built in 2006 and represents an offshore asset of 490 fti water depth.\nIts carrying capacity is 8851 t DWT and its current draught is reported to be 3.9 meters, with a length overall (LOA) is 91.44 meters and a width of 30.48 meters. A marvel of the sea!\n\n#ExtraordinaryIsOurChoice #Saipem'",0,0,743,7,,,
CDOQ3gYivcM,saipem_official,2020-07-29 10:38:36.000000,yes,False,"b'extraprdinaryisourchoice,saipem,jazanproject,makingchangepossible,gas'",b'',"b'The Jazan Project is one of the biggest gasification plants in the world. The Jazan project is particularly complex, set in difficult climatic conditions including sandstorms, extreme temperatures, and unpredictable rainstorms. The project is based around 80 kilometers from the city of Jazan in southwest Saudi Arabia and it\xe2\x80\x99s part of a wider diversified growth strategy that will make Saudi Arabia\xe2\x80\x99 energy sector more dynamic and competitive.\n\n#ExtraprdinaryIsOurChoice\n#saipem\n#JazanProject\n#MakingChangePossible\n#Gas'",3381,151.501,363,11,,,
CC_AhKPiXqL,saipem_official,2020-07-23 12:27:04.000000,yes,False,"b'biodiversity,fornature,extraordinarilytogether'",b'',"b""At Saipem, we interact everyday with different natural environments across the 70 countries in which we operate and it\xe2\x80\x99s our duty to protect them all.\n#Biodiversity is what drives us to put every effort in reducing at a minimum level air emissions and greenhouse gases, promoting energy efficiency, avoiding plastic usage and noise production, as well as water waste.\nLet's do our part #ForNature, we are #ExtraordinarilyTogether.""",2057,84.993,219,5,,,
CC8RlDTiRtb,saipem_official,2020-07-22 11:01:23.000000,yes,False,"b'extraordinaryisourchoice,saipem,makingchangepossible,oie,safety'",b'',"b'Technological innovation plays a fundamental role in minimising negative impacts and in fostering the development of new solutions, especially in the fields of drilling, engineering and construction. The Offset Installation Equipment (OIE) is an innovative system capable of preventing and limiting the dispersion of hydrocarbons at sea resulting from severe accidents. Based on the principle of the \xe2\x80\x9chot-air balloon\xe2\x80\x9d, OIE is a 4-tank structure capable of blocking the leakage of hydrocarbons in the event of a submarine well failure through a capping stack.\n\n#ExtraordinaryIsOurChoice\n#Saipem\n#MakingChangePossible\n#OIE\n#safety'",2705,172.431,334,2,,,
CC5_feKi2T7,saipem_official,2020-07-21 13:39:46.000000,no,False,"b'extraordinaryisourchoice,saipem,energytransition,innovation'",b'',b'The energy transition is the most important challenge that we at Saipem face today. We need cleaner and more sustainable energy while efficiently powering the planet. Innovation is key to make great changes possible.\n \n#ExtraordinaryIsOurChoice\n#Saipem\n#EnergyTransition\n#Innovation',0,0,195,1,,,
CCslwsZi4Md,saipem_official,2020-07-16 08:44:48.000000,no,False,"b'extraordinaryisourchoice,saipem,fornature'",b'',"b':rescue_worker\xe2\x80\x99s_helmet_selector::water_wave:Saipem to the rescue! During the weekend, the Castoro 6 crew welcomed on board a new ""member"": Tolly, a small seal pup. The puppy, in evident distress, was rescued on board, looked after for a short while and finally was safely sailed to shore to the Scarborough Seal Sanctuary in order to recover and be able to return at sea at the soonest. We wish Tolly the best of luck! \n\n#ExtraordinaryIsOurChoice \n#Saipem\n#ForNature'",0,0,919,24,,,
CCn_bRCikr9,saipem_official,2020-07-14 13:52:52.000000,no,False,"b'globalsolutionprovider,extraordinaryisourchoice,saipem,globalsolutionprovider'",b'',"b'Our more than 60 years of history have made us a world leader in engineering and drilling activities, managing the development of significant and large-scale projects in the energy and infrastructure sectors. We have the know-how and expertise needed to work responsibly, in cooperation with our local stakeholders and to create long-term value, while providing innovative and customised solutions for our clients.\n\nOur ambition is to be recognised as the #GlobalSolutionProvider in all segments of the Energy Industry. We want to continuously push beyond the frontiers of innovation, to guide our clients towards the future of energy.\n\n#ExtraordinaryIsOurChoice\n#Saipem\n#GlobalSolutionProvider'",0,0,313,3,,,
CClbR30CtpG,saipem_official,2020-07-13 13:58:32.000000,no,False,"b'extraordinaryisourchoice,saipem,renewables,plastics'",b'',"b'Minimizing waste requires strategy and new technologies. Since 2017, we have been investigating applications of CO2 management to decrease carbon footprint. Thanks to an agreement with ITEA we are investigating the \xe2\x80\x9cFlameless\xe2\x80\x9d Oxy-Combustion Technology with the aim of designing novel processes for the disposal of \xe2\x80\x9cdifficult-to recycle\xe2\x80\x9d plastics, such as plastic scraps, and the integration of this step in a broader process with CO2 capture and reutilisation.\n\n#ExtraordinaryIsOurChoice\n#Saipem\n#Renewables\n#Plastics'",0,0,155,1,,,
CCdpbY5iZcU,saipem_official,2020-07-10 15:38:26.000000,yes,False,"b'extraordinaryisourchoice,saipem,makingchangepossible,hydrones'",b'',"b'When anyone mentions drones, we immediately think of flying robots whirring in the air and capturing our imagination with applications ranging from aerial surveillance to home delivery and from disaster relief to film making. Meet our Hydrones, drones that operate underwater and can carry out important tasks at offshore oil and gas fields. Just like aerial vehicles, these underwater \xe2\x80\x9crobots\xe2\x80\x9d have the advantage of being unmanned and remotely operated from shore. At our Sonsub centre, we are actively developing hydrone solutions based on in-house engineering competences that enhance economic and environmental sustainability.\n\n#ExtraordinaryIsOurChoice\n#Saipem\n#MakingChangePossible\n#Hydrones'",2786,141.222,346,1,,,
CCLvIT_CkRg,saipem_official,2020-07-03 14:34:25.000000,yes,False,"b'extraordinaryisourchoice,lng,mozambique,saipemopentalks,energytransition,thisissaipem'",b'',"b'With the same dynamic and innovative spirit that allows us to take on impossible challenges, we want an open and real relationship with our stakeholders. That\xe2\x80\x99s why we have Saipem Open Talks, a forum for all those involved in our business launched for the first time in March 2019. The first three events were focused on sustainability of our business, then we discussed cybersecurity and international security on a dedicated event in November 2019.\n\nLast June, in the 5th Saipem Open Talks we, together with representatives from financial, scientific and academic world, explored the energy transition and the rapidly growing of Mozambique, a country where Saipem has a chance to potentially play an important role in contributing to the country\xe2\x80\x99s sustainable development and local economic growth.\n\nIf you missed the event, watch the video to enjoy the best moments of the Saipem Open Talks - Mozambique: Energy Transition and New Geopolitical Equilibria\n\n#ExtraordinaryIsOurChoice\n#LNG\n#Mozambique\n#SaipemOpenTalks\n#EnergyTransition\n#ThisIsSaipem'",1690,141.726,163,3,,,
CCIlt1li_o2,saipem_official,2020-07-02 09:11:45.000000,no,False,"b'extraordinaryisourchoice,saipem,makingchangepossible,modernslaverystatement2019,supplychain'",b'',"b'We promote and recognise human and labor rights, for our own personnel and along the entire supply chain, in the local communities and in every aspect of safety.\nIn the recently published Modern Slavery Statement 2019, we have described all the policies and the actions taken by Saipem in the last year to develop and implement measures and enhance the systems and processes already in place to ensure the respect for human and labour rights and prevent modern slavery and human trafficking in our business and supply chain. \n\n#ExtraordinaryIsOurChoice\n#Saipem\n#MakingChangePossible\n#ModernSlaveryStatement2019\n#SupplyChain'",0,0,410,13,,,
CCDrJRliJYM,saipem_official,2020-06-30 11:41:35.000000,yes,False,"b'extraordinaryisourchoice,saipem,makingchangepossible'",b'',"b'Since the beginning of our operations more than 60 years ago, our focus on working responsibly and collaborating with our stakeholders have been key drivers in our business strategy and have led to an acknowledged creation of shared value. The sustainability of our business is founded on significant evidence of the real change we bring about in the communities we interact with.\n\nWe create new jobs, instil a managerial culture, activate greater demand for local goods and services all the while creating and improving infrastructure, contributing to the education system and developing the professional capabilities of human capital.\n\nWorking with local communities, we have the opportunity to forge the socio-economic conditions needed for the effective enjoyment of fundamental human rights and the promotion of growth.\n\n#ExtraordinaryIsOurChoice\n#Saipem\n#MakingChangePossible'",1469,64.86,109,0,,,
