shortcode,username,date_utc,is_video,is_sponsored,hashtags,mentions,caption,video_view_count,video_length,likes,comments,likes+comments,location_name,location_latlongB_NOiqTAh4p,saipem_official,2020-04-20 14:51:16.000000,no,False,"b'thisissaipem,extraordinarilytogether,peopleofsaipem,extraordinaryisourchoice,saipem'",b'',"b'#ThisIsSaipem: a group of people who do not stop. We are ready to turn a difficult situation into an opportunity by using our extraordinary creativity. We manage complex projects and, at the same time, we are there for our families. Even far away we are #ExtraordinarilyTogether.\n#PeopleofSaipem #ExtraordinaryIsOurChoice #Saipem'",0,0,215,0,,,
B_Csd0aFlk9,saipem_official,2020-04-16 12:42:31.000000,yes,False,"b'extraordinaryisourchoice,saipem,wecreatevalue'",b'',b'Do you know that drones can swim?\n\nThe new \xe2\x80\x9cHydrone\xe2\x80\x9d platform is the perfect example of an innovative project that changes our business model and wins a place in the future of subsea robotics. Learn more!\n\n#ExtraordinaryIsOurChoice #Saipem\n#WeCreateValue',1600,55.46,275,2,,,
B-9_Yyvgknv,saipem_official,2020-04-14 16:50:52.000000,yes,False,"b'extraordinaryisourchoice,saipem,safety,thisissaipem'",b'',"b'Yesterday, Scarabeo 9 crossed the Bosphorus strait passing under three Istanbul bridges connecting the two sides of the city. The ultra deepwater drilling rig left the Black Sea after months of operation in Romania, contributing to connect the energy-rich Central Asian countries to markets in Europe. \nThe operation is always a great challenge, from both technical and logistical aspects: structural changes to the rig and a solid cooperation among the staff on board, engineers and institutions from different countries were fundamental to successfully assure again this outstandingly complex project, from the beginning to the end. \nThanks to everybody who was involved, don\xe2\x80\x99t miss the video of this extraordinary operation! \n#ExtraordinaryIsOurChoice \n#Saipem \n#Safety \n#ThisIsSaipem'",4437,90.18,674,15,,,
B-w_5DXiJcZ,saipem_official,2020-04-09 15:44:31.000000,no,False,"b'angola,extraordinaryisourchoice,saipem,safety,thisissaipem,wecreatevalue'",b'',"b'The safer, the better! Big ups for our colleagues on board the GIMBOA FPSO, our Floating Production Storage and Offloading vessel operating in #Angola.\n\nThey proudly celebrate 11 years LTI (lost-time injury) free, a great goal achieved by the project that is a result of our passion and commitment to safety.\n\nCongratulations!\n\n#ExtraordinaryIsOurChoice #Saipem #Safety #ThisIsSaipem #WeCreateValue'",0,0,778,9,,,
B-w56UYizsb,saipem_official,2020-04-09 14:52:16.000000,no,False,"b'safety,health,saipem,smartworking,saipem,thisissaipem,extraordinarilytogether,saipem,stopthespread,extraordinaryisourchoice'",b'',"b""In this period of emergency, the capability to quickly adapt to change allowed us to protect the \n#safety and #health of #Saipem people and their families.\n\nTo ensure business continuity, it was necessary to take action with the same timely approach.\n\nAgility in reorganizing and using technology have been fundamental. Being already active with #smartworking since last year has allowed us to extend it to more than 15,000 colleagues in a short time, also distributing laptops to those who were not equipped yet.\n\nNew ways of operating, responsibility, strong team play and #Saipem's skills made the difference.\n\nHere are the results. We will continue so, day by day.\n\n#ThisIsSaipem\n#ExtraordinarilyTogether\n#Saipem\n#StopTheSpread \n#ExtraordinaryIsOurChoice""",0,0,390,5,,,
B-cDTfpirbm,saipem_official,2020-04-01 12:32:19.000000,yes,False,"b'extraordinaryisourchoice,stopthespread,saipem'",b'',"b""Strength, resilience and courage. Our values guide us in this difficult moment. As CEO Stefano Cao and President Francesco Caio said, Saipem is a company that overcome many challenges throughout its history, thanks to the innate values in our DNA. Today, these messages of solidarity, encouragement and gratitude are strengthened by the Directors of the five Saipem divisions.\n\nAs Stefano Porcari, Onshore Drilling, says, it\xe2\x80\x99s at a time like this that Saipem's women and men are called to demonstrate the extraordinary nature that distinguishes us. Mauro Piasere, XSIGHT, reassures that Saipem is managing this situation by always putting people's health first. A message of strength also goes to those who work every day to ensure business continuity, as Marco Toninelli, Offshore Drilling Division points out. Maurizio Coratella, E&C Onshore division, expresses his closeness to those who work in remote areas, far from the family. And as Francesco Racheli, E&C Offshore division says, it is thanks to the sacrifice of each of us that we will be able to tell another success story.\n\nStay safe, stay strong!\n\n#ExtraordinaryIsOurChoice\n#StopTheSpread\n#Saipem""",2990,82.426,341,6,,,
B-PQFgelJZc,saipem_official,2020-03-27 13:12:15.000000,yes,False,"b'extraordinaryisourchoice,saipem'",b'',"b'6 years of work, 200 engineers, 4,000 drawings and documents. The OIE Offset Installation equipment is the only system capable of sealing the spill of an oil well into the sea when direct vertical access is not possible. Discover this engineering marvel!\n #ExtraordinaryIsOurChoice\n#Saipem'",3444,49.463,513,3,,,
B-M_NQbi0Ff,saipem_official,2020-03-26 16:05:53.000000,no,False,"b'castorone,extraordinaryisourchoice,saipemthinksglobal,saipem'",b'',"b'Hats off to #Castorone, our self-propelled, dynamically positioned pipe-laying vessel. Can you guess its length and how many people it can accomodate? Scroll the gallery to find out the answers :smiling_face: #ExtraordinaryIsOurChoice #SaipemThinksGlobal #Saipem'",0,0,1031,12,,,
B-FYPz-AbeJ,saipem_official,2020-03-23 17:11:33.000000,yes,False,"b'extraordinaryisourchoice,saipem,stopthespread,coronavirus'",b'',"b""The President of Saipem Francesco Caio, also on behalf of the company's Board of Directors, sent a message of nearness and encouragement to management and employees who are addressing the emergency linked to the spread of Covid-19 with flexibility, adaptability and dedication. In his message, the President also underlines that the digital transformation processes implemented in Saipem promote proximity and support cooperation between people, now and in the future. In line with what CEO Stefano Cao also underlined, the President urges everyone to take care of their own health, their family members and colleagues. Finally, he shares the feeling of gratitude that Saipem wishes to address to the authorities and to the socio-health personnel daily committed to guarantee the common health and safety. Watch the full message. #ExtraordinaryIsOurChoice #Saipem #StopTheSpread #Coronavirus""",3789,198.578,358,7,,,
B9664Y-C0zp,saipem_official,2020-03-19 15:41:45.000000,no,False,"b'extraordinaryisourchoice,wecreatevalue'",b'johnnie_duke',b'A breathtaking sunrise shot by @johnnie_duke by the Black Sea offshore Romania. Thank you so much for your contribution Johnnie! #ExtraordinaryIsOurChoice #WeCreateValue',0,0,809,11,,,
B9rtCVhA2Dg,saipem_official,2020-03-13 17:52:43.000000,yes,False,"b'coronavirus,extraordinaryisourchoice,saipem,stopthespread'",b'',"b'\xe2\x80\x9cAdapting to change in contexts of changing scenarios is fundamental in a time of crisis such as the one we are experiencing.\xe2\x80\x9d Our CEO, Stefano Cao, in a video message from his home, thanks his colleagues for the  great effort and responsibility they are demonstrating and invites everyone to take care of themselves for the  wellbeing of the community. \xe2\x80\x9cExceptional times - he underlines \xe2\x80\x93 require exceptional behaviours and attitudes. I am sure that the women and men of Saipem will respond, as they have always done, with flexibility, adaptability and a spirit of sacrifice. The company will respond with equal flexibility and availability.\xe2\x80\x9d #Coronavirus\n#ExtraordinaryIsOurChoice\n#Saipem\xc2\xa0\n#StopTheSpread'",5152,141.194,612,14,,,
B9o2_-ZARFk,saipem_official,2020-03-12 15:22:00.000000,yes,False,"b'extraordinary,energytransition,extraordinaryisourchoice,saipem'",b'',"b'For over 60 years, we have been carrying out #extraordinary projects. Today, in the age of the #EnergyTransition, Saipem has what it takes to promote the energy of the future and infrastructure development worldwide. Solid values and a clear vision are what guide us. Discover Saipem!  #ExtraordinaryIsOurChoice #Saipem'",2783,115.033,326,9,,,
B9W9DKvi--v,saipem_official,2020-03-05 16:28:02.000000,no,False,"b'extraordinaryisourchoice,wecreatevalue,saipem'",b'caro_sarchi',"b'A beautiful sunflower field close to Chinarevsk, Kazakhstan. Be like @caro_sarchi , take time to enjoy the beauty around you! Thanks everyone for the contribution and don\xe2\x80\x99t forget to follow our page to see what\xe2\x80\x99s next :slightly_smiling_face:  #ExtraordinaryIsOurChoice #WeCreateValue #Saipem'",0,0,487,6,,,
B9O9b2NC7Ia,saipem_official,2020-03-02 13:57:29.000000,no,False,"b'indonesia,extraordinaryisourchoice,saipemthinksglobal,saipem'",b'',"b'Today we are in #Indonesia, namely at the Karimun yard. Saipem Yards are located in four continents. Each one has its own distinctive specialization and features. Fabrication yards are run successfully thanks to the mobility of our personnel, transfer of know how, best practices and systems. Look at all the details! #ExtraordinaryIsOurChoice #SaipemThinksGlobal #Saipem'",0,0,1344,36,,,
B8y6o39iaXh,saipem_official,2020-02-20 16:34:19.000000,no,False,"b'extraordinaryisourchoice,saipemthinksglobal,saipem'",b'',"b'The sun sets on our Italian headquarter in San Donato, close to Milan. Thanks to our colleague for these beautiful colours! #ExtraordinaryIsOurChoice #SaipemThinksGlobal #Saipem'",0,0,781,9,,,
B8gMB5JC0_v,saipem_official,2020-02-13 10:00:42.000000,no,False,"b'extraordinaryisourchoice,saipemthinksglobal,saipem'",b'',"b':globe_with_meridians: Everyday we wake up and we are proud of what we do. Our office is the world, our job is extraordinary! :camera_with_flash: If you work for Saipem and are a talented photographer send us pictures of your Saipem life. You can be featured on our Instagram page!\n\n#ExtraordinaryIsOurChoice #SaipemThinksGlobal #Saipem'",0,0,934,12,,,
B8OvtL8ifDo,saipem_official,2020-02-06 15:26:07.000000,no,False,"b'saipemthinksglobal,extraordinaryisourchoice,saipem12000'",b'',b'Thanks to our colleague Jalal Saad\xc3\xa9 and the Saipem 12000 crew for taking shots of this beauty floating on the blue sea! #SaipemThinksGlobal #ExtraordinaryIsOurChoice #saipem12000',0,0,946,15,,,
B7q1D6vis_W,saipem_official,2020-01-23 16:40:15.000000,no,False,"b'extraordinaryisourchoice,saipem,normandmaximus'",b'',"b""Our offshore construction vessels are extraordinary! \nThe Normand Maximus is a dynamic positioning ship with unique operational benefits. \nIt's the result of innovative design philosophy aimed to combine SURF installation with field development activities in ultra-deep water. \nIt's designed to perform in the harshest environments, thanks also to the multiple layers of redundancy that provide safety and continuous operations \n#ExtraordinaryIsOurChoice #Saipem #NormandMaximus""",0,0,1334,18,,,
B7YG18diWYe,saipem_official,2020-01-16 10:10:04.000000,no,False,"b'saipem7000,saipemthinksglobal'",b'',b'Accomplishments seem even bigger when shot from above. Thanks Benjamin for capturing this great moment #Saipem7000 #SaipemThinksGlobal',0,0,1215,22,,,
B7GO1PwiPsQ,saipem_official,2020-01-09 11:33:33.000000,no,False,"b'saipem7000,extraordinaryisourchoice,saipem,saipemthinksglobal'",b'',"b'Big sky, white clouds, and the #Saipem7000. Saipem life is extraordinary! Thanks to our colleagues for these amazing shots taken in the Netherlands! #ExtraordinaryIsOurChoice #Saipem #saipemthinksglobal'",0,0,1302,22,,,
