shortcode,username,date_utc,is_video,is_sponsored,hashtags,mentions,caption,video_view_count,video_length,likes,comments,likes+comments,location_name,location_latlongCCBkwoYiLCD,saipem_official,2020-06-29 15:48:43.000000,no,False,"b'extraordinarilytogether,saipem,peopleofsaipem'",b'',"b""Due to the pandemic that hit the planet, the last months have been particularly challenging for all of us. In order to protect the health and safety of our people and their communities, we had to act quickly and responsibly. We were among the first to acknowledge the complex situation by activating emergency measures, both in Italy and abroad, to protect our people before institutional decisions.\n\nProcedures promptly defined, a 24h active task force, the use of technologies and our great adaptability allowed us to guarantee the business continuity and the health and safety of our people and communities. \nWith the same approach and responsive energy, we are facing this new phase. We were among the first to return to activities according to severe safety requirements and offering serological screenings for our employees. \xe2\x80\x9cI wish to tell you that the results we have achieved have been extremely good, I wish to share my happiness with all of you which is the happiness of all the management of the company and all the people who are working for Saipem.\xe2\x80\x9d Stefano Cao, Saipem CEO, addresses the difficult months we just witnessed whilst acknowledging Saipem's people great adaptability and skills, and their pivotal role in the company\xe2\x80\x99s future success. \n#ExtraordinarilyTogether\n\n#Saipem\n\n#PeopleOfSaipem""",0,0,377,8,,,
CB5BYbaCPV5,saipem_official,2020-06-26 08:05:39.000000,no,False,"b'extraordinaryisourchoice,saipem,openinnovation,startups'",b'',"b'Innovation is fundamental to our success. By investing in innovation we can foresee and guide change. For this reason, we are constantly working on finding innovative, competitive and sustainable solutions, as the three recently signed open innovation agreements for development projects in the energy and infrastructure sectors, with a focus on startups in Europe, North America and Israel. :light_bulb: Saipem and Aster Fab - TRG teams have jointly developed a methodology to identify startups specialized in verticals like energy storage, blockchain or water treatment :light_bulb: Thanks to the partnership with Mind the Bridge, Saipem joined the open innovation platform of Startup Europe Partnership (SEP), the first pan-European platform dedicated to transforming European startups into scaleup companies. :light_bulb: Saipem signed an agreement with the Politecnico di Milano to join the Startup Intelligence Observatory, to gain access to a powerful intelligence tool on topics such as virtual and augmented reality, circular economy, cyber security, thus multiplying collaboration opportunities, particularly in the Italian ecosystem.\n\n#ExtraordinaryIsOurChoice\n#Saipem\n#OpenInnovation\n#startups'",0,0,135,1,,,
CB29Un6CoDJ,saipem_official,2020-06-25 12:51:42.000000,no,False,"b'dayoftheseafarer,seafareresarekeyworkers,extraordinarilytogether,thisissaipem'",b'imo_hq',"b'Today on the 10th anniversary of the #DayofTheSeafarer we want to thank the women and men that work in the middle of the sea, for their efforts and for their essential role especially in this complex moment. The 2020 campaign \xe2\x80\x98\xe2\x80\x98Seafarers are Key Workers\xe2\x80\x99, promoted by @imo_hq International Maritime Organization (IMO), seeks to raise awareness of the work achieved by seafarers in response to the pandemic. Due to the coronavirus emergency, Saipem seafarers had to endure longer periods of time far away from their homes and their loved ones, sometimes up to 3 months of extended stay offshore.  To all seafarers, thank you for your great commitment, sense of duty, cohesion and adaptability you are demonstrating. Stay healthy, stay safe.\n\n#SeaFareresAreKeyWorkers\n#ExtraordinarilyTogether\n#ThisIsSaipem'",0,0,957,31,,,
CB2fciIC2J4,saipem_official,2020-06-25 08:36:45.000000,yes,False,"b'innovationfactory,saipem,extraordinaryisourchoice,makingchangepossible'",b'',"b'Set up in 2016, Saipem\xe2\x80\x99s Innovation Factory is an in-house incubator for new ideas, ingenious solutions and prototype laboratory. By focusing on discovering \xe2\x80\x9cgems\xe2\x80\x9d, the Innovation Factory aspires to explore the \xe2\x80\x9cunchartered territories\xe2\x80\x9d of disruptive ideas, technologies and business models. So far, the project has successfully involved nearly 200 Saipem employees in the innovation process, promoting digital transformation, favouring entrepreneurship and cultural change.\n\n#InnovationFactory\n#Saipem\n#ExtraordinaryIsOurChoice\n#MakingChangePossible'",2522,104.332,224,1,,,
CBxvrodiGdK,saipem_official,2020-06-23 12:19:09.000000,yes,False,"b'health,safety,people'",b'',"b'Accounting for new cultures and contexts in all of our projects is a demanding aspect of the work we do, and we are continuously reminded of the need to pay close attention to these operational risks.\n\nOur priority is to guarantee and maintain the #health and #safety of our #people, operations and stakeholders in all the countries where we operate. That means keeping one step ahead of any changes in our operating context and technologies. We are engaged in a robust and widespread capacity-building effort to transfer this commitment and capability to all people involved in our'",937,60.826,87,0,,,
CBvRiYpiU12,saipem_official,2020-06-22 13:14:25.000000,no,False,"b'extraordinaryisourchoice,saipemthinksglobal,saipem'",b'',"b'Take a look at the Arbatax yard in Sardinia, Italy! Saipem Yards are located in four continents with their own distinctive specialization and features. Fabrication yards are run successfully thanks to the mobility of our personnel, transfer of know how, best practices and systems. Saipem Yards are located in key areas and they cooperate with local players contributing to the development of the local economies. \n#ExtraordinaryIsOurChoice #SaipemThinksGlobal #Saipem'",0,0,841,17,,,
CBk7GgMp49l,saipem_official,2020-06-18 12:48:43.000000,yes,False,"b'gas,energy,zohr,benchmark,extraordinaryisourchoice,saipem,makingchangepossible,sustainability'",b'',b'Zohr is the largest #gas deposit ever discovered in the Mediterranean region or any part of Egyptian territory where we at Saipem played the central role through the whole EPCI process. Zohr is large enough to supply all of Egypt\xe2\x80\x99s natural gas requirements - and nearly two-thirds of its total #energy needs - for decades and to transform the country from a net energy importer to a net exporter and a regional energy hub. The #Zohr project with planning and development from Saipem stands to emerge as a new industry #benchmark. A story of success!\n\n#ExtraordinaryIsOurChoice\n#Saipem\n#MakingChangePossible\n#Sustainability',3260,102.559,324,3,,,
CBfTWsuljOv,saipem_official,2020-06-16 08:25:02.000000,yes,False,"b'extraordinaryisourchoice,saipem,makingchangepossible,sustainability'",b'',"b'Decarbonisation is certainly a complex challenge, which requires cooperation and a shared purpose of numerous players at the global level to achieve significant results. To achieve the carbon reductions needed globally in coming decades, all sectors need to take ambitious action to cut their footprint: we are already set to work to find ways to reduce the carbon impact of our operations and increase energy efficiency, efforts that will benefit our value chain.\n\nAs a global service provider, we play an important role in enabling the transition from an economy based on fossil fuels to a \xe2\x80\x9cdecarbonised\xe2\x80\x9d economy.\n\n#ExtraordinaryIsOurChoice\n#Saipem\n#MakingChangePossible\n#Sustainability'",1339,63.66,101,1,,,
CBVRCv1iibD,saipem_official,2020-06-12 10:49:50.000000,no,False,"b'worlddayagainstchildlabour,extraordinaryisourchoice,saipem,makingchangepossible,ethicalsupplychain'",b'',"b'Respect for human rights and our attention to child labor are of highest importance for Saipem, both in our own operations and across our supply chain. We select carefully our suppliers with a particular focus on these topics. Doing so we are able to protect human and labor rights for all the people involved in our activities all around the globe.\n\n#WorldDayAgainstChildLabour\n#ExtraordinaryIsOurChoice\n#Saipem\n#MakingChangePossible\n#EthicalSupplyChain'",0,0,153,1,,,
CBS8OVqiPlz,saipem_official,2020-06-11 13:09:26.000000,no,False,"b'extraordinaryisourchoice,thisissaipem,peopleofsaipem'",b'',"b'Saipem 7000 is the largest factory ship in the world. Over 300 great people are boarded here with different tasks: welders, assemblers, electricians, turners, carpenters, millers, crane operators, and their main work tool is only a star wrench hanging on their belt that goes along with their incredible skills.  #ExtraordinaryIsOurChoice #ThisIsSaipem #PeopleofSaipem'",0,0,1320,15,,,
CBSlOSIibIN,saipem_official,2020-06-11 09:48:27.000000,no,False,"b'extraordinaryisourchoice,saipem'",b'',"b""We are proud to introduce the new Saipem blog, a new, simple and direct way to engage with our stakeholders. We launched this blog with a renovated and easier language in order to communicate more effectively the complex challenges we face every day. The launch of the blog expands the offer of Saipem's digital ecosystem, already present today on LinkedIn, Instagram and YouTube. \n#ExtraordinaryIsOurChoice\n#Saipem""",0,0,174,1,,,
CBNaQHBi2XI,saipem_official,2020-06-09 09:38:07.000000,yes,False,"b'challenge,low,cleaner,extraordinaryisourchoice,saipem,makingchangepossible,sustainability'",b'',"b'This spirit of innovation at Saipem is vital for us to seize opportunities as they present themselves but also coincides with humanity\xe2\x80\x99s enormous #challenge of transitioning to a #low-carbon economy and energy system. For us, therefore, innovation is a lens through which we can start to see not only new business horizons but also support the shift away from carbon-intensive oil & gas extraction towards cleaner solutions and renewable energy sources. We are already making an active contribution in the form of new, #cleaner technologies such as floating offshore wind farms and small-scale liquefied natural gas facilities, and also exploring potential breakthroughs in renewables, CO2 management and circular economy solutions.\n\n#ExtraordinaryIsOurChoice\n#Saipem\n#MakingChangePossible\n#Sustainability'",1295,63.66,108,3,,,
CBDHAXbik-Q,saipem_official,2020-06-05 09:40:22.000000,yes,False,"b'biodiversity,environments,communities,biodiversity,energyefficiency,energytransition,extraordinaryisourchoice,makingchangepossible,saipem,wed2020,fornature'",b'',"b'Saipem wants to celebrate the World Environment Day, in which it has been actively participating since 2010, through the careful management of environmental issues in the 70 countries of the world where is present and through the promotion of the sense of responsibility of its people and their working teams, their families and friends.\nThe 2020 World Environment Day\xe2\x80\x99s theme is #biodiversity that has become a core issue in the global debate together with climate change, which Saipem has been committed to fight for some time.\nSaipem interacts with a variety of different natural #environments and local #communities different from each other and is keen on protecting #biodiversity through a management system and proven operational practices to reduce at a minimum level air emissions and greenhouse gases, promoting #energyefficiency, avoiding plastic usage and noise production, as well as water waste.\nToday Saipem goes beyond renewing its long-standing commitment to minimizing any impact on the environment deriving from its activities: it is engaged to accompany its customers with solutions clearly oriented towards the #energytransition\n\n#extraordinaryisourchoice\n#MakingChangePossible\n#saipem\n#wed2020\n#ForNature'",3148,153.1,298,5,,,
CA-WEo_i0YN,saipem_official,2020-06-03 13:11:15.000000,no,False,"b'mozambique,extraordinaryisourchoice,lng,mozambique,saipemopentalks,energytransition,thisissaipem'",b'',"b'Road to Saipem Open Talks!\n\n#Mozambique is globally recognized as a country with enormous potential in terms of resources and economic development. From 2024-25, the International Monetary Fund expects a double-digit growth for the country.\n\nOur company has been present in Mozambique since 2011, performing the first offshore drilling exploration campaigns in the North of Mozambique. In 2018, Italy was the second largest investor and business partner with investments of over $700 million.\n\nWe have a chance to potentially play an important role in contributing to the country\xe2\x80\x99s sustainable development and local economic growth. This is why our focus is on facilitating an open dialogue with all stakeholders involved.\n\nLearn more about rapidly growing Mozambique and the presence of Saipem in this country.  Tune in tomorrow at 3pm CET time for our online event \xe2\x80\x9cMozambique: energy transition and new geopolitical equilibria"" :pushpin: Check the link in our stories! \n#ExtraordinaryIsOurChoice \n#LNG \n#Mozambique \n#SaipemOpenTalks \n#EnergyTransition \n#thisissaipem'",0,0,564,5,,,
CAxlIvkCCGW,saipem_official,2020-05-29 14:12:46.000000,no,False,"b'energytransition,mozambique,sustainability,cybersecurity'",b'ispigram',"b'Saipem Open Talks is back! Together with @ispigram - Istituto per gli Studi di Politica Internazionale, International Energy Agency (IEA) and a representative from the financial world, we will discuss the #EnergyTransition and Saipem\xe2\x80\x99s long-term commitment in #Mozambique and Africa.\n\nOpen Talks is a Saipem event launched the first time in March 2019 with 3 episodes dedicated to #sustainability. Then, in November we discussed #cybersecurity and international security'",0,0,289,1,,,
CAqFFoVixPj,saipem_official,2020-05-26 16:19:46.000000,yes,False,"b'saipem,sustainable'",b'',"b""Natural gas is going to be of pivotal importance in the energy mix of the future. Do you know why? :evergreen_tree:It\xe2\x80\x99s greener\n:national_park_selector:It improves air quality and limits emissions of carbon dioxide\n:sparkles:It's cheaper\n\nDo you want to know what #Saipem can do for a more #sustainable future? Watch our video and learn more about our projects!""",2134,79.826,221,4,,,
CAm4UUOCud8,saipem_official,2020-05-25 10:35:48.000000,yes,False,"b'makingchangepossible,energytransition,saipem,thisissaipem,peopleofsaipem'",b'',"b'The Saipem 7000 has changed enormously to meet the needs of the present and the near future: now we just have to make use of the available energy that nature directly provides, namely wind. In these 20 plus years of experience on board the S7000, I was able to see with my own eyes and experience first-hand the evolution of the ship and of all Saipem.\xe2\x80\x9d Francesco Di Pietro, Shipmaster of the Saipem 7000, tells us the story of a changing energy scenario, made of magic moments on board a great vessel that plays a relevant role for the sustainable future of the company. Watch the video \n#MakingChangePossible\n#EnergyTransition\n#Saipem\n#ThisIsSaipem\n#PeopleOfSaipem'",2846,183.246,259,6,,,
CAcjxO6itjS,saipem_official,2020-05-21 10:17:20.000000,yes,False,"b'diversity,multiculturalism,inclusion,mentorship,women,peopleofsaipem,thisissaipem,extraordinaryisourchoice,saipem,wdcddd'",b'',"b'Today we celebrate the World Day for Cultural Diversity for Dialogue and Development promoted by the United Nations. Every day we strive to create a working environment that capitalizes on #diversity and promotes a culture of inclusion. We are a young and diverse company with more than 35,000 employees in over 70 countries, 46% of whom are under 40 years old. In Saipem, differences are considered to be resources and a source of mutual enrichment. We work every day to enhance #multiculturalism and our #inclusion policy, by also promoting leadership and #mentorship activities for #women all around the globe. Learn more in our video.\n\n#PeopleOfSaipem\xc2\xa0\n#ThisIsSaipem\xc2\xa0\n#ExtraordinaryIsOurChoice\xc2\xa0\n#Saipem\xc2\xa0\n#wdcddd'",2626,72.193,278,8,,,
CAZw7IbiFKW,saipem_official,2020-05-20 08:13:59.000000,no,False,"b'change,sustainable,progress,challenges,solutions,future,energytransition,extraordinaryisourchoice,saipem,makingchangepossible'",b'',"b'Four challenges to make #change possible, positive and sustainable. Change towards a more #sustainable future is a long-term commitment we are taking with the planet and society as a whole.\n\nTo better understand Saipem\xe2\x80\x99s effort and the #progress we are making, we have identified four interconnected #challenges that capture how sustainability connects to our business, our operations, our people and the many stakeholders we work with.\n\nThese four challenges represent our path towards becoming an enabler of new #solutions and shape a better #future.\n\nDiscover our challenges for the future of #EnergyTransition\n\n#ExtraordinaryIsOurChoice #Saipem #MakingChangePossible'",0,0,184,1,,,
CAXL5QcCvfo,saipem_official,2020-05-19 08:15:14.000000,yes,False,"b'peopleofsaipem,extraordinarilytogether'",b'',"b'The COVID-19 emergency has suddenly changed our lives putting us in front of complex emotions, unexpected situations and new habits. The #PeopleOfSaipem, united as a great team, have managed to win this challenge. Thanks to our passion, thanks to our flexibility, thanks to be #ExtraordinarilyTogether. Now we are ready to face and win the next challenges, like we always do.'",2049,84.299,240,6,,,
CANKEQtCV18,saipem_official,2020-05-15 10:46:15.000000,yes,False,"b'challenges,innovation,energy,energytransition,extraordinaryisourchoice,saipem,makingchangepossible,wecreatevalue,globalsolutionprovider'",b'',"b'Every day we adapt to meet new #challenges. We continuously push beyond the frontiers of #innovation, to guide our clients towards the future of #energy, and to contribute to provide the world with more sustainable technological solutions. In 2019, we identified 4 challenges for the #EnergyTransition to prove that making change is possible. Check our stories to learn more\n\n#ExtraordinaryIsOurChoice\n#Saipem\n#MakingChangePossible\n#WeCreateValue\n#GlobalSolutionProvider'",1759,97.799,214,1,,,
CAH5z_visWS,saipem_official,2020-05-13 09:45:20.000000,no,False,"b'thisissaipem,extraordinarilytogether,peopleofsaipem,thisissaipem,extraordinaryisourchoice,saipem'",b'',"b'Saipem is made of people with extraordinary creativity and flexibility.\n\nWe are always ready to support each other and win the most ambitious challenges.\n\nNow, more than ever, #ThisIsSaipem.\n\nAnd we are #Extraordinarilytogether.\n\nDon\xe2\x80\x99t miss these pics, browse through!\n\n#PeopleOfSaipem\n#ThisIsSaipem\n#ExtraordinaryIsOurChoice\n#Saipem'",0,0,251,0,,,
CADbDd2C7a6,saipem_official,2020-05-11 15:59:36.000000,no,False,"b'peopleofsaipem,extraordinarilytogether,thisissaipem,extraordinaryisourchoice,saipem'",b'',"b'The pandemic has changed everything except our ability to face and overcome new challenges, always with the same enthusiasm and responsibility.\n\nAnd a lot of creativity! We are the #PeopleOfSaipem.\n\nWe Are #ExtraordinarilyTogether.\n\nBrowse the gallery to find out more.\n\n#ThisIsSaipem\n#ExtraordinaryIsOurChoice\n#Saipem'",0,0,350,4,,,
B_7YKp7iuUm,saipem_official,2020-05-08 13:00:26.000000,no,False,"b'thisissaipem,peopleofsaipem,saipem,extraordinarilytogether,extraordinaryisourchoice'",b'',"b'#ThisIsSaipem: a world of pioneers and brave women and men that face and win extraordinary challenges by working in hard conditions, away from their loved ones.\n\nLike all the #PeopleOfSaipem that extended their stay on board. Their strength represents #Saipem\xe2\x80\x99s resilience.\n\nThank you. #ExtraordinarilyTogether #ExtraordinaryIsOurChoice'",0,0,479,15,,,
B_1r0bdik_V,saipem_official,2020-05-06 07:56:43.000000,no,False,"b'extraordinaryisourchoice,extraordinarilytogether,peopleofsaipem,thisissaipem'",b'',"b'#ExtraordinaryIsOurChoice and it cannot be otherwise.\n\nWe will continue to work hard, feel united as one, #ExtraordinarilyTogether and still connected.\n\nThanks to all the seafarers on board for your great commitment and sense of duty. Being #PeopleOfSaipem means acting like you.\n\n#ThisIsSaipem'",0,0,797,18,,,
B_xJEK8CSwA,saipem_official,2020-05-04 13:36:04.000000,no,False,"b'extraordinarilytogether,peopleofsaipem,thisissaipem,extraordinaryisourchoice,saipem'",b'',"b'An extraordinary ability to adapt, with creativity and ingenuity. Even in a complex time, we do not give up and keep on being always #ExtraordinarilyTogether. Browse the gallery to find out all the photos sent by our colleagues.\n\n#PeopleOfSaipem #ThisIsSaipem #ExtraordinaryIsOurChoice #Saipem'",0,0,456,7,,,
B_mX9PHCjTJ,saipem_official,2020-04-30 09:14:33.000000,no,False,"b'extraordinarytogether,thisissaipem,peopleofsaipem,saipem,extraordinaryisourchoice'",b'',"b'Being apart but still #ExtraordinaryTogether, and connected in one world. #ThisIsSaipem, a great team working worldwide, facing the most extreme conditions and reaching the depths of the oceans.\n\nNow, more than ever, we are proud of all the #PeopleOfSaipem, in particular of all the seafarers on board longer than expected. Your tenacity inspires #Saipem every day, thank you. #ExtraordinaryIsOurChoice'",0,0,719,20,,,
B_etYueiaPq,saipem_official,2020-04-27 09:47:53.000000,no,False,"b'extraordinarilytogether,peopleofsaipem,thisissaipem,extraordinaryisourchoice,saipem'",b'',"b'Even at a time like this, we are #ExtraordinarilyTogether. #PeopleOfSaipem do not stop at anything. We join forces and keep on going. With creativity, ingenuity and flexibility. Always as a great team.\n\nBrowse the gallery to discover our colleagues\xe2\x80\x99 photos.\n\n#ThisIsSaipem\n#ExtraordinaryIsOurChoice\n#Saipem'",0,0,535,7,,,
B_XQAPlo4sb,saipem_official,2020-04-24 12:16:27.000000,no,False,"b'extraordinarilytogether,peopleofsaipem,thisissaipem,extraordinaryisourchoice,saipem'",b'',"b'The COVID-19 emergency has forced us to change our daily lives and make choices to keep us safe. We managed to make everything extraordinary. With creativity, we turned a desk into an office, and thanks to technology, we hold meetings around the world while still taking care of our\xc2\xa0families. Even if far, we are #ExtraordinarilyTogether. Check our pics!\n\n#PeopleOfSaipem\n#ThisIsSaipem\xc2\xa0\n#ExtraordinaryIsOurChoice\n#Saipem'",0,0,404,5,,,
B_P3cezIhwp,saipem_official,2020-04-21 15:27:10.000000,no,False,"b'peopleofsaipem,thisissaipem,extraordinarilytogether,extraordinaryisourchoice,saipem'",b'',"b""In these difficult times, quickly adapting to change is essential.\nThe #PeopleOfSaipem are achieving this extraordinary result with great creativity and flexibility.\n\n#ThisIsSaipem: even if far, we are all united.\n\nWe are #ExtraordinarilyTogether.\n\nBrowse the gallery to discover our colleagues' shoots.\n\n#ExtraordinaryIsOurChoice #Saipem""",0,0,483,6,,,
B_NPI-SAhSR,saipem_official,2020-04-20 14:56:30.000000,no,False,"b'extraordinarilytogether,peopleofsaipem,thisissaipem,extraordinaryisourchoice,saipem'",b'',"b'In this difficult period, Saipem\xe2\x80\x99s people are demonstrating a great ability to adapt thanks to\ntechnology and a great deal of creativity. To stay closer in an extraordinary way.\n\n#ExtraordinarilyTogether #PeopleOfSaipem #ThisIsSaipem #ExtraordinaryIsOurChoice #Saipem'",0,0,152,0,,,
B_NPCyYAcEN,saipem_official,2020-04-20 14:55:39.000000,no,False,"b'extraordinarilytogether,peopleofsaipem,thisissaipem,extraordinaryisourchoice,saipem'",b'',b'The COVID-19 emergency forced us to find new solutions to protect health and safety of our\ncolleagues and to ensure business continuity. Saipem\xe2\x80\x99s people are demonstrating to be flexible and inventive: a room becomes the new office and the family are new colleagues. \n#ExtraordinarilyTogether #PeopleOfSaipem #ThisIsSaipem #ExtraordinaryIsOurChoice\n#Saipem',0,0,189,1,,,
B_NO9BmAbhV,saipem_official,2020-04-20 14:54:52.000000,no,False,"b'peopleofsaipem,extraordinarilytogether,thisissaipem,extraordinaryisourchoice,saipem'",b'',"b'The pandemic that hit the world changed our daily lives. It forced us to work from home with\ndifferent time zones. Our colleagues show responsibility and creativity. The #PeopleofSaipem act in this way: despite the distances, we do everything we can to be a team, in an extraordinary way.\n\n#ExtraordinarilyTogether #ThisIsSaipem #ExtraordinaryIsOurChoice #Saipem'",0,0,657,5,,,
B_NOytmgQOd,saipem_official,2020-04-20 14:53:28.000000,no,False,"b'extraordinarilytogether,peopleofsaipem,thisissaipem,extraordinaryisourchoice,saipem'",b'',"b'#ExtraordinarilyTogether is how the #PeopleofSaipem are facing the COVID-19 emergency. Safe at home alongside their families, we never stop to commit to our tasks. #ThisIsSaipem\n\n#ExtraordinaryIsOurChoice #Saipem'",0,0,304,11,,,
B_NOreCglde,saipem_official,2020-04-20 14:52:28.000000,no,False,"b'peopleofsaipem,extraordinarilytogether,peopleofsaipem,thisissaipem,extraordinaryisourchoice,saipem'",b'',"b""#PeopleofSaipem are capable of adapting to the most complex situations in a responsible and safe way. Because it is in Saipem's DNA to always win new challenges and to carry out extraordinary projects. In this complex period, we work together more united than ever. Because we are #ExtraordinarilyTogether. \n#PeopleOfSaipem #ThisIsSaipem #ExtraordinaryIsOurChoice #Saipem""",0,0,418,3,,,
