shortcode,username,date_utc,is_video,is_sponsored,hashtags,mentions,caption,video_view_count,video_length,likes,comments,likes+comments,location_name,location_latlongB7q59M9FSoX,scotiabank,2020-01-23 17:23:11.000000,no,False,b'areyouin',b'scenecard',"b'Hey @Scenecard members! Don\xe2\x80\x99t forget to register and use your card until Feb. 26 for a chance to win one of 300,000+ instant SCENE prizes! Plus, show your Scotiabank SCENE payment card to get even more points! #AreYouIn? See link in bio for details.\n.\n.\n.\nNo purchase necessary. Must be a registered SCENE member aged 14+ to be eligible. Contest ends 11:59pm EST on Feb. 26, 2020. ARV: $0.50-$25.00.'",0,0,76,0,,,
B7oMAdAH4qp,scotiabank,2020-01-22 16:03:10.000000,no,False,b'',b'',"b'Looking for work? Whether it\xe2\x80\x99s co-op or a summer job on your mind, we\xe2\x80\x99ve got you covered. Check out these tips for landing the gig. See link in bio.'",0,0,67,0,,,
B7luIhpgnAe,scotiabank,2020-01-21 17:03:31.000000,no,False,"b'dyk,lifeatscotiabank'",b'',"b'#DYK we also have offices in Mexico, Chile, Peru and Colombia to name a few? Many of our colleagues in Mexico work and play in their modern workspaces in Mexico City. #LifeatScotiabank'",0,0,182,6,,,
B7laji0gnvY,scotiabank,2020-01-21 14:12:27.000000,no,False,b'',b'',"b""10 days left to play! Put your money skills to the test for a chance to WIN up to $4,000 cash by playing the Scotiabank Money Smarts Game! Use promo code TFSA to earn 3 bonus entries! See link in bio to play.\n.\n.\n.\n.\nIl ne vous reste plus que 10 jours! Testez vos connaissances financi\xc3\xa8res en participant au jeu Money Smarts de la Banque Scotia et courez la chance de gagner jusqu'\xc3\xa0 4 000 $! Obtenez 3 participations suppl\xc3\xa9mentaires en utilisant le code promo TFSA. Jouez en suivant le lien de la bio.""",0,0,81,5,,,
B7jax2QlFeI,scotiabank,2020-01-20 19:36:03.000000,no,False,b'',b'',b'The RRSP contribution deadline\xe2\x80\x99s coming up! Make sure you are getting the most out of your RRSP by avoiding these 5 common pitfalls. See link in bio.',0,0,116,0,,,
B7bSbjoAmcu,scotiabank,2020-01-17 15:49:10.000000,no,False,"b'fridayfeeling,scotialovesbooks'","b'gillerprize,notianwilliams'",b'Looking to cozy up with a book this weekend? We suggest Scotiabank @GillerPrize-winning novel Reproduction by @notianwilliams. Check out our highlights for a peek into the book. #FridayFeeling #ScotiaLovesBooks',0,0,68,2,,,
B7WsMofAuTm,scotiabank,2020-01-15 20:58:07.000000,no,False,b'',b'',b'Get ahead of student debt in your post-grad life! Follow these four tips to help you tackle it. See link in bio.',0,0,78,1,,,
B7WEsOaAKEd,scotiabank,2020-01-15 15:12:55.000000,no,False,b'dyk',b'',"b""#DYK millennials spend over two hours a day worrying about money? If your New Year's resolution was to save more, you're not alone. Find out where to start.""",0,0,84,3,,,
B7T55zkJtN6,scotiabank,2020-01-14 19:00:11.000000,no,False,"b'traveltuesday,travel'",b'',b'Tired of the cold weather already? Good thing most of our top travel spots for 2020 are warm weather destinations. :sun_selector: Check out the link in our bio for some travel inspiration. #TravelTuesday #travel',0,0,228,2,,,
B7T55zkJtN6,scotiabank,2020-01-14 19:00:11.000000,no,False,"b'traveltuesday,travel'",b'',b'Tired of the cold weather already? Good thing most of our top travel spots for 2020 are warm weather destinations. :sun_selector: Check out the link in our bio for some travel inspiration. #TravelTuesday #travel',0,0,228,2,,,
B7Rj_qiBMw-,scotiabank,2020-01-13 21:10:19.000000,yes,False,b'',b'',b'Ever wonder how taxation works when withdrawing from a TFSA vs. RRSP? Scotia Investment Specialist Henri breaks down the difference.',1782,31.6,91,3,,,
B7RKR5fgQBi,scotiabank,2020-01-13 17:25:25.000000,no,False,"b'repost,gillerprize,scotiabankgillerprize,canadianliterature,canlit,instabooks,instarads,goodreads,scotialovesbooks,books,bookstagram,bookworm,book,reading,booklover,read,igreads,reader,literature,fiction,canadianfiction,bookshelf'","b'gillerprize,gillerprize'","b'#Repost :repeat_button: @gillerprize\n\xe3\x83\xbb\xe3\x83\xbb\xe3\x83\xbb\nWe are excited to introduce you to the 2020 Scotiabank Giller Prize jury.\n\xe2\xa0\x80\xe2\xa0\x80\xe2\xa0\x80\xe2\xa0\x80\xe2\xa0\x80\xe2\xa0\x80\xe2\xa0\x80\xe2\xa0\x80\xe2\xa0\x80\nThey are: Canadian authors David Chariandy, Eden Robinson and Mark Sakamoto (jury chair), British critic and Editor of the Culture segment of the Guardian, Claire Armitstead, and Canadian/British author and journalist, Tom Rachman.\n\xe2\xa0\x80\xe2\xa0\x80\xe2\xa0\x80\xe2\xa0\x80\xe2\xa0\x80\xe2\xa0\x80\xe2\xa0\x80\xe2\xa0\x80\xe2\xa0\x80\nClick the link in @gillerprize bio to learn more.\n.\n.\n.\n.\n#GillerPrize #ScotiabankGillerPrize #CanadianLiterature #CanLit #instabooks #instarads #goodreads #ScotiaLovesBooks #books #bookstagram #bookworm #book #reading #booklover #read #igreads #reader #literature #fiction #CanadianFiction #bookshelf'",0,0,93,0,,,
B7QzfsQA9uY,scotiabank,2020-01-13 14:06:19.000000,no,False,b'',b'',"b""Make 2020 your year! Play the Scotiabank Money Smarts Game for a chance to WIN up to $4,000 cash! Use promo code PLAN to earn 3 bonus entries! See link in bio to play. .\n.\n.\n.\nFaites de 2020 votre ann\xc3\xa9e chanceuse! Participez au jeu Money Smarts de la Banque Scotia et courez la chance de gagner jusqu'\xc3\xa0 4 000 $! Obtenez 3 participations suppl\xc3\xa9mentaires en utilisant le code promo PLAN. Jouez en suivant le lien de la bio.""",0,0,63,1,,,
B7PaXRXA0VU,scotiabank,2020-01-13 01:08:32.000000,yes,False,b'',b'',"b'On November 17th \xe2\x80\x93 Dan deWaal got to watch his twin boys play hockey for one last time \xe2\x80\x93 bringing this Amherstburg, Ontario community together in an emotional, heartfelt day of hockey.\xe2\x81\xa0\n\xe2\x81\xa0\nWhich makes announcing this inspiring Hockey 24 submission as our contest winner all the more special. Congratulations and thank you, Mary Beth, for sharing the first annual Dan deWaal Winter Classic. Link in our bio for more information on Hockey 24.'",1236,8.0,78,1,,,
B7J2znnp-3T,scotiabank,2020-01-10 21:20:43.000000,no,False,b'areyouin',b'scenecard',"b'It\xe2\x80\x99s @scenecard season! Register and use your membership card until Feb. 26 to be automatically entered to win one of 300,000+ instant SCENE prizes! Plus, show your Scotiabank SCENE payment card to get even more points! #AreYouIn? See link in bio for details!\n.\n.\n.\nNo purchase necessary. Must be a registered SCENE member aged 14+ to be eligible. Contest ends 11:59pm EST on Feb. 26, 2020. ARV: $0.50-$25.00.'",0,0,96,0,,,
B7JdM59gMta,scotiabank,2020-01-10 17:38:22.000000,yes,False,b'hockey',b'',"b'Our survey shows that when we support kids in hockey, it helps the entire community. Click the link in our bio for more information and sign up for the Scotiabank Hockey Club Fundraising Tool powered by FlipGive. #hockey'",1163,15.033,56,1,,,
B7GzZLfgmEu,scotiabank,2020-01-09 16:53:10.000000,no,False,"b'infinitepotential,mentoringmonth,2020goals'",b'',"b'Did you know that at least 15,000 young people are waiting for a mentor at Big Brothers Big Sisters? Check out the link in out bio to learn more about mentoring and how you can help a young person reach their #InfinitePotential in as little as one hour a week. \n#MentoringMonth #2020goals'",0,0,94,2,,,
B7EQd3Vn14Y,scotiabank,2020-01-08 17:10:00.000000,yes,False,b'',b'',"b'New year, new you? Stay true to your resolution with a new student budget. Scotia Advisor Daniel explains how to build and stick to one.'",1093,37.566,60,1,,,
B7CHerAAZWW,scotiabank,2020-01-07 21:12:20.000000,no,False,b'lifeatscotiabank',b'',"b'We\xe2\x80\x99re back from holidays, which also means New Year\xe2\x80\x99s resolutions! At the Commons in Downtown Toronto, our employees can choose from a range of healthy, plant-forward eating options all while taking a break and catching up with colleagues in the newly renovated space. #LifeatScotiabank'",0,0,344,2,,,
B6_ktEUBm0I,scotiabank,2020-01-06 21:30:05.000000,yes,False,b'',b'',b'How much can your money grow? Check out our interactive tool to see what could happen to your savings if you set up pre-authorized contributions. See link in bio to try it out!',1368,15.3,62,0,,,
B6-9021g048,scotiabank,2020-01-06 15:50:16.000000,no,False,b'',b'',"b""Put your money skills to the test for a chance to WIN up to $4,000 cash by playing the Scotiabank Money Smarts Game! See link in bio and check in each week for promo codes to help you earn bonus entries.\n\nCheck in each week for promo codes to help you earn bonus entries.\n.\n.\n.\n.\nTestez vos connaissances financi\xc3\xa8res en participant au jeu Money Smarts de la Banque Scotia et courez la chance de gagner jusqu'\xc3\xa0 4 000 $! Les d\xc3\xa9tails se trouvent dans le lien de la bio; revenez chaque semaine pour obtenir les codes promotionnels qui vous permettront d\xe2\x80\x99obtenir des participations suppl\xc3\xa9mentaires.\n\nChaque semaine, surveillez nos codes promotionnels pour obtenir des participations suppl\xc3\xa9mentaires.""",0,0,179,3,,,
B6yU5_NpFuI,scotiabank,2020-01-01 18:01:49.000000,no,False,"b'happynewyear,nye'",b'',b'#HappyNewYear! Wishing you the best in 2020 :confetti_ball: #NYE',0,0,104,6,,,
