shortcode,username,date_utc,is_video,is_sponsored,hashtags,mentions,caption,video_view_count,video_length,likes,comments,likes+comments,location_name,location_latlong
CIY9_OiJHGG,scotiabank,2020-12-04 21:00:12.000000,no,False,b'',b'scotiabank',"b'Diversification can help reduce volatility associated with one asset class, which is important for long-term investment success. Visit the @scotiabank link in bio to check out more tips.'",0,0,58,5,,,
CIYvHUrLsYE,scotiabank,2020-12-04 18:50:15.000000,no,False,"b'lifeatscotiabank,gtatopemployers,topemployers2021'",b'scotiabank',b'We\xe2\x80\x99re proud to share that for the 2nd year in a row we\xe2\x80\x99ve been recognized as one of Greater Toronto\xe2\x80\x99s Top Employers for 2021! \n\nClick the link in our @scotiabank bio to find out why we were selected. #LifeatScotiabank #GTATopEmployers #TopEmployers2021',0,0,150,0,,,
CIYvHUrLsYE,scotiabank,2020-12-04 18:50:15.000000,no,False,"b'lifeatscotiabank,gtatopemployers,topemployers2021'",b'scotiabank',b'We\xe2\x80\x99re proud to share that for the 2nd year in a row we\xe2\x80\x99ve been recognized as one of Greater Toronto\xe2\x80\x99s Top Employers for 2021! \n\nClick the link in our @scotiabank bio to find out why we were selected. #LifeatScotiabank #GTATopEmployers #TopEmployers2021',0,0,150,0,,,
CIYizobrqTY,scotiabank,2020-12-04 17:02:42.000000,no,False,"b'fridayfun,scotiascene'",b'scotiabank',b'Calling all film buffs! For some #FridayFun guess this movie in the comments below. #ScotiaSCENE. \n:popcorn::backhand_index_pointing_down: \nDid you know you can watch your favourite movies on the Cineplex Store. See the @Scotiabank link in bio for more.',0,0,109,12,,,
CIVx5SvsLZM,scotiabank,2020-12-03 15:16:48.000000,no,False,"b'idpwd,lifeatscotiabank'",b'scotiabank',"b'\xe2\x80\x9cIt\xe2\x80\x99s not my cerebral palsy that holds me back, it\xe2\x80\x99s the mismatch of my environment to accommodate my cerebral palsy that holds me back. \n\nI feel supported at Scotiabank, and that makes me feel that I can accomplish almost anything.\xe2\x80\x9d \xe2\x80\x93 Dave, VP Global Agile Leader Agile Enterprise. #IDPWD #LifeatScotiabank\n\nVisit the @Scotiabank link in bio to watch Dave and other Scotiabankers talk about our inclusive-by-design products and the diversity of our organization.'",0,0,271,6,,,
CITylKEln2h,scotiabank,2020-12-02 20:44:18.000000,no,False,b'lifeatscotiabank',b'scotiabank',"b""Looking to explore your passion in Accounting, Tax, and Finance? \n\nCPA Associate, Michelle, shares her experience with Scotia's Activate New Graduate Development Program and the countless opportunities it provides!\n\nLink in @Scotiabank bio. #LifeatScotiabank""",0,0,149,4,,,
CITHxOUsKtm,scotiabank,2020-12-02 14:30:14.000000,no,False,"b'dyk,history'",b'',"b'#DYK that the ballpoint pen wasn\xe2\x80\x99t invented until the 1930s? :pen_selector: \n\nBefore then, employees had to mix ink, keep the ink wells full and the pen tips in good condition. This picture is from 1932 and shows a forms desk, complete with pens and ink wells. #history \n\nPhoto by Pringle & Booth Limited, Toronto.'",0,0,152,5,,,
CIQqTcLAyMh,scotiabank,2020-12-01 15:34:08.000000,no,False,b'lifeatscotiabank',b'scotiabank',"b'Learn from Rylan, a Digital Accessibility Lead and Ryan a Manager of Health and Safety to find out how they are driving Scotiabank to be a more inclusive and accessible workplace through their work as the co-chairs of the DiversABILITY Employee Resource group at Scotia! #LifeatScotiabank\n\nVisit the link in @scotiabank bio.'",0,0,165,5,,,
CIHWL4tofTC,scotiabank,2020-11-28 00:45:22.000000,no,False,"b'flm2020,financialliteracy,finlit,money,finance'",b'scotiabank',"b'You\xe2\x80\x99ve probably heard of inflation, but do you know how it affects your purchasing power?\n\nInflation is the rate at which the price of goods and services in an economy increases over a period of time. When prices rise, your money buys less.\n\nThe erosion of purchasing power is the most familiar problem. Commonly-purchased household goods become more expensive, and so a single unit of currency loses value as it buys fewer goods and services.\n\nFor example, $100 in 1968 was only worth $14.02 in purchasing power in 2018. For a forward-looking example, if a cup of coffee costs $2 today, and the annual inflation rate was 5%, in 30 years that same cup of coffee would cost $8.64!\n\nAs an investor, you should be aware of inflation. If you earn less than the rate of inflation on your investments, you would face reduced purchasing power when your investments are converted into cash. The good news is, with a sound investment strategy you can guard against inflation and help maintain your purchasing power and standard of living in retirement. \n\nSee the @scotiabank link in bio to read the full article.\n\n#FLM2020 #FinancialLiteracy #finlit #money #finance'",0,0,116,2,,,
CIGPy5MsjpU,scotiabank,2020-11-27 14:30:13.000000,no,False,"b'fridayfun,scotiascene'",b'scotiabank',b'Calling all film buffs! For some #FridayFun guess this movie in the comments below. :film_projector_selector: :spaghetti: \n\nOrdering takeout for movie night? Check out  the @Scotiabank link in bio for all the restaurants you can pay with your SCENE points. #ScotiaSCENE :backhand_index_pointing_down:',0,0,111,10,,,
CIDsL3ggmxn,scotiabank,2020-11-26 14:40:27.000000,no,False,"b'tbt,history'",b'',"b'Sir George Burn had a distinguished banking career, serving for many years as the General Manager and then Director of The Bank of Ottawa. \xe2\x80\x89\n\xe2\x80\x89\nBurn\xe2\x80\x99s desk set, including this pen and inkwell, is part of the Scotiabank Archives. The Bank of Ottawa and The Bank of Nova Scotia amalgamated in 1919. #tbt #history'",0,0,131,2,,,
CIBpJxJj573,scotiabank,2020-11-25 19:35:34.000000,yes,False,"b'blackfriday,cybermonday'",b'scotiabank',b'The best deals are legitimate deals. Let us help you spot the scams this #BlackFriday and #CyberMonday. \n\nVisit the @Scotiabank link in bio for more.',1417,8.066,73,0,,,
CH-eigxgcn8,scotiabank,2020-11-24 14:05:00.000000,no,False,b'',b'',"b'During this month of Remembrance, we honour the contributions of Veterans from then and now, including our own Scotiabankers.\n\nHershey Dudley Heath, 1896-1918. Medical Detachment, United States Army and worked at the Branch in Boston, Massachusetts. \n \nDavid Sutcliffe, Corporal, Infantry Reserves, Cameron Highlanders of Ottawa and Senior Financial Advisor in Ottawa, Ontario.'",0,0,155,0,,,
CH82-tOFmS_,scotiabank,2020-11-23 23:00:13.000000,no,False,b'',b'scotiabank',"b'Curious about TFSAs?\n\nA TFSA, or Tax-Free savings Account, is a registered account in which the income you earn is completely tax-free \xe2\x80\x93 even when you withdraw your funds.\n\nIt\xe2\x80\x99s a great way to start saving for anyone, and is flexible if something comes up and you need to withdraw funds early. It works for short-term and long-term goals, from saving for a vacation to buying a car and even retirement.\n\nA TFSA is like an umbrella, and within the account you can have a bunch of different investments like GICs, mutual funds, savings and more. It all depends on your risk tolerance and personal goals.\n\nFor more info on TFSAs and how to use them, click the @scotiabank link in bio to learn more.'",0,0,97,4,,,
CHyxiPGnK6O,scotiabank,2020-11-20 01:00:14.000000,no,False,b'',b'scotiabank',b'Raise your hand if you have an emergency fund! :man_raising_hand_selector::woman_raising_hand_selector:\n\nDon\xe2\x80\x99t have one yet? Not to worry! Check out the @scotiabank link in bio for easy tips on starting an emergency fund.',0,0,71,2,,,
CHyGVJUF4PC,scotiabank,2020-11-19 18:42:44.000000,no,False,b'tbt',b'',"b'Our branch in Red Lake is celebrating its 75th anniversary this year! :party_popper: \n\nWhen we first opened in 1945, our branch was heated by a wood stove and in the fall and winter it wasn\xe2\x80\x99t uncommon to find that the ink in the ink wells had frozen during the night! #TBT'",0,0,744,11,,,
CHv__aSDXEd,scotiabank,2020-11-18 23:08:50.000000,no,False,b'',b'scotiabank',"b'What\xe2\x80\x99s the difference between an RRSP and a TFSA?\n\nAn RRSP is a Registered Retirement Savings Plan. It\xe2\x80\x99s an account intended to help you save for retirement, and contributions made result in immediate income tax deductions in the year you contribute.  One of the main benefits of an RRSP is that you defer paying taxes on the money you put in today and any investment income earned, until you withdraw your money in retirement. \n\nA TFSA, or Tax-Free Savings Account, can be used to save towards many different goals, because you\xe2\x80\x99re free to withdraw at any time without penalties. The main benefit of a TFSA is that it is completely tax free. Since you\xe2\x80\x99ve already been taxed on the money you put into your TFSA, any income you earn from the investments within it are completely tax free, even when you withdraw from it.\n\nFor more tips on RRSPs, TFSAs and how they could work for you, visit the @scotiabank link in bio.'",0,0,96,6,,,
CHvqaNiJf0H,scotiabank,2020-11-18 20:00:15.000000,no,False,b'',b'scotiabank',"b'\xe2\x80\x9cIf I learned one thing from the Impact program, it\xe2\x80\x99s that there\xe2\x80\x99s a place for everyone on the trading floor.\xe2\x80\x9d \xe2\x80\x93 Rachid, Impact Global Capital Markets Analyst Associate. \n\nTo learn more about Rachid\xe2\x80\x99s experience in our dynamic and fast-paced Impact program, check out the link in our @scotiabank bio!'",0,0,125,3,,,
CHs_0OfADxt,scotiabank,2020-11-17 19:09:27.000000,no,False,b'',b'',"b'During this month of Remembrance, we honour the contributions of veterans from then and now, including our own Scotiabankers.\n \nAnthony Alliot, Sergeant, Infantry Reserves, Canadian Grenadier Guards and Senior Consultant, Talent Acquisition in Montreal, Quebec.\n \nArchibald (Archie) Calvert, 1882 \xe2\x80\x93 1918. 260th Battalion, Canadian Siberian Expeditionary Force and worked at the main branch in Sydney, Nova Scotia.'",0,0,211,2,,,
CHjYlILgsrD,scotiabank,2020-11-14 01:33:43.000000,yes,False,"b'flm2020,financialliteracy,finlit,money,finance'",b'',"b'When it comes your money, do you have a plan? \n\nScotia Advisor Farah shares why it\xe2\x80\x99s never too early to have a financial plan and how it can help you meet your goals.\n\n#FLM2020 #FinancialLiteracy #finlit #money #finance'",969,42.008,52,4,,,
CHibrNCrVVZ,scotiabank,2020-11-13 16:41:23.000000,no,False,b'lifeatscotiabank',b'scotiabank',"b'Virtual interviews can be challenging, but they don\xe2\x80\x99t have to be nerve-wracking! \n \nSenior Program Manager Kathy shared 8 helpful tips on acing your next virtual interview and bringing your best self forward! :laptop_computer: :speech_balloon:. \n \nLink in @Scotiabank bio. #LifeatScotiabank'",0,0,89,6,,,
CHgQhhOLLdD,scotiabank,2020-11-12 20:25:28.000000,no,False,"b'tbt,lestweforget'",b'scotiabank',"b'After World War 1 the bank sent branches plaques like this one to honour and remember their staff who had served and died in World War 1. This one hangs in our Bridgetown, Nova Scotia branch. \n\n#TBT #LestWeForget\n\nSee the @Scotiabank link in bio for more.'",0,0,118,1,,,
CHfrTpesfDr,scotiabank,2020-11-12 15:00:15.000000,no,False,b'lifeatscotiabank',b'scotiabank',"b'Learn how our veteran employee resource groups are creating a community for current and former military personnel within Scotiabank, providing a forum for networking, training and support. \n\nSee the @Scotiabank link in bio for more. #LifeatScotiabank'",0,0,180,4,,,
CHdGhD8sNss,scotiabank,2020-11-11 15:00:19.000000,yes,False,b'lestweforget',b'',b'#LestWeForget',931,30.033,125,0,,,
CHbcFAqFCzI,scotiabank,2020-11-10 23:30:13.000000,no,False,b'lestweforget',b'',"b'The battles change. The commitment remains the same. At Scotiabank, we remember them. #LestWeForget'",0,0,363,1,,,
CHZRu0gFXuC,scotiabank,2020-11-10 03:21:19.000000,no,False,"b'scotiabankgillerprize,scotialovesbooks'",b'gillerprize',b'Congrats to Souvankham Thammavongsa on winning the 2020 Scotiabank @GillerPrize for \xe2\x80\x98How to Pronounce Knife\xe2\x80\x99! #ScotiabankGillerPrize #ScotiaLovesBooks',0,0,240,7,,,
CHQOtNMApxH,scotiabank,2020-11-06 15:01:44.000000,yes,False,"b'scotiabankgillerprize,scotialovesbooks'","b'gillerprize,cbcbooks,eric_mccormack'",b'The Scotiabank @GillerPrize is days away! Who do you think will win the award?\n\nTune into the live broadcast on @cbcbooks hosted by @eric_mccormack on Nov. 9 at 9pm ET/11:30pm AT/12am NT.\n\n#ScotiabankGillerPrize #ScotiaLovesBooks',1246,15.0,91,6,,,
CHN0Ct8gWSq,scotiabank,2020-11-05 16:30:15.000000,no,False,"b'tbt,history'",b'',b'This mosaic was once part of the floor at our Queen & Church branch in Toronto. \n \nIt features the bank\xe2\x80\x99s corporate seal and is now part of the bank\xe2\x80\x99s historical collection. #TBT #History \n \nPhoto by: Toni Hafkenscheid',0,0,590,10,,,
CHNmTcpg0re,scotiabank,2020-11-05 14:30:12.000000,no,False,b'lifeatscotiabank',b'scotiabank',"b'\xe2\x80\x9cEvery day, we are learning the practical aspects of financial planning through interactive sessions and open discussions. \n \nHaving this safe learning space in a warm, yet professional environment when entering the financial industry is a unique and exceptional advantage.\xe2\x80\x9d \xe2\x80\x93 Ehsan, Ascend Investment Specialist Associate. \n \nTo learn more about Ehsan\xe2\x80\x99s experience, check out the link in our @Scotiabank bio! #LifeatScotiabank'",0,0,133,4,,,
CHF0fELlaW5,scotiabank,2020-11-02 14:00:08.000000,yes,False,b'scotialovesbooks',"b'gillerprize,scotiabank'","b'Meet the 2020 Scotiabank @GillerPrize finalists! Join host Jael Richardson for Between the Pages, an intimate evening with the five shortlisted authors. Streaming available beginning tonight (November 2) 7:30 p.m. EST. See link in @scotiabank bio for the streaming link. #ScotiaLovesBooks'",727,15.0,44,0,,,
CG-A88UsmAi,scotiabank,2020-10-30 13:15:13.000000,no,False,"b'smallbusinessmonth,lifeatscotiabank'",b'scotiabank',"b'It\xe2\x80\x99s #SmallBusinessMonth and we wanted to give you a glimpse into what #LifeatScotiabank is like as a Small Business Advisor from a few of our employees across Canada! \n \nGrowing up in a family with a small business, Rouba from Halifax, attained the passion necessary to support her customers knowing there will be ups and downs along the way. \n \nSee the @Scotiabank link in bio for more.'",0,0,207,23,,,
CG8JIq6H2ly,scotiabank,2020-10-29 19:48:12.000000,no,False,"b'tbt,history'",b'',"b'Our branch in Portage la Prairie, Manitoba is celebrating its 125th anniversary this year. :party_popper: \n\nThe branch was opened by The Bank of Ottawa on October 5, 1895 and became a Bank of Nova Scotia branch when the two banks merged in 1919. \n\nThis image shows the branch in 1928. #TBT #History'",0,0,340,2,,,
CG5DYejM4eq,scotiabank,2020-10-28 15:00:16.000000,no,False,"b'smallbusinessmonth,lifeatscotiabank'",b'scotiabank',b'It\xe2\x80\x99s #SmallBusinessMonth and we wanted to give you a glimpse into what #LifeatScotiabank is like as a Small Business Advisor from a few of our employees across Canada! \n \nTisham from St.Catharines knows that as a Small  Business Advisor he is positively contributing to the economy  by developing an environment for future generations to thrive by creating jobs and helping families make wise investments. \n \nSee the @Scotiabank link in bio for more.',0,0,108,3,,,
CG3UVg6syPg,scotiabank,2020-10-27 22:49:53.000000,no,False,b'smallbusinessmonth',b'scotiabank',b'Want to start a business? \n \nCheck out the @Scotiabank link in bio for some tips to help you launch your new business. #SmallBusinessMonth',0,0,77,2,,,
CG2USTjsK7E,scotiabank,2020-10-27 13:30:14.000000,no,False,"b'smallbusinessmonth,lifeatscotiabank'",b'scotiabank',"b'It\xe2\x80\x99s #SmallBusinessMonth and we wanted to give you a glimpse into what #LifeatScotiabank is like as a Small Business Advisor from a few of our employees across Canada! \n \nAqil, a Small Business Advisor in Calgary knows that his customers value outreach. It\xe2\x80\x99s important for him to follow through on commitments and keep his customers informed at all stages throughout their relationship. \n \nSee the @Scotiabank link in bio for more.'",0,0,98,1,,,
CG0zvkihpC1,scotiabank,2020-10-26 23:27:08.000000,yes,False,"b'students,budgeting'",b'',b'Planning your budget for the school year? \n \nHere are some helpful tips from Scotia Advisor Daniel to help you develop a budget you can stick to. \n \n#students #budgeting',960,37.566,55,3,,,
CGsa7Ytlaij,scotiabank,2020-10-23 17:15:51.000000,no,False,"b'smallbusinessmonth,lifeatscotiabank'",b'scotiabank',"b'It\xe2\x80\x99s #SmallBusinessMonth and we wanted to give you a glimpse into what #LifeatScotiabank is like as a Small Business Advisor from a few of our employees across Canada! \n \nA Virtual Small Business Advisor from Halifax, Dani, feels rewarded each day that that her expertise and passion can provide value to her customers when creating plans in order to achieve their business goals. \n \nSee the @Scotiabank link in bio for more.'",0,0,110,2,,,
CGsBWNBgJBi,scotiabank,2020-10-23 13:32:11.000000,no,False,b'',b'',"b'Congrats to Noah Friebel, Curtiss Randolph & Katherine Takpannie \xe2\x80\x93 the 2020 New Generation Photography Award Winners! Check out some of the compelling work by these up-and-coming young artists. \n.\n.\n.\n.\nPhotography credits:\n\n1. Noah Friebel, Kits Beach Tree, 2019, Archival pigment prints in custom frame\n\n2. Curtiss Randolph, Suspended in the Gods, 2019\n\n3. Katherine Takpannie, Why Are You Wearing That Stupid Man Suit?, 2017, Digital Print'",0,0,127,2,,,
CGqXP8hJ7kN,scotiabank,2020-10-22 22:05:14.000000,no,False,b'smallbusinessweek',b'scotiabank',"b'Are you a small business owner? \n \nHere are 5 things you can do to help weather any storms, chart a new path forward, and thrive in a post-pandemic world. #SmallBusinessWeek \n\nCheck out the @Scotiabank link in bio.'",0,0,96,1,,,
CGp87pUpZsO,scotiabank,2020-10-22 18:15:17.000000,no,False,"b'tbt,digitalbanking,mobilebanking'",b'',"b'It\xe2\x80\x99s hard to imagine today, but mobile banking was introduced only about 10 years ago. Scotiabank was one of the first in the world to adopt this new banking platform. :party_popper: \n \nOur mobile banking services offered the same banking transactions as on computers with some additional security measures made for mobile phones. It was first launched on October 4, 2010, in Canada. :Canada: \n\n#TBT #digitalbanking #mobilebanking'",0,0,120,2,,,
CGnZ3NgpcPd,scotiabank,2020-10-21 18:30:23.000000,no,False,b'lifeatscotiabank',b'scotiabank',"b'As a new graduate trying to figure out what career path best suits my interests and skill set, Ignition is the perfect program for me. Throughout the 24-month program, I\xe2\x80\x99m able to rotate through different positions across technology. \n \nThis not only allows me to try out various roles and find the best fit, but also gives me exposure to the bank\xe2\x80\x99s many business lines, and the impact technology has on these spaces.\xe2\x80\x9d - Julia, Ignition Technology New Graduate Development Program Associate. \n \nTo learn more about Julia\xe2\x80\x99s journey with the Ignition Program, check out the @Scotiabank link in bio. #LifeatScotiabank'",0,0,286,3,,,
CGlT-lmneQ-,scotiabank,2020-10-20 23:00:42.000000,yes,False,"b'students,banking'",b'',b'New to credit cards?\n:credit_card: \nHere\xe2\x80\x99s what you should know before you start spending. \n:credit_card: \n#students #banking',939,39.433,48,0,,,
CGlFxYkAaNY,scotiabank,2020-10-20 20:56:19.000000,no,False,"b'smallbusinessmonth,lifeatscotiabank'",b'scotiabank',"b'It\xe2\x80\x99s #SmallBusinessMonth and we wanted to give you a glimpse into what #LifeatScotiabank is like as a Small Business Advisor from a few of our employees across Canada! \n \nMatt, Small Business Advisor in Trenton helps customers go from dreams to reality by dedicating his time to each individual need, because, every business has a different path. \n \nSee the @Scotiabank link in bio for more'",0,0,149,2,,,
CGh9xYogHPX,scotiabank,2020-10-19 15:48:41.000000,no,False,b'lifeatscotiabank',b'scotiabank',b'Coffee chats can be a powerful way to learn more about an industry and grow your network. Nervous about taking the first step? We\xe2\x80\x99ve got you covered! \n \nCampus Recruiter Jahanvi Pandit shared some insider tips on the anatomy of a successful coffee chat and how to build a genuine relationship. :hot_beverage: \n \nCheck out the @Scotiabank link in bio for more. #LifeatScotiabank',0,0,121,2,,,
CGTcSulFmhZ,scotiabank,2020-10-14 00:26:40.000000,yes,False,"b'worldsbestworkplaces,lifeatscotiabank,worldsbestworkplaces'",b'gptw_us',b'Thank you to our employees for placing us on the @gptw_us #WorldsBestWorkplaces 2020 list! #LifeatScotiabank #WorldsBestWorkplaces',2247,12.0,184,9,,,
CGPo7uPlEaR,scotiabank,2020-10-12 13:00:16.000000,no,False,b'thanksgiving',b'',b'Wishing everyone a Happy #Thanksgiving. What will you be giving thanks for this year?',0,0,166,6,,,
CGNOTG_gDIQ,scotiabank,2020-10-11 14:29:39.000000,yes,False,"b'dayofthegirl,girlsbelonghere'",b'scotiahockey',b':repeat_button: Repost @scotiahockey \n\nThis International #DayOfTheGirl is for all girls claiming their space on the ice. This is YOUR game and YOUR day. \n \nTag girls and womxn in hockey who inspire you below! #GirlsBelongHere',1051,30.066,51,1,,,
CGNIFaNgdU1,scotiabank,2020-10-11 13:34:45.000000,no,False,b'lifeatscotiabank',b'scotiabank',"b'Hey Students! Interested in our co-op placements, internships or new graduate programs? \n \nGo check out our campus events page and come meet us virtually this fall to learn more about #LifeatScotiabank! \n \nSee the @Scotiabank link in bio for more.'",0,0,103,3,,,
CGFjc_rA2AB,scotiabank,2020-10-08 14:59:59.000000,no,False,"b'dyk,tbt'",b'',"b'#DYK that prior to having ABMs, Scotiabank offered banking using a unique walk-up window? All communication was done via telephone and money and forms were exchanged through a sliding metal compartment. \n \nThe pilot for this program, a first in Canada, was installed at Yorkdale Mall in Toronto in 1968. #TBT'",0,0,290,15,,,
CGDpm_TABIc,scotiabank,2020-10-07 21:15:18.000000,no,False,b'lifeatscotiabank',b'scotiabank',"b'\xe2\x80\x9cThe Catalyst Program has allowed me to pursue a career in a fast-paced team environment and make an impact on our customers and employees. \n \nHaving the opportunity to work in three different departments, working with a dedicated Program Manager, having layers of mentorship, and participating in various workshops with my cohort is truly the best. \n \nI feel lucky to be a part of such an amazing program.\xe2\x80\x9d \xe2\x80\x93 Adriana, Catalyst Operations Development Program Associate. \n \nTo read more about Adriana\xe2\x80\x99s experience @Scotiabank visit our link in bio. #LifeatScotiabank'",0,0,623,13,,,
CF9wqHzA06v,scotiabank,2020-10-05 14:21:27.000000,no,False,b'scotialovesbooks',"b'gillerprize,scotiabank'",b'Congratulations to the 2020 Scotiabank @GillerPrize shortlist authors! Searching for a new book to cozy up with as the weather gets cooler? Look no further. #ScotiaLovesBooks \n\nSee @scotiabank link in bio to learn more.',0,0,99,0,,,
CF22xvLAxHT,scotiabank,2020-10-02 22:00:14.000000,no,False,b'',b'scotiabank',b'A pre-approval helps you understand how much you can afford. Get homebuying tips from new homeowner and Scotia advisor Meera. See @scotiabank link in bio.',0,0,71,3,,,
CF22xvLAxHT,scotiabank,2020-10-02 22:00:14.000000,no,False,b'',b'scotiabank',b'A pre-approval helps you understand how much you can afford. Get homebuying tips from new homeowner and Scotia advisor Meera. See @scotiabank link in bio.',0,0,71,3,,,
CF0SO3ZAmZX,scotiabank,2020-10-01 22:02:16.000000,no,False,b'scotiaphotoaward',"b'ricgallery,scotiabank'","b'Get an inside look at 2019 #ScotiaPhotoAward winner Stephen Waddell\xe2\x80\x99s exhibition at @ricgallery! Which work are you most excited to see?\n\nVisit the @scotiabank link in bio to learn more about the exhibition.\n\n:camera_with_flash: cred: Scotiabank Photography Award: Stephen Waddell (installation view), 2020 :copyright: Larissa Issler, Ryerson Image Centre'",0,0,122,5,,,
CFw2Qb6FtMI,scotiabank,2020-09-30 14:00:15.000000,no,False,"b'orangeshirtday2020,lifeatscotiabank'",b'scotiabank',"b'As Indigenous and non-Indigenous Scotiabankers, we acknowledge Orange Shirt Day as a day of learning, growing and supporting each other in the continued path towards reconciliation. \n \nAngie, who is Dakelh from the Stellat\xe2\x80\x99en First Nation and member of the Indigenous Employee Resource Group recently shared with Scotiabankers: \xe2\x80\x9cIt\xe2\x80\x99s important to learn the history and understand how it continues to have a varying effect on indigenous communities across Canada. By educating ourselves we allow for a deeper understanding of how we can contribute to the change needed.\xe2\x80\x9d \n \n#OrangeShirtDay2020 #LifeatScotiabank\n\nSee the @Scotiabank link in bio for more.'",0,0,231,7,,,
CFwxilRgXCJ,scotiabank,2020-09-30 13:19:02.000000,no,False,b'orangeshirtday',b'scotiabank',"b'In recognition of #OrangeShirtDay, we are proud to unveil our third Downie-Wenjack Legacy space in Yellowknife. \n \nThe space is fully accessible for public use and features two works of art by Indigenous artist, Angus Beaulieu, considered one of the finest landscape and wildlife painters living in the North West Territories.\n\nSee the @Scotiabank link in bio for more.'",0,0,283,6,,,
