shortcode,username,date_utc,is_video,is_sponsored,hashtags,mentions,caption,video_view_count,video_length,likes,comments,likes+comments,location_name,location_latlongB66AC7DBCpj,warbyparker,2020-01-04 17:33:27.000000,no,False,b'',b'mistermort',b'Our new Windsor Collection reimagines a classic construction in vivid hues and neutral tortoises\xe2\x80\x94we hit the streets with photographer and fashion anthropologist @mistermort to capture the new frames on some stylish New Yorkers :backhand_index_pointing_up:Pictured here: Arlen in Wineberry with Riesling :red_heart_selector: Head to the link in bio to see the full collection!',0,0,1459,20,,"b'New York, New York'",40.7142 -74.0064
B63KQ8sBEzG,warbyparker,2020-01-03 15:05:02.000000,no,False,b'',b'mistermort',"b'ICYMI: We brought back our Windsor Collection last week and asked our friend @mistermort\xe2\x80\x94fashion anthropologist and street-style photographer\xe2\x80\x94to test out the new frames on some stylish, everyday New Yorkers. Shown here: Duncan in Oak Barrel with Riesling :smiling_face_with_sunglasses: Tap the :shopping_bags: icon for more!'",0,0,792,12,,,
B61msC9BGZZ,warbyparker,2020-01-03 00:34:55.000000,no,False,b'',b'mistermort',b'Our Windsor Collection is back! We asked renowned street style photographer @MisterMort to document some stylish New Yorkers wearing our time- and trend-tested Windsor construction. See more of our Windsor Collection with the link in bio! (Pictured here is Alma in Tiger Tortoise with Polished Gold :sparkles:)',0,0,1613,31,,,
B60-9JJh-83,warbyparker,2020-01-02 18:47:43.000000,no,False,b'',"b'mistermort,mistermort'","b""Last week, we brought back our Windsor Collection\xe2\x80\x94a time-and trend-tested construction that's universally adored (and flattering!). We took to the streets of NYC with fashion anthropologist and renowned street style photographer @mistermort\xe2\x80\x94best known for documenting people's unique personal style\xe2\x80\x94to capture the new frames frames on stylish, everyday New Yorkers. First up: Duncan in Scotia Blue with Riesling. Swipe :right_arrow_selector: to the end to see @mistermort in action!""",0,0,1386,20,,,
B6yHdunhVFG,warbyparker,2020-01-01 16:04:21.000000,no,False,"b'frameinspiration,michelhaddi'",b'',b'Aretha Franklin is our mood for 2020 :smiling_face_with_sunglasses: #frameinspiration (Photo by #MichelHaddi)',0,0,1130,13,,,
