shortcode,username,date_utc,is_video,is_sponsored,hashtags,mentions,caption,video_view_count,video_length,likes,comments,likes+comments,location_name,location_latlongCE6-_zGh3Bd,warbyparker,2020-09-09 15:57:28.000000,no,False,b'',b'nastassjaebony',"b'We\xe2\x80\x99re big fans of sculptural fiber artist @nastassjaebony\xe2\x80\x99s felted wool portraits. Her work pairs perfectly with our latest launch, Studio Edition\xe2\x80\x94a well-crafted mix of eyeglasses and sunglasses that pay tribute to creativity in every form.'",0,0,961,27,,,
CE4UNXwBbrQ,warbyparker,2020-09-08 15:05:06.000000,no,False,b'',b'',"b'Introducing Studio Edition: A well-crafted set of eyeglasses and sunglasses :right_arrow_curving_up_selector:Take a look at our freshest hues\xe2\x80\x94from opaque-to-crystal fades to playful, spotted tortoises\xe2\x80\x94with the link in our bio!\n\nP.S. We shared our latest collection with five unimaginably talented makers to interpret these mixed-material, details-driven beauties in the medium of their choice. Find out who we worked with later this week!'",0,0,1203,37,,,
CErjgArBPBT,warbyparker,2020-09-03 16:22:01.000000,yes,False,b'',"b'iamshellybell,blackgirlventures,blackgirlventures'","b'Introducing \xe2\x80\x9c5 Questions With\xe2\x80\x9d: An IGTV series we\xe2\x80\x99re dedicating to highlighting members of our community.\n\nFirst up, we spoke with @iamshellybell, CEO & Founder of @blackgirlventures\xe2\x80\x94an organization dedicated to removing the barriers of access to social and financial capital for Black & Brown female-identifying founders.  As part of our $1 million pledge to organizations and initiatives focused on ending systemic racism, as well as our commitment to supporting Black entrepreneurs, we donated $100,000 to Black Girl Ventures in June.\n\nA woman of many talents, Shelly spoke with us about what inspires her and what led her to start Black Girl Ventures\xe2\x80\x94she also treated us to some of her poetry! Learn more about Shelly and @blackgirlventures at the link in our bio.'",4926,479.6,215,14,,,
CEo_LWslB2j,warbyparker,2020-09-02 16:12:43.000000,no,False,b'',b'',"b'Presenting the crystal frames that our customers return to time and time again :star-struck: These bestsellers represent an array of vivid hues and easy-to-wear shapes that were created to compliment any face\xe2\x80\x94each pair is made from high-quality cellulose acetate, which retains its original, vibrant color over time. (In other words, they\xe2\x80\x99re total keepers.) \n\nPictured here: Nancy in Rose Crystal, Watts in Pacific Crystal, Wright Narrow in Nutmeg Crystal, Durand in Rose Water, and Griffin in Pacific Crystal:sparkles:'",0,0,992,25,,,
CEjv38EhjER,warbyparker,2020-08-31 15:23:18.000000,yes,False,b'',b'',"b'There\xe2\x80\x99s no need to switch between pairs with our light-responsive lenses :glasses::sun_selector::sunglasses: In sunlight, these lenses darken from clear to grey, brown, or green\xe2\x80\x94outfit any frame with your favorite color!'",22731,14.266,704,40,,,
CEXB5cBDiRr,warbyparker,2020-08-26 16:50:40.000000,yes,False,b'',b'',"b'Just received your new frames but think the nose pads could be more comfortable? We have some options for you! :nerd_face: Though we\xe2\x80\x99ve safely reopened our stores with modified operations, we understand it may not be easy to get to an optician during these times. Head to our story to learn some simple at-home adjustments you can make to your frames in the meantime! :thumbs_up:'",26812,2.866,670,44,,,
CERlS6IBO2H,warbyparker,2020-08-24 14:04:13.000000,yes,False,b'',b'',b'Welcome to the future! The Virtual Try-On tool in our app instantly shows you how frames realistically fit and look on your face :thumbs_up: Download our app to get started!',17521,14.166,555,50,,,
CEHf82fhWDR,warbyparker,2020-08-20 16:04:55.000000,no,False,b'',b'',"b'How would you describe these lookers? :right_arrow_curving_up_selector: We\xe2\x80\x99ve got three words: Enduringly, appealingly polished :smiling_face_with_heart-eyes: With our Fall 2020 collection, you can choose from new colors and shapes (and new sizes, too!)\xe2\x80\x94shown here from the top: Landon, Mullins, and Lydell.'",0,0,1339,50,,,
CECRdgbhvkY,warbyparker,2020-08-18 15:22:06.000000,no,False,b'',b'',"b':NEW_button: frames launch today! Introducing our Fall 2020 collection: everlastingly (and autumnally :fallen_leaf:) color-rich acetates in an array of new shapes and sizes. Start picking in our Story! (Pictured here from top to bottom :glasses: : Wright in Rosemary Crystal, Cognac Tortoise, and Grapefruit Soda)'",0,0,2950,107,,,
CD_90eiBhuJ,warbyparker,2020-08-17 17:52:11.000000,yes,False,b'',b'',"b""Our first Reel! :film_frames::grinning_squinting_face:(And if you're looking for blue-light-filtering glasses, we've got you covered :nerd_face:)""",42370,14.8,784,42,,,
CD9D5C1hEiz,warbyparker,2020-08-16 14:47:20.000000,no,False,b'',"b'cnnbusiness,neilblumenthal,davegilboa'","b'In a @cnnbusiness op-ed co-authored with Business for America founder Sarah Bonk, our co-founders and co-CEOs @neilblumenthal and @davegilboa are asking business leaders across America to join us in ensuring all employees are able to exercise their right to vote, and have the proper tools and means necessary to do so. Visit the link in our bio to learn more about why we feel it\xe2\x80\x99s our duty as members of the business community to take action to safeguard the democratic process.'",0,0,7165,164,,,
CD38EI9BIfl,warbyparker,2020-08-14 15:02:44.000000,no,False,b'',b'',"b'New online-exclusive styles are in! Our latest stainless steel frames are pressed, plated, and painted\xe2\x80\x94a new-to-Warby-Parker construction you\xe2\x80\x99ll only find online. (Try them on virtually in our app!:mobile_phone_with_arrow: Shown here: Radlett and Loretta!)'",0,0,2095,42,,,
CDzACvghQQD,warbyparker,2020-08-12 17:01:27.000000,yes,False,b'',b'jocelyn_dom',"b""Just received your new frames but think the fit could use some tweaking? We've got some options for you! :nerd_face:We've reopened our stores with modified operations, but we understand it may not be easy to get to an optician during these times. Head to our Story to learn some simple at-home adjustments you can make to help your frames fit more comfortably until your next visit at one of our stores or a local optical shop. :thumbs_up: (Video by @jocelyn_dom.)""",39801,7.3,1738,69,,,
CDtwWT8hhXu,warbyparker,2020-08-10 16:08:15.000000,yes,False,b'',b'',"b""Have you seen our latest? You can now try on the newest Concentric Collection with just your iPhone X (or a newer model) and our Virtual Try-On tool\xe2\x80\x94it's wildly lifelike! :nerd_face::selfie:""",23740,28.533,612,64,,,
CDly3hxB_5t,warbyparker,2020-08-07 13:56:02.000000,no,False,b'',b'',"b'Don\xe2\x80\x99t forget to fill out the 2020 Census! (You have until September 30.) Swipe through to review how the census impacts your community, and find out how you can complete it online quickly and easily :thumbs_up:'",0,0,825,32,,,
CDg26a9hZYM,warbyparker,2020-08-05 15:55:22.000000,yes,False,b'',b'',"b'Ready to choose your hue? Our light-responsive lenses (which change from clear to dark in sunlight) now come in grey, brown, or green :sun_selector: Add your favorite to any pair of eyeglasses! :nerd_face::smiling_face_with_sunglasses:'",13950,8.133,988,74,,,
CDeMBqqB3qF,warbyparker,2020-08-04 15:01:57.000000,no,False,b'',b'',"b'Before you press play :play_button_selector:...we\'ve got podcast titles to dream up! :studio_microphone: Find the month and day you were born, then share your custom creation below :speaking_head::down_arrow: (Ours would be ""Between your nightstand book pile and me"" :face_with_tears_of_joy:)'",0,0,913,98,,,
CDTyZu4BH9V,warbyparker,2020-07-31 14:06:27.000000,yes,False,b'',b'noah.cottrell',b'That new glasses energy :nerd_face::dizzy: (Video by @noah.cottrell.)',15065,45.366,1325,74,,,
CDRa8pdB7xn,warbyparker,2020-07-30 16:02:13.000000,no,False,b'',b'',"b'Have you met the newest Concentric Collection? :drooling_face::dizzy: Peep the latest riff on our signature construction featuring understated crystals with saturated lens rings. Many of these silhouettes now come in multiple widths to flatter every face! (Shown here from the :TOP_arrow:: Durand in Crystal with Oak Barrel, Morgan in Traced Clover Crystal, Morgan in Traced Cedar Crystal, Haskell in Crystal with Blue Jay, and Durand in Traced Aquamarine Crystal)'",0,0,4943,151,,,
CC_cWp8hu-i,warbyparker,2020-07-23 16:28:35.000000,yes,False,b'',b'',"b""Just received your new frames but think the fit could use some tweaking? We've got some options for you! :nerd_face:We're slowly reopening our stores with modified operations, but we understand it may not be easy to get to an optician during these times. Head to our Story to learn some simple at-home adjustments you can make to help your frames fit more comfortably until you can get to one of our stores or a local optical shop:thumbs_up:""",60174,2.333,2162,97,,,
CCrE-ZlhxO6,warbyparker,2020-07-15 18:39:04.000000,no,False,b'',b'',"b'For a decade, we\xe2\x80\x99ve focused our Do Good efforts on helping the world see by making vision services more accessible through our Buy a Pair, Give a Pair program. However, the majority of our glasses distribution efforts have been put on pause due to COVID-19. Vision for all remains our ultimate objective, and we\xe2\x80\x99re working to find safe ways to resume our glasses distribution programs. In the meantime, we\xe2\x80\x99re figuring out new ways to make a positive impact on communities by responding to immediate public health needs. Visit the link in our bio to learn more about the changes we\xe2\x80\x99ve made.'",0,0,3201,75,,,
CCoHz4AB_mH,warbyparker,2020-07-14 15:06:08.000000,no,False,b'',b'',"b'More roomier and Low-Bridge Fit options right this way! :right_arrow_selector: We just added a bunch of wide and extra-wide widths, plus more Low-Bridge Fit options (including sunglasses! :smiling_face_with_sunglasses:) into our assortment. Shown here are:\n:glasses: Bensen in Crystal Extra-Wide\n:sunglasses: Harris in Jet Black Wide + LBF\n:glasses: Kimball in Marzipan Tortoise Wide\n:glasses: Brady in Jet Black Matte Eclipse Extra-Wide\n:glasses: Percey in Tidal Blue LBF\n:sunglasses: Hayes in Mesquite Tortoise LBF\n:glasses: Percey in Jet Black Matte LBF'",0,0,2131,63,,,
CCd74_bBxcu,warbyparker,2020-07-10 16:09:34.000000,no,False,b'',b'quentin_jones',"b""Intricately rendered and thoughtfully timeless, The Foundry Edition reimagines what metal eyeglasses can be. We asked four talented photographers\xe2\x80\x94including @quentin_jones\xe2\x80\x94to help us realize the possibilities and prove that The Foundry Edition is all about making the frames your own. Learn more about Quentin's artistic process, and swipe to see the end result. :sparkles:""",0,0,1062,55,,,
CCbWwQlhthD,warbyparker,2020-07-09 16:06:35.000000,no,False,b'',b'taomeitao',"b""Yesterday we introduced The Foundry Edition, a new collection of nine intricately rendered and thoughtfully timeless styles. To help us tell the story of this collection, we teamed up with a group of talented photographers\xe2\x80\x94including @taomeitao, who got creative with her family and the new frames at their home in New York City. Channeling her artistry and individuality, Mei's portraits help capture the simplicity and beauty that shines through each pair.""",0,0,1968,76,,,
CCY08d3hztV,warbyparker,2020-07-08 16:32:40.000000,no,False,b'',b'',"b'Meet The Foundry Edition, a modern set of eyeglasses that reimagines what an all-metal assortment can be. To help us tell the story of this collection, we teamed up with a handful of talented photographers who got creative with the frames in their own spaces. First up: photographers, filmmakers, and twin brothers Jalan and Jibril Durimel, who were born in Paris, raised in the French Antilles and Miami, and studied in Los Angeles. The duo captured each other taking The Foundry Edition for a spin on the streets of Paris.'",0,0,1461,35,,,
CCJKaXghcUm,warbyparker,2020-07-02 14:32:24.000000,no,False,b'',b'',"b""To amplify our commitment to fostering inclusivity, equity, and diversity within our company and beyond, we\xe2\x80\x99ve created a plan specifically focused on advancing racial equity.\n\nWe know that this starts within our brand and at our workplace\xe2\x80\x94and we will move forward diligently and transparently. You'll find the full plan on our website (through the link in our bio); expect more comprehensive updates from us in our future Impact Reports.""",0,0,2812,121,,,
CB_glhxhAbE,warbyparker,2020-06-28 20:35:05.000000,yes,False,"b'teamwarby,pride'",b'oureric',"b'Last week, #teamwarby had the opportunity to engage in a Q+A with @oureric, the bestselling author of \xe2\x80\x9cHere For It, or, How to Save Your Soul in America.\xe2\x80\x9d Thank you to R. Eric for sharing your knowledge and experience with us\xe2\x80\x94we\xe2\x80\x99re wishing a happy #Pride to the entire LGBTQ+ community and all those celebrating in solidarity this month. :blue_heart::rainbow:'",7618,210.7,240,22,,,
CB3vHyHBwiz,warbyparker,2020-06-25 20:06:51.000000,no,False,b'',b'ihollagram',"b'This month, and always, we stand in solidarity with the Black and LGBTQ+ communities in advocating for equity. As we celebrate Pride and continue the fight for racial justice, we\xe2\x80\x99re working to help each other and our community better understand how to be active allies. With the expert help of @ihollagram, a grassroots organization that addresses harassment in all forms, we created a shareable resource to help identify privilege and its power in standing up to injustice. We\xe2\x80\x99re grateful for their guidance and for equipping us with accessible tools to use in our daily lives.'",0,0,1346,43,,,
CBYe2Z1hpeY,warbyparker,2020-06-13 16:48:12.000000,no,False,b'',b'',"b'We are committed to creating change within our workplace and beyond. To those who haven\xe2\x80\x99t felt seen, included, or appreciated within the walls of Warby Parker, we\xe2\x80\x99re deeply sorry. Thank you for holding us accountable. We will do better.'",0,0,6828,418,,,
CA5ePqqh2GH,warbyparker,2020-06-01 15:46:28.000000,no,False,b'',b'',"b'To our Black community members, employees, customers, colleagues, and friends: We see you, stand with you, and are pledging $1 million to organizations and initiatives focused on combating systemic racism.'",0,0,7040,912,,,
CAvMrxKlNSr,warbyparker,2020-05-28 16:00:38.000000,no,False,b'',b's.medberry',"b'""These are my blue-light-filtering eyeball assistants!""- Jermaine (:camera_with_flash:: @s.medberry)'",0,0,1873,70,,,
CAsn-jRBVd5,warbyparker,2020-05-27 16:01:40.000000,yes,False,b'stayathometryon',b'',b'#StayAtHomeTryOn: ASMR edition :speaker_high_volume::ear:',10454,11.4,519,28,,,
CAp8lsOBz4O,warbyparker,2020-05-26 15:03:46.000000,no,False,b'',b'',b'Surprise! We brought back our crowd-favorite Winston frame in three :warning_selector:new colors and updated it with our signature Graduated Rivets \xe2\x80\xa2\xe2\x97\x8f (Link in bio for a closer look!)',0,0,2691,143,,,
CAdMASmAJeQ,warbyparker,2020-05-21 16:08:31.000000,yes,False,b'',b'',"b'Talk about accurate! Our Virtual Try-On allows you to try on eyeglasses and sunglasses\xe2\x80\x94seeing the realistic color, texture, and size of each style\xe2\x80\x94with just an iPhone X (and all newer models). Download our app to get started!'",39538,6.366,1633,106,,,
CAam3E5B2Bk,warbyparker,2020-05-20 16:06:39.000000,yes,False,b'stayathometryon',b'',"b""We've loved seeing how you stay home with your #StayAtHomeTryOn :smiling_face_with_heart-eyes: We're here if you need help choosing a winning pair\xe2\x80\x94tag or DM us! :nerd_face:Get started with your own Home Try-On with the link in our bio""",15691,16.7,372,22,,,
CAX7Kgrg0o8,warbyparker,2020-05-19 15:05:12.000000,yes,False,b'',b'affirm',"b'Did you know you can split your purchase into three (interest-free) payments when you shop with us? No late or hidden fees, either :slightly_smiling_face: Just choose @affirm at checkout!'",28553,8.366,1005,25,,,
CAVQjXXhfUi,warbyparker,2020-05-18 14:14:10.000000,no,False,b'',b'kdesireet',"b'That ""I can finally see!"" feeling :smiling_face_with_smiling_eyes::nerd_face:(Pictured here: Butler in Teal Tortoise. :camera_with_flash:: @kdesireet)'",0,0,5424,104,,,
CAN6-J9hIqJ,warbyparker,2020-05-15 17:50:54.000000,no,False,b'',b'',"b'Glasses or contacts? :thinking_face: We\xe2\x80\x99re obviously fans of both, but which one suits you? Swipe :right_arrow_selector: and tell us below :speaking_head::backhand_index_pointing_down:'",0,0,2786,56,,,
CALDqyOhsYh,warbyparker,2020-05-14 15:09:10.000000,no,False,b'stayathometryon',b'cheeseburgerforever',"b""Let's help @cheeseburgerforever choose a winning pair from her #StayAtHomeTryOn! Comment below with your favorite: :keycap_1:Hayden in Striped Pacific (top left) :keycap_2:Haskell in Crystal (top right) :keycap_3:Durand in Rose Water (bottom left) or :keycap_4:Felix in Pacific Crystal (bottom right)?""",0,0,1151,50,,,
CAIfTyhhXCe,warbyparker,2020-05-13 15:12:59.000000,no,False,b'',b'',b'Looking for blue-light-filtering lenses? We\xe2\x80\x99ve got you covered :thumbs_up: Head over to our link in bio for more info!',0,0,2847,47,,,
CADbmxJh7Jz,warbyparker,2020-05-11 16:06:41.000000,yes,False,b'',b'laurenokay',"b""We're not saying you should use our Virtual Try-On on a sleeping baby but... :face_with_tears_of_joy::winking_face: Thanks for sharing with us, @laurenokay!""",16028,16.033,788,23,,,
B_7leUiBI2R,warbyparker,2020-05-08 14:56:59.000000,yes,False,b'',b'',"b""Did you know that you can get an updated glasses prescription from home? :house_with_garden: All you need is your glasses :nerd_face:, an iPhone :mobile_phone:, and about 12 feet of space :man_cartwheeling_selector: Download our Prescription Check app with the link in bio to see if you're eligible!""",45252,8.233,1829,93,,,
B_5AFQfAh2b,warbyparker,2020-05-07 14:51:46.000000,yes,False,b'stayathometryon',b'',"b""Show of hands: who received a #StayAtHomeTryOn box this week? :woman_raising_hand_selector::man_raising_hand_selector: DM us if you need help choosing a winning pair! :nerd_face: (P.S. Thinking about ordering a Home Try-On? Not to worry, all of our frames are thoroughly cleaned before being sent to customers, as well as after they're received back to us :thumbs_up:)""",13375,6.0,658,56,,,
B_2qxO7hkHu,warbyparker,2020-05-06 17:06:47.000000,no,False,b'',b'',"b""We're thanking all essential workers today (and every day)\xe2\x80\x94we see :eyes: you and appreciate everything that you do! :blue_heart:Want to thank an essential worker? Head over to our Story and write your own thank you haiku. We'll be resharing the love!""",0,0,1193,17,,,
B_z4pRilQdP,warbyparker,2020-05-05 15:10:53.000000,yes,False,b'',b'',b'Dirty lenses are the worst :thumbs_down: Clean and protect your glasses (and a loved one\xe2\x80\x99s :nerd_face:) with our all-in-one kit which includes lens spray and a microfiber cloth!',38298,24.819,1400,61,,,
B_xfqqYBhjD,warbyparker,2020-05-04 16:53:43.000000,yes,False,b'',b'',"b'Have a few minutes? :paintbrush::artist_palette:Head to our Story to design your own acetate pattern, or paint an existing one (like Teal Tortoise! :up_arrow_selector:)\xe2\x80\x94go on and get creative! :woman_artist::man_artist:'",28076,15.0,1272,52,,,
B_ptt5NBgGZ,warbyparker,2020-05-01 16:22:49.000000,yes,False,b'teamwarby',b'',b'Ever wonder how the same frame looks on different faces? See how Hayden in Striped Pacific looks on some members of #teamwarby (filmed virtually from their homes!) in our Story!',18088,13.11,487,15,,,
B_nFVb5BJgP,warbyparker,2020-04-30 15:51:04.000000,no,False,b'',b'duhgram',b'Who can relate? :fog::glasses::man_raising_hand_selector:Check our Story\xe2\x80\x94we have a few tips that may help with foggy lenses! :nerd_face: (Rg @duhgram)',0,0,9910,244,,,
B_khuiBhHGr,warbyparker,2020-04-29 16:01:27.000000,no,False,b'',b'',"b'Try on glasses with just your iPhone! :mobile_phone_with_arrow::slightly_smiling_face: Using our Virtual Try-On tool, swipe to instantly see yourself in a pair of our eyeglasses and sunglasses\xe2\x80\x94download our app on an iPhone X (or any newer model) to get started!'",0,0,1183,47,,,
B_h5lIoF4Ef,warbyparker,2020-04-28 15:32:09.000000,no,False,b'',b'',"b':alarm_clock:Time for a quick game of ""spot the difference"" :alarm_clock: Comment below with all the differences you can spot between these two illustrations :eyes: (Hint: there are 17\xe2\x80\x94swipe :right_arrow_selector:to see!)'",0,0,981,47,,,
B_fR01ilGxZ,warbyparker,2020-04-27 15:06:18.000000,no,False,b'',b'',"b""When you realize it's time to switch to blue-light-filtering lenses :persevering_face::mobile_phone_with_arrow: (Our blue-light-filtering lenses are ideal for screen-heavy days and can be purchased with or without a prescription. :thumbs_up:)""",0,0,838,24,,,
B_aVgkRB3az,warbyparker,2020-04-25 17:02:28.000000,yes,False,b'teamwarby',b'',"b""In need of something new to read? :books: We've rounded up what #teamwarby is reading right now (plus a few of our favorite independent bookstores that are accepting online orders)\xe2\x80\x94more in our Story!""",46898,4.1,1910,20,,,
B_VFMZSByuE,warbyparker,2020-04-23 16:03:31.000000,no,False,b'',b'',"b""The reviews are in :right_arrow_selector: Need a new :glasses: prescription? Our Prescription Check app is a telehealth service that allows an eye doctor to assess how you're seeing through your glasses and provide an updated prescription :thumbs_up:\xe2\x80\x94tap the link in bio to check if you're eligible!""",0,0,1108,31,,,
B_P0e2bBUSc,warbyparker,2020-04-21 15:01:17.000000,no,False,b'teamwarby',b'',b'We\xe2\x80\x99re navigating a new batch of activities according to one of #teamwarby\xe2\x80\x99s favorite questions\xe2\x80\x94\xe2\x80\x9dglasses or contacts?\xe2\x80\x9d\xe2\x80\x94because hanging close to home means having both within reach :nerd_face:',0,0,1198,26,,,
B_NPsbphEAI,warbyparker,2020-04-20 15:01:43.000000,yes,False,b'warbyhometryon',b'',"b""Need help finding a new pair of glasses? Let's get you started with a #warbyhometryon :nerd_face:Take a quiz that will suggest frames we think you'll love with the link in bio (Quick note: You can rest assured that all of our Home Try-On frames are thoroughly cleaned before being sent to customers, as well as after they're received back to us :thumbs_up:)""",39543,3.533,2849,162,,,
B_IcWH4BF8S,warbyparker,2020-04-18 18:16:05.000000,yes,False,b'',b'andyrementer',b'Art break time! :writing_hand_selector: Artist and friend @andyrementer shows us how to draw a self-portrait in a few easy steps\xe2\x80\x94check it out in our Story!',22608,9.3,860,23,,,
B_GIxA2BSGe,warbyparker,2020-04-17 20:46:07.000000,no,False,b'',"b'neilblumenthal,davegilboa'",b'The last few weeks have challenged all of us in ways we never could have imagined. We hope you\xe2\x80\x99re all staying as healthy and safe as possible. See above for an update from our co-founders and co-CEOs @neilblumenthal and @davegilboa.',0,0,5635,261,,,
B_C7Anthvyf,warbyparker,2020-04-16 14:49:02.000000,yes,False,b'',b'bencorda',b'Virtual Try-On: fun for the whole stay-at-home gang :winking_face: This tool in our iOS app allows you to instantly see yourself in a pair of our glasses (with lifelike accuracy!)\xe2\x80\x94head to the link in bio to download our app on an iPhone X or above and get started! :nerd_face::smiling_face_with_sunglasses: (Video by @bencorda.)',24781,7.433,716,25,,,
B-9585-hRFs,warbyparker,2020-04-14 16:03:18.000000,yes,False,b'teamwarby',b'',b'Looking to spice up your stay-at-home reading sessions? :open_book::nerd_face:#TeamWarby has been getting creative with some advanced reading positions\xe2\x80\x94which one will you try out this week? :thinking_face:',15418,27.725,671,20,,,
B-7OYnghZaM,warbyparker,2020-04-13 15:03:34.000000,no,False,b'teamwarby',b'neilblumenthal',"b""RG from our co-founder and co-CEO @neilblumenthal :blue_heart: We're so incredibly proud of all the #teamwarby members at our optical lab in Sloatsburg, NY, who\xe2\x80\x94after implementing enhanced social distancing, best practices for sanitization, and other safety measures\xe2\x80\x94continue to work hard to ensure that we can get you the essential vision products you need during this time. Please join us in thanking them :clapping_hands:""",0,0,3633,125,,,
B-rxrWsBIEJ,warbyparker,2020-04-07 15:04:07.000000,no,False,b'',b'',"b'Tied to your devices lately? We\xe2\x80\x99ve got something that may help :nerd_face: Our blue-light-filtering lenses filter more blue light than our standard polycarbonate or high-index lenses, and can be added to any optical frame. Learn more with the link in bio! (Pictured here: Whalen in Acorn Tortoise :glasses:)'",0,0,1433,32,,,
B-pdA-7h8QQ,warbyparker,2020-04-06 17:25:05.000000,no,False,b'',b'',b'Quick Monday break: Comment below with all the differences you can spot between these two illustrations :eyes: (Hint: there are 15\xe2\x80\x94swipe :right_arrow_selector:to see!)',0,0,1549,67,,,
B-mnIa8h_Fa,warbyparker,2020-04-05 14:55:46.000000,no,False,b'stayathometryon',b'catherinepdv',"b'Something to make you smile: @catherinepdv tagged us in this video of her dad\xe2\x80\x99s Home Try-On. Swipe :right_arrow_selector: and help him choose his next pair\xe2\x80\x94Roosevelt, Brennan, or Welly (aka Welty :face_with_tears_of_joy:)? #StayAtHomeTryOn'",0,0,1931,328,,,
B-heaJGh1xt,warbyparker,2020-04-03 15:05:24.000000,yes,False,b'',b'',"b'Consider your eyeballs covered :eyes: Did you know that, in addition to our very own Scout daily contact lenses, we offer a variety of daily, bi-weekly, and monthly options? :eye::blue_heart: Browse them all via the link in bio!'",10704,9.966,490,27,,,
