shortcode,username,date_utc,is_video,is_sponsored,hashtags,mentions,caption,video_view_count,video_length,likes,comments,likes+comments,location_name,location_latlongB-ZpAUaBixy,warbyparker,2020-03-31 14:02:00.000000,no,False,b'',b'',b'Friendly reminder that you can try on our frames from the comfort of your own home using the Virtual Try-On tool in our iOS app :slightly_smiling_face: Pictured here is Haley in Opal Tortoise (virtually :right_arrow_selector:and IRL!)\xe2\x80\x94head to the link in our bio to give it a try!',0,0,2994,127,,,
B-Nvc5aBUCN,warbyparker,2020-03-26 23:07:27.000000,no,False,b'',"b'neilblumenthal,davegilboa'","b'With the health and well-being of our retail employees and customers in mind, we have decided to keep our stores closed until it is responsible to reopen. See above for an update from our co-founders and co-CEOs, @neilblumenthal and @davegilboa.'",0,0,3930,181,,,
B-KhauyFSfl,warbyparker,2020-03-25 17:07:08.000000,no,False,b'teamwarby',b'levi_the_v',"b""Hi everyone! We're popping up to say hello\xe2\x80\x94and that while you're social distancing, working from home, caring for loved ones, or just trying to maintain a sense of normalcy, #teamwarby is here. You can continue to count on us for your glasses, contacts, and prescription needs. We're thinking up a few ways that we can help make your days a little brighter (and easier!), but we're curious\xe2\x80\x94what would you like to see from us right now? :blue_heart::nerd_face:(Photo by @levi_the_v.)""",0,0,2468,92,,,
B9ufSNFB0cu,warbyparker,2020-03-14 19:49:43.000000,no,False,b'',b'',"b'Given the rapidly changing environment, we have decided to temporarily close stores for the safety of our employees, customers, and the general public\xe2\x80\x94more information above.'",0,0,5446,288,,,
B9o948tBcY2,warbyparker,2020-03-12 16:21:43.000000,no,False,b'',b'',b'Cooper\xe2\x80\x94a vintage-inspired number from our new Spring Sun Edit\xe2\x80\x94features a level brow bar linking two wonderfully round lenses :smiling_face_with_sunglasses::sun_selector: Tap the shopping icon for more from our Spring Sun Edit!',0,0,1881,38,,,
B9mXLg7hUmt,warbyparker,2020-03-11 16:05:31.000000,yes,False,b'',b'',b'Meet Bettina in Marzipan Tortoise\xe2\x80\x94a new style from our Spring Sun Edit\xe2\x80\x94whose oversized proportions and metal brow bar are primed to make a statement :smiling_face_with_sunglasses: Tap the :shopping_bags_selector: icon for more!',14025,8.6,717,21,,,
B9jzz3zBecc,warbyparker,2020-03-10 16:17:26.000000,no,False,b'',b'',"b'Sunny days are here, and so are our new sunglasses! Meet Spring Sun Edit, a new collection of striking silhouettes and inventive constructions :sun_selector: Find Tilson (pictured here!) and the rest of our latest styles in our story! :smiling_face_with_sunglasses:'",0,0,1958,25,,,
B9hHbNiBndC,warbyparker,2020-03-09 15:11:13.000000,yes,False,b'frameinspiration',b'thiswashollywood',"b""Us when we hear there's a new sunglasses collection dropping tomorrow :smiling_face_with_sunglasses: #frameinspiration (Rg @thiswashollywood)""",22141,5.4,1747,25,,,
B9cUl1FhEAP,warbyparker,2020-03-07 18:30:55.000000,yes,False,b'',b'',"b""Our 10th birthday party is in full swing at 130 Greene Street in NYC! We'll be here 'til 6 p.m.\xe2\x80\x94check our Story for the full rundown on all the treats we have in store for you! :partying_face:""",35549,8.966,2537,69,,b'Warby Parker',40.7254761162 -73.9990997314
B9aRvCZhr-m,warbyparker,2020-03-06 23:28:52.000000,yes,False,b'',b'',"b""A sneak peek :eyes: of our 10th birthday party\xe2\x80\x94there will be plenty of games and prizes for you to win! :beaming_face_with_smiling_eyes: Swing by :round_pushpin:130 Greene Street tomorrow from 11 a.m. to 6 p.m. to enjoy pizza, cotton candy, arcade games, skee-ball, a bounce house, and more. We can't wait to celebrate with you!""",14414,17.466,910,44,,,
B9XAxXfFUGT,warbyparker,2020-03-05 17:00:37.000000,no,False,b'',b'shopthesonocollection',"b""In new store news: :newspaper::right_arrow_selector: Our second Connecticut location opens at @shopthesonocollection this Saturday, March 7! :party_popper: Come explore our full collection of eyewear and contacts options, and check out the custom artwork inspired by the city's architectural heritage. We'll be celebrating with exclusive totes and sweet treats\xe2\x80\x94see you there! :round_pushpin:The SoNo Collection 100 N. Water St. Norwalk, CT 06854""",0,0,1161,25,,b'Warby Parker',41.09726 -73.41487
B9UP6CnBSGW,warbyparker,2020-03-04 15:15:47.000000,yes,False,b'warbyblue',b'',"b""We're turning 10 this year, so we decided to throw the ultimate 10-year-old-style birthday party :partying_face: The best part? Everyone's invited! Come eat pizza :pizza:, play arcade games :alien_monster:, get hyped on #warbyblue cotton candy (:backhand_index_pointing_up::face_with_tears_of_joy:), and jump in a bounce house\xe2\x80\x94it'll be a sight to see! \nWHEN: this Saturday, March 7th starting at 11am \nWHERE::round_pushpin:130 Greene St. New York, NY (Right across from our flagship store in Soho)""",61550,3.833,4016,88,,,
B9PI6xYhsMW,warbyparker,2020-03-02 15:37:49.000000,no,False,b'',b'',"b'Can you name all of our Los Angeles retail locations? First person to mention all nine stores featured here correctly wins one of our LA-exclusive :right_arrow_selector: Keys :key:, Wallet :dollar_banknote:, Sunglasses :sunglasses: pouches + a gift card!'",0,0,1134,33,,,
B9MnAuihbLV,warbyparker,2020-03-01 16:03:04.000000,no,False,b'',b'',"b""We've been asking you to share the funniest, most surreal, insane, glorious, and mysterious ways you've lost your glasses\xe2\x80\x94here are a few of our favorites :face_with_tears_of_joy::thinking_face::astonished_face: Think you can top these? Sound off below! :speaking_head::backhand_index_pointing_down:""",0,0,1375,113,,,
B9KCQb9BirC,warbyparker,2020-02-29 16:03:34.000000,yes,False,b'',b'',"b""Attention, New Yorkers: We\xe2\x80\x99re celebrating our 10th birthday next Saturday, and everyone's invited! :partying_face: Come eat pizza, play arcade games, jump in a bounce house, and experience the ultimate 10-year-old birthday party :party_popper:  Details below: \nWHEN\nSaturday, March 7 \n11 a.m.\xe2\x80\x936 p.m.\n\nWHERE\n:round_pushpin:130 Greene St. New York, NY""",12816,4.566,1027,26,,,
B9HadokB_k9,warbyparker,2020-02-28 15:37:12.000000,no,False,b'',b'',"b""What's flatter than a Scout flatpack? :face_with_monocle: We went around NYC to find out\xe2\x80\x94check our Story for more!""",0,0,1979,32,,"b""Joe's Pizza""",40.73056 -74.00213
B9E_OKaFxTw,warbyparker,2020-02-27 17:00:44.000000,no,False,b'',b'',b':thinking_face::glasses::zzz::person_in_bed:',0,0,4578,379,,,
B9CdQCCBUvX,warbyparker,2020-02-26 17:25:22.000000,no,False,b'',b'rachelsaundersceramics',"b'Lately we\xe2\x80\x99re all about @rachelsaundersceramics. Why? Rachel mixes modern aesthetics with artisanal craftsmanship to create pieces that are equal parts striking, functional, and playful. It\xe2\x80\x99s the sort of effortless combo you\xe2\x80\x99ll find in our Nesso Series frames, which she\xe2\x80\x99s wearing above:nerd_face::backhand_index_pointing_up: Straight from Italy :Italy:, these design-driven styles turn functional constructions into beautiful embellishments. More of the collection with the link in bio!'",0,0,1468,38,,"b'Vancouver, British Columbia'",49.2819 -123.1204
B8_vLW0Ba6w,warbyparker,2020-02-25 16:05:44.000000,yes,False,b'teamwarby',b'',"b'Believe it or not, the name ""Warby Parker"" often gets misspelled in Google searches\xe2\x80\x94so we asked #teamwarby members to read a few of our favorites. :face_with_tears_of_joy:'",20798,78.06,960,48,,,
B89Evt3BtZl,warbyparker,2020-02-24 15:15:02.000000,no,False,b'',b'cinnamonryan',"b""Our friend and florist @cinnamonryan brings together romantic details and unexpected textures in her must-see arrangements :bouquet::sparkles:(Seriously. Go peek her work.) We\xe2\x80\x99re thrilled that she spotted similarly noteworthy combinations in our Nesso Series collection, crafted in Italy :Italy: with a mix of materials and design elements. Check which frame she's wearing with the link in bio!""",0,0,2024,27,,"b'New York, New York'",40.7142 -74.0064
B86lN2jFDqf,warbyparker,2020-02-23 16:01:07.000000,no,False,b'teamwarby',b'',b'#teamwarby appreciation post :smiling_face_with_smiling_eyes: Shout out your favorite retail advisor in the comments!',0,0,2161,135,,b'Warby Parker',41.88393 -87.64937
B84AWnjF5aA,warbyparker,2020-02-22 16:00:30.000000,no,False,b'',b'',b'Glasses? :nerd_face: Contacts? :eyes: Both? This handy guide should sort things out for you.',0,0,3388,62,,,
B81WjI7hmqj,warbyparker,2020-02-21 15:17:00.000000,yes,False,b'',b'',"b"":partying_face: CONTEST ALERT :partying_face: We're turning 10 this year! To celebrate, we're throwing the ultimate 10-year-old-style birthday party (think pizza :pizza:, arcade games :alien_monster:, prizes :trophy:, a bounce house :zany_face:, and much more) in New York City on March 7th\xe2\x80\x94and everyone's invited, duh! Not in New York? Good news: We're flying out one lucky person (and a friend) to come join us! To enter, tag your plus-one in the comments below. (FYI: Entries are unlimited, so tag as many friends as you\xe2\x80\x99d like to increase your chances :winking_face:)\n.\n.\n.\n.\n.\nNo purchase necessary. 50 U.S./DC, 18+. Enter by 2/26/2020 at 11:59 P.M. ET. See official rules at https://warby.me/32lyEtY for details. Void where prohibited.""",18574,53.45,2087,7980,,,
B8y3_CChq06,warbyparker,2020-02-20 16:11:07.000000,no,False,b'',b'coldpicnic',"b""We\xe2\x80\x99re big fans of the design duo Phoebe Sung and Peter Buer, better known as @coldpicnic :star-struck: From rugs to quilts, they\xe2\x80\x99re reinterpreting traditional craftsmanship through a refreshing, cheerful, and minimalist lens. Fitting, then, that they feel right at home in these styles from Nesso Series, our new Italian-made collection that reveals a similar blending of romance and technical skill. See which frames they're wearing with the link in our bio!""",0,0,1938,25,,,
B8xDF-uhN9e,warbyparker,2020-02-19 23:09:43.000000,no,False,b'',b'lichennyc',"b'Our friends Jared Blake and Ed Be scour New York City and beyond to stock their vintage furniture store, @lichennyc. As curators and tastemakers, the pair leads with their eye for detail and design. Here, :backhand_index_pointing_up: they take our new Nesso Series frames for a spin\xe2\x80\x94embracing the small but mighty construction elements that make this Italian-made :Italy: collection so special :dizzy: See the frames Jared & Ed are wearing with the link in bio!'",0,0,1317,17,,b'Lichen',40.7073521568 -73.9449620247
B8wZfhnBtjK,warbyparker,2020-02-19 17:06:12.000000,no,False,b'',b'',b'Meet Whittier from our just-launched Nesso Series! :backhand_index_pointing_up: Its rounded silhouette is topped with polished accents and our signature interlocking end piece :link::dizzy: Get acquainted with our latest Italian-crafted styles via the link in our bio! :Italy:',0,0,4528,134,,,
B8uoD3vB9CM,warbyparker,2020-02-19 00:35:01.000000,no,False,b'',"b'mollybaz,bonappetitmag'","b'We love (like, really love) @mollybaz\xe2\x80\x99s recipes :fork_and_knife_with_plate: :face_savoring_food: As the Senior Food Editor of @bonappetitmag, Molly creates innovative dishes through thoughtful pairings\xe2\x80\x94kind of like the ones found in the new Nesso Series frames she\xe2\x80\x99s wearing. Our latest collection from Italy features a measured mix of materials and skillful blending of design elements. See more of the collection in our Story!'",0,0,5009,85,,,
B8t7nylBSkv,warbyparker,2020-02-18 18:06:42.000000,no,False,b'',b'',"b'Introducing new styles straight from Italy! :airplane_selector: :Italy: Nesso Series (meaning \xe2\x80\x9clink\xe2\x80\x9d in Italian) is all about connections :link: Swipe to see the trio of design details on Garland, including layered face fronts :right_arrow_selector: glossy wraparound accents :right_arrow_selector: and signature interlocking end pieces.\nSee more in our Story! :dizzy:'",0,0,5049,135,,,
B8opJUjFfGk,warbyparker,2020-02-16 16:49:05.000000,no,False,b'',"b'saskiakeultjes,xavbalan'","b""FYI: Our new store on Flatbush Ave. in Brooklyn has two entrances with custom floor-to-roof murals by @saskiakeultjes! :exploding_head: Choose your own optical adventure by entering on Flatbush Ave. or on Bergen St. (pictured above) :blue_heart: Check them out if you're in the neighborhood :nerd_face: (Photo by @xavbalan.)""",0,0,6047,57,,,
B8l_vjvBbOi,warbyparker,2020-02-15 16:09:44.000000,yes,False,b'',b'',"b'Today is our 10th birthday! :partying_face: To better understand what it means to be this age, we interviewed a bunch of 10-year-olds on a range of topics :backhand_index_pointing_up:(We think we\xe2\x80\x99re in good company :face_with_tears_of_joy:) Stay tuned for more videos in the coming weeks\xe2\x80\x94plus a special giveaway that involves coming to our 10th birthday party in New York City! :party_popper:'",13309,54.966,1004,61,,,
B8jT1PTBeYS,warbyparker,2020-02-14 15:06:36.000000,no,False,b'warbyparkerglassesgirl',b'',"b""A Valentine's Day meet-cute (round two) :bow_and_arrow::two_hearts: Does anybody know #WarbyParkerGlassesGirl? (She was last seen at our Heights Mercantile store in Houston, TX!) Let's help reunite them in the comments :heart_with_arrow:""",0,0,1567,23,,,
B8g9J-OhUZQ,warbyparker,2020-02-13 17:09:59.000000,no,False,b'',b'thenewlywedwards',"b'Did you know you can virtually try on our frames using only an iPhone X (or above)? Head over to the link in bio to download our app and give it a shot!:mobile_phone_with_arrow: (Thanks for sharing, @thenewlywedwards!)'",0,0,3516,89,,,
B8eXSN9l6Jm,warbyparker,2020-02-12 17:00:37.000000,no,False,b'',b'',"b'Important announcement :speaking_head:: Our extra-wide Durand frame in Whiskey Tortoise has been restocked\xe2\x80\x94we repeat, our extra-wide Durand has been restocked! :party_popper: What other styles would you like to see in an extra wide fit? :thinking_face: (Run over to the link in bio to find Durand! :man_running_selector::dashing_away:)'",0,0,2091,87,,,
B8broH9FAWI,warbyparker,2020-02-11 16:00:39.000000,no,False,b'',b'middleclassfancy',b'Tag a silly goose :zany_face: rg @middleclassfancy',0,0,3866,164,,,
B8Y_-tTBQrh,warbyparker,2020-02-10 15:01:12.000000,yes,False,b'',b'',"b'How does Scout\xe2\x80\x94our super moist, super comfy daily contact lens\xe2\x80\x94make your eyes feel, you ask? Just like that :backhand_index_pointing_up::eye::sweat_droplets:'",29768,3.0,734,28,,,
B8WiAo3FSZV,warbyparker,2020-02-09 16:00:25.000000,no,False,b'atwarby',b'picklesthegriff',"b'""Hop in\xe2\x80\x94we\'re going shopping!"" :shopping_bags::face_with_tears_of_joy:-@picklesthegriff #atWarby'",0,0,2120,30,,b'Warby Parker',45.5286835724 -122.6987805963
B8UQldYBDBP,warbyparker,2020-02-08 18:49:50.000000,yes,False,b'frameinspiration',b'lauradern',b'@lauradern making a case for gold metal frames :star-struck: #frameinspiration',28435,5.2,1758,25,,,
B8R5GRvBTCD,warbyparker,2020-02-07 20:47:36.000000,yes,False,b'atwarby',b'sandiefalcon',"b'Gotta pass the dance test first:man_dancing: Thanks for sharing with us, @sandiefalcon! #atWarby (More of our favorite tags of the week in our Story :backhand_index_pointing_up:)'",69092,5.866,6394,119,,,
B8O6_gIhDUN,warbyparker,2020-02-06 17:05:21.000000,yes,False,b'',b'',b'Do a double take: our Spring Sun collection debuts a new signature detail\xe2\x80\x94the Graduated Rivet\xe2\x80\x94which can be found on Beale \xe2\x80\xa2\xe2\x97\x8f:backhand_index_pointing_up:Tap on the video to shop! :smiling_face_with_sunglasses:',10854,11.266,730,32,,,
B8MV7V2HuB8,warbyparker,2020-02-05 17:02:54.000000,yes,False,b'teamwarby',b'',b'Ever wondered how the same frame looks on different faces? Check our story to see how Brennan Extra Wide in Shoreline Fade (from our Spring 2020 collection) looks on some members of #teamwarby!',20200,11.1,586,15,,,
B8JqHJzFX6q,warbyparker,2020-02-04 16:01:05.000000,no,False,b'',b'',"b""Yikes! :see-no-evil_monkey: We hear so many stories of eyewear-gone-astray that we decided to start sharing a few of our favorites :backhand_index_pointing_up::glasses::toilet: Tell us the funniest, most surreal, insane, glorious, and mysterious ways you've lost your glasses with us below!:backhand_index_pointing_down:""",0,0,2520,165,,,
B8HMz7IB9G7,warbyparker,2020-02-03 17:06:51.000000,yes,False,b'',b'karissfarris',"b""@karissfarris' words, not ours! :up_arrow_selector: Request a Scout trial pack with the link in bio to see for yourself :winking_face:""",12338,31.091,332,9,,,
B8EZvcOBsuo,warbyparker,2020-02-02 15:01:58.000000,yes,False,b'frameinspiration',b'',"b""Seems appropriate to post this today :smiling_face_with_sunglasses: Where's the groundhog emoji? #frameinspiration""",8760,3.533,736,5,,,
B8B7qHNlmgr,warbyparker,2020-02-01 16:00:28.000000,no,False,b'atwarby',b'splash',b'Keep those mirror selfies coming! :nerd_face::selfie: #atWarby (Photo by @splash.)',0,0,867,17,,b'Warby Parker',42.3346443864 -83.0495166779
B7_T3lRhKR2,warbyparker,2020-01-31 15:34:16.000000,no,False,b'',b'',"b'What people on the internet are saying about Scout (our new daily contact lenses!) :eye: Get started with a $5 trial pack for with the link in our bio, and take $5 off your next order! :thumbs_up:'",0,0,1160,23,,,
B785gmkh5zY,warbyparker,2020-01-30 17:05:55.000000,yes,False,b'',b'',"b'From the statement browline to the generous lens height, Ada\xe2\x80\x99s glamorous appeal just won\xe2\x80\x99t quit :smiling_face_with_sunglasses::sheaf_of_rice: Tap the shopping :shopping_bags: icon to help warm things up!'",18491,37.4,734,14,,,
B76UNdXFh5K,warbyparker,2020-01-29 17:01:05.000000,no,False,b'',b'',b'Have you ever made a friend by discovering you wear the same frames? :nerd_face::nerd_face:',0,0,6865,181,,,
B73ofwul00d,warbyparker,2020-01-28 16:00:38.000000,no,False,b'',b'',"b':loudspeaker::nerd_face: Paging colorful acetate lovers: Which of these crystal colors would you love to see us bring back\xe2\x80\x94Melon, Rose Guava, Crystal Fern, Citron, Himalayan Salt, or Lemon Meringue? Comment below with your favorite! :backhand_index_pointing_down:'",0,0,6560,2019,,,
B71hA1dhUXu,warbyparker,2020-01-27 20:16:43.000000,no,False,b'',b'jasonpolan',b'We are incredibly saddened to hear about the passing of our friend and longtime collaborator @jasonpolan. Jason was an extraordinary artist and equally amazing person who left an indelible mark on the world of Warby Parker (and well beyond). :blue_heart:',0,0,2104,52,,,
B7ye9XKFWqi,warbyparker,2020-01-26 16:01:05.000000,no,False,b'atwarby',b'tie.percival',"b'""Do these make my nose look big?"" - @tie.percival #atwarby'",0,0,3317,37,,b'Warby Parker',41.9180580591 -87.6504760981
B7v8vYmhEMH,warbyparker,2020-01-25 16:23:34.000000,no,False,b'',b'jchaneyedoc',"b""@jchaneyedoc's sunglasses gang :smiling_face_with_sunglasses: :bride_with_veil::man_in_tuxedo:""",0,0,1844,19,,,
B7t5rd3hJyG,warbyparker,2020-01-24 21:18:20.000000,no,False,b'',"b'doughnutplant,ovenly,saskiakeultjes'","b'We\xe2\x80\x99re opening a new store in Brooklyn :right_arrow_selector: This time, meet us on Flatbush Ave. :party_popper: Swing by our grand opening weekend and enjoy treats by @doughnutplant and @ovenly, while surrounded by the playful, floor-to-roof murals by Brooklyn-based artist @saskiakeultjes\xe2\x80\x94tomorrow, Saskia will be illustrating custom portraits on posters that you can take home! Oh, and did we mention that in addition to frames, this store offers contacts and eye exams? It has it all! More in our Story :backhand_index_pointing_up:'",0,0,3517,73,,b'Warby Parker',40.68132 -73.97568
B7q4Banh8Fe,warbyparker,2020-01-23 17:06:45.000000,yes,False,b'',b'',"b""Swap :snowflake_selector: for :sun_selector: with Brewer from our Spring Sun collection! Tap the :shopping_bags: icon to see what we're serving up this season.""",6948,8.4,465,6,,,
B7oSvCogzwx,warbyparker,2020-01-22 17:02:06.000000,yes,False,b'',b'',"b""Fresh-cut sunglasses for the upcoming season, courtesy of our Spring Sun collection :sheaf_of_rice::blossom::smiling_face_with_sunglasses: Tap the :shopping_bags: icon to see what's in bloom!""",7402,6.4,503,12,,,
B7lqS-mBXwc,warbyparker,2020-01-21 16:31:17.000000,yes,False,b'',b'',"b'New sunglasses, just in time! Meet our Spring Sun collection :backhand_index_pointing_up: With deep hues and airy crystals, our newest collection of sunglasses is a springtime delight! (Tap the :shopping_bags: icon to get up close :smiling_face_with_sunglasses:)'",8015,10.0,565,15,,,
B7gd-1UBevS,warbyparker,2020-01-19 16:06:21.000000,yes,False,b'',b'',"b""Slight change of scenery :sheaf_of_rice::blossom::sun_selector: Here's a sneak peek at our newest sunglasses dropping next week! Tap the :shopping_bags: icon to get notified.""",14647,10.133,821,23,,,
B7d4hDOlyR1,warbyparker,2020-01-18 16:00:22.000000,no,False,b'atwarby',b'jenniferroselogan',b'A Kimball moment we fully support #atWarby (Photo by @jenniferroselogan.)',0,0,4684,58,,b'Warby Parker',33.51416 -86.80798
B7bNFPOBkEX,warbyparker,2020-01-17 15:02:37.000000,yes,False,b'',b'',b'Caption this! :speaking_head::down_arrow_selector: BTS from the set of our Spring 2020 shoot. :winking_face_with_tongue: (Most-liked comment wins a $95 gift card and a Parker Travel Case!)',12180,7.833,719,92,,,
B7Y-peOh_a8,warbyparker,2020-01-16 18:18:26.000000,yes,False,b'',b'',"b'Did you know that we have contacts? :eye::eye: And that they come in an innovative, space-saving flat pack? :backhand_index_pointing_up:Try Scout daily contact lenses for $5 with the link in our bio, and take $5 off your next order!'",21609,6.1,666,40,,,
B7WRMrkFBdA,warbyparker,2020-01-15 17:02:07.000000,no,False,b'',b'',"b""Have you seen the latest? :glasses::up_arrow_selector: Don't miss our new Spring 2020 frames, some of which are also offered in multiple sizes! Pictured here: Sadie Narrow in Riverbend Tortoise and Brennan Extra Wide in Shoreline Fade :blue_heart:""",0,0,1865,57,,,
B7Tee6OlMTh,warbyparker,2020-01-14 15:00:28.000000,no,False,b'frameinspiration',b'',b'Our favorite version of Harrison Ford \xe2\xa7\x93 :nerd_face: #frameinspiration',0,0,5146,87,,,
B7RJOiqhMft,warbyparker,2020-01-13 17:16:38.000000,yes,False,b'warbyhometryon',b'',"b'#warbyhometryon: Spring 2020 edition :glasses::backhand_index_pointing_up: Try our latest with the link in bio! (Frames shown here: Clemens, Brennan, Sadie Narrow, Brennan Extra Wide, and Carrington.)'",21594,28.191,569,9,,,
B7OctJihPqZ,warbyparker,2020-01-12 16:09:04.000000,yes,False,b'warbykids',b'jessika.ahlberg',"b'Another in-depth #warbykids review submitted by @jessika.ahlberg\xe2\x80\x94blue is our favorite color too, Hattie! :smiling_face_with_3_hearts::raising_hands:'",18730,13.4,1167,20,,,
B7L5hutBKvu,warbyparker,2020-01-11 16:22:49.000000,no,False,b'atwarby',b'katiiarose',b'\xe2\x80\x9c20/20 vision for 2020 :victory_hand_selector:\xe2\x80\x9d -@katiiarose #atWarby',0,0,1339,13,,b'Warby Parker',34.09192 -118.28012
B7JTOBZBzSn,warbyparker,2020-01-10 16:09:36.000000,no,False,b'',"b'warbybarker,the_tac0cat'",b'@warbybarker may have some competition :winking_face_with_tongue: Find our first Frame Crush Friday of the year in our Story! (Photo by @the_tac0cat.)',0,0,3199,58,,,
B7G0O95F6Fi,warbyparker,2020-01-09 17:00:24.000000,no,False,b'',b'',"b'Our Spring 2020 features newcomers in playful shapes, plus some old favorites in refreshing palettes (like Hughes Wide in Marzipan Tortoise!) :backhand_index_pointing_up: Find more newness with the link in bio.'",0,0,3108,85,,,
B7ESkLtB50Y,warbyparker,2020-01-08 17:27:41.000000,no,False,b'',b'',"b""It's our first launch of the year! Meet our Spring 2020 collection :up_arrow_selector: Refreshing palettes and slender acetate forms round out this mix of frames. Shop the latest with the link in bio!""",0,0,2624,73,,,
B7CcxtVhQoZ,warbyparker,2020-01-08 00:18:45.000000,yes,False,b'',b'',b'Looking for a classic cat-eye that\xe2\x80\x99s still a little understated? Shea\xe2\x80\x99s upturned lenses and bowed browline achieve the perfect balance :thumbs_up: Find Shea and more of our Spring 2020 collection in our Story!',48493,9.3,1684,51,,,
B7Bl_JkhNwk,warbyparker,2020-01-07 16:19:40.000000,no,False,b'',b'',"b'Introducing Spring 2020! This season, we\xe2\x80\x99re embracing classic forms, invigorating palettes, and pared-down acetates\xe2\x80\x94like Butler in Teal Tortoise. Find your style in our Story!'",0,0,7407,175,,,
B6-_KbThZu8,warbyparker,2020-01-06 16:01:57.000000,no,False,b'',b'',"b""Shout out your favorite Warby Parker store below! :speaking_head::down_arrow_selector: (We'll send a special treat to the store with the most kudos :winking_face:)""",0,0,1670,289,,,
B68oU_2hXJt,warbyparker,2020-01-05 18:04:33.000000,yes,False,b'',b'biscuitgoodboi',"b""We hear so many stories of eyewear-gone-astray that we decided to start sharing a few of our favorites! Raise your hand if your four-legged friend has ever mistaken your glasses for a chew toy like @biscuitgoodboi did :woman_raising_hand_selector::man_raising_hand_selector:Share the funniest, most surreal, insane, glorious, and mysterious ways you've lost your glasses with us below!:backhand_index_pointing_down:""",13602,56.8,673,27,,,
